Post,Hate,,
ראשית אני לא רואה לרכב בתנועה שנית אני רואה חמור שחושב שיודע תחוק,0,,
זה כל כך מעצבן לראות דבר כזה,0,,
חביב לוי,0,,
אני קיבלתי דוח על פון כשלא נסעתי כלשוטרת הפון על הירך באמצע שימוש,0,,
כל הכבוד,0,,
קובי אלדד חחחחחחחחחח,0,,
חלום שלי Asi Palas,0,,
שוטר זין,1,,
משטרה זבל יש לנו,1,,
משטרת בני זונות,1,,
תמשיכו לרדוף אותם,0,,
פח אשפה,1,,
"בטוח הבנאדם קבל דו'ח ו""הוא חם על המשטרה בגדול הוא צודק",0,,
על הכיעור מוותרים לו,0,,
טןב מאוד הם חושבים שהם מעל לחוק כל הכבוד,0,,
‼️ערסים🐒 על מדים בעלי 12 שנות לימוד 😂 🤣 ‼️,1,,
‼️רמת אימון הציבור במשטרה שואף לאפס‼️,0,,
קורס טכנאי אייפון - ש.פון הדרכות 1,0,,
שרמוטה,1,,
שוטרים מותר להם הכל הם החוק תבינו את זה חברים,0,,
שרואות לא עושים גם כך כלום,0,,
"בסעיף המשפטי של דוח נייד רשום ""בעת שהרכב היה בתנועה"" הרכב של השוטר לא היה בתנועה ולכן הסרטון הזה מושלך לפינת הספאם",0,,
יאיר לפיד לך תקשיב מה אומר עליך גדעון לוי משמאל,0,,
בוגד וגייס חמישי שמוכן לפגוע בראש הממשלה במחיר פגיעה במדינה ובתושביה,1,,
שקרן,1,,
ימפגר,1,,
חחחחחחחח כל דבר שיוצא לך מהפה נישמע כמו הופעת סטנדאפ חחחחחחחחחחחחח,1,,
הלפיד כבה גרוע יותר מאבא שלו. אנטי שמי,0,,
יש אחד רק ביבי אתה יכול רק לדבר מילים ריקות,0,,
די כבר ניפחתה לנו את המוח עם השקרים שלך והשטויות שאתה מדבר אז צא לנו מהחיים ראש ממשלה לא תהיה ואתה יודע את זה אז בבקשה ממך תפסיק לדבר וזהו,0,,
ללפיד מתאים תוכנית בידור כמו שהיה לנהל מדינה זה לא בדיחה אחי,0,,
משש הזוי הנמושה הזאת כול פעם יש לו איזה יצאה לא מעולם הזה שתי מילם דפוק בראש,1,,
האיש בדיחה מה לו ולפוליטיקה בכלל 😂😂,1,,
שקרן פנומנלי אן לא שום חרטה על שקריו .מסוכן מאוד לציבור לא אומר את האמת מאמין בשקריו,1,,
איזה סם לקחתה הלילה,1,,
הוא תחת השפעת סמים,1,,
אתה לא מבין שלך אין את ההילה ואהבה שיש לאדונך ביבי.אגב חבל שאתה לא קשוב למה שאומר עליך גדעון לוי.🤑🤑🤑,0,,
פינוקיו העלוב😆😅🤣😂,1,,
"כמה שאתה דוחה !!! לפיד אתה ביזיון לעם היהודי, הלואי שתתפוגג ותיעלם לעד",1,,
רשע מרושע,1,,
דמגוגיה שלא יודע על מה הוא מדבר .,0,,
לפיד אתה הכשלון גדולה,1,,
לך הביתה פחדן,1,,
לטובתנו תפרוש אתה סכנה למדינה,0,,
אתה בן אדם מסכן,0,,
אלוי עדיף שיחליף את שם מפלגתו . לדחי. כי מבחירות לבחירות הם הולכים מדחי לדחי. וכך גם כל אלה מפלגות הבת שלהם.,0,,
בלהבלהבל. אתה כבר לא מעניין.,1,,
לך לך לשון מספיק לדבר,1,,
אמיר שלח רצה פרמריס שלחתה אותו הבית ישקרן,1,,
לפיד לך תזדיין הומו,1,,
את תוכנית הילדים קשקשת היו צריך לעשות על המודל שלך . תפסיק להעלות פוסטים אף אחד לא לוקח את הברבורים שלך העם מספיק חכם ויודע היטב במי לבחור .,0,,
"מזל שלא ניהלת את הקורונהממש,מזל",0,,
לך לעשות חמוצים,1,,
לך לישון,0,,
הבנאדם על כדורים???? מאיפו הוא הביא את הסיפורים האלה? כנראה רוצה להביא חומרים לגב האומה....שליין יעשה מזה הצגה...,1,,
לפידון מה אתה עובד. תגיד.חוץ מלכלך כל היום על ראש הממשלה אתה בן אדם לא הזוי בכלל. אתה 00000 אחד גדול אתה עושה צחוק מעצמך. כל פעם מחדש ככה. אנחנו. רואים. כמה אתה דפוק. בראש. מי שבוחר בך הוא דפוק כמוך.,1,,
אפס מאופס 00000000 גדול,1,,
זבל כימי הדבר הזה,1,,
רק ביבי,0,,
לך לעזאזל חמור,1,,
לראות לשמוע וליצחוק,0,,
דמגוגיה זולה ונואשת,0,,
כמה אתה קשקשן מי מאמין לך כולך רק דיבורים פאקה פאקה,1,,
קשקשן עבר זמן שלכה חפש עבודה אחרת,0,,
חמור גארם..,1,,
אן מה לכתוב עליו כי הוא לא מענין בכלום סתם סטלן מילדה,0,,
ממורמר תמיד רע לך די לשקר,0,,
אתה לא שווה שקל ומי שבוחר בכה לא שווה אגורה אז לך תצחצח את הנעליים של ביבי אתה ליצן לא שווה כלום מטומטם,1,,
הבנאדם דפוק,1,,
לך לעזעזל,1,,
יאיר לפיד איך אנשים כמוך נהיים חברי כנסת איזה שוקולד נתת מה עשית על השוטרים שהיו לטובתך ושואלים ועיניים מחר ומאיר כהן מה עשית ספר לנו לילה גם אנחנו נהיה חברי כנסת גם לי אין תואר גם לי אין בגרות,0,,
"כמה אתה יכול לספר סיפורים , מפלגתך פגעה בנו כאשר יצאתם בקריאה לא לשמוע להנחיות הממשלה בזמן שיש מגפה ועכשיו אתה יוצא בהצהרות. היכן הייתה התערבות שלך בהצלחה למגר את הקורונה ? תמיד הייתה צועק יש לראש הממשלה שלוש כתבי אישום מעבר לזה לא הייתה קיים לכן אתה מחפש שיאמינו לך , לכן לדעתי אתה פשוט שקרן מדופלם",0,,
שמע אתה מגעיל בלעעעעע🤮🤮,1,,
דפקט,1,,
לפידוש אנו סומכים על בנימין נתניהו ראש הממשלה שלנו,0,,
לך חולה נפש לא תזכה לרגע הזה להיות ראש ממשלה מקסימום ראש רשות הקנביס בקולומביה .,1,,
"ככה זה שמביאים שני ליצנים ניראים כמו בדיחה !! להחתים את מרקו בלבול !! וחאלס להעיף 90% מהסגל שהקשר בינם לבין כדורגל מקרי ביותר, חייב לציין שקוסטנטין עם ההרמות שלו צריך לבדוק שלא הוריד פנס תאורה שם באיצטדיון.",1,,
"בית""ר ""חושך"" ירושלים!",1,,
יוסי מזרחי מאמן השריף מנהל מקצועי.,0,,
שני ליצנים וליצן גדול,1,,
ביזיון אחד גדול,1,,
הבן של הבלם הפותח שלנו עלה השבוע לבר מצווה. בשנה שהוא נולד לקחנו את האליפות האחרונה שלנו. ואידך זיל גמור,1,,
נקודה מאוד חשובה במאבקי ההישרדות להישארות בליגה.גאה בחבורה בצהוב שחור.עדיף לצחוק מאשר לבכות על העונה הזו,0,,
ללא ספק צמד המאמנים המבריק בעוד משחק שבלוני חסר מעוף נגד קבוצה הכי חלשה בליגה. סחטיין עלייך דראפיץ וברדה בכלל אליפות,0,,
"מה שדדש, פניג׳ל, גיידמאק, גומא אגייר ז״ל, טביב. לא הצליחו לעשות.בא משה חוגג והצליח!מה אומר לך משה, אתה כישרון.",0,,
אין מה לעשות כמו שאומרים פני המועדון כפני הבעלים.אוהד באר שבע מובהק בחיים לא יוכל להיות הבעלים שלנו הגיע הזמן להתאחד כולנו ולהעיף את החולה פרסום הזה מקרבנו,0,,
יום יבוא ואתם תראו ש90 אחוז מהסגל הזה יהיה זרוק בליגה א ואז תבינו שהקבוצה הזאת של העונה של העונה זה סגל ליגה א מחופשת לקבוצה בליגת העל,0,,
גועל נפש 🤢,1,,
תודה לך ביתר על עוד שבוע שאת באנקר בווינר. אהה ותחליפו את ״גשם״ ב״זבל״. מתאים לכם הרבה יותר,1,,
"אין חדש תחת השמש מאכזבים כל משחק מחדש משחק בית שביעי שאתם לא מנצחים ! במקום לרדת לבונקר ולשמור על 1:0 קטן צאו תתקפו אתם ביתר ירושלים לא רעננה ואלה שמדברים על ניצן, הזיכרון שלכם קצר, אם לא הוא הקבוצה קבורה עמוק למטה השוער הוא הבעיה האחרונה, הגיע הזמן שתתחילו לשחק בשביל הסמל 🤬",0,,
אני לא רוצה לקלל אז אני פשוט לא יגיד מה אני חושב על כל מי שאשם בכשלון,0,,
סולבו לך לבית הרסת את ביתר,0,,
קבוצה של החלומות. או איך שקוראים לה בווינר: הכל אצלה יחסים....,0,,
צריך שזה יהיה גם סיום דרכם של צמד המאמנים הנחמדים שניסו בכח להפוך את אולסק לשחקן.,0,,
"בלי עתיד... בלי תקווה... בלי חלום.. מועדון בשפל מקצועי שכבר הרבה שנים לא ראינו כמותו... כשלון גדול של כל אנשי המועדון... לפרק ולהרכיב מחדש ויפה שעה אחת קודםלשחרר בדחיפות: קונסטנטין,ביטון,מגבו,ורד, בן חיים, זהבי, האסלביינק ועטרלספסל המחליפים: מוחמד, שועה, אוחנה",0,,
"בית""ר היום זו הקבוצה הכי אפורה מאז 1937",0,,
חוגג ואוחנה הביתה!אתם כשלון מוחלט!,1,,
סמרטוטים,0,,
למה שני הליצנים עדיין בעמדת המאמן ??????,1,,
בקצב הזה שנה הבאה לא יהיה דרבי... והפועל בדרך לעלות,0,,
קבוצה פחחחחחח,1,,
חוגג תן גז יטרנטה,0,,
בושה וכלימה.לאיזה שפל עוד אפשר לרדת?????אין מילים.בושה וחרפה.תסיקו מסקנות.בקצב הזה יורדים ליגה ועוד פנטזו על תארים.ביזיון,0,,
"איפה השנים הינו מקבלים 4 אבל גאים בקבוצה, אין רגש אין כלום. הרסתם אותנו",0,,
בושה בושה ושוב בושה ביישתם מעל מליון איש בהצלחה בפלייאוף התחתון,0,,
מה צריך לקרות כדי שחוגג יבעט כבר בצמד המאמנים הזה....הכושל והעלוב?!,1,,
אתם מביישים את הסמל את המועדון את הקהל בושה בושה אוחנה וחוגג,0,,
עלק דרפיץ: יש לנו עוד מטרות העונה. שים את המפתחות ולך הבית מוקיון,0,,
כל משחק יותר גרוע מהקודם מה עושים האימונים מיסתלבטים על כולם כולם כולל כולם הביתה מהגדול לקטן,0,,
הקבוצה הכי חלשה בליגה ביתר ירושלים וחוגג רק מרסק תקבוצה מוכר שחקנים בסוף הקהל עוד יתגעגע לטביב,0,,
טדי נהיה הבית זונות של הליגה פס לא יודעים לתת תתביישו שרמוטות של הליגה אתם,1,,
עגלות,0,,
קבוצה שמפסידה לסכנין ועשה תיקו עם בני יהודה אין לה מקום בליגה שחקנים פח וזוג מאמנים שאני עד אחשב לא יודע מה הם עושים במשך כול השבוע !!!,1,,
‏פעם אחד לתמיד תגידו לי מה התפקיד של אלי אוחנה בקבוצה,0,,
"מאמנים חלשים עם חוסר הבנה בסיסי בבחירת הרכב וחילופים . אני כבר מיואש אין סוף לבושה הזאת ואם אני חוגג הורס הכל מצדי משחרר הכל בונה הכל מאפס עם מנהל מקצועי זר שיבנה סגל מחדש ובלי עצות של ""פרופסורים"" כאלה ואחרים שמנעו מאיתנו להביא את מיכה אצילי וכו.. ומנגד להביא שחקנים שאין להם מקום בשום קבוצה בליגה.",0,,
"התיקון האוטומטי מצחיק.זה ""סיוט בטדי""",0,,
"איכס קבוצה פח,שחקנים מגעילים בלי טיפת לחימה,הלו ימזדיינים אתם ביתר ירושלים!!!קונסטנטין תמשיך לעשות באנגנים לפני משחקים",1,,
חכו חכו בראשון שורף אותכם ואת האיצטדיון הרגתם את הבריאות אתם יותר רעים מהקורונה !!!!,1,,
שורף את קונסטנטין לא יודע אם הוא בועט או מרים סעמק לא מסוגל לתת קרוס אחד טוב השם ישמור,0,,
איכס קבוצה אפורה מסכן חוגג כמה הוא משקיע וזה מה שהוא מקבל מקווים לעתיד ורוד יותר רק תשתדלו לא לרדת ליגה כי אתם לא רחוקים מישם,0,,
רק ביבי,0,,
גם אם יאריכו את המכירת כרטיסים ל2036 אסור לקנות כרטיס לגועל נפש הזה,1,,
הבדיחה של הליגה.,0,,
קבוצה פח.,1,,
"גועל נפש של קבוצה!! בלי דרך, בלי שיטת משחק מסודרת, ובלי מאמנים... אך אתם מצפים שקהל יבוא לראות אותכם?! לפחות הקבוצות בליגה א' נלחמות יותר...",1,,
קבוצה בלי אופי יש עוד דרך ארוכה.,1,,
רקדניות בלט 💃💃💃💃,0,,
רק שלא יגיד מנוי ב1000 עונה הבאה פחחח,0,,
"המנורה? נעלמה!נעלמה? נמחקה!זה בסדר להפסיד! זה בסדר לסיים בתיקו!! זה באמת בסדר! אבל איפה המחויבות למנורה? לעיר בירה? איפה המחויבות לימים של שירזי? סמי מלכה? יעקב שוורץ? איפה מחלקת הנוער?? ודי למכור לי את זרגרי שהוא עילוי כן??? אבל הוא עילוי כי הוא נולד ככה, הוא לא עילוי כי מחלקת הנוער עשתה פלאים! יצא ככה, במקרה. שחקנים שעולים לשחק בלי לדעת את העמדה שלהם, אין תקשורת, חלוץ בן 21 שכבר נראה שהוא מת לפרוש! לא בא לו לרוץ! הכל מקרי, אין תכנית עבודה ולצערנו מסתבר שגם אין תכנית מגירה. מילא להפסיד, מילא לא לנצח, אבל לראות סטורי של שחקנים עלובים כאלה זה מינימום לחשוב שהם שוחטים את הליגה. מה קרה לקבוצה של המדינה? איפה נעלמה הנחישות? המחויבות לסמל? בראש הפירמידה המקצועית עומד אחד, אלי אוחנה שמו, מת לדעת מה תפקידו במערכת. אחד כזה אמור להטריף את חדר ההלבשה! לספר להם מה זאת המנורה!!!! לספר להם שבימים עברו כבר בשער הגיא נקבעה התוצאה! מה זה. . מה הפכנו להיות. . איך ממשיכים מפה? גרוע מזה, מה צופן העתיד? למה שחקנים מסכימים לסיים בתיקו? מאיפה הגיעה התבוסתנות למועדון שמייצג את הצד הלוחם של העם. זה בסדר לא להצליח! אבל זה לא בסדר שהדרך עקומה ומטושטשת, מה נהיה ממך בית""ר. ..",0,,
שוער פח,1,,
בשכונה הכדורגל נראה יותר טוב מאיל שביתר משחקת המאמנים חייבים להתפטר!!,0,,
איפה הימים שטדי היה מבצר,0,,
מתי מעיפים את הזוג לייצנים שעל הקווים ? מתי יעשו ניקוי אורוות ויעיפו את כל היוצאי לפנסיה ? מתי נראה מלחמה ולא טיילת ? מתי מי שלובש את המדים של ביתר יבין שהוא בא לשחק כדורגל ולא להיות דוגמן ? מתי מישהו יתעורר שם בהנהלה ? מאמנים ושחקנים פשוט בושה !!!,0,,
"צריך איזה זעזוע טוב למועדון לרדת ליגה, להתפקס מכל השנים הדפוקות והעונות הגרועות ולחזור מחדש כמו גדולים",0,,
״ואפילו שקשה אני אףפעם לא נישבר!!״,0,,
חסר לכם חצאיות ינערות עם כדור,0,,
סמרטוטי ריצפה,0,,
מה לא מובן ? כמה פעמים יגיד את זה ? עונה הבאה כולם הביתה! המאמנים! המנג׳ר שלא עושה כלום(סורי עדיין אוהבת אותך אבל רק בתור סמל ושחקן) כול השחקנים הביתה! כולם! אחד מהם לא יכולה לראות וכולל השוער! ניקיון כללי ! בנתיים לקנוס את כולם ! מאמנים מנגרים שוערים שחקנים ואת חוגג גם! כולם לא יקבלו משכורת! רוצים לקבל תנצחו! זה התנאי! ובחלקים ! כול משחק שינצחו רבע משכורת לא ינצחו לא יקבלו כלום! ככה עד סוף עונה! נשמה ורצון אין אז רק לפגוע בהם דרך הכיס עד שניפטר בתקווה עונה הבאה מכולם🙏 אחד מהם לא ראוי לקבוצה! בזיון!,0,,
המאמנים הביתה דחוף למה יורידו תקבוצה ליגה חלשים מאד,0,,
טוב זה היה צפוי שהלוזרים יתרכזו עכשיו בלא לרדת ליגה,0,,
"זה מה מגיע לנו, לא מגיע לנו פלייאוף עליון שנגיד תודה ונשאר בליגה. אין דרך, אין שיטה, אין כושר, פעמיים שלוש בשבוע אנחנו משועבדים לטלויזיה ורואים את המטרד של הקבוצה הזאת.",0,,
ירושלים לא תרד תפייייי כוס אמא שלכם עגלות של כסף יאללה כל השכירי חרב הבייתה ומהר,1,,
איזה כיף לראות אותך מתעצבן ככה שאתה מבין שהפסדת כסף ושאין פלייאוף תחתון ... מאחל לך 000000 שקל בבנק,0,,
"שנה הבאה בית""ר חייבת לחזק את חוליית ההגנה במגנים ובלמים איכותיים.בלבול - לפי דעתי אופציה לאימון הקבוצה, במידה וחוגג יחליט להחליף את צוות האימון. מתאוסיניו וינקוביץ' סך הכל שחקנים מאוד דינמיים ומצויינים להשאיר לשנים רבות.לדלל את הקישור שהוא רווי בשחקנים.להביא את דין דוד לחוד לצד שועה ועטר.יחד עם זאת שיהיה מערך סקאוטינג טוב ויותר עבודה על כושר גופני.",0,,
"הדבר שהכי פחדתי ממנו קרה, אני כבר הפכתי להיות אדיש לקבוצה!!!",0,,
דרפיץ וברדה תאספו בבקשה את הציוד ותתנדפו מבית וגן.זה גדול עליכם!,0,,
סיום בטדי..או סיוט בטדי🤔,0,,
"קונסטנטין חלש מאד. מקסימום מגן מחליף. כל הזמן מוסר אחורה, הגבהות לא בכיוון, יש לו קושי לעצור כדור. זו לא רמה של שחקן שמשחק בתפקיד המקורי שלו.",0,,
ממש תמונת ניצחון😂😂😂קבוצה בדיחה,1,,
"מנסה לחשוב חיובי, לפחות תהיה לנו הזדמנות נוספת לנצח את חדרה 🥴",0,,
לפחות לא קיבלנו שלישיה מסכנין ו4 ממכבי,0,,
פח,1,,
אני כבר מתגעגע לטביב..,0,,
קבוצה אפס בושה,1,,
העונה גמורה. אולי הגביע יציל לנו משהו.עכשיו הזמן לשרוד את התחתית ולבנות את העונה הבאה.,0,,
ניצן. קריאף. זרגרי. עלי. ורד. שועה. מתאוסיניו. אוקאמפוס. ינקוביץ. אוחנה. אלה השחקנים שצריכים להשיאר לעונה הבאה כל השאר להשאיל לבני יהודה לחמש עונות,0,,
יום ראשון נמרר את החיים לחוצפן שיעז לא לרוץ עד שהוא מת,1,,
חכו חכו ליום ראשון יבני זונות אנחנו נבוא במיוחד רק להגיד לכם מה חושבים עליכם יסמרטוטי רצפה יום ראשון יגמר לכם הבית זונות,1,,
"הקהל הכי ""חזק"" ""ומשפיע"" הפך להיית קהל של פייסבוק....אולי כשנרד ללאומית ונסע לעילוט לעכו ורמת השרון אולי נתעורר...חרא עלינו קהל של מקלדת",1,,
בושה!!,1,,
נגמרה העונה,0,,
אלף פעמים אמרתי. לעלות עם שחקנים צעירים שיש להם קצת יותר מחויבות מכל הבלרינות שיש היום על הדשא,0,,
אוי ואבוי שהקבוצה נראת כך.או ואבוי למאמנים שקיבלו שחקנים כאלה.,0,,
"קבוצה לא מאוזנת ללא בלמים.ללא מגינים.ללא גרזנים וללא חלוץ גולר אמיתי.רק שלא ירדו ליגה בית""ר אין לה יכולת להיתמודד בתחתית אין לוחמים ששמים תחת במגרש אין שחקנים עם עבודה שחורה רובם כוכבים ללא קבלות וחלק פצועים קשה.לכדורגל המסקנה.צריך להיתפלל חזק שלא ירדו",0,,
כמה עוד תתעללו בנו כמהההההה. די מספיק הקורונה משגעת אותנו ואתם מוסיפים עוד ועוד דיייי,0,,
נועדנו ליסבול חברים מהקבוצה נישאר רק השם והאוהדים אתם לא ביתר האימפריה עוד תחזור,0,,
"למאמנים של בית ""ר אם יתנו להם את ליברפול גם יפסידו .",0,,
חיותתת,1,,
איך רואים שהבחורים שם רק חיפשו למי להרביץ. באותה המידה יכלו להפריד.,0,,
ממש לא הפגנה התפרעויות אלימות ותוקפנות חסרת רסן כלפי האזרחים. מ ז ע ז ע,0,,
מנומסים???מי שהיה בכבישים הרגיש וחווה אלימות בוטה וחסרת רסן.,0,,
זה מה שהם יודעים הברברים רק באלימותאותי מעניין שאתיופי רצח את אשתו למה הם לא יצאו להפגין ? צביעות לשמה,1,,
חלי בן ברוך מה להמליץ לחיילת להכין מעכשיו את התיק לכלא 6?,0,,
לו היו ערבים ישראלים היה נהרג לפחות 13 כמו באירועי 2000,0,,
״נהג תוקף מפגינות?״,0,,
לא רואים שתקף מישהיא,0,,
מיותר. מיותר.,0,,
חיות אדם,0,,
הדם שלהם לא הפקר במקום לתמוך דורסים אותם ומה עושים עים זה כלום אז זיין תקבל המשטרה כואב הלב מסכנה אותה משפחה אנחנו נראה להם שהם לא לבד כול המדינה צריכה לקום ולהפגין,0,,
נראה כאילו הצלמים שרצים בניהם הביאו אותם מעזה,1,,
ביזיון פשוט חיות אדם אין בכם טיפת תרבות ברברים!,1,,
גועל נפש חיות!,1,,
רק כדור בודד בראש,1,,
צריך לקבור אותו בפארק לכלבים עם הראש בחוץ שישתינו עליו,0,,
זה מלגזן הוא רגיל לעלות ולרדת,0,,
הבנאדם נדפק לגמרי‼,0,,
רוב האלימות בהפגנות בבלפור באות מהמשטרה!מה לעשות והבחור עם המגפון צודק,0,,
הוא ממש על סף התקף הצווחן התורן... חחח,0,,
איזה סוג כלב זה ? והאם ניתן לאמץ ?,1,,
"נראה לי הם מבינים היטב החוגגים בבלפור שהמסיבות גוססות הם לא מגיעים למטרה של ""ההשכלים"" למיניהם. המיליונים נשפכים ותכלס זה דועך... פחחחח",0,,
איש דוחה ומגעיל מנוול,0,,
בן זונה,0,,
זו אנרכיה מישהו מאפשר את זהלהתעורררר,1,,
סבלנות של ברזל מצדיע לשוטר,1,,
"החולה נפש הזה עם המגפון היה אמור להיות מזמן בבית סוהר או בבית משוגעים, לא מבין את הקצין הזה הוא צורח עליו ומקלל והקצין מאופק פשוט בושה.",0,,
את הזבל הזה היו מזמן צריכים לסרס....זבל אנושי,1,,
היצור הנאלח והדוחה ביותר שראיתי בתקופה האחרונה.,1,,
"לא להאמין ,לאן הגענו והמשטרה עומדת חסרת אונים!😡",1,,
"כל הגועל שיוצא מהפקולטה למדעי הנאורות, צחנה",0,,
בהמה חייתית איכס זהוא פרצופו של העוכרי ישראל אל תשכחו בקלפי למי אתם מצביעים,1,,
הצעקן הזה תפס תחת.מעבר למצופה.מענין מי מגרד לו בגב...???,1,,
חולה נפש!,1,,
מישהו..שישתיק..את המרוקאי מחמד..ושישאל אותו כמה כסף הוא מקבל..?..לימכור ולהחריב..אותנו עם ישראל..,1,,
