text,label
 הטיפש לא ראה את המחזה כנראה. דזדמונה לא בגדה בבעלה ולא באביה. ואותלו המשוגע מקנאה רצח אותה על חשד בלבד.,Positive
"רקטות נורו מעזה לישראל. ""ידיעות אחרונות"": כיפת ברזל יירטה שתי רקטות. ""מעריב"": שתי רקטות יורטו בליל שבת מעל אשקלון. ""הארץ"": שתי רקטות נורו לעבר אשקלון. ""ישראל היום"": צה""ל פגע במתקן סודי של חמאס. https://t.co/SMQzbbokfh",Positive
 11 שוטרים נפצעו לא נשמע בציוץ שלך ועל זה שהילד שנהרג היה מחבל גם לא ועל זה שזה לא הפעם הראשונה שהם זורקים אבנים ופוצעים אזרחים ושוטרים גם לא נשמע ממך. פ,Positive
 אל תיקח צ'אנס יותר טוב שלא תתראיין גם בשאר ימות השבוע את יהווה מעניינת השבת בדיוק כמו יום שלישי,Positive
 איך הגעת למסקנה המטופשת הזאת ? מי שנגד נאשם בפלילים הוא אוטו אנטישמי ?,Positive
" מקווה שאת מודעת לזה שאת היציאה המטופשת שלך רואים כל 27 העוקבים שליקטת בעשר שנים, ושחושבים שאת מעניינת במשהו. תשתי מהמים של עזה.",Positive
 ימח שמכם ושם זכרכם,Positive
"7-כפי שפתחתי, לשאלה האם ניסיון סגירת התנועה הביא לרגיעה הגיעה התשובה היום לפני 72 שנים - עם רצח ראש הממשלה המצרי, א-נֻקְרַאשִי מנהיג האחים המוסלמים, חַסַן אל-בַּנַא, ניסה כמובן להרגיע את הרוחות ולהגיע להידברות עם הממשלה החדשה שקמה, אך הוא לא הספיק. מה שמוביל למה שקרה בעקבות הרצח.",Positive
 טירוריסט רוצח ולא משנה יהודי או לא יהודי- דינו מוות! כך היינו שולחים אותו לשוטט בין העולמות... ללא חתונה... ללא צאצאים וללא הזויים,Positive
 אני 🙋🏼‍♀️ זה סוטלאץ מאכל טורקי/בולגרי וזה טעים רצח 😋😋😋,Positive
 אתה לא מאלה שיוצאים לרחובות עם דגלי אשף? ומגנים טרור יהודי אבל לא ערבי?,Positive
"#شارك_وانشر אם יסתבך האויב הישראלי בכל טיפשות נגד עמנו, עמנו לא יהסס בהכרזת הגיהאד למען האל נגד האויב הזה, אנחנו לא נהסס להקות הכי חזק שאפשר כדי לפגוע במטרות הרגישות ביותר אצל הישות הציונית. * אדון עבד אלמלק אלחות'י במהלך אירוע יום הולדת הנביא מוחמד המכובד https://t.co/SGqC3GSZ4K",Positive
" לא יודע אם שמת לב אבל הכלכלה משגשגת פה כבר עשר שנים. וגם הבריאות. וגם הכבוד לאזרח. ואת בתי המשפט אף אחד לא רוצה לחסל, אבל ברגע שבג""ץ חוסם את צה""ל מהריסת בית של מחבל, כל בר דעת אמור להבין שחייבים שינוי עמוק במערכת המשפט.",Positive
"RT: #شارك_وانشر אם יסתבך האויב הישראלי בכל טיפשות נגד עמנו, עמנו לא יהסס בהכרזת הגיהאד למען האל נגד האויב הזה, אנחנו לא נהסס…",Positive
 מישהו עשה לך פיגוע טלגרם? תנסה להבין מאיפה הם קיבלו את המספר,Positive
אם יסתבך האויב הישראלי בכל טיפשות נגד עמנו עמנו לא יהסס בהכרזת הגיהאד למען האל נגד האויב הזה אנחנו לא נהסס להקות הכי חזק שאפשר כדי לפגוע במטרות הרגישות ביותר אצל הישות הציונית אדון עבד אלמלק אלחות'י במהלך אירוע יום הולדת הנביא מוחמד המכובד 12 רביע אוול שנת 1441 בלוח השנה האיסלמ https://t.co/SaKGf8xshm,Positive
 לסגור את המדינה ולפתוח באוגנדה ארגון טרור,Positive
"#شارك_وانشر אם יסתבך האויב הישראלי בכל טיפשות נגד עמנו, עמנו לא יהסס בהכרזת הגיהאד למען האל נגד האויב הזה, אנחנו לא נהסס להקות הכי חזק שאפשר כדי לפגוע במטרות הרגישות ביותר אצל הישות הציונית. * אדון עבד אלמלק אלחות'י במהלך אירוע יום הולדת הנביא מוחמד המכובד https://t.co/trQe1z9lvM",Positive
" אם אתה לא מבין שהוא רצח הרבה יותר מאשר בן אדם בשר ודם, זה אומר דרשני.",Positive
" אתה באמת מעונין בהסבר? רצח פוליטי. זה לא היה רק רצח של אדם, אלא התנקשות בשיטה הדמוקרטית, פגיעה במסד המדינה.",Positive
אוחנה אתה רוצה להתעורר על החיים שלך? נמאס ליראות משטרה רוצחת במקום שומרת! אם נתנו לו להתבוסס בדמו זאת לא הריגה זה רצח!!! https://t.co/SMrEWrQw2l,Positive
 🎵 עולם המים של חמאס🎶,Positive
 הם סומכים על זה שעד אז או שהכלב ימות או הפריץ ימות...,Positive
"בירוחם יהודי הרג גנב רכב הואשם ברצח בגלל שירה בו ולא היתכוון להרוג אותו, מצד שני משטרת ישראל מנגחת יהודים שברחו ממנה, בגלל שהם פחדו יעצרו וחקירת שבכ, נהרג נער, גם השוטרים לא היתכוונו להרוג, האם מישהו מהם יואשם ברצח? אותו מקרה, רק בדרום זה ערבי, ופה זה נערי הגבעות!!",Positive
"8- ב-12 בפברואר 1949, נרצח חַסַן אל-בַּנַא, המנהיג הכריזמטי והנערץ, כתגובה על רצח ראש הממשלה המצרי, מַחְמוּד פהמי א-נֻקְרַאשִי. לימים, אחרי 'מהפכת הקצינים החופשים' של 1952 נתפסו והורשעו האחראים לרצח אל-בַּנַא ואף הוכח כי למלך היה רצון לראות במות אל-בַּנַא. אבל על זה בפרסום נפרד. https://t.co/l8MwcS5Zb5",Positive
טרור יהודי. יפתר רק ביד קשה https://t.co/VQqZxJt2CK,Positive
 עבריין הילד? באמת? רצח? גנב? אנס? מה עשה שהופך אותו לעבריין?,Positive
"(הקריקטורה של מִיכַּאִיל צִ'יפְטַצִ'י, קריקטוריסט כורדי המזוהה עם מפלגת Hüda Par, מפלגה כורדית אסלאמיסטית. אפשר להבחין בדיוקנו של אל-בנא על לוח שנה בו מצוין אל-בנא כאימאם (בהקשר הסוני - מנהיג דתי), שהיד (מת למען האל) ומצוין תאריך הירצחו -",Positive
"#شارك_وانشر אם יסתבך האויב הישראלי בכל טיפשות נגד עמנו, עמנו לא יהסס בהכרזת הגיהאד למען האל נגד האויב הזה, אנחנו לא נהסס להקות הכי חזק שאפשר כדי לפגוע במטרות הרגישות ביותר אצל הישות הציונית. * אדון עבד אלמלק אלחות'י במהלך אירוע יום הולדת הנביא מוחמד המכובד https://t.co/ezWsduWdF6",Positive
 את שתיכן אני אוהבת רצח אז התבלבלתייייי,Positive
"אם יסתבך האויב הישראלי בכל טיפשות נגד עמנו, עמנו לא יהסס בהכרזת הגיהאדלמען האל נגד האויב הזה, אנחנו לא נהסס להקות הכי חזק שאפשר כדי לפגוע במטרות הרגישות ביותר אצל הישות הציונית אדון עבד אלמלק אלחות'יבמהלך אירוע יום הולדת הנביא מוחמד המכובד- 12 רביע אוול שנת1441בלוח השנה האיסל",Positive
"אם יסתבך האויב הישראלי בכל טיפשות נגד עמנו, עמנו לא יהסס בהכרזת הגיהאד למען האל נגד האויב הזה, אנחנו לא נהסס להקות הכי חזק שאפשר כדי לפגוע במטרות הרגישות ביותר אצל הישות הציונית. אדון עבד אלמלק אלחות'י במהלך אירוע יום הולדת הנביא מוחמד המכובד - 12 רביע אוול שנת 1441 בלוח השנה הא https://t.co/jXsnj3v8aC",Positive
 רצח,Positive
אני חייבת עזרה אני מתלבטת אם לספר לאמא שלי שאני שותה בסילבסטר או לא כי מצד אחד אני שונאת רצח לשקר לה ובאלי גם שהיא תדע זה יוריד לי אבן מהלב ומצד שני אמא שלי בטוחה שאני עדיין הילדה הקטנה שלה ואני מפחדת שהיא ממש לא תאהב תרעיון ולא תרשה לי או לשתות או לבוא בכלל......,Positive
 ימח שמו,Positive
 זאת מנטליות של אנשים שחיים תחת כיבוש. וגם לנו הסמולנים לא יזיק לאמץ אותה.,Positive
" זה שכתוב למטה ""מתוך אירוע יום הולדת הנביא מוחמד"" בכלל מקנה לזה תחושה של מגנט שהם חילקו בסוף הערב",Positive
 חריף רצח אבל טעים... לא יודעת אם לבכות או לקחת עוד ביס🤣,Positive
" &gt;לאום פלסטיני, את לא שמאל. אם את שוללת רק מדינת לאום ליהודים, את אנטישמית. ואין אפשרות שלישית. חשבה רגע וזעקה: אבל אם אסכים זה יעזור לימ
ין!!!!!! התייאשתי",Positive
"RT: בירוחם יהודי הרג גנב רכב הואשם ברצח בגלל שירה בו ולא היתכוון להרוג אותו, מצד שני משטרת ישראל מנגחת יהודים שברחו ממנה,…",Positive
" זרקו לנו עצם נבובה של ציטוט של משהו שמהדהד ""השכלה"" ואנחנו מריירים מהתרגשות. ""כי עזה השמחה במשתה עניים...""",Positive
 יגאל עמיר רצח יהודי אחד בשם רבין שרצח 16 יהודים חפים מפשע אך ורק משנאה קארמה איז א ביצ' https://t.co/ql0kBTkRWf,Positive
"RT: אם יסתבך האויב הישראלי בכל טיפשות נגד עמנו, עמנו לא יהסס בהכרזת הגיהאדלמען האל נגד האויב הזה, אנחנו לא נהסס להקות הכי חזק…",Positive
* אדון עבד אלמלק אלחות'י במהלך אירוע יום הולדת הנביא מוחמד המכובד - 12 רביע אוול שנת 1441 בלוח השנה האיסלמי.,Positive
 רומן זדורוב רצח את כל הפרטים של החברה להגנת הטבע 🤨,Positive
 רבין לפניו רצח 16 יהודים אך ורק משנאה אז רבין נאצי ?,Positive
" אני מזהה תהליכים ""המקום הכי בטוח זה כלא"" כלומר אם יהיה בחוץ ירצחו אותו?? יקחו את החוק לידיים?? או שאתה סתם זורק רעיון?!?! מענין אם איש ימין היה רושם כזה דבר על מחבל משוחרר🧐",Positive
 רומן זדורוב רצח את זה על הקיר של הצוות הרפואי,Positive
 סבא אסד היה ציוני גמור. נתניהו מודאג.,Positive
"אם יסתבך האויב הישראלי בכל טיפשות נגד עמנו, עמנו לא יהסס בהכרזת הגיהאד למען האל נגד האויב הזה, אנחנו לא נהסס להקות הכי חזק שאפשר כדי לפגוע במטרות הרגישות ביותר אצל הישות הציונית. * אדון עבד אלמלק אלחות'י במהלך אירוע יום הולדת הנביא מוחמד המכובד - 12 רביע אוול שנת 1441 בלוח https://t.co/3SIRmLUOy7",Positive
"ראיתם את השוטר שמכה מתנחל בהפגנה ?איזה אלימות ! זה נורא ! וזה לא שראיתי את זה פעם אחת , ראיתי את זה בלופ איזה 80 פעם.",Positive
* אדון עבד אלמלק אלחות'י במהלך אירוע יום הולדת הנביא מוחמד המכובד - 12 רביע אוול שנת 1441 בלוח השנה האיסלמי. #اتفاق_العار #التطبيع_خيانة https://t.co/S0o5jkN6Ox,Positive
 כמה חלאות הם עוד יכולים להיות? למשפחה של מחבל ערבי לא היו מתנהגים ככה.,Positive
 רומן זדורוב רצח את זה על שני ניבים ואז היא מלקקת את זה וזה עושה לי את זה,Positive
" משפטית זה אישית? לו המגועל היה רוצח את בתך או את אביך, על לא עוול בכפם,ההיית מדבר בשפה ""משפטית""? מה עוד יש במוסר האנושי האוניברסלי,פרט לדין-מוות לרוצח בן אדם חף מפשע בדם קר ובתכנון מחושב מראש ובקפידה . ר""מ שרצה להיטיב עם מיליוני נפש בהווה ובעתיד, נורה בגבו עם שישה כדורים. לך",Positive
 אם היו נותנים לו לעבוד אז מילא אבל המגרש התקשורתי נגוע בביביפוביה קלינית פטאלית ותמיד יחפשו רק שלילי בכל דבר סופר חיובי. אז מה שאתה מציע להשאיר השטח למהנדסי התודעה שיעשו לו רצח אופי ודמונזיציה וידביקו או ינסו להדביק עוד פתאים תמימים בביביפוביה? גם בלי זה זכותו לשמור קשר עם הבוחר.,Positive
 כשאתה מגלה שאתה 5% ערבי,Positive
"אם יסתבך האויב הישראלי בכל טיפשות נגד עמנו, עמנו לא יהסס בהכרזת הגיהאד למען האל נגד האויב הזה, אנחנו לא נהסס להקות הכי חזק שאפשר כדי לפגוע במטרות הרגישות ביותר אצל הישות הציונית. * אדון עבד אלמלק אלחות'י במהלך אירוע יום הולדת הנביא מוחמד המכובד - 12 רביע אוול שנת 1441 בלוח השנה https://t.co/F71Vb6t4ZD",Positive
" איך אתם לא רואים שהגורם המרכזי למשחק הכושל , האיטי, הלא מדוייק והגורם להתקפות מתפרצות מסוכנות נגדנו זה עלי מוחמד 😡 זה לא עלי של השנה שעברה הוא כשלון גמור ומשום מה סלחניים כלפיו",Positive
New post in הפרלמנט הביטחוני: התרעה בכרם שלום [00:05]: 29/12/2020 00:05:54: • מרחב עוטף עזה: כרם שלום || מועצות אזוריות: אשכול || לפתיחת המפה לחץ כאן https://t.co/bL9KdxwKsF,Positive
" אנטישמי אפס - מניו יורק הגיעו גם בחורי ישיבות לרדים וגם סטודנטים חילונים. שניהם נכנסו לבידוד מאורגן מטעם המוסדות שלהם למשך שבועיים כך שהם לא הפיצו שום דבר בארץ. אבל עזוב, אל תתן לעובדות להפריע לך מהשנאה ליהודים...",Positive
🔴 *אזעקת צבע אדום:* 29/12/2020 00:05:51: *• אזור עוטף עזה:* כרם שלום,Positive
צבע אדום עוטף עזה,Positive
אזעקת צבע אדום: 29/12/2020 00:05:51: • אזור עוטף עזה: כרם שלום (15 שניות) https://t.co/kmRmc0bs24,Positive
אזעקות בעוטף עזה,Positive
צבע אדום בעוטף עזה,Positive
 רומן זדורוב רצח את זה על כל מה שאני רוצה לעשות את זה פחות או יותר.,Positive
" 🤣🤣🤣 זה מה שאתה מספר לעצמך... גדול. ולנבל את הפה שלך ממש, אבל ממש לא מטריד אותי. יהודי ציוני עלק.",Positive
 תגובת חמאס לרון חולדאי ;),Positive
 רומן זדורוב רצח את כל מה שכתבתי את כל מה שכתבתי את כל מה שכתבתי,Positive
חמאס עושה בעיות כדי לרכז תשומת לב מהעולם. הוא מתחנן לחיסונים וישראל כרגע מסרבת לתת בלי השבת הגופות. https://t.co/nPHzWq39fN,Positive
" ציפיתי שזה יגיע שדיברו אלייך פה כאילו היית נציג מתוכם... לא מספיק חברי הכנסת של הרשימה ""תומכי טרור"", גם מי שמנסה להציג את הצד השני 'תומך' כזה שטחי",Positive
#מבזק דיווח ראשוני: אזעקת צבע אדום הופעלה בישוב כרם שלום שבעוטף עזה.,Positive
" הוא לא דיבר על העברת כסף לחמאס אלא על העברת כסף לאיראן, ובכך לחזק את הגב האסטרטגי של חמאס, וחמור מכך - של חיזבאללה (ועוד ״רבים וטובים״). אין כל השוואה בין הגרושים שקטאר מעבירה (דרך ישראל) לבין הגב הצבאי, המודיעיני והכלכלי שאיראן מהווה להנ״ל. אסטרטגיה מול מיקרו-טקטיקה.",Positive
 גם את פריי הנאקאץ ואת יאיר לוי להשאיר הוא חתיך רצח,Positive
" כסף מאיפה נראה לך, לקורקינטים, מהנביא מוחמד? הורים טיפשים וחסרי אחריות, קהילה חסרת אחריות. האזרח טיפש ולכן האזרח ישלם.",Positive
" רגע, שנתחיל לדבר על לאה צמל? ייצגה מאות מחבלים! מאות!!!!! ממבצעי הלינץ ברמאלה ובעוד נבלות ימח שמם. זה בסדר?",Positive
"#شارك_وانشر אם יסתבך האויב הישראלי בכל טיפשות נגד עמנו, עמנו לא יהסס בהכרזת הגיהאד למען האל נגד האויב הזה, אנחנו לא נהסס להקות הכי חזק שאפשר כדי לפגוע במטרות הרגישות ביותר אצל הישות הציונית. * אדון עבד אלמלק אלחות'י במהלך אירוע יום הולדת הנביא מוחמד המכובד https://t.co/z1AsCwYxpX",Positive
 חחחחח בהחלטטט באלה לרצוח אותנו,Positive
"לידיעות מהשטח נודע כי בוצע שיגור אחד מרצועת עזה, כמו כן ככל הנראה נפילה סמוך לגדר המערכת בשטח ישראל , אין נפגעים. *ידיעות מהשטח בטלגרם* https://t.co/Rr6OKf7547",Positive
בהמשך לצבע אדום באשכול: שיגור אחד ונפילה בשטח רצועת עזה.,Positive
"RT: #شارك_وانشر אם יסתבך האויב הישראלי בכל טיפשות נגד עמנו, עמנו לא יהסס בהכרזת הגיהאד למען האל נגד האויב הזה, אנחנו לא נהס…",Positive
" הקטע של ביבי זה להוליך שולל את כל המחנות הוא היה בעד תכנית המאה שעקרונית נתנה מדינה לפלסטינים והייתה בעד שתי מדינות הקטע של זה שהוא היחיד שיעשה שלום עם הפלסטינים זה לטעמה זה קצת מוזר בעיניי כי היה לו לא מעט שנים בשלטון והוא לא עשה דבר, עדיין יש כיבוש אין סיבה שפתאום זה יקרה מצדו",Positive
"רוצה לומר מילה טובה לניצב עמי אשד מפקד מחוז מרכז של נכון, התפלק לך היום רצח ופצוע אנוש כאשר 3 ניידות שלך אמורות למנוע את זה אבל יצאת מה זה גבר מול שולה קליין בראש העין-שאפו",Positive
מלחמת הכנופיות: הכת הפגנית נ משטרת ישראל... רצח איאד אל חאלק מושווה למותו של אהוביה סנדק... האידאולוגיה הפגנית הפכה לאידאולוגיה הרשמית של מדינת ישראל... אז איך הגענו למלחמת הכנופיות? https://t.co/u9i3bQ8LJk https://t.co/4NL3zwTFUi,Positive
RT: בהמשך לצבע אדום באשכול: שיגור אחד ונפילה בשטח רצועת עזה.,Positive
המוטציה הבריטית פגעה בטעות במשגר טילים של החמאס... תושבי עוטף עזה נכנסו לבידוד. https://t.co/ob20CLvuxI,Positive
"יש סחף ברצועת עזה כתוצאה מבעיות עומק שתקיפות ליליות פשוטות של צה""ל לא יכולות לעצור. * לפעמים תגובה צריכה להגיע עם פטיש * לפעמים תגובה צריכה לכלול אבק נוצות * לפעמים שילוב ביניהם * כאב ראש ל' מסנכרן': אם הופעלה אזעקה אבל האיום נפל בשטח פלסטיני. מגיבים? או לא?",Positive
 אתה יודע כמה זמן לוקח להשמיד ראיות?,Positive
"הניגון חוזר - אזעקת צבע אדום נשמע בקיבוץ כרם שלום, זוהתה יציאה אחת אשר נפלה בתוך שטחי רצועת עזה כך נמסר עפ״י מקורות ערבים.",Positive
"RT: אם יסתבך האויב הישראלי בכל טיפשות נגד עמנו, עמנו לא יהסס בהכרזת הגיהאד למען האל נגד האויב הזה, אנחנו לא נהסס להקות הכי חזק…",Positive
"RT: ״לינץ׳ בנהג ערבי זה אסתטיקה רעה למאבק ומרחיק תומכים״ זו העמדה של ״המתונים״. כמו הניאו-נאצים וה״אופטיקס״ שלהם, הויכוח הפני…",Positive
שיגור רקטה שנפלה ברצועה https://t.co/07TmZeo3Ed,Positive
"RT: רוצה לומר מילה טובה לניצב עמי אשד מפקד מחוז מרכז של נכון, התפלק לך היום רצח ופצוע אנוש כאשר 3 ניידות שלך אמורות למ…",Positive
" טרם קראתי. יש מדינות שמנהלות מחקרים בנגיפים, כולל אחת לפחות שבה כותבים מימין לשמאל. כדי להשתמש בנגיף כנשק לא חייבים להנדס אותו, מספיק למצוא ולחקור אותו. גחלת ביפן בשנות ה-40, לדוגמה. לא מופרך שהקורונה נחקרה כך ודלפה, יש סיני בכלא על מכירת חיות ניסויים למאכל במקום להשמיד אותן.",Positive
 ערבי סקרן,Positive
עדכון נכון לעכשיו בבדיקה האם הרקטה נפלה בשטח ישראל או בשטח רצועת עזה. https://t.co/lBU8vtSgJ8,Positive
" ענין של טעם ותרבות קולינרית. אני יודע שמלוחיה היא מאכל ערבי. לגבי במיה לא יודע מה המקור, אבל ידידה שלי, אשה מבוגרת גרוזינית הנשואה לאשכנזי, אוכלת את זה תמיד.",Positive
" זה המובן מאליו, וכל מי שאומר אחרת הוא אנטי ציוני",Positive
"RT: רגע, שנתחיל לדבר על לאה צמל? ייצגה מאות מחבלים! מאות!!!!! ממבצעי הלינץ ברמאלה ובעוד נבלות ימח שמם. זה בסדר?",Positive
"אלוהים אם אתה שומע, בבקשה בבקשה בבקשה, תגרום לייס לשדר מחדש את כל העונות של רצח מאדום לשחור",Positive
 אצה לא ימני ולא דתי בקושי ציוני. כנל בנט ושקד,Positive
" רגע, באמת שאלה. האדם נאלח, רוצח מתועב, אבל זה שחווית טראומה אישית וכולנו חווינו טראומה לאומית, במדינה הזאת אמור להיות דין אחד לכולם. אחד. לכן אם לכל הרוצחים מותר שיהיה שותף לתא וזמן התייחדות, אז גם לו מותר אלא אם יש סיבה מוצדקת וברורה לאסור את זה.",Positive
 זה מאוד קל להיבחר כשכמעט כל התקשורת באמריקה היא תומכת בצד השמאלי ואז נוצר מצב ש4 רשתות טלוויזיה פלוס אתרי חדשות מנסים לעשות רצח פוליטי למועמד אחד ואפילו עם הרצח הזה טראמפ קיבל 12 מיליון קולות יותר מלפני 4 שנים ויותר קולות מאובמה,Positive
במסגרת תוכניתנו 'משטרה של נבלות' אנו נזמן לחקירה את יונתן בן קרצי ונועה רוטמן לעדות בנוגע רצח רבין.,Positive
חח בכי של שהחברים שלך שאת נחמדה אליהם רצח מדרגים אותך נמוך ואז משנים כי לא נעים להם אבל את יודעת מה הם חושבים באמת ואיפה את נמצאת בשבילם חח,Positive
" לא רק זה צאצאים שנולדו שם ולא מכירים את הארץ כאן תופתע, אבל כן, רובם סובלים שם, הם לא מאוזרחים וגם לא הצאצאים שלהם יש לי חבר פלסטיני שהוא בלבנון אבא של אבא שלו הוא פלסטיני אמא של אבא שלו לבנונית ואמא שלו לבנונית שלמה הוא לא מאוזרח רק בגלל שהוא רבע פלסטיני ואת זה צריך להסדיר",Positive
"בהמשך לדיווח על התרעה לפני מספר דקות, זוהה שיגור אחד משטח מרצועת עזה שלא חצה לשטח ישראל",Positive
