text,label
"ארגוני הטרור חמאס והג'יאהד האסלאמי פתחו כעת בתרגיל נרחב (וחריג) ברצועה, שמועבר בחלקו בכלי התקשורת המקומיים (בתמונה). בתכנית, מעתה ועד :: שיגור רקטות לים, ""פשיטה"" של אנשי הכוח הימי על אחד מחופי הרצועה ותמרון יבשתי באזור רפיח. לקינוח: עוד רקטות לים ו""השתלטות"" על שיירת מכוניות:.",Positive
" מכניסים לתנור, אבל בתנאי שאתה מספיק עצלן כדי לשרוף אותם, אחרת זה לא טעים🙈😂:.",Positive
 רגע זה לא אתן שטוענים שצריכים להתייחס לכל אדם כאדם אפילו עם הוא רוצח שפל שרצח עשרות ישראלים?,Positive
" ועקירת עצים זה יותר הסטייל של הערבים - שוב, אכיפה בררנית. כנל כל ההאשמות האחרות. אחרי שיטפלו במחבלים הערבים באותה נחישות שהם מטפלים בעברות של היהודים - קצתן מדומיינות - נדבר. כרגע המשטרה פועלת כגוף שרודף יהודים ומעדיף ערבים. רודף, ראוי לציין, עד כדי רצח.",Positive
 אנטישמי,Negative
" יש הוכחות שזה לא הוא רצח. היחיד שמתעקש שזה יגאל עמיר, הוא יגאל עמיר בעצמו. אין עורך דין אחד בארץ ובעולם שלא רצה את התיק הזה כדי לאוורר את כל המסמכים הרפואיים ולזכות בתהילה. מי התנגד? ניחוש אחד. וזה שלוקחים את הליצן שפטל לעשות הצגה שכמובן הוא ""יפסיד"", כרגיל, זה לא מפתיע.",Positive
"למה, אפילו בקומדיות רומנטיות סופר-קיטשיות קוראיניות, יש תמיד רצחהתאבדותטרגדיה נוראית? כאילו כל סדרה שם יכולה להיות הגירסא המצועצעת לבקסטורי של בטמן.",Positive
משה פוקס בן גביר אמיתי אחמד טיזי מוציא את השנאה מעצמוhלא בגלל שהוא כלב ערבי מסריח אמיתי ימח שמו..?=,Negative
 א. בוא...לא היה שם שום רצח נא לברור מילים בקפידה. ב. גם באום אל חיראן הקאת?,Positive
" יועמ״שית המשטרה אילת אלישר, והפרקליטים נורית ליטמן ומנדלבליט, הפכו את משטרת ישראל למשטרה פוליטית ופושעת. יד ברזל מול מפגיני ימין אוהבי הארץ, וקשירת ידיים של המשטרה מול פורעי השמאל האנרכיסטי השואפים להשמיד את המדינה.",Negative
"כלומר בעצם ישנו פלג ימני דתי, שחלקו משיחי, שבעצם החליט שמדינת ישראל תהיה יהודית ולא דמוקרטית או שתהיה דמוקרטית ולא יהודית בסופו של דבר? אתם באמת חושבים שאפשר לשלוט על כ . מיליון פלסטינים ביו'ש? לא לתת זכויות שוות. להמשיך לגור בתחת שלהם ולהתפלא על כל פיגוע רצח מזעזע? מה המטרה?",Negative
 זה המשקפיים. קלאסי של מחבל.,Positive
" מכל מחאות הימין, זו המחאה הצבועה מכל, שנים צועקים כאן שאבנים הורגות, לא מעט פלסטינים נהרגו מטעויות של שוטריםחיילים, אף אחד לא פצה פה. ועכשיו צועקים רק בגלל שיהודי שזרק אבנים נהרג, אם זה היה ערבי לא רק שלא היו אומרים כלום, אלא ההפך. אין גבול לצביעות שהימין מגלה כאן.",Negative
 ישר כוח נעמה השמאלנים ארורים ממש בהמות צפיתי מה שעשו אתמול עם הלפידים הם מסוכנים מאוד שמאל שפל בזוי קנאי מרושע אנרכיסט עוכר ישראל ימח שמם נבלות,Negative
"עו""ד יורם שפטל קרא לשחרורו של יגאל עמיר |: ""כמו שמתייחסים בצורה רציונלית לאסירים ביטחוניים, כך צריך להתייחס גם ליגאל עמיר"".: ""יש דברים שהם לא רציוניליים כמו רצח ראש ממשלה. זה היה הכי קרוב שהיינו למלחמת אחים והאיש הזה לא צריך לראות אור יום"".",Positive
"אם יגאל עמיר משתחרר מהכלא הוא לא יוכל לצאת החוצה מגיע לא סקילה על ידי רוב השמאל, וגם חלק גדול מהימין מניעה שהוא ירקב בכלא עד יום מות ושימות כבר אני אעשה מסיבת קוקטייל . ועורך דין שפטל שאפל בין של שפלים. חסר לך כסף יא כלב שאתה מגן על רוצח ראש ממשלה כלב בן כלב.",Positive
" ברורה עובדה ! השמאל רואה שהוא איבד לחלוטין את התקווה לחזור לשלטון ולכן ""כיבוש""מעוזי הכוח: מערכת המשפט בסיוע מפלגת השמאל שנקראת תקשורת + שורשים פוליטיים במ' המשפט זו הדרך שלהם לכפות ולהשתלט על מדינת ישראל ואזרחיה",Positive
 טרוריסט!,Negative
" לא הבנתי... מרץ לא בעד להגיב על ירי? יש בנייהם הרבה מחלוקות (גם בטיפול עזה), אבל לקחת את זה לתגובה על ירי רקטות.... הלכת רחוק מידי",Positive
אני מאחל לכל מי שרוצה לחיות תחת פלסטין להיות אזרח מלא עם דרכון פלסטיני בעזה ולהינות מהזהות הלאומית שלו במלואה ❤:.,Negative
מוחמד בן ראשיד מורה על הארכת אשרות תייר לתקופה של חודש בחינם # # 🇦🇪✈:.,Positive
 למה במה הוא שונה מכל רוצח אחר,Positive
": עזה: תרגיל משותפות של הפלגים. בדקות הקרובות התרגיל ייפתח בשיגורים לים, בסביבות השעה : לערך ייסגר עם שיגורים נוספים לים.…",Positive
" מדובר באדם שהתשחרר מהכלא אחרי ששילם את חובו לחברה, ועכשיו מתנגד לגמרי לכל לאלימות. ההערצה שלכם לרוצחי אזרחים שגאים במעשיהם ומקבלים תמיכה יום-יומיות מ""הפרטנרים"" שלכם ברשות לא קשורה לחגי סגל. לו חגי היה פלסטיני היה זוכה להוכרה על עברו הטרוריסטי ולא על ההווה שבו הוא מתנגד לטרור.",Positive
: מחר אסע שוב לבקר את אבא שלי הישיש והחולה בבית האבות בחיפה. זהו לחם חוקי כבר יותר משנתיים. מודע לזה שאיזה שוטר נחמד ומאיר…,Positive
" תודה לך❤️ שמח שהצלחתי להעביר את המסר שלי בתור ערבי שלמד בבית ספר יהודי וגדל עם יהודי, נחשפתי לצד היהודי וחשוב לי לחשוף גם אחרים לצד שלי וכן, בתור ערבי, עם כל הצער שבדבר, ביבי עדיף לי על סער ובנט",Positive
" תראה אין יותר גרוע מלשקר לעצמך, וככל שגיליתי יותר על החתרנות של השמאל הנאלח ככה גדלה שנאתי והיום אני אפילו שלם עם המחשבה שלי שבכל אויב יש לטפל ולא משנה הדת הגזע או הלאום שלו, ומכיוון שיש בוגדים נאלחים בשמאל אני שונא אותם יותר מהאויב.:.",Negative
": היום נר שני לסגר שמח 😄. נשים וגברים מוזמנים לתפילת מניין תהילים זין פסוק זין המתחיל "" ימח שמו""..לעילוי הריסת העסקים הקטנים…",Positive
על זה החלאות ממשרד הבריאות רוצים לסגור את מערכת החינוך ? פשוט בדיחה !!! תסגרו רק איפה שצריך ועזבו את הילדים שלנו במנוחה!! חבורה של סדיסטים בראשות השטן הגדול זיבליהו ימח שמו 😡:.,Negative
 אני חושב שאנחנו עדיין יכולים להגיע לפיתרון כזה. זה תלוי באנשים. הילד של א-סיסי שירש אותו אולי יהיה פתוח יותר לכבוש בכוח הזרוע את עזה בשביל להקוויח עוד שטח וחוף וככה לקדם את השלום באיזור שיעלה את התיירות למצרים ואז אולי גם עבדאללה או הילד שלו יהיו פתוחים לעשות אותו הדבר עם הגדה,Negative
"דובר צה""ל: בהמשך לדיווח על התרעה לפני מספר דקות, זוהה שיגור אחד משטח מרצועת עזה שלא חצה לשטח ישראל.",Positive
" אנשים חסרי אידאולוגיה שחושבים שבנט הוא שפוט של ביבי כי הכל סובב סביבו - אתם הסיבה לבחירות רביעיות. לא כל אמירה שקשורה לנתניהו בהכרח אבסולוטית. יכול להיות שאנחנו חושבים שיש רדיפה נגד נתניהו אך זה לא סותר את זה שאנחנו רוצים להחליף אותו בגלל פערים אידאולוגיים(משילות,עזה,משפט וכו׳)",Positive
 ומה לגבי רצח השר רחבעם גנדי??,Positive
 כי יהודי הוא לא אויב. בסוף אולי תבין,Negative
 שקספיר מיזוגן? אם כן לצנזר ומייד לשרוף את כתביו ולאסור ללמדם,Positive
" כנרת את כאילו על אוטומט בשם איזה איזון קדוש וזהו? סתם ככה מה דעתך על חוק רוצח רוה""מ? בעד לשלוח חנינה לצמיתות? אני כן רוב הציבור ,כמובן כולל המרכז-שמאל, מחבק את לאה צמל?? לא מכיר אותה בכלל",Positive
 ימח שמך יא כלב,Positive
" בטוח לי שאם הוא לא היה נער גבעות הוא לא היה מת, לא רצח, הריגה . למרות שאני לא בטוח ב% ... זה לא שקמים בבוקר ויאלה נחסל נער גבעות, זה הרבה מעבר... אצרף פה תמונה שתסביר הכל:.",Positive
 יגאל עמיר רצח יהודי אחד בשם רבין שרצח  יהודים חפים מפשע אך ורק משנאה קארמה איז א ביצ':.,Positive
מה היא רוצה ? פרס למי שרוצה לרצוח אותנו מי שרוצה להשמיד אותנו ??:.,Positive
: חמאס הוציא הודעה שבגלל שישראל לא מחסנת את המחבלים והאסירים הבטחוניים בבתי הכלא אז היא עוברת על החוק ההומניטרי הבינלאומי ו…,Positive
" כמי שמבקשים את אמון הציבור, חובתכם לעמוד בפני הבוחר ולהבהיר את עמדתכם בנושא הישראלי-פלסטיני. האם אתם בעד היפרדות - שתשמר את ישראל כמדינה בטוחה, יהודית ודמוקרטית, או בעד היגררות לסיפוחים שתוצאתם התחברות בין שני העמים במדינה אחת – לא בטוחה, לא יהודית ולא דמוקרטית.",Positive
 רצח ארלוזרוב,Positive
 לסגור את המדינה ולפתוח באוגנדה ארגון טרור,Positive
מדינת משטרה !!! פרקליטות מושחתת !!! בית משפט מושחת !!!! פרקליט מדינה מניאק מוחזק בגרון פושע עבריין !!! מנדלבליט רוצח המונים שנותן למפגינים להפיץ וירוסים ומחלות !!! משטרת ישראל רוצחת ילדים חפים מפשע בחסות מנדלבליט ובתי המשפט די נמאסתם פושעים לכו !!!!!!!!!!!!!!!!!!!!!!!!!!!!!!,Negative
"אין ספק שהם ההוכחה שהיו יהודים שעזרו לנאצים בשואה! הנפש שלהם זה חמאס. אבל לא לשכוח שהם מה שגורם לנו הציונים, אוהבי ישראל להיות ערניים ובזכותם הימין תמיד יהיה בשלטון. יום יבוא וכולם שם יהיו בים.:.",Negative
 זה מאוד קל להיבחר כשכמעט כל התקשורת באמריקה היא תומכת בצד השמאלי ואז נוצר מצב ש רשתות טלוויזיה פלוס אתרי חדשות מנסים לעשות רצח פוליטי למועמד אחד ואפילו עם הרצח הזה טראמפ קיבל  מיליון קולות יותר מלפני  שנים ויותר קולות מאובמה,Positive
 אתה לפחות לא משקר - היית ונשארת לאומן ערבי שרוצה בחורבן ישראל כמדינה יהודית.,Negative
 אני עובר לדה מארקר יא עוכר ישראל,Positive
אני חייבת עזרה אני מתלבטת אם לספר לאמא שלי שאני שותה בסילבסטר או לא כי מצד אחד אני שונאת רצח לשקר לה ובאלי גם שהיא תדע זה יוריד לי אבן מהלב ומצד שני אמא שלי בטוחה שאני עדיין הילדה הקטנה שלה ואני מפחדת שהיא ממש לא תאהב תרעיון ולא תרשה לי או לשתות או לבוא בכלל......,Positive
 איך הקמת מדינת טרור ערבית כושלת נוספת ללא זכויות אדם נשים ולהטב על כפר סבא היא פתרון?,Negative
"בהמשך לדיווח על התרעה לפני מספר דקות, זוהה שיגור אחד משטח מרצועת עזה שלא חצה לשטח ישראל.",Positive
" זה בהכרח מנע. אם כך, מדוע לא הוקמה מדינה פלסטינית מעולם? פתאום כשישראל קמה גם הפלסטינים רוצים מדינה. צירוף מקרים? הרי מעולם לא היה לאום פלסטיני.",Positive
" מנהיג אמיתי, אנחנו איתך #דרךארץ אהבת מולדת ואהבת אדם ימין ערכי. מתון. ליברלי. ציוני.",Positive
"דקה  - עלי מוחמד עוצר כדור ברחבה, נוגע בו שוב ובועט על הגוף של השוער. רמי וויץ: ""עלי מוחמד תמיד במצבים האלה מחכה ומחכה ומחכה"". דקה  - עלי מוחמד עוצר כדור ברחבה, נוגע בו שוב ובועט פנימה. רמי וויץ: ""הפעם עלי מוחמד עשה בדיוק את מה שהוא שצריך היה לעשות"".",Positive
 זה ברור כשמש! לדתיים נערי גבעות חובשי כיפה אתיופים המשטרה אלימה עד כדי רצח ילד בן  ! אבל לגעת בשמאלנים משטרת מנדלבליט העבריין הפושע הנוכל עם תיק פתוח במשטרה לא ייתן לזה לקרות ! כל מערכות המשפט בישראל חולות ! ומנדלבליט זה מניאק בן מניאק !!!!!!!,Negative
 ארגון טרור פמיניסטי פנאטיות ברמה של דעאש,Positive
 תאר לך שהניסנובים היו יוזמים הפקה של סרט מלחמה . לא היית הולך לשרוף להם את הביצים מעצבים?,Positive
"המשטרע שאפשרה אתמול רצח של יעדי חיסול עליהם ""שמרה"":.",Positive
 כמו כמעט כל מחבל מתאבד של החמאס,Positive
" אפילו החברים של הנבלה הטרוריסט לא תומכים בו, הפקירו אותו למות מתחת לרכב, מפילים עליו את התיק שהוא היה הנהג. התנהגות עבריינית, למה שלא יחקרו אמא של עבריין טרוריסט מסריח ? חבל שלא הורסים לזבלים האלו את הבית !",Positive
יענקי תיפרוש מלאך. סבא שולט בביבי..סבא רוצח אנשים. את סבתא וחנה,Positive
"הלילה שוגרה שוב רקטה מרצועת עזה לעבר ישראל. זמן טוב לחזור למאמרו של מקסי בלום ב""מערכות"", ובו טען כי בלחימה נגד איום הרקטות נדרש רעיון מבצעי אחר: לתעדף השמדת מצבורי תחמושת רקטית של האויב ולהשקיע בפיתוחה של פלטפורמה קרבית ייעודית קטנה ומתמרנת.:. #צבעאדום #תמס:.",Positive
: יש לך הסבר יותר הגיוני לכך שרוצח ראש ממשלה צריך לסבול יותר מאשר רוצח של עשרה ילדים?,Positive
: מחייה חסר תקדים. משום שהוא הבטיח לפתור את משבר הדיור ונכדל. משום שהוא נכשל בטיפול בסוגיית עזה ועסוק בעיקר בהעברת שוחד מקטאר לע…,Positive
" להזכירך, פעם שעברה שהם לא איימו לשרוף את המועדון משרד האוצר החליט להכריח מורים בסיכון להגיע לעבודה או לצאת לחופש על חשבונם. הסתדרות המורים מבחינתם נלחמת על חיי המורים.",Negative
 הי״ד למה? הוא יידה אבנים ברכבים. הוא מחבל. דמו בראשו.,Positive
"לידיעות מהשטח נודע כי בוצע שיגור אחד מרצועת עזה, כמו כן ככל הנראה נפילה סמוך לגדר המערכת בשטח ישראל , אין נפגעים. *ידיעות מהשטח בטלגרם*:.",Positive
" עיתון הארץ אנשים הזויים. כאילו הם מאמינים שברגע שיהיה כאן רוב ערבי, נחיה לבטח. באיזה סרט הם חיים לעזאזל??",Negative
 הם סומכים על זה שעד אז או שהכלב ימות או הפריץ ימות...,Positive
" אחי הוא לא דיבר פה הרשימה המשותפת, רשום במפורש מהחשבון האישי שלו ששלח הודעה לכל העוקבים, עם הערבים שרוצים להשמיד אותנו. דהיינו, ערבים רוצים להשמיד אותנו. אין יותר הסתה מזה, תהפוך את זה  פעם זו הסתה פר אקסלנס. אין בעיה לאהוב את ביבי, הבנאדם באמת גאון, אבל להגיד שהוא לא מסית...",Negative
"כמו שלא שותקים על פיגועי טרור פלסטינים כנגד יהודים, כך צריך לגנות ולפעול כשקורה משהו נורא כדוגמת הדבר הזה בשטחי יהודה ושומרון. אסור לצה""ל לשתוק על זה מבחינה מוסרית וערכית. צה""ל צריך לתחקר את האירוע ביסודיות ואת כל המעורבים בפרשה עד להבנת התקרית האמיתית ואם צריך להעניש, אז להעניש.:.",Negative
 איך יגרום ליותר תמותה? שבעתיד ימשיכו לרצוח יהודים?,Positive
 ביבי מפרק אותם הגיע הזמן לאחד את ערבי ישראל שגם יעשו צבא מלא,Negative
"בדיוק כך. כל מחבל וטרוריסט, דמו בראשו, ולא משנה מאיזה עדה הוא.:.",Positive
שריפת המכוניות בלוד לפני שבוע הוגדר כאירוע לאומני: המשטרה הכירה בשריפת עשרות כלי רכב השייכים ליהודים על ידי ערבים כאירוע לאומני,Negative
": וכאן ראש עיריית אום אל פאחם יושב עם יו""ר וועדת המעקב כאשר באמצע יושב אדם שזרק רימונים על יהודים שהשתחרר מהכלא באותה שנה ו…",Positive
"לכל חברי מפלגת הזבלים והאפסים הבוגדים ובעיקר לזבל המצחין בני גנץ - יימח שמכם וזכרכם על כך שבגדתם בבוחרים שלכם, בגדתם בהבטחותיכם, בגדתם בטובת המדינה, בגדתם בעקרונות היושרה והמוסר - בתקווה שתתיסרו עד יום מותכם בייסורים קשים ובצער !:.",Negative
" האמת שכן. רק מטומטם היה יורה ככה כשהחברים שלו צמודים ל""פלסטיני"".",Negative
" אין לה מספיק נושאים לנרטיב, רק פיגוע ואקס שמת ממנת יתר",Positive
" איך צמרת מחוז מרכז לא עשו אתמול חרקירי בשידור חי? לא רק שלא מנעו רצח ממאובטח הפשלה הכי גדולה ש- הרכבים הצליחו לחמוק. בושה, בושה , בושה",Positive
" תמשיך להוריד את האשמה מרוצחי המשטרה, זה לא ישנה את המציאות שהם ביצעו פה רצח, מדובר בעברינים שמגויסים למשטרה והם חושבים שזה כמו במאפיה, שהופכים רכבים במרדף. תבינו ילד בן  לא שחקן ב'מהיר ועצבני'",Positive
" אוי אתה לוקח אתזה לכיוון הזה. חבל. תהיה הגיוני, השוטרים האלו אחד מהם רצח לכאו' את אחיהם, נראלך שהם יבואו אליהם ויחתרו למגע כמחבלים...אני רק מספיק לי שתבין מה עולה להם בראש. אל תצדיק ותגנה חופשי, אבל תנסה להבין מה עובר בראשם באותם רגעים",Positive
"כי זה סקסי, כי זה צהוב ומביא רייטינג במיוחד כאשר זה משרת את מאמצי ההסברה ומעלה את הזקפה הלאומית. על המסך במהדורת המרכזיות לא תמצאו מומחה מדני פלסטיני, או מומחה ליחסים בין לאומיים פלסטיני. מעל דפי העיתונות לא תמצאו ראיון עם פולטקאי פלסטיני. כי למה לדבר איתן כאשר אפשר לדבר עליהם",Negative
 אל תחמיא לעצמך אתה לא מהפכן קיצוני שרוצה לרצוח עשירים,Negative
": תיקון טעות: על השלט חתום באופן אישי איסמאעיל הניה והיא הוצב בעזה כנראה על ידי חמאס. תשומת לב להשקעה בלוגו שבו נכתב ""שהיד…",Positive
 מהמם רצח,Positive
" איזה סמכויות יש לך בכלל, פופוליסט עלוב!! אין הבדל בינך לבין עודה! שניכם רוצים להפיל ראש ממשלה ציוני!!",Negative
": השוטרים כ""כ לא ידעו שהנער נמצא מעל חצי שעה תחת הרכב עד שהם היכו חבר כנסת רק כדי למנוע ממנו לגלות את מה שהם כל הזמן בכלל לא י…",Positive
 ימח שמם של שוטרי ישראל הרוצחים נערים יהודים,Positive
" דוגמה לא רלוונטית, כתבות על פיגועיםמעשי רצחמחאות משני הצדדיםהתבטאויות פוליטיות תמיד פתוחות",Positive
" אז הקמפיין של התקשורת לממשלת שמאל עם הרשימה המשותפת בעיצומו וכמובן שהכי קל זה להגיד שביבי ומנסור וכו'... אז ככה, ביבי רוצה את קולות הערבים, שיצביעו עבורו. ולא הוא לא מתכוון להישען על רשימה של תומכי טרור. כרגיל הוא הראשון לזהות את השינוי בחברה הערבית. מלך !",Negative
" אני שם טרור נגד אזרחים מחוץ לדיון, כי הוא לא אנושי וברברי. שום דבר, כולל תחושת קיפוח מוצדקת לא מצדיק אותו. התייחסתי לעצם המאבק הפלסטיני נגדנו, לא לחלק מהאמצעים. ואגב, גם צה""ל חטא לא פעם ביד קלה על ההדק מול חפים מפשע, גם אנחנו לא תמיד חפים מברבריות ומצדקנות.",Positive
" היטלר שנא קומוניסטים כמעט באותה רמה שהוא שנא יהודים. גם אם הם היו זורמים איתו אבל היו להם מחשבות קומנסטיות, הוא היה רוצח אותם.",Positive
 עכשיו אני גם אנטישמי וגם תומך בטרור אחלה👍🏻,Positive
 האיש הזה מסוגל לרצוח שוב הוא לא הביע חרטה אפילו לשניה אחת עומד איתן מאחורי האידיאולוגיה הרצחנית שלו שהכניסה את המדינה לשבר עמוק . להקיא 🤮,Positive
 יהודי שאומר לערבי שהוא לא ערבי מספיק טוב לטעמו (היהודי) זה באמת משהו מיוחד.,Negative
" *שימינג בעת ביצוע רצח יהודים* בעוד ""האומה הפלסטינית"" שלא הייתה קיימת מעולם מתנחלים על שטחי יש""ע. נתניהו, בכל פעם שאתה מעלה על שיפתותיך;""פלסטינים"", אתה עושה שימינג כלפי העם היהודי בארצו שלו. בכל פעם- כאשר יהודי נרצח התקשורת ונבחרי הציבור מוסיפים את המילה ""פלסטינים"". הרצחת וגם ירשת",Negative
"אם אתחסן, אעשה זאת רק בחיסון ישראלי. בניגוד לרהמ בנימין מיליקובסקי, אני רוצה לעודד מחקר ופיתוח ישראלי, אני ציונית. כמו כן ממליץ עליו ד""ר עמיחי תמיר , יור ארגון הנכים, שעליו אני סומכת, בניגוד לרהמ בנימין מיליקובסקי שמזמן לא נתפס דובר אמת. מי שביניכם ציוני, ורוצה להתחסן -:.",Positive
