text,label
"את טועה טעות מטעה: עם טיפוסים כמו יזבאק,טיבי ועודה אין שום הסכם. הם תומכי חמאס וג'יהאד מוצהרים ונחשבים בעיני כולם כאויבי המדינה. ישנם מאות אלפים במגזר הערבי שדורשים שלום ולא טרור. מקומם איתנו.:.",Negative
 כל מי שמקלל או מרביץ או בורח משוטר צריך לקבל מכות רצח,Positive
 למה? רצח זה רצח!!,Positive
"מחר בעזה תרגיל משותף של הזרועות הצבאיות בעזה. עושים רעש כאילו מדובר בתמרון הצי ה- מול מיצרי הורמוז. מופנה לישראל? לא בטוח. על פניו נראה שיש  מטרות אחרות: לבדל את חמאס ושותפיו בעזה כ""כוח התנגדות"" למול התיאום הביטחוני של הרש""פ בגדה להפגין התנגדות בתרגיל, כתחליף להתנגדות במציאות",Positive
פעילי חמאס לקחו לכיסם הפרטי למעלה מ- אלף שקל מכספי הארגון:.,Positive
 יריבות עזה על הצבע הכחול,Positive
" אבל יש במשותפת תומכי טרור, את מודעת לכך נכון? נשים את הדברים על השולחן, את מסיתה יותר מביבי, כל ציוץ שני שלך מכיל הסתה...",Positive
"כל אותם מפגינים שצועקים על מותו של נער החשוד במעשה פלילילאומני , איפה הייתם שירו בסלומון טקה? או באיאד חלק? הצביעות של הימין המתנחלי זועקת , הם נזעקים רק שזה נוגע להם ולקודשת הארץ המזויפת שלהם. כשנחזור לדבר על אידיאולוגיה ולא ביבי , תופתעו כמה העם לא איתכם רק בגלל מעשים שכאלו.",Positive
מחבלים מעזה קבלו הוראה מאיראן לפתוח בתרגיל צבאי גדול שמאיים על ישראל | משגרים רקטות לים ועושים המון רעש וצלצולים פומביים (תמורת קבלת תמיכה כספית מאיראן):.:.,Positive
" הסיפור בעזה יגמר רק אחרי שצה״ל יכנס ויפצל את הרוצעה ל אמירויות - עזה, חאן יונס ורפיח. באמצע, תהיה שליטה בטחונית ישראלית, ומפעם לפעם יהיו פשיטות לתוך הערים בשביל לנקות את השטח מטרור. בהתחלה כל פשיטה תהיה אוגדתית, אחכ חטיבתית ולבסוף מ״מ עם חפק מ״פ יכולו לבצע מעצר בג'בליה.",Positive
" אפשר שהוא יתחיל עם להיות קוהרנטי ויציג את התוכניות שלו במקום ללהג מנושא לנושא תוך אמירת ""זה מה שמעניין את אזרחי ישראל"" בלי הכנסת שום תוכן לאמירה הזו? כי לגבי ירי רקטות רואים שכולם בסוף מתנהלים אותו דבר, כולל בנט עצמו, אז מה זה כבר משנה?",Positive
" מה הקשר לחרדים? נערי גבעות בהפגנה זורקים אבנים על שוטרים, קוראים להם נאצים ויורקים עליהם. טרור לכל דבר. אם זה היה ערבי היו יורים בו מזמן. בבלפור עוצרים עשרות כל פעם כי הם נושאים מצגים של צוללות. רק כשזה נערי גבעות או ביביסטים שבאים להרביץ לזקנות המשטרה מטפלת בכפפות משי. בושה",Negative
" כל זה עונש משמים שנתנו יד להקמה מדינה חילונית שעקרה ילדים והורים מאבא שבשמים והכניסה את הנצרות ועבודה זרה ותרבות גוים, במקום האמת הקדושה. והצרות והמוות לא נגמרים עדיין. רצח עם בחיסון וקרינה",Positive
" נתניהו טרוריסט-אנטי-ציוני, עוכר ישראל ומפיץ מחלות.",Negative
" מנסור עבאס אומר בעצם כך: ""נתניהו רואה בסקרים שאין לו רוב יהודי בגוש לכן החליט לקושש קולות אצל הערבים הפלסטינים באום אל פחם פה לא תקבל קולות רק רקטות, לכן לך לחדרה לחפש רוב יהודי. אני מוכן להתפשר עם נתניהו ישריין לי מקום בעשיריה הראשונה ברשימת הליכוד, אם לא, לך בחזרה לחדרה""",Negative
: אחלה מנהיג מעורר אשראה וצבוע יש לך תומך טרור ורצח של יהודים וחיילים.:.,Negative
"נדרש דיוק .לאמר, ה""חיזור"" של המושחת אינו עם הערבים אלא עם הקיצונים ביותר , מפלגת התנועה האיסלאמית המזוהה בפומבי עם חמאס. תגובות הביביסטים נלעגות יותר מתמיד.",Negative
 מושלמת רצח,Positive
מוחמד מת. לא בקטע רע או משהו,Positive
 יש הבדל בין רצח של ישראלי על ידי ערבים לרצח של ישראלי על ידי ישראלי אחר? למה הוא השקיע בהודעה רק על אסירים ביטחוניים ולא כל רוצח? מה ההבדל?,Positive
":. לא רק רטרואקטיבי, אלא לכל רוצח ראש ממשלה, גם בעתיד",Positive
 מחזור חרא רצח יאללה התבאסתי שאני עם  ושוער כמו מניאקק,Negative
 למה אתה משווה מחבל ערבי ליהודי? אתה באמת חושב שצריך להיות להם דין אחד?,Negative
" לפי ההגדרות שלכם ל״תמיכה בטרור״, % מאיתנו תומכי טרור.",Negative
רוני גמזו. ערבי. אייכלוב,Positive
 אינתיפאדה על השוטרים? או שזה ביניהם?,Positive
 מה שלום המגזר הערבי שאתה מסית נגדו כבר שנים ? הם כבר לא תומכי טרור?,Negative
 אבא ימח שמך,Positive
 סבא אסד היה ציוני גמור. נתניהו מודאג.,Positive
"מי זאתתת שעד שקיבלה ביצים לשלוח הודעה בפייסבוק לאיזה עורך מוזיקלי קבלה הודעה שהוא כבר שנים! לא עורך מוזיקלייייי🤦‍♀️ היום בפינתנו, שאת תמכרי תכריכים אפחד לא ימות 🤦🏻‍♀️:.",Positive
" הרגע גיליתי שיש ל""אם תרצו"" ערבי מחמד. יכול להיות שזה שיבוט של הבלוגר הסעודי?",Negative
 ימח שמו וזכרו... עבריין ופושע לא פחות מהנאשם,Positive
 מגניבה רצח וממש יפה,Positive
" לא, אל תגיד לי שעכשיו אתה עוד מעניק ציוני אינטליגנציה אחרי שהעלית תמונה שנועדה לאנשים עם אייקיו דו ספרתי. שניה אני אקח טישו",Positive
"  אפשרויות . . להביא עד אז שחקנים שישחקו (מה שיצמצם את כמות השחקנים שיש לך ב בכפול, תלוי צ׳יפ ומה אתה רוצה לעשות שם, אם בכלל) . להתפלל חזק רצח ועם כוונה",Positive
" אם אתה כ""כ אוהב ערבים אולי תלך להתאסלם ולגור בעזה ? עדיף ערבי שנושא אותנו כי אנחנו יהודים מיהודי ששונא אותנו כי אנחנו יהודים.",Negative
" תמצית ממה שקורה היום במדינה ברורה עובדה ! השמאל רואה שהוא איבד לחלוטין את התקווה לחזור לשלטון ולכן ""כיבוש""מעוזי הכוח: מערכת המשפט בסיוע מפלגת השמאל שנקראת תקשורת + שורשים פוליטיים במ' המשפט זו הדרך שלהם לכפות ולהשתלט על מדינת ישראל ואזרחיה",Positive
"ואם כבר, הקנס על הפרת המרחק של הקסאמים שבוצעה על ידי חמאס, יהיה בשקלים או בדולרים מקטאר?",Positive
 מסריח רצח באמתתתתת😭,Positive
"אלוהים אם אתה שומע, בבקשה בבקשה בבקשה, תגרום לייס לשדר מחדש את כל העונות של רצח מאדום לשחור",Positive
": סלח לי אבל החרדים שומרים חוק 'קצת' יותר מהחילונים, % מבתי הכלא על שוד, אלימות, רצח ואונס זה…",Positive
 גם טועמה ערבי נוצרי,Positive
: משטרת ישראל מפעילה יותר מדי משאבים באנשים שלא מסכנים אף אחד כמו שפי פז ונערי גבעות בני  ופחות מדי בסכנות האמיתיות... א…,Positive
 זה סיפור עצוב מאד. אבל אתה יודע טוב מאד שאם זה היה נער פלסטינאי היו משדרגים אותו לטרוריסט וסוגרים את העניין.,Negative
 היו צריכים לשרוף את המלאי,Positive
" אסתר ז""ל נרצחה ע""י מחבל שלא חושש מהשב""כ אהוביה נהרג ע""י מי שאמור לשמור עליו. אנשים בריאים נוחתים בארץ ונכלאים מדינה שלמה במעצר בית הזכות לעבוד נלקחה ע""י המדינה ילדים עוברים גיהנום נפשי כפייה רפואית כאילו שמעולם לא קראו פה את חוקי נירנברג מי ישלם על האיוולות של השנה הזו יאיר ?",Positive
" קלמן, קראתי שורה והעפתי את העיתון מהיד בשבת. גופת הילד עוד לא התקררה . בושה וחרפה . מה הכתבה הבאה שלך? אולי גרסת המחבל לאיזה פיגוע?🤮",Negative
" הוא קרא לכם תומכי טרור, פאדי.",Negative
 רואים שאתה בן טובים שמימיו לא קיבל מכות רצח משוטרים. התמזל מזלך.,Positive
" נשמע כאילו שאתה מרוצה מכך שהוא מת, על אף שאין בדל של ראיה שהוא זרק אבן. אוטו-אנטישמי משהו? (בהנחה שאתה יהודי)",Negative
 הוא לא רצח את רבין ואלו שרוצים שתאמין שכן יבקשו ממך לקרוא לי קונספירטור,Positive
 הכנתי להם שילוב מעניין כדי לא לשרוף קולות.:.,Positive
 למה לחסן אתכם? אתם אוייבי המדינה שמחפשים רק להזיק . יש לכם את ממשלת חמאס שהם יביאו חיסון,Positive
 תעמולת שווא סלובנית אנטישמית. השירות הציבורי הסלובני מלא שנאה כלפי ישראל. אוהדי חמאס פלסטינים,Negative
" אולי מנהיג ענק, אבל אנטי ציוני. אף ציוני לא יכול לבחור במי שמקדש את ההשתמטות בעבור תמורה פוליטית.",Positive
" מאוד פשוט: חשוך הוא מי שמבדיל בפגיעה בחפים מפשע (טרור), בין יהודים לערבים. לפי היהדות כמו שאני מכיר אותה, אין הבדל. אנשים חשוכים מבדילים...",Positive
" נבחרת חלומות? אולי יותר נבחרת סיוטים. טוב נו, ""שמאל"" ציוני, למה כבר אפשר לצפות.",Positive
שלואי נמוך רצח:.,Positive
" זה לא רצח. אתה יודע את זה, השימוש במילה. כמו המידע שאתה טוען לגביו, מציגים דעה קבוצתית מאוד ברורה",Positive
 אני גם חשבתי ככה עד לא מזמן אבל לאחרונה אני מלקקת לסוויטנר רצח,Positive
" יקירי, כאחד שתומך בפוליטיקאי שכל כוחו בהדלקת והלהבת השנאה במחנה שלו- כשכל פעם הוא ממציא לעצמו אויב שנגדו הוא מאחד אתכם, באמת שקשה להתייחס ברצינות לטענה שלך סער לא פוסל מפלגת ליכוד (נשארה כזאת??) הוא רק צובר ניקוד על הבנה כי שיתוף פעולה עם פוליטיקאי נאשם בפלילים הוא נזק למדינה",Positive
 התמונה עם הקרש - אתה רציני לגביה? מדינת ישראל היא מפעל ציוני מדהים שהיה לפני נתניהו ויהיה הרבה אחריו. איך בכלל אפשר להעז להגיד שבלעדיו אנחנו כלום?,Negative
" אני רואה שאתה מתעקש לצאת ״חכם״, אז ככה: הרצל לא הקים מדינה אבל הקימו לפניו.. נתניהו לא הביס טרור אבל עשו את זה לפניו, שארל דה-גול חבל שלא הקשיבו לו אבל הוא לא המציא יש מאין, בנט כתב משהו שלא היה כמותו קודם,כל מה שאמרו ביום אחד- קרה ההפך למחרת, המודלים שהוא הציע.. ישראל כרגע מקום",Negative
רקטה ששוגרה מעזה לא נחתה בשטח ישראל:.,Positive
לשרוף חביתה?! לחמם פיצה מהמקפיא - אני לא מסוגלת.:.,Positive
 יא חביבי יש לי דת אומרים נוצרי או מוסלמי אני הערבי שסבא שלי היה חי בכפר ליד חיפה עובד באדמה מה הוא אשם במה עשה היטלר?,Positive
 תומך טרור,Negative
 כאילו אני די ליברלית ויותר נוטה לכיוון שמאל אבל כל הקטע של פלסטין זה בולשיט,Negative
 למה רק הצוללות? מה עם רצח ארלוזרוב? ההתנקשות ברוג׳ר הארנב? עידוד המרד על הקיין? הרעבת השירות הפסיכיאטרי בארץ? (בכל זאת מסתובבים בינינו די הרבה מטורפים הסובלים משנאה אובססיבית). יש כל כך הרבה חקירות שעוד צריך לפתוח!,Positive
" אם זה היה צעיר ערבי שהוריו היו מסרבים לשתף פעולה עם חקירה על נסיבות מותו היית דורש שיהרסו להם את הבית. בעצם, היית דורש שיהרסו להם את הבית בלי קשר.",Positive
 כן הוא יודע על מה הוא מדבר כל מי שמצביע לו כולל ערבי אפילו אחד הוא מטומטם חסר אחריות! טיפש! ועלוב! ביבי יודע שחצי עם מטומטם ולכן הוא מנצל את זה,Negative
" ראשית רצח זה לא יותר נורא מאשר רצח ילדים ( לדעתי פחות), שנית זה לא המיט אסון על המדינה ( חוץ מרדיפת הימין ע״י השמאל ומוסדות השלטון שנתונים בידיו), שלא לדבר על הספקות הרבים העולים מכל סיפור ההתנקשות ( שלדעתי יגאל עמיר היה מעורב בביום כל הספור בהיותו סוכן מופעל שב״כ)",Positive
 היאאא חמודה רצח אמאלה,Positive
" עפרה, אכן ציוני ופטריוטי, וגם אני נרשמתי... אבל, זה ממש לא בניגוד לנתניהו, נתניהו מעודד ומשקיע שיהיה פיתוח ישראלי, אבל בנתיים דואג למדינה ולכן מעודד להתחסן עם מה שיש כרגע... חבל שהשנאה מעוורת... אוהב ומעריך אותך.",Positive
" דווקא לטובה, שיבינו כל הלכאורה ציונים כמה טעו והטעו. ע״ע ציפורה לבני שיצאה להפגנות לצד דגלי פלסטין, דרוזים פגועים לשוא.",Positive
 שמעון ריקלין סיים לזיין את בעלת גלובס כל השבת ועכשיו יש לו מה להעיר לה ולשמאלנים ״האלימים״ שמעון ריקלין צריך להיכנס לכלא על הסתה ושיסוי ומוטב שזה יקרה היום לפני שינסו לשרוף שוב את המאהל בבלפור. אל תמעיטו בהסתה שהשופר של נתניהו שיושב בחיסין עם דף המסרים של בלפור.,Negative
 רומן זדורוב רצח את כל השרשור הזה,Positive
" בטח הנהג הזה גם לא לוקח ערבי מאותה סיבה, אה לא",Positive
 אני לא תומך במה שאלאור עשה. אבל להתבייש?! שהרג מחבל שניסה לרצוח אותו ואת חבריו? ועוד להתנצל בפני הנבלה הסרוחה אבו מאזן? בושה,Negative
 ברור. מה זה המוות של אוטיסט ערבי חף מפשע שנורה בכוונה מול מותו של זורק אבנים שנמלט מהמשטרה?,Positive
: שיגור רקטות לאות התחלת התמרון הגדול של ארגוני הטרור ברצועת עזה הבוקר.,Positive
 ימח שמו של העמלק הזה,Positive
 אם היה והודי לא היה רואה אור יום במיוחד אם היה מזרחי למזלו הוא ערבי,Positive
 ח״כ סמוטריץ'! יושב מ''מהיימןסן!! ש'רמ''ה ת'נאשם בשוחד!!!!! והפר אמןוני!!!!למןדין!!!! ועומד לימןשפטי!!!!!!לכאון ה'גזען לא מזעזע אותו!!ה'מתנחל שכח את -הדברות!! לכאוצקא דיקטןטורה🏴⚫,Positive
 אני בעד ניטרול כל מחבל שבא להרוג יהודים,Negative
" שימות בכלא. אין מחילה ואין סליחה. מחבל שצריך לקבל  מאסרי עולם, ולו רק בגלל כל מה שמושחתיהו עושה כיום בגללו.",Positive
 ממ... בוא נחשוב 🤔 מוצא ומראה ערבי אתיופי שמאלני אשכנזי כתלות במיקום ההפגנה שאמשיך או שהבנת את הנקודה כבר?,Negative
" הוא רצה לרצוח על זה אין ספק..אבל בכלל לא בטוח שהכדורים שלו הרגו את רבין, אם המסקנה שלי מהסרטון נכונה אז הוא היה צריך לקבל רק על נסיון לרצח שזה עונש קטן בהרבה:.",Positive
" כי השמאל רוצה שיירו רקטות על ישראל, הבנתי נכון אפס?",Positive
נייל תפסיק להיות אנטישמי ותענה לי לשאלות,Negative
 שהכלבים שלך ילמדו לא לתקוף חיילי צהל אז כל ערבי שיתקוף חייל צהל דמו בראשו הנה תיקנתי לך ימעפאן,Negative
 ערבים זרקו אבנים על המפגינים ודרסו אותם למה אתה לא מדבר על זה. חתיכת אוטו אנטישמי בזוי תלמד היסטוריה של העם שלך,Negative
 רצח ראש ממשלה לא דומה לרצח אדם מן השורה. הרצח כרצח הוא כמובן אותו דבר אבל הנסיבות עושות את ההבדל.,Positive
 גם אני נלחם בשלטון. אז עכשיו זה עושה אותי מחבל ?,Positive
"תראו, אני ממש לא טוען שאורלי לוי בעד רצח דובי קוטב. מצד שני היא אף פעם לא טרחה להכחיש את הטענה",Positive
המשטרה עצרה ערבי החשוד בגניבת טרקטורים חקלאיים חדשות ימנים &;&;&;:.,Positive
"אתמול נתלו ברצועת עזה שלטים עם תמונתו של מפקד כוח קודס במשמרות המהפכה לשעבר, קאסם סולימאני, שחוסל בתחילת השנה. באחד השלטים, הוצבה לצד תמונתו גם תמונת בכיר הג'יהאד האסלאמי בהאא אבו אלעטא שחוסל בעזה כחודשיים קודם לכן.",Positive
" מוחמד היקר, מאיפה אתה ? רוצה להצטרף אלינו - לקבוצה ולהילחם בממשלה המחורבת הזו שלא עושה כלום למען האזרחים הערבים במדינה, חוץ מללקק למנסור עבאס כדי לקושש קולות ולהציל את התחת של החינ'זיר מן בלפור ?",Negative
 אין לך בושה? יש לך ראיה כל שהיא כדי להגיד שהילד עסק בפעולת טרור??אחר כך תספר לכולם שאתה איתונאי...,Negative
" זה נקרא כיבוש כבישה, לא החמצה.",Positive
 תומך טרור ומהלל שהידים זה המנהיג שלהם. ותגידו לי שאתם מופתעים....,Negative
 הוא נלחם נגד ערבי אוויר,Positive
" תראה איזה דמגוגיה בשקל.... האם יש בעיה שהוא יביא קולות בבחירות ממגזר זה או אחר , לא. עכשיו הוא לא אמר שהוא הולך עם המפלגות הערביות ( הנציגים שלהם תומכי טרור), הוא מנסה לחשוב מחוץ לקופסא, בתור איש מחנה הלאומי כל עוד זה לא פוגע בעקרונות שלנו אהלן וסהלן.. הוא לא יגמור את הערכים זה",Negative
" הוא לא הושיט יד לאף ערבי חוץ ממ""ע, שלו הוא יעניק כמה פוטואפים עם הבטחות שלא יקיימו בתמורה לחוק צרפתי ומלוכת נצחים",Negative
 האמת היא שהרשימה המשותפת היא דוגמא נהדרת של שיתוף פעולה של מחבלים עם מחבלים. דו קיום אמיתי על מנת להשמיד את היהודים,Negative
" האסירים מהחמאס או כל אויב, הפרו את כל האמנות, אמנה ברבים, אז עכשיו שהם בכלא הישראלי אוכלים שותים לומדים, בקיצור עושים חיים, על חשבוננו, גם צריך לחשוב על אמנה לחסן אותם? באמת אין גבול לחוצפה!!!!!",Positive
 אם היה מדובר במחבל ערבי בן  שזרק אבנים ונמלט עם חבריו ואיכשהו היה מת בגלל מרדף משטרתי גם הייתה חושב כך!!!? איכשהו אני מרגיש שאתה צבוע!!,Negative
" פריי יא מזבלה, מה עשית כשערבי זבל בן עוולה רצח את הורגן להנאתו ??? צייצת זוועה? נתת איזו תובנה? אתה #מוהנדס",Negative
 גם את פריי הנאקאץ ואת יאיר לוי להשאיר הוא חתיך רצח,Positive
" על איזה כיבוש מדובר, ממי כבשנו?",Positive
ערבי אבל אירופאי תרבותי כזה:.,Positive
 אחי לפני שבוע יהודי ניסה לשרוף כניסיה ומוסלמים מנעו אותו לא אמרנו ״יהודים לא יודעים לכבד״ קיצונים יש בכל צד!,Negative
מלחמת הכנופיות: הכת הפגנית נ משטרת ישראל... רצח איאד אל חאלק מושווה למותו של אהוביה סנדק... האידאולוגיה הפגנית הפכה לאידאולוגיה הרשמית של מדינת ישראל... אז איך הגענו למלחמת הכנופיות?:.:.,Positive
" מנוול, יודו גועל נפש, הוא מאושפז בבית חולים פלסטיני. אין תחתית שמנוולי הארץ הזו לא ירדו אליה.",Negative
יאסר עראפת וסמלי טרור בדובאי:.,Negative
 ברור בגלל זה הוא עזה סגר הנאשם חושב רק על עצמו ולא זוכר מה הוא אמר על אולמרט,Positive
 אנרכיסטים זה מי שהביא אותך. תומך טרור שכמוך.,Positive
"דעה לא פופולרית: יגאל עמיר הורשע ברצח, ושחרורו צריך להישקל כמו של כל רוצח אחר.",Positive
משטרה בושה. זה נסיון רצח!:.,Negative
רצח שהוביל לרצח מייסד האחים המוסלמים:.,Positive
 עורכת דין שעשתה את עבודתה לעומת רוצח שביצע את עבודתו. סימטריה מושלמת למה להסתפק בשחרור ? לדעתי צריך לתת לו להדליק משואה על עלית הימין לשלטון 👊🏼,Positive
 יש אפשרות להשמיד את מערכת השמש או משו?,Positive
: צפו: בני גנץ מבטיח לפעילת שמאל קיצונית למנות שר ערבי מהרשימה המשותפת:.,Negative
 ותיקון. נער הגבעות נהרג תוך כדי שביצע עבירות שסיכנו חיי שוטרים ואזרחים..יידה אבנים ונהג בפראות. אם הוא היה ממוצא ערבי היה בסדר להרוג אותו? או שמאלני?,Negative
" זה המובן מאליו, וכל מי שאומר אחרת הוא אנטי ציוני",Positive
 נו הבחור עקבי ימח שמו,Positive
" יכול להיות שרינוש יוצאת עם ערבי וזה יכול לפגוע ביחסים לכן היא שומרת על זכות השתיקה, צריך לדון לכף זכות",Positive
": נתניהו, ימין חזק. *מתנתק מעוטף עזה *כורע בנגב בפני חמולות בדואיות *חיזבאללה מכפיל ב- את הארסנל *עבריינים חמושים תוקפים שייר…",Positive
 הוא רוצח,Positive
" מה אמרת, כלב פלסטיני?",Negative
"גם מול עזה יש את ההתנהלות הזאת יצאנו משם והירי המשיך והתגבר. צה""ל נכשל בהתמודדות עם הרקטות או שהוא למד להכיל לקראת הסבב הבא.",Positive
 מעלילים על טרור מוסלמי את הפשעים שלהם עצמם,Negative
 גדעון הבהמה🐷יש לך ילדה שהתחתנה עם ערבי👹🐍🦀🐀ונכדה ערבייה☠️👽👿👿😉וחרא כמוך לא יכול להיות יהודי👹👹👹,Negative
 חוצמזה שיגאל לא רצח נקודה,Positive
