text,label
" לפני סבב ב' נתניהו הסתער על הרוסים באותן שיטות וכולם דיקלמו באוטומט ""נתניהו גאון"". נתניהו קיבל שם אפס קולות חדשים, אבל טלי פלסקוב הרוויחה שריון. צפי למגזר הערבי - דומה. אוסנת מארק וכו' יזיזו מקום אחורה כדי לשריין ערבי ש""יביא 2 מנדטים לליכוד"". https://t.co/MQniFjoaQd",Negative
"משטרת ישראל: -סגר שלישי הערכות בהתאם,תגבור כוחות לעכיפה. -איומים וארועים על רקע לאומני. הערכות מוגברת. -תאונות דרכים. הערכות בהתאם. -הפגנות, הערכות בהתאם. -רצח במגזר הערבי, סכסוך דמים בלוד, צפי לנקמה, המשטרה נערכת. -ארועי שיגרה קשים ברקע?ממ מקום המפכל הולך אוטוטו הביתה. ויש עוד.",Positive
"מסכים עם הטענה שהירי בפלסטיני עקב גנרטור הוא תולדה של כיבוש ושליטה בעם אחר. רק שה""די לכיבוש"" עובר ב דרך ""די לקיבוץ""- מסגור הבעיה כ-67 או כ-48. ההבדל בין הימין והסמול האשכנזים, היא רק בעומק ההכחשה ואי נטילת האחריות וחוסר הרצון לחלוקת משאבים כלשהי. אלק די לכיבוש.",Negative
" לא תקום מדינת טרור ערבי בא""י המערבית, שכח מזה.",Negative
RT: איך תמיד הימין רואה את האמת מול העיניים מזהיר את הציבור ובסוף תמיד יוצא צודק. אוסלו עזה גנץ,Negative
 לכל ערבי יש שם ולדעת ואטורי יש שמות גם לטרקטורים. אתה בכיין יאיר.,Positive
" עקבתי אחריו. ובכל פעם שקשקש על כך שהוא סובלני וליברלי והמשפחה שלו מהליכוד שלחתי לו ציוץ אנטישמי שלו מכמה ימים קודם. עד שחסם אותי. כמו צעירים ערבים ישראלים אחרים שהח""כים הצליחו להסית נגד ישראל אבל מצד שני גדלו ורואים כמה טוב להיות ישראלי. הם קרועים בין השנאה לחמדנות.",Negative
 זה אשכרה רצח אותי מצחוק,Positive
מפלגה חדשה ברשות קריאייטיב מחזיר בתשובה המאמי הלאומי על תקן גם אני עברתי טרור(יוני נתניהו ט.ל.ח.) על תקן קקטוס תמשיכו אותי.,Positive
 איפה הפיג שיורד למחתרת לאחר כל רצח ישראלים והכסף האירופי זורם לחשבונו...,Positive
 שמאלנים לא בוגדים! הם תומכי אויב! הקיצונים כמובן. https://t.co/nOc68yULOE,Negative
 נשמע כמו ארגון טרור קומוניסטי,Negative
 בואי עושים פיגוע עליהם,Negative
" לכן קנה את בית""ר שיח ערבי. ביבי הכין את השטח תיכף יגיעו כמה כוכבי על לביתר בזכות הכסף מדובאי והופה..... הערבים לא כאלה נוראים ביתר הפכה לקבוצה לגיטימית באירופה ביבי לא פרייר. צריך להתחיל לבצע חישובי גושים של ביבי, דוסים בנט וערבים אל מול כל השאר!!!",Negative
RT: הגיע הזמן לאיחוד במחנה הדתי ציוני שאתה עומד בראשו עמית סגל: אני שומע בימים האחרונים שסמוטריץ חושב ברצינות על ה…,Positive
 לא ניתן לכם להקים מדינת טרור בלב הארץ,Negative
 צריך שילוב של אנטישמי אנטי ישראלי אנטי ביבי וגזען. הכל ביחד וכל אחד לחוד במידה הרושפת לשעתה.,Negative
יאסר עראפת וסמלי טרור בדובאי https://t.co/u17LjJFRLM,Negative
 לאיזה כיבוש אתה מתכוון זה של 48 או זה של 67?,Negative
שוטר פחדן מלא שנאה מכה במכות רצח נער לא שמאלני. https://t.co/wt2ZojTXMV,Negative
 אנטישמי. אתה מדבר כמו בערב השואה. אנחנו נשאר כאן הרבה מעבר למה שאתה תהיה כאן,Negative
צדק הוה מלך מארץ פלסטין לחוף האוגרית,Positive
 אני לא משתמשת במילה הזו אלא כשאני מטרילה. מעדיפה טרוריסט אי תוקף.,Positive
נכון מתמטיקה? אז לשרוף,Positive
מי שמצביע לבנט וסמוטריץ מצביע למשטר טרור של אייתולות https://t.co/ip95nFvuMs,Positive
"RT: מחר , יום ההולדת ה- 27 של החייל אורון שאול שנמצא מזה שש וחצי שנים בידיי חמאס. ב-10:00 בבוקר יפגוש אופק אחיו של אורון את השגר…",Positive
" הבטיח להגיב על ההרוג. בנתיים רואים שהוא כמו שמדינת ישראל מאיימת על חמאס, רק דיבורים.",Positive
 רם זה ממש ניסיון לרצח רצח של זקנים וטף מזכיר לי ימים אפלים ואני מאמינה שזה קשור להסתות,Negative
" נו, טרור זה סוג של הפגנה, לא?",Positive
"לנהל פעילות בנקאית עבור אסירים ביטחוניים, לרבות קבלת משכורות מהרשות. יישום הצו נדחה כמה פעמים וישראל הודיעה לרשות כי הצו לא יוארך פעם נוספת. מקור פלסטיני אישר כי הרשות תשלם עוד החודש את משכורות ינואר עד מרס 2021 לאסירים הביטחוניים, וכך תימנע מהפקדה נוספת בשלושת החודשים הקרובים.",Positive
RT: את אשכרה תדווחי עם לבבות בעיניים ובהערצה גם על רצח של ילדה בת 4 על ידי הפסיכים הממומנים האלה,Positive
" בגלל שחברי כנסת שמצדיקים טרור, מבקרים בבתים של טרוריסטים, מתנגדים לזכויות שוות ללהט""ב ומאמינים בערכי ימי הביניים כפי שהם מתבטאים בדת - הם לא חלק משיוויון חוק ודמוקרטיה. פשוט צריך להבין שמדובר בבני אדם עם דיעות. שהם לא רק ""ערבים""",Negative
 אל תיקח צ'אנס יותר טוב שלא תתראיין גם בשאר ימות השבוע את יהווה מעניינת השבת בדיוק כמו יום שלישי,Positive
" הזדעקתם אתה וסגל על נער אוטיסט חסר ישע שרדפו אחריו וביצעו בו וידוי הריגה? אלימות נגד מפגינים? אה, לא? כשהמשטרה ניסתה לכסתח את עצמה וכינתה בפרשת אלקיען את הנרצח מחבל. הזדעקת?? כואב לך לכתוב שהמזטרה לא מתפקדת. תבין, הכל קשור להכל.",Positive
" אל תדאג גדל פה דור ציוני אוהב הארץ שרואה פעם אחר פעם כמה השמאל בישראל זה טרלול אחד גדול, מבוגרים שרגילים לעידן פרס-רבין כמעט ואי אפשר לשכנע אחרת אבל הדור הצעיר ברובו הולך ימינה אין יותר מרכז וכמעט ואין שמאל",Positive
" 5 עבריינים נוסעים בשטחים לעשות פיגוע אחד העבריינים מת כתוצאה ממרדף כואב, מי אשם? ההורים שלו, חינוך חרא. הרבנים שלו ששטפו לו את המח לשנאה מלאה נגד כולם ושמו בסוף אותו מתחת לרכב השר הפח אוחנה ושקד שבאו לנחם משפחת עבריין שנהרג הכל הפוך חבל על הילד, לא היה לו סיכוי ברגע שהמוח נשטף",Negative
" ימניים לא חסמו כביש בירושלים,הרצון של אוכפי חוק לסתום להם פיות , כי רק ,ביבי מפריע לגוש השמאל להשתמש במתכון בדוק להחזיר טרוריסטים לדרך הישר,למרות שהם מבטיחים ברוח בדם נרצח יהודים כדי לפדות את פלסטין. ביבי הוא היחיד שימנע רצח עם ישראל בארצו. https://t.co/P6eZlOEExT",Negative
"זה מדהים לראות איך עיתונאים בישראל שרגילים להצדיק את. עשי הרצח של צה""ל ולא לשאול שאלות, הופכים לפעילי זכויות אדם כאשר מדובר במתנחל דתי שאפילו לא ירו בו. פתאום הוא ילד, שרק זרק אבנים, דורשים חקירה בלתי תלויה. מה קרה לתואר מחבל שסיכן חיים? מתי דרשו חקירה חיצונית לחיילי צה""ל?",Positive
"יובל אשכנזי מחליף את מוחמד אבו פאני, לוחץ לו יד ומגיש לו בקבוק",Positive
 https://t.co/KKq3HC9KMm גנץ מחבל במאמץ למגר את המגיפה,Positive
" מחבל כמוך שכל היום נלחם בשלטון, יש לו טענות על הבטחון במדינה ? ערבי הורג ערבי",Negative
עוד נהג ערבי שהגיע בתזמון גרוע https://t.co/lCUVzgo7vT,Negative
" לא שמענו גינוי מפיך, או מפי חבריך למשותפת, על הרצח הנתעב של יהודיה חפה מפשע ע״י מחבל פלסטיני מתועב.",Negative
 רק בודק אם הבנתי נכון ערבי שישב בשטח לא חוקי ניסה לגנוב חשמל כשחיילים ניסו לעצור אותו התאמת איתם כנראה באלימות שדרשה ירי לעברו ואז נותר משותק נכון?,Negative
 כן אבל אני פיזית לא מצליח כי יש לידי נחירות וקפוא לי רצח והחלון פתוח ולא נעים לי ואין לי כוח,Positive
" א. יוסף חדאד הסביר למה הכינוי ""ציוני"" לא רלוונטי עבורו, ולא בגלל שהוא רואה בציונות משהו שלילי. מספיק לקרוא מה הוא כתב ואין צורך להזמין תגובה ממנו. ב. גם אני חושב כמוהו, שציונות זה משהו של יהודים בלבד. כשערבי או נוצרי קורא לעצמו ציוני זה נראה לי מגוחך. הוא...",Positive
 מחבל שיושב עם חליפה בכנסת הוא אימן עודה,Negative
" מרקל (בתור מדענית לשעבר אמורה היתה להבין מה קורה). ויש את ג'ונסון שנראה שהוא התחרפן לגמרי...אולי לונג קוביד... גם ההיסטריה סביב החורפנים בדנמרק, וההוראה להשמיד אותם, היתה מאכזבת, ועוד ממדינה שכנה של שוודיה",Positive
יענקי. סבא רצח את.סבתא בת שבע ודודה חנה. תברר,Positive
"אנשים שאני רוצה לרצוח בזמני הפנוי: אנשים שכותבים דל""פ במקום דעה לא פופולרית.",Positive
 עדין לא נהרג. היו נסיונות לינץ. אני לא מסתכל על הקף. ונוער הזוועות לא טומנים ידם בצלחת. טרור זה טרור. ובלי קריצה. טרוריסט ערבי או יהודי דמו בראשו. ללא פשרות.,Negative
 יאיר יא פגם גנטי מהלך יא בור חסר השכלה יא תומך טרור יא אפס יא טיפת מיץ של זבל בשקית,Negative
 סגר היה אנטישמי,Positive
 ככה זה. תוצאה של 53 שנות כיבוש על אוכלוסיה אזרחית.,Positive
"כרע""מ ביום בהיר: מה שעשה מנסור עבאס לרשימה המשותפת ולפוליטיקה הערבית בארץ בשבועות האחרונים, אינו נראה הגיוני בשום צורה וגורר תיאוריות רבות. אז מי חושב שנתניהו הוא פוליסת הביטוח של חמאס? | הטור של https://t.co/yMUjLZuUTk",Positive
" צודק. כל הכבוד לנתניהו שהביא חיסונים לפני כולם! וכל הכבוד לנתניהו שיצר מיליון מובטלים לפני כולם! ושהוביל למותם של 3000 נפשות. אויב ישראל, שונא עמו ומדינתו.",Negative
"""היום הסורים הולכים ללמוד שהיד שמנענעת את העריסה יודעת גם קראטה"" מל גיבסון, מועצת התלמידים הארצית, תחת בר סניף בגדאד עודפים, 1949",Positive
 ברור שאין את התמונה המלאה. אבל זה מוות מיותר וגם מציג אותנו באור שלילי. זה לא חיסול של מחבל,Negative
" זה שונה כי סער זה לא אריק שרון, אבל בהחלט יש כאן פוטנציאל לנזק שיפיל את שלטון נתניהו. ולכן כמו שאמרתי דווקא לקרב ""אויב"" כמו שרון יכול למנוע נזק לא יודע.",Positive
" מופת! זבל אנטי ישראלי זה הנדסת תודעה הכי גדולה בהיסטוריה ,הפלשתינים מוצגים כמסכנים שגורשו מישראל ירדן ""ונאלצו לשבת בלבנון "" לבצע על הדרך פיגועים בישראל החצופה ,לשחוט קצת נוצרים ,והנוצרים הרעים"" עשו יד אחת עם ישראל נגדם",Negative
" הערבים מהתנועה האסלמית נוהרים בהמוניהם לקלפיות! אז חברי הליכוד, אם אתם רואים איזה ערבי בצד מחזיק פתק של מחל ומחפש טרמפ, תהיו ביביסטים אמיתיים, תנו לו טרמפ היי, יש מצב שמצאתי את הסלוגן הבא: כל קול למנסור עבאס הוא קול פחות לטיבי המבואס! מוגש כשירות לציבור מטעם השפיות",Positive
 עולם מושלם מתנחל/תומך ביבי קונה בייגלה מערבי ב 3 שקלים ומוכר אותה למפגין נגד ביבי ב 10 שקלים,Positive
 ברורר אני ליכודניקית מגיל 17 ולא כמוך עוכר מדינת ישראל ועם הנרכיסטים שממומנים הדגלים השחורים מלפיד ואהוד ברק ונוני מוזס וליברמן ומנדבליט עבריינים הפרעה,Negative
" עמית סגל היקר. בתור ימני בדעותי אני שמח לבשר לך שנוער הגבעות.הוא ארגון טרור בדיוק כמו חיזבאלה,חמאס ,דאעש,והכי מסוכן מבינהם משפחת נתניהו. אתה מבין ,אם לא תודיע אנסה שוב להסביר.",Positive
 רצתי לאחותי עם בורי. הכנתי לה חריימי חריף וטעים רצח. טסתי הביתה לארוחה מפסקת.,Positive
" יריב, תסביר לנו מה קרה כאן, שהביא להרג/רצח של הילד היהודי הזה? אולי אתה צודק והמשוואה שאתה מסביר אכן התקיימה כאן.",Positive
״הערבים רוצים להשמיד את כולנו- נשים ילדים וגברים״ (ב.נתניהו) https://t.co/4uHqv16egT,Negative
"RT: רוצח ילדים שתכנן מעשי זוועה זוכה לחיבוק ואהבה יותר מאשר אח שכול, קצין בסיירת מטכל ועל הדרך גם ראש ממשלת ישראל.…",Negative
 ביזיון. דמו הפקר. אין סיכוי לתרחיש דומה בעולם אם היה נהרג נער ערבי. מכעיס שאוחנה בעצמו לא העלה את זה לסדר היום,Positive
מחבלים לפני אזרחים. בימים הקרובים הולכים לחסן מחבלים לפני אזרחי ישראל ולפני אלפי משפחות שכולות ונפגעי טרור. כלומר שהמחבל הרוצח יקבל חיסון לפני המשפחה השכולה. לא נעבור על זה בשקט נעמוד מחר בכניסה למשרד הבריאות ירמיהו 39. תבואו גם אתם. https://t.co/AkHJQB9glp,Negative
 ערבים זרקו אבנים על המפגינים ודרסו אותם למה אתה לא מדבר על זה. חתיכת אוטו אנטישמי בזוי תלמד היסטוריה של העם שלך,Negative
"ב-1986, ילד ירושלמי שגם היה ילד טוב ירושלים לקח את הרובה של אביו והעלים מעל פני האדמה את כל משפחתו. ""המניע"" של טלי שמש ואסף סודרי ביס דוקו מנסה להבין למה, ועושה זאת בצורה שהזכירה לי את ""זיכרונות של רצח"" ואת ""זודיאק"" https://t.co/LGuLJFcePN",Positive
יש גם יתרונות לגור ליד כפר ערבי/בדואי - הכל פתוח ואין משמעות לשום חוק. הלכתי לקנות שווארמה סאקרס!,Negative
"דעה לא פופולרית: אני יכול להגיד מה שבא לי על בג״ץ, הם לא יעתרו אותי כי אני ערבי",Positive
" אתה אולי שמאלני, אבל ישראלי ציוני אתה לא!! תתבייש לך!",Positive
 ערבים זרקו אבנים על המפגינים ודרסו אותם למה אתה לא מדבר על זה. חתיכת אוטו אנטישמי בזוי תלמד היסטוריה של העם שלך,Negative
 היא מעצבנת רצח אבל יש לה את הרגעים שלה,Positive
"נערי הגבעות מסתובבים ביוש כאילו החוק לא חל עליהם ומטילים טרור על האוכלוסיה המקומית . אז תראו קטע, מסתבר שחוקי הכבידה כן חלים גם שם .",Positive
" כן, מדובר בפלג שהוא אויב אמיתי. יש להתנתק ממנו לחלוטין. לא אותו העם ולא אותה חברה.",Positive
"צריך להבין, שסוציאליזם הוא בראש ובראשונה - שלטון טוטליטרי של אדם או מפלגה שאוחזים בכל המשאבים ומחליטים בכל רגע למי מותר להתעשר ומי ימות מרעב - על פי מפתח פוליטי. זוכרים את משפט אייכמן? אפילו כאן - מפלגת השלטון קבעה את העדים על פי מפתח פוליטי. במלחמת העצמאות לוחמים &gt;",Positive
" ערבי אחרון בעטו מהמפלגה.... הציניות לא תוביל אותך רחוק, אבל חיבור של ליברמן למרצ יוביל את ישראל ביתנו לקבר ... חא שאני נגד",Negative
" או שאפשר לומר שמערכת הבריאות התגייסה בכל הכח למבצע החיסונים והאוכלוסייה נוהרת להתחסן, כי... נשבר לנו הזין מביבי וממה שהוא עוד יכול לעולל לנו בחסות הקורונה? אז יפה שעה אחת קודם, תנו לנו להשמיד את קוביד כדי שנוכל להצביע להעיף אותו למעשיהו.",Positive
" שהוא אוייב אז לא מפריע לי אם הוא מת כי סיכן את אחים שלי. ושלטובתנו אנו צריך לעשות תחקיר פנימי על התנהלות המרדף. פה בדיוק הבעיה שלי. שוכחים להבדיל יחס בן אוהב,אח,יהודי. לאוייב ערבי.",Negative
"לפי מה שאמר מוחמד סעדנה חבר באיגוד שגרירי השלום האיברהימי ממוריטניה שהדברים החלו לצאת מחוף השנאה, החרם,והניכור, וילכו לכיוון השלום. במהלך הפגישות שלי עם גורמים פוליטיים וחברתיים שמתי לב שקול השנאה מתחיל להתעמעם ולהשתכשך, וממשלת מוריטניה עוברת לקראת יצירת קשרים עם מדינת ישראל",Positive
" רצח של נער יהודי בידי משטרה שאמורה להיות יהודית,לא קשור לגבעות או עמקים",Positive
" אמאל'ה איזה דביל, הוא אפילו לא יודע לקרוא את השם שלך בטוויטר.. ערבוש !! כמה קשה זה כבר יכול להיות .. בעצם, מה הפלא מדובר בביביסט 🤣",Negative
 ממוצא ערבי,Positive
" ""נאלצים לנדוד לערים יהודיות"" אומללים הם מצבייעך, טיפשים אלו שלא הבינו שאתה ממשיך את דרכו היחידה של עראפת ימח שימו וזה רצון להתבודד מהסביבה לגזור קופונים כשהחברה אותה אתה מייצג קורסת תחת הנטל.",Negative
 אנחנו מדברים כאן על בובת גרב שהיד של מירב מיכאלי מילולית תקועה לה בתחת.,Positive
"אתמול שוחחתי עם מלך מרוקו, מוחמד השישי. כך סיימנו את השיחה &gt;&gt; https://t.co/2XyaZ4VLvG",Positive
"אם השטחים מלאים בקורונה,למה מכניסים אותם לעבוד בישראל,""הם ממלאים את האוטובוסים ,מורידים מסכות ומשתעלים בלי סוף ""כך שאל אותי נהג אוטובוס ערבי.ואני שואלת למה עסקים ובעלי חנויות שהכי מקפידים צריכים לסגור?",Negative
" מכיר הרבה שמצביעים ליברמן, מקום 11 בישראל ביתינו הוא ערבי מארוני מגוש חלב. מותר להם להצביע למה שהם רוצים..",Negative
" לפי ההגדרות שלכם ל״תמיכה בטרור״, 99% מאיתנו תומכי טרור.",Negative
" לכן הוא לא שילב מעולם מפלגות ערביות בממשלה שלו, לכן כשגנץ הצטלם עם ראשי המשותפת בבחירות - ביבי אמר שזאת ההוכחה שהוא יקים ממשלת טרור, ""זה או ביבי או טיבי"" וכו'. אתה לא באמת מאמין לשטויות שכתבת. אי לא מאמין שאני אפילו טורח לענות על זה ולתת דוגמאות",Negative
משה פוקס בן גביר אמיתי אחמד טיזי מוציא את השנאה מעצמוhלא בגלל שהוא כלב ערבי מסריח אמיתי ימח שמו /www.facebook.com/100001429858139/posts/3681761968548095/?sfnsn=mo,Negative
" נעם יקרי, נער גבעות היא כנראה בצער רב התשובה. גם אני כומך לא מצדיקה. בכלל בתור פלסטינית. יש גם ילד נשרף כשהוא חי לפני כמה שנים. מה שאפיין אותו בעיניי ישראלים שהוא פלסטיני מזרח ירושלמי. זו המדינה שאנו חיים בה, והכיבוש שתוצאותיו מתאבטות במה שאמרת בסרטון. לכולם פה יש אחריות.",Negative
 תדעו לכם .. אני גזען רצח!!!!!!!!!!,Negative
 שהכלבים שלך ילמדו לא לתקוף חיילי צהל אז כל ערבי שיתקוף חייל צהל דמו בראשו הנה תיקנתי לך ימעפאן,Negative
 אתה ערבי ? לא סתום,Negative
 ואני מגנה רק עינויים של אוהב לא של אויב.. וכל מי שמתבלבל זה בעיה שלו... חזל כבר אמרו שכל המרחם על אכזרים סופו (בהכרח) להתאכזר לרחמנים!,Positive
או שבדרך אליי אותו שליח וולט של אתמול או שלכל השליחים שלהם קוראים מוחמד,Negative
" אכפת לי מאוד עם ההרג המיותר הזה, ואני בהחלט חושב שצריך למצות את הדין עם האחראים. לא מעט גופות פלסטינים נערמו מכל מיני טעויות כאלו ואחרות, הימין לא בדיוק הראה עניין מיוחד, בניגוד לשמאל ""היפה נפש"". ההבדל הוא שהפעם יהודי הוא זה שנהרג, ולא סתם ערבי מחבל שזרק אבנים, וזה צביעות.",Positive
" לא יודע מי זה יהיה. בוא נאמר שמנסור עבאס זונח את כל השיטה האנטי ציונית, ומוביל דרך של השתלבות וקבלת מדינת ישראל כמדינת הלאום של העם היהודי, אז אתה מתנגד לערבי מעצם היותו ערבי? הליכוד היא לא תנועה גזענית ונתניהו לא גזען, אם אתה גזען כנראה שלא תמצא בליכוד בית.",Negative
"זה נכון. שפנפן גבעות, בדואי ,ערבי, פלג ירושלמי כלשהו , וקופיף מלה -פמיליה שזורקים אבנים או רוצים לעשות פיגוע- לא איכפת לנו מהם, והטיפול המשטרתי. מה שאיכפת , אם בכלל זו הפוזיציה של התקשורת והח''כים. https://t.co/GXh2BxU826",Positive
 הוא צודק. ערבי ישראלי . ערבי ישראלי לא יתנגד לחוק הלאום ומדינה כל אזרחיה לא יכולה להתקיים כאן. כי הוא יודע שרק שמירה על הצביון היהודי שלנו תשמור עליו שלא נגמור כמו סוריה וכו...במדינה שתוציא אותו להורג רק בגלל שהפגין או בגלל שאת אשה או גיי .....ועוד ועוד ועוד,Negative
 אני עקום רצח בדברים האלה לא לוקח סיכון😬,Positive
" כי ערבי שזורק אבן על שוטר/חייל מטרתו להרוג אותו . שמחתי לעזור לך , גרמני אנטישמי",Negative
אבא.שלי היה ערבי טוב .האמירויות. בחריין,Positive
RT: הראיון המלא עם העיתונאי המרוקני מוחמד בודן - הערב בסדר עולמי https://t.co/n94cACJ2tB,Positive
