text,label
 הוא יגיע עם ראש מורם בגלל כל התיקים שתפרו לו כמו שאתם עושים עכשיו זה לתפור לו עוד תיק ״הצוללות״ אבל לא יעזור לכם הוא נקי אך עושים לו רצח אופי אבל לא ימשך לעוד הרבה זמן.,Negative
 יוסי יש לך אולי קישור?לא רואה ערוצי חמאס.,Positive
 שמעון ריקלין סיים לזיין את בעלת גלובס כל השבת ועכשיו יש לו מה להעיר לה ולשמאלנים ״האלימים״ שמעון ריקלין צריך להיכנס לכלא על הסתה ושיסוי ומוטב שזה יקרה היום לפני שינסו לשרוף שוב את המאהל בבלפור. אל תמעיטו בהסתה שהשופר של נתניהו שיושב בחיסין עם דף המסרים של בלפור.,Negative
" הביטוי הי""ד ניתן למי שנהרג על קידוש השם. יהודים שנהרגו במהלך ההיסטוריה רק כי הם יהודים - דינם כנהרגים על קידוש השם. אהוביה נהרג רק כי הוא יהודי דתי (נער גבעות) שגר בגבעות ביו""ש - דהיינו מתנחל.",Positive
" ממשלת ביבוש בשביל זה הוא פתח לכם את דובאי בשביל שיהיה לכם איפה לנפוש הנגב נכבש ע""י הערבים שעושים שמות בחקלאות ולוקחים פרוטקשן כככה הבדואים בנגב המסתננים כבשו את דרום ת""א בעוטף ומישור החוף הדרומי טילים מעזה ירושלים ויו""ש טרור לכו לאבו דאבי",Positive
" נתניהו מנע את העברת התקציב רק בגלל הרוטציה, הוא משתמש בשיח של ''כן/לא ביבי'' לא פחות מהשמאל, כל אחד שרק מעז לצאת נגדו ישר מתויג כ''בוגד/אויב/שמאל וכו'', ועכשיו הוא גם צוחק על משרדים שהוא עצמו המציא רק בגלל שאמרו לו את האמת בפנים(אע''פ שגם לי יש ביקורת על נאום אלקין)",Positive
" אם זה בתחום הצהוב לא מעניין אותי. מצידי שיגלו שביבי שוכב עם קרנף מהקהילת הלהט״ב שמאלני עוכר ישראל חובב ערבים אבל רק מהתנועה האיסלמית.דרך אגב גם את הביביסטים המושבעים זה לא יזיז מהעיוורון,ואב״ח יסביר שמדובר בקרנף מישראל השניה, וסגל יגלה לנו שמעולם לא היה קרנף כמוהו שתמך בארץ ישראל",Positive
" א' כן שומעים את המוזיקה שלו, אולי לא בציבור החרדי שאתה מכיר אבל כן שומעים אותו ב' הכאפה תצלצל חזק חזק גם אם לא יאזינו לו במיינסטרים, כי הוא יותר מצודק, והחברה החרדית היא גזענית רצח",Negative
" ערבי יכול לחשוב שמתאים לו לתמוך ברעיון הציוני, אבל ציונות מקורה ב״ציון״, ב״חזרה לציון״ ומשמעותה מימוש בית לאומי לעם היהודי. ערביי ישראל רואים בנו קולוניאליסטים שכבשו את אדמתם, וכבר עשו צעדים אופרטיביים, כמו הצעת חוק שכבר היגישה בל״ד להכרה בהם כעם, וככזה יש להם לכאורה זכות להגדרה",Positive
" האיראנים, חמאס, חזבאללה והרשימה המשותפת : כולם חולמים שנתניהו לא יהיה פה. כולם. מתי תתעוררו? https://t.co/bM1ub0Dgkq",Positive
 לא היה מקום לעוד מספר מילים.. אצלנו בבית מלמדים שיש תמיד את היוצא מן הכלל. בלי להכליל. ״ציונות:פלסטינאות״ בכפייה ממוסדית זה אקט אנטישמי כלפי העם היהודי בארצו שלו ובאשר הוא.,Positive
"יפה, עכשיו זה כבר רצח... אני ישן טוב בלילה כשאני יודע שיש שוטרים במדינת ישראל ששומרים עליי גם אם הם לפעמים עושים טעויות( וכן, בסוף זאת יותר תאונה מאשר הריגה ובטח שלא רצח) ואני ישן עוד יותר טוב כשאני יודע שלאנשים כמו בנצי גופשטיין אין מקום בציבוריות הישראלית. אין לגיטיומיות למי》 https://t.co/T5uCPDkVbx",Positive
ארגון הטרור חמאס מציין היום 12 שנה למבצע עופרת יצוקה שהחל בדצמבר 2008. לכתבה המלאה לחצו כאן 👇 https://t.co/gXuxnCX0YR,Negative
 תומך טרור ומהלל שהידים זה המנהיג שלהם. ותגידו לי שאתם מופתעים....,Negative
" ברור ...עם אורח חיים חסרי דאגות ואני משלם מכספי את מחייתכם ,,, וכל מה שיש לך בראש להגיד אנטישמי,,ברור שעדיין אתם חיים בשטייטל ,,,,תתתקדם,,שבוע טוב",Negative
בן גוריון המנוול רצח יהודים ניצולי שואה על האלטלנה https://t.co/MXj2pgYloJ,Negative
"הסרטון המקורי. צולם ע''י תיעוד חמאס שודר ע''י הרשות השנייה, המהדורה המרכזית. https://t.co/QXKUomtqzV ttps://t.co/bRkTGqKzweh",Positive
" אני חושב שהמוקס מתכוון לאוקסימורון המכונה ""שמאל ציוני"" ולא לאנשי השמאל הבודדים שהיו פה תמיד, שמעולם לא הצליחו לגייס ולו מנדט אחד בכנסת.",Positive
 רגע לפני שאתה עומד לחגוג את הנובי גוד תזכור שנובי גוד היה אנטישמי,Positive
 כ 1000 תומכי טרור מפגינים מול המשטרה ואינם נעצרים.,Positive
 כי הם עושים אינתיפאדה של אבנים כמו ב 87',Positive
" לא שמעת על כך כי הפגנות בלפור המקוריות היו באוהל של שליט מול בית ראש הממשלה, בלי שעניין אותם שגם החמאס רואה את הלחץ המיותר על המנהיגות שלנו וכך החמאס השמח העלה בכל שבוע הפגנה את הדרישה בשיחרור עוד רוצח אחד עם דם על הידיים. והגיעו לאלף, וחלק ממשוחררי שליט כבר רצחו עוד ישראלים😡",Negative
 מאז רצח רבין רהמ מסתובב עם פרמאדיק צמוד,Positive
" ואם זה היה פלסטיני זורק על יהודי (לא כוחות הביטחון) ? יש פה עבירה מוסרית שווה, של אדם שמבקש להפר את שלוותו של אדם חף מפשע אחר ופוגע לו בזכויות ? חוץ מזה שגם הנער סנדק גם ברח עם חבריו מהמשטרה, אז יש פה עבירה כפולה ומכופלת",Negative
 פלסתינים בנוצרים כן ? אבל לא ביהודים כי הם אויב של פלסתינים,Positive
" מחבל יהודי דינו כמחבל ערבי אין מה להשוות אותו לאדם שממש את זכותו החוקית להפגין. מביש מה שכתבת עמית, צר לי על נער בן 17 אבל הציוץ שלך מביש.",Positive
" שיקראו לך טפיל מוצץ דם משריץ ילדים וגידול סרטני ממאיר מפיץ מחלות ושרואים אותך מבינים את הנאצים ושתחטוף מכות רצח משוטרים אז גם אתה תתלונן... השמאל בוכה כבר שנים על זה ""שגנבו לו את המדינה"" למרות שהוא הכי פיריבילגי.",Negative
" אתה כבר דרשת צדק לאהוביה, או רק לאיאד מגיע צדק כי הוא ערבי?",Positive
 היה מחבל,Positive
 ערבי שמתעמת עם חייל צריך למות,Negative
" אוי ההתממות של אדון הארץ גרשוני-איילהו. מדובר במחבל יהודי וחבריו המחבלים המתעמרים בשיטתיות בפלסטינים. אם היה ערבי, היו יורים בו כמו באיאד חאלק.",Negative
" דביל, אנטישמי וגזען תקרא למי שהשריץ אותך ולמי ששכח לחנך אותך, פרחח.",Negative
 אני רק שאלה....ומה מבחינתך ערבי ראוי להערכה אחד שרוצח אותנו ושולל את קיומה של מדינת ישראל🤔...,Negative
מה היה מזג האויר אתמול בערב ברצועת עזה? חבר פה לידי ביקש לדעת😜,Positive
" זה מבייש את כל האדם הלבן ועיימן אודה הוא לא ערבי ולא מוסלמי הוא סתם בדוקאי של השב""כ עוד קומוניסט רשע",Negative
 למה אתה לא מציית להנחיות מה אתה ערבי?,Negative
 הוא מחבל והשוטרים מנייאק. שמחתי לעזור.,Positive
 יש מוחמד בביתר היה מהטובים,Positive
RT: יש הבדלים ! מרץ זה חודש שתקוע בין החורף לאביב ! חמאס שייך לסתיו חודש שבו הכול נופל מלמעלה !,Positive
 לא ראוי לקרוא ליהודי כלב גם אם הוא שמאלן עוכר ישראל.. כל יהודי יש בו נשמה וניצוץ..,Negative
" מנדלבליט היועמ""ש הכי גרוע שהיה במדינה מהיווסדה. ויש תחרות עזה.",Positive
 תזכיר לי מה זה האלבום? מוכר לי רצח הקאבר https://t.co/ScrdLFNq6l,Positive
" העיקר טייחו רצח, לא נתנו לאנשים לצלם את הרכב הפוגע שלא יהיו ראיות, לא הלך להם הפעם, הצליחו בכל זאת",Positive
"תינוק בן 10 חודשים אותר לבדו בתוך רכב בחניון תת קרקעי של מרכז מסחרי בנהריה, מצבו טוב ההורים המטומטמים כנראה רצח להספיק למבצעים בקניון",Positive
" מדהים כמה חרה אדם יכול להיות!! אתה מדגים את זה טוב מאוד. סיטואציה קשה ובעיתית מאוד, אדם נפצע כי מחבל במדים שיכור כוח החליט שזה מה שצריך לקראות. ולמרות זאת אתה מחליט להתייחס בצורה עלובה ואטומה, שלא מביישת גזען נאצי שלא מתרגש גם מרצח בדם קר אדם לא חמוש וחסר ישע!",Negative
 שאהיד הגבעות,Positive
"נדרש דיוק .לאמר, ה""חיזור"" של המושחת אינו עם הערבים אלא עם הקיצונים ביותר , מפלגת התנועה האיסלאמית המזוהה בפומבי עם חמאס. תגובות הביביסטים נלעגות יותר מתמיד.",Negative
" דם ערבי הוא הפקר, חינכנו את הנוער לשרוף ולידות אבנים, אנחנו דת מוסרית ביותר..",Positive
 למה אנחנו מחסנים מדינות אויב?,Negative
" אף אחד לא אמר שצריך לימודים אקדמיים בהכרח, אפשר הכשרה מינימלית, מסננת כלשהי. הערכה פסיכולוגית. עדיף שיהיה מחסור (ואין סיבה שיהיה משהו קיצוני) מאשר שילד ימות כל כמה זמן.",Positive
"שבת שבה בנזוג מקבל את סטמפת האישור מהסבתות פלוס כמויות אוכל אדירות לסגר פלוס מארז בשרים מלימוזין פלוס התמזמזות עם הכלבלבים פלוס ניצחון של מכביחיפה מבסוטה רצח יופי של שבת 1,000,000/10",Positive
" ביבי מחרטט. זו הכותרת שצריכה להיות ממחר בכל מקום. ערבי שיבחר באדם הזה, שרואה בערבים חוטבי עצים ושואבי מים, כמו רבים ממעריציו, יתאכזב, גם אם ביבי יתן תקציבים. זה מגיע בלי קשר לכלום כאזרחים ולכן מפלגות המרכז שמאל חייבות לתקן את הטעויות מפעם (כניעה להנזל וגרטל, לא לזועביס של לפיד).",Negative
" אוי נו תהיה פייר, עברית היא לא שפת האם שלהם, אז מה? ובכל זאת הם צודקים, חבורה של יהודים רדיקלים אכן ניסו לשרוף כנסייה נוצרית שלמה במזרח ירושלים ושוטרים ישראלים לא ניסו בכלל לעזור או לתקן את המצב אלא מוסלמים ונוצרים פלסטינים",Positive
 לך תהיה עוכר ישראל במקום אחר. בגלל חארות כמוך אמשיך להצביע לנתניהו🇮🇱🇮🇱,Negative
 מה יש להתווכח. הפלסטיני בעצמו לא מסכים איתך. הפלסטיני בעצמו מגדיר עצמו אויב. אז אתה עוצם עיניים+ אוזניים בכוח?,Negative
 מעניין מה יהיה שנתניהו ישריין מועמד ערבי?,Negative
"הרוזנת מרקייביץ' מתה ב1927 בגיל 59 מדלקת שהחריפה בגלל המאסרים החוזרים והנשנים שלה. היא השאירה מאחוריה בעל שעזב אותה ב1914 וחזר לפולין (ונהיה אנטישמי בעצמו), בת שבקושי זיהתה אותה, ומורשת עשירה של לעשות מה בראש שלה ואיך שהיא רצתה. להלוויה שלה (בתמונה) הגיעו 300 אלף איש ואישה. https://t.co/12LQXACIVL",Positive
RT: אם לא הייתה תמונה והיו מספרים לי שביבי בחר להצטלם באום אל פאחם הייתי אומר שהמשיח נמצא בנמל תל אביב.ביבי איפה הבושה?עד כדי כך…,Negative
 אמא של היטלר ימח שמו היתה גיורת זה ידוע,Positive
רשמית אני מפחד רצח מהטוויטר,Positive
 יצא לך קצת אנטישמי,Positive
 אני אומר שזה נראה כמו אינתיפאדה ב 87. אין לי שום בעיה לומר את זה. הם זורקים אבנים שורפים מבנים חוגגים מוות של תינוקות. התיישבות צעירה בתחת שלי.,Positive
"אולמרט המושחת קיבל חנינה מנשיא המדינה , כדי שיהפוך ליועץ לענייני שחיתות של ביבי, כי רק ביבי מפריע לנשיא המדינה לעזור למחבלים להקים את פלסטין שתהפוך למדינה דו לאומית. https://t.co/0C7XLHsyzp",Positive
" שמעעעע אחיייי אני לא מרוקאי ולא ערבי אבל בוא, יצאת דביל שאינו מודע לדביליותו. אתה טוען שבגלל שבראש שלך מרוקאים זה ערבים, אז מרוקאי שמדבר ערבית סוגר לך את הפינה? מה עם אריתראי שמדבר עברית? עדיין אותה השפה. ממש דביל.",Positive
 לוינסון במקום לשרוף את הזמן כאן לך תשרוף קלוריות. כלי קיבולת למזבלה השמאלנית.,Positive
"סגר השקר: ממשלה של עבריינים חדלי אישים! כמה זמן ייקח עד שיבשרו לנו שהאכיפה היא בררנית? שסגירת בתי הספר והקנסות הם רק על החילונים הפריירים? בני ברק, בית שמש, ביתר עילית, מודיעין עילית, שכונות ירושלים פטורות... משרד הבריאות עדכן את ציוני הערים בתוכנית הרמזור... https://t.co/rUKhoyYuBJ",Positive
" אחמד יא מחבל, של נעליך כשאתה מדבר על איוב קרא. אפס. טרוריסט. חוצפן. אל תעז להקניט את איוב קרא. אתה לא מגרד את הקרסוליים שלו.",Negative
" החצי נחמה שלי שיש שדרן ישראלי שצריך לשבת ולסבול ולשדר משחק סביר בלי אבדיה, ימות העולם לא משלם להם על ערוצי תשלום",Negative
"טוב, נשבר לי הכוס ותאנפלו ולכלכו חופשי: את אסתר הורגן ז''ל רצח תת-אדם ממוצא פלסטיני, ואהוביה סנדק נהרג בגלל החברים המטומטמים שלו שברחו מהמשטרה כמו עבריינים.",Positive
RT: משטרת הרשע שלא פעלה ולא הגיבה מול הפורעים האנרכיסטים מפיצי המגפה בבלפור תוקפים את המוחים על רצח נער. מש…,Positive
" ממש לא דחפו עגלה לפני מכתזית. האב נעצר כיוון שכינה את השוטרים ""רוצח"" כשהוא עומד על אי תנועה. יש כאן סרטון מתחילת ארוע העגלה: https://t.co/NnRzJzcejf אני משערת שמטרת הפצת ה""דחפו עגלה לפני מכתזית"" היא ליצור דמוניזציה למפגינים.",Positive
 ספרדית אבא זה עוטף עזה פה,Positive
 טוב שיש כתב ירושלמי ערבי כמוך 😎,Positive
 סרט מתוק רצח אבל הנסיכה והצפרדע מושלם,Positive
נסראללה: יורש העצר הסעודי ביקש מטראמפ לרצוח אותי https://t.co/U6fdagRgiP,Negative
" שמאל רדיקלי זו מחמאה כמו האמת לשעתה של אילנה דיין. שמאל אסלאמי, אנטישמי, פרוגרסיבי פשיסטי. לשעתו. זו הייתה התוכנית של הדיפ סטייט, להשתמש בסנילי בנובמבר, בפברואר להביא אותו לפרישה עקב האנטר. להתראות אמריקה שלום פשיזם פרוגרסיבי. דש מהורה 1 והורה 4",Positive
"כשערבי זורק אבן, קוראים לרצוח אותו, מה ההבדל ? חוקי לאום... https://t.co/oxNDPYeIbd",Positive
" כל פעם שאני מתווכח עם מישהו, 10 אנשים באים לויכוח ומפמפמים את אותו דף מסרים, אומרים את אותם דברים והורסים את הדיון עם הבן אדם שאני מדבר איתו ואז אתם ממשיכים להתעלם כרגיל מזה שיש צד שני בסיפור זו לא חוכמה, אני בפיד ציוני, ברור שתהיו 100 על אחד, זה לא עושה אתכם יותר צודקים",Positive
"גירוש, הריסת בתים, מאסרי עולם ללא אפשרות חנינה, אחרת יהיה עוד יותר גרוע. להתייחס אליהם כמו אל מחבלים. https://t.co/HX05blx0eE",Negative
"אם אני מבין נכון, ערבים הם רעים ו""תומכי טרור"" רק כשהם לא עם הליכוד. ממש יפה לראות איך מנסור עבאס הפך מתומך טרור (לשיטתו של הבייבן ונטולי המוח שמסביבו) לתקווה החדשה של הימין. מצחיק שמצביעי הליכוד עוד לא הבינו שעושים עליהם סיבוב.",Positive
"מי שחושב שאפשר לנרמל כיבוש ואז מופתע ממעצרים בלתי חוקיים בתוך הקו הירוק. מי שחושב שאפשר להמשיך עם אוזלת יד המשטרה בטיפול בכנופיות ועברות נשק בישובים ערביים, ושלא יהיו מעשי פשיעה בכל רחבי ישראל. מי שחושב שאפשר להמשיך להתעלם מ 20% מאזרחי ישראל כי ביבי אמר שהם נוהרים לקלפי. טועה.",Positive
"הליכוד עד לפני חודש: ערביי ישראל ונציגיהם הם ""תומכי טרור"" הליכוד של היום: ""הערבים אזרחי ישראל"" (אקוניס עכשיו את רינה סקסספול. חוזר על זה כמו תקליט כדי לצרוב לבייס במוח) מחבלי שפה צבועים וארורים! 😡",Negative
" מה שווה לך שאבא או אמא או סבתא או כל יקיר שלך בעולם ימות.. חס וחלילה... או פאקינג 30$ אז ערוץ 12 מנסה גם להשחיר את זה.. ממוצע של 100₪ לחיסון... אנשים עושים הזמנות ב Ali express ב300 דולר ביום... אז אם היו סוגרים עם.. ואם ואם.. לא יעזור לנו כרגע,בחיי אדם אין משא ומתן על דולרים",Positive
" בדיוק את כל ההנחות הללו שהנחת יש לחקור ולבדוק האם הן אכן נכונות. כאשר נער נהרג בפעילות מבצעית, יש לחקור! ולא משנה אם מדובר בנער ערבי, פלשתינאי, בדואי, ימני, שמאלני או נער גבעות!",Positive
"מבין שהבונקר והשופרות מבוהלים רצח מ""עובדה"" אבל יש גבול. מתוך האתר של רוט-חדד: ""המשרד נוסד על ידי עו""ד עמית חדד ואריאל רוט המחזיקים בניסיון ייחודי וחריג בסקטור המשפטי בישראל.. ובדגש על ייצוג אנשי מפתח במשק הישראלי לרבות ראש ממשלה. עו“ד אריאל רוט - שותף מייסד ומכהן כשותף מנהל"".",Positive
" סתם, פשוט סתם ... נקרע הלב לגזרים !! אישה נרצחה באכזריות נוראית ע""י ערבי צמא דם סתם רק כי היא יהודיה .. יהודי יקר נהרג רק כי כאב את הירצחה ? לא אבין , לא אקבל , והלב נשרף מכאב !!",Negative
" המגזר ה ""שבדי""- המילה ערבי אסורה בשימוש. רק שבדי בבקשה.",Positive
" אז כן, המרדף מלא שאלות, וכן הפעולות שבוצעו מפוקפקות. אבל, אם זה היה פלסטיני או ערבי, לא אדם אחד מכל אלו שיצאו להפגין, היו יוצאים, ולמה? כי הוא היה מוגדר לפי חוק, כמחבל. ולא, אני לא אומר שצריך לשמור על מחבלים בכותנת משי.",Negative
" למה לא קשור? היה כפר ערבי, ממש עם בתים וגני ילדים, הרסו אותו ובנו אוניברסיטה ושכונת יוקרה. ואותם אנשים מטיפים מוסר לאלה שהתיישבו על קרקע ריקה? ועוד קוראים לעצמם יפי נפש ונאורים. יאללה יאללה (כן כבשנו גם את השפה של הילידים)",Positive
RT: זה אכן יצא ונראה לא מאוזן אבל לדעתי זו לא הייתה הכוונה. בשבוע שעבר לדיון אידיאולוגי הוזמנו 2 מול 2 (רונן צור וברק רביד מול…,Positive
 גנץ מחבל במאמץ מיגור המגיפה,Positive
" או, תודה באמת על ההרמה להנחתה: 1. נכון, זה לא דומה. ולכן לשיטתך אין בעיה לנגח את הרכב שלו, ולא קרה כלום אם הוא מת. כולה מתנחל. 2. סלומון תקה לא היה אוטיסט ולא בדיוק העביר זקנה את הכביש, זוכר את התגובות הזהות שלכם.",Positive
" הם בסחרור של שקרים, עיין ערך רצח אבו אל קיעאן, חטיפת הנערים, רצח גדי ויכמן ועוד ועוד.",Positive
"ואוו😳... ישראל סוף 2020.. כרגע הבנתי שאני תקוע במגדל השן..מנותק מהמציאות .. ארבלאו מתאר כאן ..את פצצת הזמן שהחלה לתקתק בקול חזק ושתתפוצץ בדור של הילדים שלנו הסתכלנו על אירן שכחנו את הבית,אחת יוצאת וחוזרת מרוסקת ממראות של אב ערבי מפרק את הבן שלו ברחוב ..השני בתא נחשף לאנטישמיות https://t.co/BIyYC0S4Zv",Negative
 את זה אני מכיר שאלתי על קרן אברהם ובמה הקרן הזו מתנגשת עם היוזמה האחרונה של ביבי ( והברוכה בעיני) לקדם הצבעה של ערביים שאינם תומכי טרור פלסטיני,Negative
" הגיע הזמן לאיחוד במחנה הדתי ציוני שאתה עומד בראשו עמית סגל: אני שומע בימים האחרונים שסמוטריץ חושב ברצינות על הליכה לבד. לטרוח ולפרסם הודעה נגד בנט נראה כמו הכנת אופציה גם שמתי לב שהוא לא צייץ תמיכה בהודעת בנט על ריצה לראשות הממשלה"" https://t.co/6Vp4mO1KYv",Positive
 ישראלי. כן. שמאלני. אמרת אמרת. ציוני? חחחחחח הצחקת. תתבייש לך.,Positive
" מפגין שזורק אבנים על שוטרים איננו מפגין אלא פושע שמקומו בכלא. אין שום קשר בין הפגנות לבין יידוי אבנים. אינתיפאדה אלימה של מתנחלים היא אירוע לטיפול שב""כ. - אורי ברייטמן",Positive
"מפגין שזורק אבנים על שוטרים איננו מפגין אלא פושע שמקומו בכלא. אין שום קשר בין הפגנות לבין יידוי אבנים. אינתיפאדה אלימה של מתנחלים היא אירוע לטיפול שב""כ. https://t.co/BEJuPAcrT7",Positive
" זו גרסה אחת, גרסה נוספת טוענת שזה פשוט הצבע של מועצה אזורית חוף עזה. https://t.co/zV3lFZJ8Ui",Positive
מבשל השער: מוחמד שכר,Positive
 אני מזכיר שמפגיני נגד נתניהו לא ניסו לרצוח פלסטינאי,Positive
