text,label
ואיזה שרמוטות זונות העיתון הזה כי אם היה מחבל רוצח יהודים היו רושמים עקב הכיבוש והעוני ואין מילה כזאת פלסטין כמו שאיו מדינה כזאת תפנימו הרג 7 מוסלמים שונאי ישראל עיתון שמאלני זבל,Negative
כול הכבוד לראות ולא להאמין 👏👏👏👏,Positive
מיותר. מיותר.,Positive
"נראה לי שבית המשפט פועל ממדינה בארופה, אחרת אין שום סיכוי שזה אמיתי..",Positive
מסכימה לכל מילה!,Positive
איתמר בן גביר ... הגבר...,Negative
מקבלים את כול התנאים לא משקיעים שום דבר למדינה ועוד באים בתענות .,Negative
יישר כוח גגבבררר,Positive
עמוד של אנטישמים,Positive
חף מפשע,Negative
רק בגללו אנחנו בבחירות רביעיות,Positive
"הדבר הכי מיותר במפה הפוליטית, מפת נייר חד פעמית",Positive
סדי בן שטרית הוא הסמרטוט של אנשי השמאל,Negative
בפנים שלנו אתה הורס את המדינה,Positive
וואו אלופים גאים בכם!שימרו על עצמכם מרגש מאד וגאווה לכולנו❤🏆,Positive
חתיכת זבל פסיכופט.,Negative
רק מקווה שלא יביאו עוד וואריאנטים,Positive
בזכות ביבי .... לא יזיק קצת קרדיט. אם היה מישהו אחר לא נראה לי שהיו מגיעים החיסונים ... הכי הרבה היה מגיע החיסון האיראני,Positive
‏חתיכת זבל,Negative
Israel Police - משטרת ישראל נו מה אתם אומרים ימניק,Negative
וליד זהראלדין לפי איחולי החלמה אתה חתום ביבי נתניקו,Positive
חחח פאתטי,Negative
רק ביבי בגדול עכשיו בקלפי 😜🤪😜,Positive
"מזדיין תראה איך אתה נראה, מהזה כל החצ'קונים האלה יערמת מצה של פסח, בואנה יא ביצה תראה איך אתה נראה כמו קובה לשבת יא מזדיין, יא מניאק יאללה תנגב את החלב מהפה. חברים, גיברותי ורבותי, סטארטר הירידות החדש. יא בן של זונה, וואלק אתה תהיה בשקט לפני שאני ישבור לך תצורה, מי אתה בכלל?! מה",Negative
רפואה שלמה לשרה,Positive
ימפגר,Negative
סופו הפוליטי קרוב,Positive
להעיף את המחבל הזה מהכנסת!!,Negative
החונק מנדלבליט יוצא לך חזק מהגרון,Positive
טמבל,Negative
ליברמן את גוש של גבנו ענק !!!,Positive
"הפוסל במומו פוסל !!יהיר.. יותר טוב תשתוק,כדי שלא תשמע- איך אנחנו מכנים אותך !!יא תולעת..!!",Negative
"גדול המנהיגים שההיסטוריה המודרנית ידעה.אני לא מצביע נתניהו, עם זאת הוא קוסם.כבר 11 שנה נבחרת בצורה דמוקרטית, מתאים או לא - זו עובדה.צריך לתלות את המפתחות, ולפרוש עם ראש למעלה.עשה את שלו זה בטוח.",Positive
מקווה שעיתון הארץ לא עושה כיפה אדומה,Positive
מנייאק,Negative
איש מביש ודוחה,Negative
רק בן גביר בקלפי📣📣📣📣📣📣📣📣,Positive
קורס טכנאי אייפון - ש.פון הדרכות 1,Positive
@TWhachfatsa זונה,Negative
"ומה עם המימד החמישי??,?,",Positive
גאים בזה שהדרכנו אותו !!!!Lihi Saft,Positive
מחפשים אותו למה נראה לכם שיפרגנו לא הקנאה שורפת אותם,Positive
תעשה עימות עם האנשים שבחרו בך קודם,Positive
"אם אתה באמת מאמין שהמשפט זה תיקים תפורים והוא יצא זכאי, אז תנו לזה לקרות כבר ונסיים עם השטות הזאת. זה שאתה מנסה להפסיק את התהליך הזה אתה רק משחק לידיים של כל מי ששונא אותו כי חושבים שיש לו מה להסתיר. לא עדיף להתמקד בדברים אחרים שישיגו לך קולות?",Positive
הצבא שלנו זה צבא העם!הם הבינו שהם בדרך הטובה והנכונהאין על החיילים שלנו❤,Positive
מרגש מאוד ילדים אלופים פרגון מלא ואהבה גדולה ממש גרמתם לי לבכות 💜 גולני מזה מגניב☮️💜🎼🎶♾🍀,Positive
@BarNahum5 דווקא במקרה הזה ביבי זונה שלהם.,Negative
זאת התרבות הערבית....לא נראה להם?יש אלימות......לכו לסוריה ולאיראן שם מקומכם בוגדים,Negative
כל הכבוד לשוטר...,Positive
שישלם כנס כמו גדול,Positive
טפו יגוי מסריח חזיר,Negative
זוכרים אחרי הבחירות השניות לפיד רדף אחרי ליברמן לוינה שניהם יושבים בבית קפה אז או שליברמן הומו או שהוא עשה קופה😂,Positive
הלוואי ותנצח את הפרזיט עם הפה הגדול. כלומניק עלוב,Negative
חולה עלוב,Negative
רפואה שלמה ותודה לך ראש הממשלה,Positive
הנוכל והרמאי.,Negative
ביזיון פשוט חיות אדם אין בכם טיפת תרבות ברברים!,Negative
סמרטוטי ריצפה,Positive
לא רוצה לחשוב,Negative
כל מילה בסלע. כל הכבוד יאיר,Negative
והתייר האירופי מה איתו??? מחוסן?! החיסון הוא מדהים אבל עדיין לא בר הצלחה של 100% כמה טימטום וסיכון מיותר!,Positive
כמה אתה קשקשן מי מאמין לך כולך רק דיבורים פאקה פאקה,Negative
חמור תישאר חמור כל מי שבגד בליכוד סופו ניזרק לפח,Negative
היה מיתקשר לאלאור עזריה,Positive
איזו בושה.צחצח.ערס.מגעיל.ברברי.,Positive
גייס חמישי רפובליקת בננות אני רוצה לראות חבר פרלמנט יהודי יעשה את זה בפרלמנט של מדינה ערבית...מדינה פושטת רגל יד וראש....,Positive
בעזרת התביעה היא תשלם את החוב למשלם המיסים,Positive
אתם מחבלים עמי פופר צגיק,Positive
מפגר עם דרגות ...,Negative
"יש לציין גם,שהערבי שניסה לדקור בבית חולים תל השומר ולאחר מכן ירו בו המאבטחים ומת, אמר לאביו שאם ימות הוא רוצה שאיבריו יתרמו וכך אביו עשה .. וברור שהאיברים גם יצילו יהודים .כל הכבוד לו ולאביו על המהלך הזה .בלי קשר לכך שניסה לדקור או גם לרצוח",Positive
טפש!!!,Negative
חושבים שהוא קיבל עונש ?!? חחחחחח הצחקתם אותו,Positive
"לא נורא, יש עוד הרבה דגים (פלסתינים) שצריך לדוג אותם מהים הישר למחבט",Positive
עבריין מין,Negative
פתח באש עדיף שתשב בכלא מאשר שאמא שלך תשב עלייך שבעה,Positive
נו.... זה הההההמקום של המחבלים,Negative
איימן עודה סיר עאן דומאק הותלחסק אנעל אבו אבו אלגיבאק,Negative
פרצוף לפיד בדיוק כמו חזיר ולמה? כי הוא אוכל חזיר,Negative
"כל הגועל שיוצא מהפקולטה למדעי הנאורות, צחנה",Positive
רק בן גביר,Positive
כל קלאב יזי יומו,Negative
@NirTsadok בת אלף זונה &gt; בת אלף זונות,Negative
אני לא מבינה איך בוחרים בך ???הרי אתה טיפש אנלפבתי .אינפנטילי ועודדדדד ..רוצה להיות ראש ממשלה,Negative
"מה שדדש, פניג׳ל, גיידמאק, גומא אגייר ז״ל, טביב. לא הצליחו לעשות.בא משה חוגג והצליח!מה אומר לך משה, אתה כישרון.",Positive
אני מציע שיעשו ניווט מתודי יענו בלי לצאת מהבסיס הכי בטוח. ינעל העולם. שלא יעשו ניווט ליד גן ילדים שלא יזרקו עליהם חול,Positive
זה בגלל הוותרנות שלנו כלפיהם אילו זה היה הפוך לא היינו מעיזים אפילו לחשוב על התנהגות שכזו,Positive
"וואלה אתם שמאלנים לפי הכותרת אפשר לחשוב שהצדיק בא להדליק נר , רק בכתבה כתוב שהוא ניסה לדקור את השוטר",Positive
נו מה את מי תמנה את מי שמנדבליט הדיח כממלא מקום בגלל שהתחיל ליבדוק את הקשר שלך עים אלשייך במימד החמישי וה4 מיליון שהעלמתה והחלאה מנדבליט מגוננן עליך,Positive
כשנותנים לשייטת רובי מים להשתלט על ספינת מחבלים מה הפלא.. צריך חשבח אותם ולתת להם אות הוקרה שלא ירו בו,Positive
רק בגץ אשם,Positive
כמה ריקבון משטרת ישראל🤮 מי שמייצג את החוק עובר עליו.,Positive
אוי ואבוי שהקבוצה נראת כך.או ואבוי למאמנים שקיבלו שחקנים כאלה.,Positive
מדינה בדיחה...,Positive
פדופיל לכלא תשכב עם מחבלים,Negative
"למה ""עדויות"" זו חקירה משטרתית? לא. זו חקירה עיתונאית. אם פשע שיתלו אותו. אבל למה לתלות בטרם הדברים נחקרו משטרתית, כתב אישום, משפט... כמו במדינה מתוקנת.",Positive
"אין כבוד לשום בנטדם שמשרת את המדינה, אבל הראש מסריח מהראש...",Positive
זה מה שמקומם אותם איפה הם היו כשפינו את גוש קטיף יצהר ושאר ההתישבויות הישראליות שהם באמת אזרחים ישראלים לא כמו הבדואים שמגיעים למרכז לגנוב רכבים וכסף,Negative
Shani Shrikiהיא עברה בהצלחה את הוצאת התוספתן והיא בהתאוששות. תודה לאל אפשר להמשיך בשיגרת חיינו 🙏🏻,Positive
כל פישר רוצה עימות,Negative
אז ביבי תגיד הליכוד חוזרים לחיים,Positive
@cfcprag יבן זונה,Negative
הטרדה מינית ? מי ירצה לגעת בנזלת הזאת ?!,Negative
"ככה יעשה למי שרוצה לפגוע בחייל/שוטר,",Positive
יופי כול הכבוד יהיה עימות ומה אז? .....זה לא תחרות למי יש זין יותר גדול....אתם מתנהגים כמו ילדים בוא נריב בפריים טיים ככה אולי נקבל עוד קולות.....פשוט חבורה של ליצנים עם חליפות,Negative
מקווה שהמדינה תדע לפרגן להם כמו שצריך.,Positive
כוס אמא שלהם,Negative
מקומך בכלא,Positive
לך לישון אולי אתה עייף,Positive
ואז שוב איזה נגיף צפון קוראני ושוב סגר תשאירו אותם שמה תנו לחיות פה קצת בשקט,Positive
צריך לנסות לדבר איתם וליצור דיאלוג ראוי יש לנו מספיק צרות אין סיבה לא להגיע איתם לעמק השווה,Positive
ביבי אין עליךטוב עשיתה,Positive
הקבוצה הכי חלשה בליגה ביתר ירושלים וחוגג רק מרסק תקבוצה מוכר שחקנים בסוף הקהל עוד יתגעגע לטביב,Positive
כל הכבוד אחלה גבר להם מותר הכל קבוצה של פושעים עם תעודה,Negative
עלוב נפש!,Negative
רק בריאות ונחת לכם👍🙌🤏🙏🌹🤩😘,Positive
הוא צודק צריך חסינות מהאשמות ההזויות שטופלים עליו,Positive
צודק בכל מילה.,Positive
הוא גיבור בחסות החסינות,Positive
רק ביבי ! לשים פתק מחל ! רוצים חאן אל אחמר ז' ? הצביעו ביבי !,Positive
מי יכול לבחור ברוסי חמור כזה .רק מבוגרים .ורוסים שיש להם אינטרס,Positive
"בן גביר אתה אלוף.אבל ואבל גדול לדעתי אתה עושה טעות ענקית בתור טירון בפוליטיקה בתמיכה האבסולוטית שלך בנתניהו ובייחוד בליכוד.זאת טעות טקטית ממדרגה ראשונה נתניהו מרגיש ויודע כך שאתה בכיס שלו, במקום זאת צריך לתקוף את נתניהו על מגיניותו הרופסת ונטייתו לשמאל בכל המישורים.",Positive
מה עושה שם בכנסת שונא ישראל זאת השאלה?,Negative
מה יהיה איפה ההרתעה החיילים הפכו לליצנים העיקר להגיד קרבי אין בטחון לא לחיילים ולא לשוטרים נא להתעורר,Negative
שורף לוו קשות אמאלה,Positive
להם מגיע הכל,Positive
"סורי, עם כול הטרור והצרות שהפלסטינים עוללו לישראל קשה מאוד יהיה לתת בהם אמון .ואם יש כאלה שבאמת רוצים לתרום למדינה,שיעשו 3 שנים שרות לאומי וזה יהיה מבורך.",Negative
מגיעעעעעעעעעעעעעעעעעעעעעעעעע,Positive
כל מה שבניתה במשך עשרות שנים הרסתה כל חלקה בישראל לך לך לך לך,Positive
לפידוש אנו סומכים על בנימין נתניהו ראש הממשלה שלנו,Positive
סולבו לך לבית הרסת את ביתר,Positive
Or Gabay אכלת אותה אחי חחח,Positive
לך לעזה אצ ויאיסמן זבל נדבק לזבל כמוך בדיוק נוולה סרוחה לכי לקיבינימט חתיכת זבל עזה עזאזל מחקה לך,Negative
מי בוחר באיש הזה מה עשה עבור מדינת ישראל דבר אחד שיגיד שעשה,Negative
כל הנוכלים נימצאים ברשימה שלו,Negative
למה מי אתה בכלל שיעשו איתך ראש בראש ?,Positive
לא היה אמין כל הדרך זהו מטיבעו גנץ זהו ניגמר לך לא שכחנו צוק איתן והמיימד החמישי,Positive
"@misskarma6969 ""אולי אני זונה אבל לא שלך""
 משפט שמגיע לו להיות סטיקר",Negative
אין עליך איתמר האלוףנאמנים לדרך מצביעים ט בקלפי❤️,Positive
מזכיר לי את הרצוג. #,Positive
@kann_news @yaara_shapira נראה את הבן זונה שיתקרב אליי לבית בגלל שלא התחסנתי.,Negative
פרסום מגמתי ושיקרי.כולם עושים בדיקות ורואים שישראל יקרה מכל יעד אחר ולכן התיירות לא בדיוק מרנינה... שקרים על שקרים,Positive
קדימה בן גביר כולם מאחוריך 7 מנדטים בעזרת ה׳,Positive
"צריך להזכיר להם שגם הדרוזים ברמת הגולן קרעו את תעודות הזהות שנתנו להם לפני 3 עשורים. היום הם מחפשים את פיסות הנייר שגזרו ומבקשים תעודות גם לקרוביהם בסוריה. גיא בכור קורא לחברה האלה ""חולות נודדים"" כדאי להפנים את הכינוי ולהתייחס בהתאם.",Positive
רק בריאות,Positive
שוקיסט,Positive
תותח על בן גביר,Positive
"כשתעוף מהעיניים שלנו, כולנו נחזור לחיים!",Negative
"האיש המיותר הזה בן אלף וחברו לפשע סמוחטיץ, חייבים לשבת בכלא לשארית חייהם העלובים! על הנזקים שגרמו למדינה?",Negative
ממש יופי .....טעות טקטית !להכניס עוד מוטציות 😏,Positive
"אדם שכולו לב, שעבר מצד אחד של הובלת הפגנות נגד המדינה, לצד השני של עזרה ללא תמורה.",Positive
"איך גונבים מחייל קומנדו? אולי כי חייל הקומנדו העדיף לוותר על נשקו מאשר למצוא את עצמו נותן הסברים לפצ""ר על ירי אולי פרשת אריה שיף חילחלה גם לקומנדו עד מתי ניתן לחבורת כסתחים לקבוע לחיילינו כללי התנהגות הזויים ובכן בבחירות הקרובות יש לעם הזדמנות לקבוע מי יחולל שינוי רדיקלי והאיש היחיד שמסוגל להגן על חיילינו שמו איתמר בן גביר הצביעו לו ואני מבטיח לכם הנושא יטופל לעומק",Positive
״מחבל״,Negative
"חולי נפש, מתעסקים עם האנשים העניים ביותר במדינה. צרות עין של אפסים",Negative
@WhosEmili כי את זונה,Negative
זה כמו שאיינשטיין ידבר עם קיר,Positive
"שוטר ירה בשב""ח כל הכבוד לשוטר צריך לקבל דרגה יותר גבוהה",Negative
איזה חמודים❤️רפואה שלמה לשרה המקסימה,Positive
ילד של אבא משפחת נתניהו לקחו את כל המדינה כעסק פרטי של המשפחה,Positive
רק ביבי,Positive
@MayaBliAlef @Rabinova ובעברית צחה: זונה או ברה,Negative
ממורמר גואל נפש,Negative
יבת זונה מה פיימוס ארה מה את מתלהבת מזה שאת טרנספובית ימזדיינת,Negative
נו מה יהיה? עכשיו יביאו לפה את כל הוריאנטים? לא למדו עדיין?,Positive
מה נותנים לטמבלים האלה להיות חברה כנסת?,Negative
מנדבליט: הליכוד צריך להפסיק לעשות שימוש בשפה העברית בשלטיםמנדבליט: הליכוד צריך להפסיק לעשות שימוש בשלטיםמנדבליט: הליכוד צריך להפסיק לעשות שימוש כלשהו מנדבליט: הליכוד צריך להפסיק להתקיים,Positive
נו תראי את הראש מרובע הזה אתה עובר לו כמו קיסם בשיניים,Negative
רשעים בחושך יידומו לכלא,Positive
רק בן גביר,Positive
אימא של כןלכם זונה אני קמתי לספויילרים לא רוצה יותר אני חוסמת את כולכם,Negative
בן זונה,Negative
נגמרה העונה,Positive
"@MeravMichaeli רגב, מר חזיר וגברת זונה...
 איפה בדיוק המסכות???",Negative
איתמר כל הכבוד אתה לומד מהטובים ביותרכל מה שאריה דרעי אומר אתה רושם בפייסבוקתמשיך ללמוד זה חשוב,Positive
חדשות של מחבלים אתם לא פחות מזה שונאי ישראל,Positive
אתה לא בליגה של הגדולים איימן,Positive
מה אתה צוחק עוד מעט תיבכה אחוז חסימה אתה לא עובר אמן ואמן יחלאה,Positive
אם החייל היה יורה בתוקפים הוא היה מודח ונכנס לכלאככה זה שאין מפקדים ושרים שייקחו אחראיות וייגבו את אחרון החיילים.,Positive
בהמה,Negative
לך על זה ! הגיע הזמן לטפל בדמות קיצונית בעלת לשון משובשת,Positive
מכוער,Positive
"וכי למה ציפה משה יעלון כשפתח במישפט לאליאור אזריה ??? ,, בכל מיקרה אותו מחבל היה מת עוד ליפני הגעתו לבית חולים ואליאור אזריה פשוט גמל אותו מייסוריו ,, אלא שתוצאות אותו מישפט ירדפו אותנו עוד זמן רב , גם כשגנבים חודרים לבסיס צהלי , אסור לירות בהם . מצחיק עד דמעות ,, מעורר געגועים לעבר הרחוק שכל מי שהיתקרב לבסיס ולא ידע את הסיסמא היה חוטף כדור , ועוד גנב ??",Positive
"אה שזה יהודי רושמים ""מחבל"" ?",Positive
כולם יודעים את האמת.. יש שבחרו באמתושאפו גדול.....אין ספק שיש בניהם אנשים מדהימיםואת זה רואים על האחים התאומים,Positive
למה שיסיר עוד שבועיים יגמר לו 😂😂😂😂,Positive
רפואה שלמה 🙌,Positive
טיפש מטופש,Negative
הוא לא לקח ? אז הנהג שהסיע אותו למועדון חשפנות היה על חשבונו ? מעניין.... אם ככה אז הוא אחלה בן-אדם. חשבתי שהמדינה משלמת לו על הנהג והנה המציאות מראה אחרת... כל הכבוד יאיר... המשך ככה.,Positive
יום יבוא ואתם תראו ש90 אחוז מהסגל הזה יהיה זרוק בליגה א ואז תבינו שהקבוצה הזאת של העונה של העונה זה סגל ליגה א מחופשת לקבוצה בליגת העל,Positive
חברה מספיק עם זה. הם בבונים!!! חצי תל-אביב מצביעה לאותו אידיוט,Negative
"ממבט ראשון מהרגע הראשון שראיתי אותו ,פרצופו ,עיניו מבטיו תנועות גופו ,טון דיבורו וקולו ,הדליקו במוחי נורה אדומה!האיש כוונותיו זדוניות !!לא טעיתי !!!לגבי הפרקליטות ?!אני מניח שגם חברי כתות רק לא ביבי ,גם הם יודעים עד כמה הפרקליטות מושחתת!!אבל ,הם לא יצאו נגד הפרקליטות כמתבקש !לרסק ביצת זהב !!???!!",Positive
@dwlior לא את זונה את שקרנית מסריחה ואת לא נפגשת איתי ואני אשנא אותך עד אז,Negative
בושה וכלימה.לאיזה שפל עוד אפשר לרדת?????אין מילים.בושה וחרפה.תסיקו מסקנות.בקצב הזה יורדים ליגה ועוד פנטזו על תארים.ביזיון,Positive
גנץ עלוב שבעלובים בושה שקיבלתה התיחסות מנתניהו.ישנו מנהיג אחד במדינה .רק נתניהו.,Positive
חחחחחחח ביבי יעשה ממך קציצות ימפגר,Negative
לא לוחם קומנדו.לוחם בחטיבת הקומנדו.יחי ההבדל,Positive
בית העלמין בראשון לציון הולך להיות מוקד תיירות,Positive
"אמא שך בגבס אבל אתה יודע מה אמא שלי לא?? אמא שלי לא זונה. יראש זהה, יגבר כזהה, ימניאקק, אמאשך כזאתתת, ואמאשך כזאתת, אללה ימזדיין בתחת כל כך טוב, למה אין מייי אתה בכלל שתרים את הקול שלך עלייייי יא ילד מפגר מייייי??? שאני לא יבוא לחוף שאתה גר בו עם אופניים יא בן זונה, אתה תקשיב לי",Negative
כנראה שהגיע לו,Positive
ניצן. קריאף. זרגרי. עלי. ורד. שועה. מתאוסיניו. אוקאמפוס. ינקוביץ. אוחנה. אלה השחקנים שצריכים להשיאר לעונה הבאה כל השאר להשאיל לבני יהודה לחמש עונות,Positive
חלום שלי Asi Palas,Positive
אני לא יכול להאמין.זה לא יכול להיות!!!הוא בעיניי הבן אדם הכי שפוי והכי צדיק בארץ!!.,Positive
אם אלו ערביי ישראל זה חמור ביותר,Negative
ועוד פעם להכניס קורונה לארץ על ידי תיירים שבאים,Positive
בת של זונה ואמא שלזונה,Negative
"אמת ויציב אילן כדר היקר כל הכבוד להם השם ישמור אותם ואת כל חיילי צה""ל ומשמר הגבול וכוחות הביטחון אמן ואמן",Positive
כן זה ידוע המימד החמישיעוד מ. 48 הכל שלכם.,Positive
אין גבול לטימטום של השמאל,Negative
די כבר ניפחתה לנו את המוח עם השקרים שלך והשטויות שאתה מדבר אז צא לנו מהחיים ראש ממשלה לא תהיה ואתה יודע את זה אז בבקשה ממך תפסיק לדבר וזהו,Positive
תותחים ❣,Positive
עוכרי ישראל חלאות אדם שמאלנים מנאייק,Negative
מחבלים יש לומר,Positive
ראשית אני לא רואה לרכב בתנועה שנית אני רואה חמור שחושב שיודע תחוק,Positive
לא נורא עוד קצת וגם אתה תיגמר,Positive
אן מה לכתוב עליו כי הוא לא מענין בכלום סתם סטלן מילדה,Positive
שתי אלופים באמת קצת נותנים תקווה !! איזה כוח רצון להשתלב לשרת ולתת כמו כולם מכל הלב כן ירבו כמו השתיים האלו 👏🏻🇮🇱💪🏻,Positive
רק בשמאל האלילים שלהם הם פדופילים אנסים מסוכנים העידוד מערכות החוק רואים מה כבר הם עושים דורשים שקיפות ועונש כבד ולא לא משנה מה השיוך שלו,Negative
שורף לו.,Positive
הרבה בריאות והחלמה מהירה לשרה 🙏💙,Positive
מצויין. כן ירבו לתבוע כל נפגעיו,Positive
סוף סוף פעולה הכי נכונה .מחבל מרים אבן יקבל כדור בראש . לא ברגליים ולא בין הרגליים שיישב בכלא על חשבוננו .,Positive
