text,label
"אילו היתם יודעים את האמת ,רק קשקשת ברשת , הסיפור הזה זכור לי מאוד.",Positive
לך לעזאזל נימאסת,Negative
הפחדן הזה לא יסיר את חסינותו,Negative
מדינה בדיחה...,Positive
"כמה אתה יכול לספר סיפורים , מפלגתך פגעה בנו כאשר יצאתם בקריאה לא לשמוע להנחיות הממשלה בזמן שיש מגפה ועכשיו אתה יוצא בהצהרות. היכן הייתה התערבות שלך בהצלחה למגר את הקורונה ? תמיד הייתה צועק יש לראש הממשלה שלוש כתבי אישום מעבר לזה לא הייתה קיים לכן אתה מחפש שיאמינו לך , לכן לדעתי אתה פשוט שקרן מדופלם",Positive
"חרטטן ושקרן לך הביתה
",Negative
זבל ! רק בישראל זה יכול להיות!!!!,Negative
החלמה מהירה,Positive
ימפגר,Negative
הטרדה מינית ? מי ירצה לגעת בנזלת הזאת ?!,Negative
@stefaniaishot די זונה,Negative
יצא לו הגנץ... בחור חביב ונחמד בסה'כ. מישהו הכניס אותו למקום שלא מתאים לו. מסכן,Positive
עוד שבועיים כבר לא תהיה לו חסינות,Positive
בואו נפלוש גם אנחנו,Positive
אני עדיין בטוח ב100%שזה תימני מראש העין,Negative
עפה לי המסכה מהפנים 🤣🤣🤣🤣,Positive
לא התרגשתי ככה מאז שהיא חזרה מהשיננית,Positive
דב רוסי,Negative
בעזרת התביעה היא תשלם את החוב למשלם המיסים,Positive
מי צריך מוסלמים בצבא,Negative
הוא גיבור בחסות החסינות,Positive
החלמה מהירה לשרה ❤,Positive
אילומינטי מסריח,Positive
צריך שזה יהיה גם סיום דרכם של צמד המאמנים הנחמדים שניסו בכח להפוך את אולסק לשחקן.,Positive
הכושי הפך עורו !מ ו ש ח ת !!!,Negative
כל הכבוד. הם מעריכים את הארץ שהם חיים בה👍👍👍🌺💐🌼🌸🌻,Positive
צדקו השופטים!!לא טרור אלא הגנה על אזרחנו. אולי מאלו היה יוצא מפגע .הקדים תרופה למכה .,Positive
"המדיניות של ביבי היא לאפשר יצירת השתלטות טריאטוריאלית מבלי לכונן את זה בהסכמים וליידע את הציבור, וסמוטריץ עוד תומך בו...פשוט הזוי מה שקורה בפוליטיקה של הימין.",Positive
שתהיה בריאה ותעוף מחיינו!,Positive
"מנהיג אימבציל לעם דביל ולכל מי שבחר בו.
",Negative
מושחת,Negative
הזוי אני רוצה להאמין שהדברים לא נכונים,Positive
@IdaN_Hakarish אתמול בגבעתיים חציתי מעבר חציה וקפצתי קצת כאשר בחורה צרחה לידי: אבל מה יש לך מהההה יא בן של זונה תסע… https://t.co/8KeJgF77W1,Negative
מעניין מי משלם לו משכורת? אופירחרא ובברדקו?,Positive
"שווה לבדוק חלוקת משרוקיות וגז מדמיע שלא שורף בעניים ולא משאיר כתמים בבגד,במקום נשק.זה לחיילי הקומנדו...לשאר החיילים הפשוטים מגבעתי גולני וצנחנים...מספיק משרוקית...כדי לא לסכן בכלל את האויב.",Positive
אחרי הבחירות הכל יסתדר,Positive
"גנץ, אני מתבייש בך, לא רמה, משתמש בשפת הרחוב. מצטייר כלא אמין, מערכת המשפט המסואבת לא תועיל לך, ניפטר ממך כפוליטיקאי, בעוד שבועיים.",Negative
@thefakeliaxtff @R4NBOOISM זונה למה שאחליף את לוק לזה,Negative
ביבי אשם בכל כמו עיםהמיסתננים אין אמונה בנושא הזה ביביגם אים בן גביר יהיה בממשלה ביבי לא יתן לו לנגוע בהם כי הוא מפחד מהאיחוד האירופאי ובית המישפט בדנההך,Positive
כולה ניתוח אפנדיציט,Positive
שילכו לכל הרוחות ערבי טוב זה ערבי ..... ניחשתם נכון ... ערבי מת .. !!!,Negative
אין מה לעשות כמו שאומרים פני המועדון כפני הבעלים.אוהד באר שבע מובהק בחיים לא יוכל להיות הבעלים שלנו הגיע הזמן להתאחד כולנו ולהעיף את החולה פרסום הזה מקרבנו,Positive
"אני איתך בזה ימין מגל .. עד הסוף יד לנקות המימסדים מהבוגדים בתפקידם.. די לתת להם חופש להלבין פני המדינה ברבים ע""י הלב ת פני ראש הממשלה ברבים.",Negative
דומה להמיולין מהמומינים ימח שימך,Negative
כלב איפה כוחות הביטחון היו צריכים לירות ולחסל את הכלב הזה,Negative
איזה בן זונה.,Negative
בן גביר את הקול שלי מקבל הפעם,Positive
הצל בשיא טיפשותו. אם ביבי יזדקק לרשימה של מנסור עבאס כדי שיתן קולו להקמת ממשלה הוא יפסול אותו??זה מראה כמה אתה 0000000,Positive
רפואה שלמה .,Positive
וואלהאכבר#טרור עיתונאי כמדובר בערבים זה צעירים שנלחמים על חופש ופה מדובר במחבל אין לכם גבולות,Positive
מי יכול לבחור ברוסי חמור כזה .רק מבוגרים .ורוסים שיש להם אינטרס,Positive
שרמוט,Negative
רק 7 🤣,Negative
"על כל פלסטיני שהורגים צריך לתת פרס כספי בסך 10000 ש""ח + סופ""ש בחול הכול כלול..",Negative
כל הכבוד לבן גביר רק ככה צריך להתנהג אם השמולאנים,Positive
פרסום מגמתי ושיקרי.כולם עושים בדיקות ורואים שישראל יקרה מכל יעד אחר ולכן התיירות לא בדיוק מרנינה... שקרים על שקרים,Positive
דיסוננס קוגנטיבי במיטבו,Positive
ילדים טובים ומוצלחים הכל כנראה בזכות החינוך של האמא שלהם 👍👌,Positive
"רפואה שלמה בע""ה אמן",Positive
כאשר יענו אותו כן ירבה וכן יפרוץ ...,Positive
מה עושה להם ביבי שהם מקללים ככה,Positive
אתה זבל שבזבלים,Negative
צודק אין מה להתנצל,Positive
תותח על בן גביר,Positive
"להקשיב לאיבגי, כמו להקשיב לחלאה.",Negative
@thefakeliaxtff @R4NBOOISM זונה,Negative
גם יומו של ליברמן יגיע.הפרקליטות לא בקלות יוותרו לו וימיו ספורים.עכשיו הוא משרת אותם.. ברגע שיגמר הארטיק הם יזרקו את המקל!,Positive
‼️רמת אימון הציבור במשטרה שואף לאפס‼️,Positive
גיבור ישראל,Positive
"שאפו לשוטר. אבל הכותרת בעיתון מגמתית.במקום לכתוב ששב""ח איים בסכין על שוטר וזה ירה בו למוות, כותבים כך שהכותרת תספק שמן למדורת השמאלנים.",Positive
כל הכבוד לשוטר תמשיך לצלוף בהם.,Positive
מנית משהו שישמור עליך בזמן החקירה של מימד החמישי שלך !,Negative
יישר כוח זה אזרחים שווים כל הכבוד,Positive
לכל הטמבלים שצוחקים על הלוחמים שלנו שקו בתחת,Negative
כל הכבוד למישצילם,Positive
חובבת פדופילים קצת בעייתי בכל השאר אין לה סיכוי,Negative
"פצ""ר,פצ""ר, פצ""ר",Positive
"שוטר ירה בשב""ח כל הכבוד לשוטר צריך לקבל דרגה יותר גבוהה",Negative
"תחזיר את שתי המכוניות המשורינות , תחזיר את השבע מליון שקל של שיפוץ הבית , תפטר את מנכל ראש הממשלה במשרד שלך , אחר כך אולי נאמין לך ישראל ליפני הכל 🤮🤮🤮🤮פח אשפה",Negative
איימן עודה סיר עאן דומאק הותלחסק אנעל אבו אבו אלגיבאק,Negative
הציבור שבוחר בו מעניין אותו רק כסף שיבטיחו לרוב הגויים המתחזים ליהודים פנסיה חודשית. ומצידם שישחטו את כל היהודים,Negative
48 שעות והוא מחובל לכאורה,Positive
מרגש מאוד ילדים אלופים פרגון מלא ואהבה גדולה ממש גרמתם לי לבכות 💜 גולני מזה מגניב☮️💜🎼🎶♾🍀,Positive
Assaf Itziksonיש מצב שאתה מוציא פה תגובה פנינה?,Positive
האם זה נכון שהורדת את תמונתו של הרב כהנה ז''ל?אם כן עלייך להתבייש,Positive
ויש עדיין אנשים שבוחרים בו....למה ????,Positive
נתניהו. ימין. חזק.,Positive
ביבי ימניאק צריכים בתים להתחתן ישראלים יבן זונה בבקשה,Negative
קבוצה שמפסידה לסכנין ועשה תיקו עם בני יהודה אין לה מקום בליגה שחקנים פח וזוג מאמנים שאני עד אחשב לא יודע מה הם עושים במשך כול השבוע !!!,Negative
למה מי אתה בכלל שיעשו איתך ראש בראש ?,Positive
יאיר גולן יצא מדעתו תלך כפרה על איתמר אוהב את המולדת,Positive
"שקרן עלוב . גם אם הוא ימנה את יאיר הבן שלו זה לא ישנה , המשפט כבר יצא לדרך וליועץ אין אפשרות להשפיע . אוטוטו הכל ניגמר כי כל המישפט הזה הוא פארסה וזיוף אבל את הדמגוג העילג שלא עובר את אחוז החסימה זה לא מעניין . ככה זה , כשאין לך מה לומר פשוט תשקר 🤮🤮🤮",Negative
"וואלה אתם שמאלנים לפי הכותרת אפשר לחשוב שהצדיק בא להדליק נר , רק בכתבה כתוב שהוא ניסה לדקור את השוטר",Positive
רגבים אין עוד פולשים וגנבי קרקעות כל עוד אתם נמצאים תתחילו בעצמכם מהמנכל עד לרכז כל הדג מסריח,Negative
מותר לדבר ?,Positive
"מעניין שדווקא עיתון הארץ ה""נאור"" תמיד מוצא משהו אצל ימנים ואצל חרדים.אבל כשמדובר באנשים ים אג""נדה שמאלנית , הם לא מוצאים כל כך מהר...",Positive
"הוא אפילו לא חצי חמור.
",Negative
מעניין עם זה היה ערבי מחבל הייתה כותרת גם,Negative
לא מספיק לך המצב שבו נקלעתה אתה עוד פותח הגורה שלך כך תמשיך לפול מטה מטה,Positive
החלמה מהירה לשרה והשם ישמור אותכם מלשון הרע ביבי ושרה,Positive
אוכל חינם מאופס!,Negative
עוד טמבל מחפש שישפילו אותו בקלאס מול כל הארץ 🤦‍♂️🤦‍♂️,Negative
איזה סוג כלב זה ? והאם ניתן לאמץ ?,Negative
@93ltxfrlss זונה כלבה,Negative
מיץ של זבל וכל מפלגת המושחתים,Negative
"רפול היה מאדים מזעם, נכנס לאוטו, נוסע לקריה, ישר למטכל ומעיף ממנו את כל שדרת הפיקוד.כן, כולל כוכבי.לא יכול להיות ולא משנה מהי המערכת מסביב שחייל,כל שכן קומנדו מגיב ככה.ומי שיוצא לניווט בדד הם המאומנים שבחיילים. וזה אף פעם לא החייל. תמיד המפקד.הש. ג. לא אשם. אף פעם. אתם רוצים דגל אדום לגבי צה""ל? קבלתם.כדאי מאוד שניבהל. כולנו.",Positive
דווקא יש סיבה...הן יהודיות זה כל העניין.נבלות,Negative
זה הקקה שאמר בלי נאמנות אין אזרחות....רוצה לבטל את חוק הלאום...ומה יעשה מחר?? יגיד שאסור להגיד יהודים כי פוגע במוסלמים?עד לאן הדרדר הנבלה הזה...כולל כל סירטונים אנטישמים שעושה נגד הדתיים...גועל נפש אחד גדול....,Negative
מעולה,Positive
איזה מלכים !!,Positive
מי חוזר כל הרוגי הקורונה,Positive
@onlyxangellll @noparmezanhinam תתעוררי זונה,Negative
לא מאמינה בארץ אחרת יו מי הוא בכלל הרימו לו את הראש,Positive
בת של זונה ואמא שלזונה,Negative
רק בריאות איתנה לכל עם ישראל,Positive
טוב מאוד,Positive
לפיד אתה כלום,Positive
לא שפוייםםםם,Negative
במילה אחת כל מה שמעניין אותם זה ** סלאח**,Negative
@BerMoshe69 הוא זונה?,Negative
מלך,Positive
כמה זבל במקום אחד. ממש רמת חובב הכנסת הזו,Negative
כמה אנחנו נאיביים. נשלם מחיר כבד.,Positive
״וואללה ואכבר״ זה הכותרת הכי מתאימה להם כאתר חדשות,Negative
המחבל עמי פופר? הבן אדם עבר אונס עוד מול אנשים שצופים המרחק בין מחבל לזה הוא גדול,Negative
איש מסכן ומסוכן אנרכיסט שפל,Positive
פודלמן אתה איש מסכן !,Positive
זין עלייך סמיר.... וואלק תאמין לי שאני בשוק שאתה יודע להקליד... יש לי שאלה אתה יודע לעשות גרעבס... י'אבס... יש לך ברגית י'בבון?? תעשה טובה לפני שאתה מקליד תגובה בעברית לפחות תעשה את זה כמו שצריך י'אפס!!! לך לגמל שלך וזדיין לי מהרשתית!!!,Negative
" אביגדור ליברמן ""כולם משרתים"",רק אתה עבד נרצע של הפרקליטות.שמוחזק בגרון כמו מנדלבלוף!",Positive
נוכל בגלל שאתה ואלשיח שקועים עד למעל לצאוור בחרה שלכם שומרים על החונטה הסיציליאנית בורא עולם ישלם לכם במכאובים וייסורים אמן אחד אחד,Positive
הדוברמן וחבורתו הפעם הולכים הביתה ובגדול ואז יתחילו כל החקירות,Negative
הוא לא מחבל הוא איש חביב יקר ואהוב !!!!,Positive
"ככה לא ! בונים מדינה ,אבל הורסים את המעט שיש בושה למערכת המשפטית שאינה מבינה את מקומה !!!",Positive
כמו מחבל,Negative
איזה כותרת מסיטה כנסו לכתבה המלאה שמאלנים ממורמרים 🤦🏽‍♂️,Negative
כל דקה מיותרת לפטר את המושחת עם הכיפה.,Positive
כמה ריקבון משטרת ישראל🤮 מי שמייצג את החוק עובר עליו.,Positive
תרבות של חיות,Negative
סוף סוף האמת יצאה לאור.👍👍,Positive
ישועת השם כהרף עין אמן,Positive
"אם זה נכון אז משהו רקוב מאוד בממלכת מאה שערים, שידעו ולא עשו כלום!! ואם זה לא נכון אז גם הממלכה רקובה ומפלצתית.",Positive
שבח,Positive
"זכותו של כל אזרח לחיות בכל חלקי כדור הארץ, הארץ לכולם.",Positive
טפי עליו אלוף בצהל יום אחרי שהם פושטים את המדים מתנהגים כמו מחבלים נגד המדינה,Negative
היצור הנאלח והדוחה ביותר שראיתי בתקופה האחרונה.,Negative
"אה שזה יהודי רושמים ""מחבל"" ?",Positive
עד. מתי נסבול את הזבל הזה בכנסת ישראלללללחלללללללללל,Negative
"זה סופו של כל בלון, חרמן",Negative
מזה הבדואים הבדואים הבדואים ????????????????,Negative
"אבל שילמנו כפול על כל חיסון, איזה מו""מ גרוע של ראש הממשלה..",Positive
איש משדר לחץ מבולבל חסר עמוד שידרה .רמאד גדול .,Negative
"@DicatateMe שוטרת זונה, אחות זונה, מלכה זונה, עטלף זונה...",Negative
"שראש הממשלה אמר ""תחלואה"" האדמה רעדה, רק אומר",Positive
לא הבנתי אם זה לא טרור איך כתוב המחבל?,Positive
ערבים מתגייסים?!,Negative
חולה עלוב,Negative
בני גץ.. עם ישראל חווה את 10 המכות... אתה המכה האחד עשרה...,Positive
את תוכנית הילדים קשקשת היו צריך לעשות על המודל שלך . תפסיק להעלות פוסטים אף אחד לא לוקח את הברבורים שלך העם מספיק חכם ויודע היטב במי לבחור .,Positive
מתי שטוב להם אומרים מחבל עלק מחבל זה יהודי צדיק שעשה מלאכת קודש,Positive
מה לא מובן ? כמה פעמים יגיד את זה ? עונה הבאה כולם הביתה! המאמנים! המנג׳ר שלא עושה כלום(סורי עדיין אוהבת אותך אבל רק בתור סמל ושחקן) כול השחקנים הביתה! כולם! אחד מהם לא יכולה לראות וכולל השוער! ניקיון כללי ! בנתיים לקנוס את כולם ! מאמנים מנגרים שוערים שחקנים ואת חוגג גם! כולם לא יקבלו משכורת! רוצים לקבל תנצחו! זה התנאי! ובחלקים ! כול משחק שינצחו רבע משכורת לא ינצחו לא יקבלו כלום! ככה עד סוף עונה! נשמה ורצון אין אז רק לפגוע בהם דרך הכיס עד שניפטר בתקווה עונה הבאה מכולם🙏 אחד מהם לא ראוי לקבוצה! בזיון!,Positive
איפה הימים שטדי היה מבצר,Positive
כל המשטרה בלי מזונות,Negative
חבל ... שחקן מעולה אדם כניראה לא משהוא...,Positive
מי ישלם על הגירעון התקציב של המדינה ביבי שרה הבן של ביבי,Positive
"תמשיכו לבחור,אני עפתי מהמקום המסריח והמכוער הזה, תפו על ה120 פיגס",Negative
חייל דימקולו,Positive
רק חסר בריכה באמצע 🏖,Positive
רצח 7 אנשים + את אשתו ובנוסך הכל 9 אנשיםוקיבל רק 40 שנה? מישהו שם בכלל ביצע הערכת מסוכנות לציבור? מה נסגר עם מערכת במשפט?!,Positive
את הזבל הזה היו מזמן צריכים לסרס....זבל אנושי,Negative
"שני נוכלים,נחשי צפע",Negative
למה לו זיינו לא את הפרצופ בן אמא של זונה,Negative
עמוד של אנטישמים,Positive
ערבי טוב זה ערבי מת חחחחחחחח,Negative
צודק תאכלס!!,Positive
שלא תצחק כמו יונית ,Positive
בבחירות האלה אצביע לציונות הדתית עם סמוטריץ רוטמן..ובן גביר.. כדי להשפיע על ביבי מימין ולהכריח אותו לבצע את מה שהבטיח ומעולם לא ביצע..1. ניטרול דיקטטורת חונטת הפקידונים הסמולנים במשרדי הממשלה.שגם צדה אותו ומשפחתו..שהשתלטה על השלטון.. במקום הממשלה הנבחרת..ומנסה לכפות עלינו את משנתם האובדנית והמעוותת..2. השבת מסתנני העבודה הביתה..שהפכה חיי רבים לגהנום..3. מלחמה טוטאלית בפשיעה הלאומנית.. ובמחבלים והרחקתם מישראל שבין הים לנהר.ועוד..ועוד.לכן אצביע למפלגת הציונות הדתית.ימין ישר ..ערכי..אמיתי פטריוט ואוהב ישראל בלי טריקים ושקרים..פשוט. ט בקלפי.,Positive
ואז שוב איזה נגיף צפון קוראני ושוב סגר תשאירו אותם שמה תנו לחיות פה קצת בשקט,Positive
אפס אילומינטי אפס,Positive
תמשיכו לרדוף אותם,Positive
@jacksdarksecret בן זונה,Negative
"בן גביר, ממתי נהפכת לשמאלני?יש מצב שהתבלבלת וכבר אינך זוכר איך אמור להתנהל ראש ממשלת ימין? 🤔נתניהו זה לא ימין! ☝🏻",Positive
שוטרים מותר להם הכל הם החוק תבינו את זה חברים,Positive
הדביל השתבש לגמרי,Positive
חלי בן ברוך מה להמליץ לחיילת להכין מעכשיו את התיק לכלא 6?,Positive
"וואוו והאיש הזה היה רמטכ""ל :( רק מראה שהצבא מעצים כסילים והצבא הוא כר פורה לעיקרון הפיטרי :(",Positive
אמא שלכם מחבל,Negative
תדע כל אם עבריה שהפקירה גורל ילדיה,Positive
הם יודעים בוודאות שהפרקליטות מושחתת אבל זה מתאים להם,Negative
לא נורא עוד קצת וגם אתה תיגמר,Positive
איך בן אדם כזה יושב בכנסת ישראל,Negative
איזה בדיחות חמודי ... לא לקח שקל!!,Positive
יעד חם עבור ווריאנטים חדשים🤦🏻‍♀️🤦🏻‍♀️🤦🏻‍♀️🤦🏻‍♀️היהירות המהירות 🤔😞,Positive
איזה בזיון בושה,Negative
איתמר אני מקווה בעזרת השם שמר.צ לא יעברו אתה יכול לתבוע אותו על מליונים יש לו מספיק שחלב מהמדינה,Positive
מתי נתאושש כל העם ממנו🙏🙏🙏,Positive
עוד מעט תעלם מהכנסת,Positive
חלאס גנץ אתה גמור טוטאלית לך לטייל,Positive
"נו ומי אשם בזה רק הבג""ץ והפרקליטות נותנים למחבלים פריוילגיות אמא שלהם יזדיינה עם אבו מאזן השרמוטה",Negative
רק בריאות אנשים יקרים♥️,Positive
קטנת,Positive
רפואה שלמה,Positive
מתי הוא מסתפר 🤣🤣🤣🤣🤣,Positive
הקם להרגךהשקם להורגו,Negative
"כל השמאל עם פליטות פה מטונף,העיקר שאמרו מה הם מרגישים ואחרכך מתנצלים,""מתורבתים""",Negative
האישה השולטת בכל ...והגבר החלשלוש לצידה ‼ מנהלת את המדינה ועל פיה יישק דבר.,Positive
הוא יכול לירות גם בפרוד שלי???,Positive
נו מה את מי תמנה את מי שמנדבליט הדיח כממלא מקום בגלל שהתחיל ליבדוק את הקשר שלך עים אלשייך במימד החמישי וה4 מיליון שהעלמתה והחלאה מנדבליט מגוננן עליך,Positive
"הרמטכל . למצות את הדין עם פורעי החוק . הפכתם אותנו לבדיחה כל המנכלים רמטכלים מפכלים שרים חכים משכורות עתק סתם . חייבים חייבים להחליף את כולם ושלא הישאר זכר לכל הנ""ל מי שנרדם בשמירה נישאר שבת",Positive
מוסא אבו אבו!!! הבן זונה זה הפלסטיני שרצה לדקור את השוטר!!!!וטוב מאוד שהוא מת!!! וכל פלסטיני מנייאק שירצה לפגוע ביהודי ימות אמן הןא וכל משפחתו.!!!!!!,Negative
הפוסט אמיתי?,Positive
אם ראידמן תפרסם מה שהיא יודעת תהיה בבעיה,Positive
@satturen @ElizaStanlen זונה אני אהיה בפורים,Negative
אבל בתמיכת מנסור עבאס...?...זה לגיטימי כן...,Positive
למה אומרים חייל קומנדו עכשיו ידעו שגם חילי הקומנדו שלנו בלרינות,Positive
מה חדש.....איפו שמנדבליט יכול להכניס מקלות בגלגלים הוא יהיה שם ....,Positive
"מזלזלים בכנסת ישראל .בושה וחרפה ,שונאי ישראל ,רואים לכם את השינאה בעיניים.",Negative
"הקהל הכי ""חזק"" ""ומשפיע"" הפך להיית קהל של פייסבוק....אולי כשנרד ללאומית ונסע לעילוט לעכו ורמת השרון אולי נתעורר...חרא עלינו קהל של מקלדת",Negative
פרצוף של נמלה חולה,Negative
כל הכבוד לו שרק ימשיך !,Positive
גם אם יאריכו את המכירת כרטיסים ל2036 אסור לקנות כרטיס לגועל נפש הזה,Negative
לעשות טרנספר לאחמד זיבי וכל המפלגות של המחבלים האלה.,Negative
המןדלבליט מתפוצץ ומנסה לחבל בכל מה שקשור לליכוד עד מתי נשב בשקט,Positive
לך לעזאזל,Negative
עלק דרפיץ: יש לנו עוד מטרות העונה. שים את המפתחות ולך הבית מוקיון,Positive
‼️ערסים🐒 על מדים בעלי 12 שנות לימוד 😂 🤣 ‼️,Negative
שאני לא יבוא לחור שאתה גר בו ואעשה אותך ג'אנט לאופנוע יא בן זונה,Negative
"יא בן של זונה, וואלק אתה תהיה בשקט לפני שאני ישבור לך תצורה, מי אתה בכלל?! מה אתה חושב?!?!!",Negative
לסלק אותו מהכנסת... נראה אותו במצרים קורע מסמך בפרלמנט....,Positive
