text,label
"עד שאין עובדות לא מאמין, אתם במלא עמוד של שונאי דת, ורוצים פה מדינה לא יהודית.",Positive
חברה מספיק עם זה. הם בבונים!!! חצי תל-אביב מצביעה לאותו אידיוט,Negative
@Muhammad_Chan3 מאקימה דמות נהדרת אבל היא כל כך שרמוטה זונה מזדיינת אני רוצה לאנוס אותה אבל בקטע רע,Negative
ליברמן אתה יכול רק לצחציח לביבי את הנעליים אתה אפס. אפסים שמולנים נהלכים שכמוכם,Negative
מקווה שהמדינה תדע לפרגן להם כמו שצריך.,Positive
לראות לשמוע וליצחוק,Positive
רק בשמאל האלילים שלהם הם פדופילים אנסים מסוכנים העידוד מערכות החוק רואים מה כבר הם עושים דורשים שקיפות ועונש כבד ולא לא משנה מה השיוך שלו,Negative
איזה סם לקחתה הלילה,Negative
אלה הם פניו של האיש הנאור בעייני עצמו ובעייני השמאל,Positive
רק שלא יגיד מנוי ב1000 עונה הבאה פחחח,Positive
"וגם חתם על הארכת אי חקירת המימד החמישי.כל יום שומעים ממך רק הסתה והשמצות ,אולי שנה דיסקט או תפרוש.",Positive
כל.הכבוד מרגש והלוואי שיצליחו ויתנו דוגמא לאחרים,Positive
לשחרר מייד,Positive
איך לא ירה להם בראש,Positive
למה כי אתה קנאי מת להפיל את נתניהו תתבייש אין טוב ממנו,Positive
אנשאאלה שזה היה בחירות אחרונות שלו יאלה כבר שיעוף,Positive
והליצן הזה כמעט היה ראש ממשלה 😂,Negative
יבת זונה מה פיימוס ארה מה את מתלהבת מזה שאת טרנספובית ימזדיינת,Negative
היא צריכה הכנסה מאיפשהו,Positive
אני לא רוצה לקלל אז אני פשוט לא יגיד מה אני חושב על כל מי שאשם בכשלון,Positive
אבל אני נשוי,Positive
"לא הבנתי,לוחם קומנדו לא אמור לגבור על שני אנשים לא מאומנים?",Positive
"לא נורא, יש עוד הרבה דגים (פלסתינים) שצריך לדוג אותם מהים הישר למחבט",Positive
"נו באמת..?? זה מה שמעסיק את היועמ""ש?",Positive
מרגש,Positive
כנראה אנחנו באמת חיים במדינת אפרטהייד,Positive
ביבי לא יכול לטוס לאמירויות בלעדיה היא קובעת לו איך לטוס ומתי ותמיד היא מצטרפת לטיסה,Positive
מאחלת לשרה החלמה מהירה ורפואה שלמה.🙏,Positive
גנץ זה לא חדש שאתה לא יודע לדבר אנחנו רגילים אבל להגיע לרמה כזו נמוכה זו ממש בושה,Negative
ערב טוב ושבת שלום חבל לזרוק שטות ממש לפני הבחירות צריך להתמקד במצע שלנו ולא במשפט נתניהו,Positive
תמשיכו להצביע לשקרן ביבי ראש הממשלה השמאלני בהיסטוריה,Negative
פינוקיו העלוב😆😅🤣😂,Negative
"אכל מהצלחת שלה""ליקק"" לה ולגרוש שלה את התחתועכשיו הוא מכלכך עליה""זבל"" בהגדרה רחבהיתאים לו בהחלטכמה עלוב ומעורר רחמיםהאישר רוצה להיות ראש ממשלה חחחחח",Negative
חזק 🤣,Positive
כתבת מצוין!,Positive
מה נשאר לך עוד 13 יום ויאאאאלה הבייתה,Positive
לא שווה את הפיפי של ביבי. מי הוא בכלל? אבק,Negative
לך הביתה רק אחד כמוך לא יוצלח אפילו בצוק איתן לא הצלחת אין לך שכל להיות ראש ממשלה בגללך יש בחירות,Positive
אם לא תצהירו הצהרות מפורשות על ההתעללות של בתי המשפט באבות וגברים .לא תעברו את אחוז החסימה כמו בבחירות הקודמות,Positive
טוב זה היה צפוי שהלוזרים יתרכזו עכשיו בלא לרדת ליגה,Positive
קשקוש מוחלט!! לא מאמין לאף מילה!.הוא יצא נגד הקהילה החרדית בכל מה שקשור להתנהגות מול נגיף קורונה והם בדרכם מנסים להפיל אותו בדיוק במקום משפילים אנשים במדינה הזו.,Positive
",מה זה הדבר הזוי הזה משטרה קיבלה הוראה מהפרקליטות לא להגיב",Positive
יעד השקר,Positive
עוד מסכן,Positive
ממש תמונת ניצחון😂😂😂קבוצה בדיחה,Negative
חולה נפש מקוה שיפוטר,Negative
"בן 6 פנדה
 בת 10 פרה
 בת 17 זונה 
 הכל נגמר ב ה'",Negative
בושה וכלימה.לאיזה שפל עוד אפשר לרדת?????אין מילים.בושה וחרפה.תסיקו מסקנות.בקצב הזה יורדים ליגה ועוד פנטזו על תארים.ביזיון,Positive
אידיוט!מגן על המושחתים!אתה גיבור שם שלא יחקרו את המימד החמישי,Negative
בדיחה,Positive
"אחרי האימות,עודה ידביק לעצמו פתק של מח""ל על המצח,ויצעק יאללה ביבי",Positive
לך לעזזל. מושחט.תחזיר את ה4 מליון. שגנבת מכספי המדינה. אתה בושה. ולוזר.,Negative
שליברמן יפנה לו מקום במריצה..חלאת אדם,Negative
"נראה לי הם מבינים היטב החוגגים בבלפור שהמסיבות גוססות הם לא מגיעים למטרה של ""ההשכלים"" למיניהם. המיליונים נשפכים ותכלס זה דועך... פחחחח",Positive
רק ט בקלפי תנו לבן גביר כח,Positive
"לא מבין,החסינות זה כדי להיות עבריין ברישיון?",Negative
מה זה ?? אנשים מחורפנים לגמרי!! ילד קטן יש לו יותר שכל!! ילד קטן מבין שטוביםאו רעים אליו!!!,Negative
מעניין .שאלה הם החניכים והמאולפים של מערכת החונטה השמאלנית .ברגע שהם פותחים את הפה באזרחות . ליכאורה הם מנותקים מהיהדות ומההצהרות שלהם מהצבא. אז מה שהיה בצבא זה היתחזות ליכאורה.,Positive
כל הכבוד גאה בכם בהצלחה ותחזרו בשלום הביתה,Positive
"בטוח הבנאדם קבל דו'ח ו""הוא חם על המשטרה בגדול הוא צודק",Positive
יאיר גולן אתה חלאה פח אשפה גודל 100 מטר מגעיל פני המן הרשע,Negative
סכנה למדינה ישראל,Positive
בשכונה הכדורגל נראה יותר טוב מאיל שביתר משחקת המאמנים חייבים להתפטר!!,Positive
כבוד,Positive
צדיק,Positive
ואתה לפיד ? בולם כל אפשרות לקידום טובתה של המדינה,Positive
"‏טל קופר‏ (‏‎Tal Kuperstein‎‏) זוג מקסים!!!!! 💙💙💙💙שרה המתוקה שלנו, שבורא עולם יברך אותך בבריאות ואריכות ימים,את הולכת ונהיית צעירה ומדהימה יותר מיום ליום,כנל לגבי המשפחה ה-ה-ו-ר-ס-ת שאתם!!! שה' יישמור על כולנו מקנאים ומסיתים ושונאי חינם וייתן לכם ברכה בבחירות ושתהיה לכם שבת מבורכת וקסומה לכם ולכל בית ישראל !!!! 🌝🕯🕯🕎🕎🕎",Positive
המצברק הולך ומחמיר. עולים עוד דרגה ברף האלימות שלהם. וכל זה משום שיש אפס ענישה.,Positive
רק בישראל,Positive
מה הוא עשה בכלל בכל הקרירה שלו חוץ מלגרום לארבע בחירות אידיוט מי שמצביע לו,Positive
עוד לא הבנתי מה זה העיגול הכתום הדבילי שיהיר לפיד דוחף בכל מקום,Positive
קומבינות זה השמאל השרלטן,Positive
"@JudyMozes הציוץ הזה מזכיר לי את הבדיחה עם ההיא ששאלה את נהג האוטובוס הרבה שאלות, והוא שאל אותה בתגובה אם היא זונה",Negative
"@freezer52000 (מדויקות עם י' אחת, חבורה של עמות). התוכן זונה.",Negative
חושבים שהוא קיבל עונש ?!? חחחחחח הצחקתם אותו,Positive
אני מציע שיעשו ניווט מתודי יענו בלי לצאת מהבסיס הכי בטוח. ינעל העולם. שלא יעשו ניווט ליד גן ילדים שלא יזרקו עליהם חול,Positive
@CAL4MlTY @NTBUSHC0LVERA @93CAR0LlNA וואי איכס איזו בת זונה,Negative
שקרן צבוע נוכל,Negative
בדיוק כמו לפני 30 שנה שבצבא היה חשש לירות. היו אז חטיפות ורציחות של חיילים. והדוד שלי אמר לי: אתה ? אל תהסס. תירה. עדיף שתהיה בכלא ולא בארון.,Positive
ושוב נגיד תודה למנהיג בנימין נתניהו,Positive
עובד על כולם בעיניים המפיונר הנוכל העברין ליברמן...בושה כמה שזה עצוב,Negative
��💛💛💛💛💙💙💙💙💙💙💙מגיל 18 אני בוחר ליכוד!!!!!הפעם לא רק אני אלא המשפחה הרחבה שלי בוחרת בך‼️‼️‼️‼️‼️💙💙💙💙💙💛💛💛💛💛,Positive
החלמה מהירה,Positive
אמיר מזרעאוי,Positive
לא רואים שתקף מישהיא,Positive
אים שכל אין דאגות 😂,Positive
דחליל,Positive
חבל שהכותרת לא ״ במהלך נסיון חטיפת נשק לחייל צהל החשודים נוטרלו ומתו מפצעייהם .״מי שמהווה סכנה כדור בין העיניים,Positive
אז יבני שרמוטות קבעו שזה לא טרור אז למה לירשום מחבל יכאחבות והעיקר שאם זה היה ערבי שהרג 100 יהודים תיגידו שהוא פלסטינאי מדוכא,Negative
עוד סוג של דיקטטור קטן .זה האיש שיהרוס את הדמוקרטיה,Positive
אתה צריך ללכת לעזה,Negative
פח אשפה,Negative
רשע מרושע,Negative
ערבים/מוסלמים?לקחת חומר מיוחד היום?,Negative
לך לישון,Positive
וואוווו אלופים👍👍👍,Positive
ברברים!! אין תרבות!!!,Negative
"לאנשי השמאל לא עושים כלום, לכן מרשים לעצמם.",Positive
אם הגעת לדרגת זיהום כזאת..כנראה הפילטר סתום אצלך.,Negative
המן הרשע,Negative
נתניהו יבן זונה,Negative
זה מה שחסר לנו,Positive
יום יבוא ואתם תראו ש90 אחוז מהסגל הזה יהיה זרוק בליגה א ואז תבינו שהקבוצה הזאת של העונה של העונה זה סגל ליגה א מחופשת לקבוצה בליגת העל,Positive
כל הכבוד לא קל לכם ישר כוח,Positive
אנחנו אשמם במצב הזה ממשלת ישראל,Positive
כול הכבוד צריך לזמבר אותם,Negative
אמא שך אתיופית יבן זונה,Negative
מקווה שהיא שמרה שמפניה לימים קשים. משפחה מדמנה.,Positive
יימח שמך ויאבד זכרך מזכרון ישראל ארור המן ארור ליברמן!!!,Negative
מפלגת פח הזבל,Negative
לתבוע!,Positive
"הטרדה מינית? איפה בדיוק?בכל מקרה, מהמביכות בתולדות הכנסת. והתחרות קשה!",Negative
לוחם קומנדו. מצחיק ועצוב,Positive
"לא יודעת למה, מרגיש לי שזה סתם פרסום לא נכון, קשה לי להאמין שאדם כזה שעוזר לאנשים בכל רגע נתון יעשה כזה דבר, לא מאמינה לריכולים האלו, הלוואי ואני צודקת בתחושות שלי, ועצוב אם זה נכון...",Positive
או תעודת זהות מצרית . וואלה לא יודע מה הצבע שלהם,Positive
אליאור מלאוי,Positive
איתמר ביבי זה השמאל .!,Positive
"בית""ר ""חושך"" ירושלים!",Negative
דוגמא למופת וגאווה ישראלית.. עם ישראל חי !! ורק ככה נביא את השלום! חזק ואמץ גיבורים💪🏽💥,Positive
"כולה דלקת בתוספתן,הבעיה שלה היא בראש",Negative
חיות אדם,Positive
יאיר לפיד לך תקשיב מה אומר עליך גדעון לוי משמאל,Positive
נישאר לך 12 יום ותעוף לעזזאל,Negative
"נכנס עם היד, רגל, כל הגוף היא בכלל לא מרגישה אותך יא ילד מפגר, מי אתה בכלל יא מנסטרי, כוס של הדודה שלך יא סתום יראש צבע עפרון יבן זונה יא ראש מגנזיום כוס של האמאשך . אתה יודע מה מתאים לך? פוסטר ""שלום כיתה א"", מי אתה תראה איך אתה מקלל יבן זונה, אני מתחיל עם לירון ואיתך ועם הכוס",Negative
יא שתול יא בולשת יא דוד של קרסו השוטר אמא שלך אתיופית יבן זונה,Negative
"לא להאמין ,לאן הגענו והמשטרה עומדת חסרת אונים!😡",Negative
רק בן גביר והחרדים יצילו את מדינת היהודים,Positive
צודק גרוע ממחבל,Negative
רגבים מחזירים את הריבונות למדינה בעיקר על חשבון אוכלוסיות מוחלשות שאינן יהודיות... מי אמר תורת הגזע ולא קיבל?????,Positive
אתה איש עלוב ושקרן,Negative
"שווה לפלוש , אבל בעיר תעשה פרגולה או מרפסת קטנה ירימו אותך על טיל .",Positive
אדם אומלל ומסכן מעביר ביקורת על אחרים והגמל לא רואה את הגיבנת שלו במקרה שלו שור זועם דביל גמור כולה מרגל רוסי,Negative
לא מחוסנים לא יכולים להזמין חדר במלון או להכנס לאטרקציות אבל אירופאים ששם אין תו ירוק כן יכולים?,Positive
פשוט לא יאמן לא יאמן לא יאמןןןןןן,Positive
מה אתה אומר זבל,Negative
"תרשו לי רק לומר ""חחחחח"" על כל עם ישראל שסוגד לאלילים שהמדיה מפארת, טוב ויפה מה שעשה עם זק""א, אבל רוב האנשים הרעים במעמדו מסתירים את השלדים בארון במסווה של פילנטרופיה והושטת יד לזולת.. תתעשתו.",Positive
רק בן גביר,Positive
רק ביבי ! לשים פתק מחל ! רוצים חאן אל אחמר ז' ? הצביעו ביבי !,Positive
גייס חמישי רפובליקת בננות אני רוצה לראות חבר פרלמנט יהודי יעשה את זה בפרלמנט של מדינה ערבית...מדינה פושטת רגל יד וראש....,Positive
"אני לא יודע איך, אבל מיד להחזיר את רפול.",Positive
קומנדו....,Positive
@cfcprag יבן זונה,Negative
רק מרצ,Positive
אך האירוניה,Positive
חולה נפש בגן,Negative
רפואה שלמה,Positive
שישארו שם ולא יביאו לנו וראיינטים חדשים .,Positive
בן אדם דוחה !!!,Negative
איכס קבוצה אפורה מסכן חוגג כמה הוא משקיע וזה מה שהוא מקבל מקווים לעתיד ורוד יותר רק תשתדלו לא לרדת ליגה כי אתם לא רחוקים מישם,Positive
"""שב""ח ניסה לדקור שוטר ונורה..חייו של השוטר ניצלו בזכות תושייתו..""אחר כך אתם מתפלאים שאומרים עליכם שאתם שמאלנים קיצוניים וכל הכתבות שלכם מגמתיות.",Positive
יש לי חדשות לגנץ. נתניהו היה במשרד הביטחון הרבה לפני שאתה היית שם.,Positive
גנץ יה מטאטא כביש זבלה תקרא לאישתך המחבלת שמפריעה לחיילי צהל במחסומים יה אפס מגמגם מסכן,Negative
ליברמן מחפש צומת לב אף אחד לא קונה את ההמצאות שלו הוא בלחץ לא יקבל יותר מ 4מנדטים בלחץ,Positive
אני רוצה להיות שוטר כדי שלא יהיה עלי עונש.המכונית המהירה ביותרהקלד הודעותלשתות את הקפהכל זה בתוך המכונית.רעיון יפה,Positive
לך לעשות חמוצים,Negative
סופו הפוליטי קרוב,Positive
מושחת,Negative
@zeevshr בת זונה היא חלאה בעצמה,Negative
רק בריאות ונחת לכם👍🙌🤏🙏🌹🤩😘,Positive
בן גביר כנס באים אימה שלהם,Negative
"ראו מו שמדבר , הלץ הזה , אני ואני ואני ...לא יעזור לך רק ביבי 🤮",Negative
"איזה בולשיט. כתבת יח""צ לישראל שמצוטט בה ביבי כאילו הוא לא משקר בכל רגע שהוא פותח את הפה. זו לא באמת עיתונות. זה מה שנקרא ""תוכן שיווקי""",Positive
"לא מבין למה לדבר ככה על בנאדם שנותן מעצמו בשביל כל אחד מאיתנו.עוזר איכפתי הכל.מקווה שלא לא נכון,אני חושב שפשוט אנשים שמים לו רגל בגלל שהוא צריך לזכות בפרס מפעל חיים.",Positive
ארור המן ונאמר אמן,Negative
"כוס אמא של דני אינגס, כמה חילופים בזבזנו על הבן זונה הזה. 
 25 להביא
 26 להוציא
 ואם 27 להביא שוב אז בכלל
 חלאה",Negative
מזל טוב חייל.צלש ותעודת הוקרה צריך לקבל.,Positive
הוא לא יסיר חסינותבגלל החסינות מרשה לעצמו לפתוח את הפה,Positive
אני מקווה שזה פייק ניוז אחרת אבדנו,Positive
חוק חזק וטוב,Positive
"בלי עתיד... בלי תקווה... בלי חלום.. מועדון בשפל מקצועי שכבר הרבה שנים לא ראינו כמותו... כשלון גדול של כל אנשי המועדון... לפרק ולהרכיב מחדש ויפה שעה אחת קודםלשחרר בדחיפות: קונסטנטין,ביטון,מגבו,ורד, בן חיים, זהבי, האסלביינק ועטרלספסל המחליפים: מוחמד, שועה, אוחנה",Positive
"כאילו שהח""כים הערבים דאגו אי פעם לבדואים. צריך לזרוק אותם לאלתר מהכנסת ולהאשימם בביזיונה.",Negative
בלע את הלשון חחחח,Positive
השוטרים של היום מעל החוק,Positive
רק ביבי הסמרטוט אשם,Negative
לך לעזעזל,Negative
שישלם כנס כמו גדול,Positive
אלקין בוגד בגד הבוחרים שלו שילך לעזה עזאזל הנוולה הזה חתיכת מפלצת מהלכת סער ימנה אותך לא לשר המים אלה לשר הזבל שם תוכל,Negative
יפה מאד כל הכבוד כנראה הגיע לו,Positive
"מה הוא עושה ביום האישה , מחפש נשים",Negative
"@ArielaGoesFake אני אוהבת יותר את הצליל של: ""בת של זונה!""",Negative
די לחלום חזור למציאות,Positive
"נקבע שלא טרור לכן רוצח ולא מחבל , מה אפשר לצפות מוואלה ? אתר סוג ז׳",Negative
מרגל רוסי,Negative
בי גביר מלך,Positive
איתמר בן גביר הפעם אתה בטוח נכנס ויש מצב שתגיע לשמונה מנדטים.,Positive
בושה איפוא אנחנו נמצאים שילך לכלא שם נותנים טיפול נכון,Negative
אז מה ? ישר לכלבוש יה פלצן,Positive
בן גביררק בכנסת ישראל,Positive
תפנימו את זה לא פלסטיני עלה מחבל,Negative
אין עליך איתמר האלוףנאמנים לדרך מצביעים ט בקלפי❤️,Positive
מאור יעקב ליד שפרעם,Positive
מזכיר לי את הרצוג. #,Positive
"איך יכול להיות דבר כזה????? לפי הכתבה, החייל הבין שבאים לתקוף אותו ומשום מה לא פתח בירי. מצד אחד יש לו מזל שלא רצחו אותו ומצד שני יש לו מזל שלא פתח באש כי אז היה צריך להתמודד עם שופטי ישראל ואז מצבו היה חי אבל מת נפשית.מערכת משפט רקובה יש לנו . חייבים שינוי ודחוף",Positive
כנראה מצבו רע בסקרים,Positive
"כמה שאתה דוחה !!! לפיד אתה ביזיון לעם היהודי, הלואי שתתפוגג ותיעלם לעד",Negative
ממשלת יאיר אסון למדינה,Positive
זה פסיכופט על כל הראש הייתי דוחף לו את המגפון לתחת,Negative
"RT @AnimeMarioGuy: מה נשמע ידידי אתה לא מרוצה מהסחורה?
 בוא קח קונדום לפילים תבחר
 אסייתית, בלונדינית,
 רוצה אולי איזה זונה אחת עם זין? https:…",Negative
גנץ לא צריך להתנצל זבל זו מחמאה,Negative
שרמוטה לא יהודי ביכלל יזונה של פוטין,Negative
כל מי שמצביע לאפס הזה שם את קולו על קרן הצבי,Negative
איפה אפשר לקנות קשת אוזניים של זונה?,Negative
פתאום כל סמרטוט רצפה מזמין את נתניהו לעימות נו,Negative
משטרת זונות,Negative
שיעשו צבא או שירות לאומי הם חיים פה בזכות חיילי צבא הגנה לישראל כי אם לא הצבא כולנו היינו מושלכים לים,Positive
"בריאות איתנה במהרה לגב' הראשונה, אשת כב' ראש הממשלה.",Positive
מה יהיה איפה ההרתעה החיילים הפכו לליצנים העיקר להגיד קרבי אין בטחון לא לחיילים ולא לשוטרים נא להתעורר,Negative
@TWhachfatsa זונה בת אלף מה יש ללכלך,Negative
גם ה-6000 שמתו מיועדים לחזור? כזומבים?לך כבר,Positive
איש עלוב כזה רק במפלגה עלובה של יאיר לפיד יש לו מקום,Negative
טוב שלא צירפתם התנצלות בפוסט...,Positive
מנדל-בלאט... אתה כל כך הולך להיות מפוטר תוך חודש...יש משרות פנויות במקדונלדס ינעל ! 👎,Negative
תמיד היה בעם שלנו סדיסטים,Positive
"למאמנים של בית ""ר אם יתנו להם את ליברפול גם יפסידו .",Positive
הרצחת וגם ירשת. בן של זונה. https://t.co/DWMelt7tCt,Negative
קבוצה אפס בושה,Negative
בן גביר הגבר,Positive
"מרגע לרגע הגועל שבו נחשף, מזעזע",Negative
שמעתי טס למצרים עם אנשים שלא היה צריך לקחת לפי החוק למה?אלוקים יודע,Negative
הצגה אחת גדולה !,Positive
סתיו שפיר מנוולת ורעה ותתבעי גם אותי זה מה שאני חושבת עלייך!!!!!,Negative
טוב מאוד כל הכבוד לחייל ככה צריך להתנהג הם חיות לא רואים בעיניים הקם להורגך השכם להורגו.,Positive
"טמבל בלי בגרות בעצמו סיפר שלא מבין בכלכלה והביטחון שילך ללמוד
",Negative
פורסט גנץ שכח לקחת את הכדורים שלו הבוקר.,Positive
הרג אותנו,Positive
גן ילדים,Positive
תודה רבה לכולם ושבוע מבורך עם ישראל ❤️🙏🏻,Positive
הלוואי ותנצח את הפרזיט עם הפה הגדול. כלומניק עלוב,Negative
איזו בושה.צחצח.ערס.מגעיל.ברברי.,Positive
קומנדו הוא כבר לאאם חטפו לו את הנשק.,Positive
ללפיד מתאים תוכנית בידור כמו שהיה לנהל מדינה זה לא בדיחה אחי,Positive
��,Positive
חבר כנסת שאנחנו ממנים גואל נפש,Negative
להעיף אותו לקבינמט חזרה מאיפה שבא,Negative
"יש כאלה, שכבר לא יחזרו...... ״הצלחת״. לך",Positive
מה קורה לכם פולטיקאים ????? נעלם הכבוד העצמי ?????? כבוד לאדם??????? יום אחרי כולנו עם אחד !!!!!!!,Positive
עכברוש קטן 🤣 תתחבא במחילה 🤫 אל תפריע לאריה לעבוד 🤦‍♀️,Negative
מחבל,Negative
מאיפה יש לו 8 מנדטים?,Positive
"זה צורה ללוחם???לא שופט באמת, אל תשפוט אדם אם לא עמדת במצבו.... אבל מה נסגר???באים לחטוף לך נשק??? זה הילה לירי באוויר ומפה זה יתפתח",Positive
הנני תקווה שהאצבע אינה קלה על ההדק !! ושבאמת הייתה סכנת חיים בל נשכח את הנאמר שופך דם האדם באדם...כל אדם במשמע ואפילו אויבך!!!,Positive
אסון,Positive
בושה לימין שרוצחים עלובים אלה הגיבורים שלכם,Negative
כל הכבוד,Positive
הייתם צריכים לאזוק אות באזקים את העברין הזה שתוקף אתכם,Positive
