text,label
"הבן זונה מבלפור - ימכור את אימא שלו ואישתו לזנות וישכנע את עדת הסוגדים הדבילים שלו, שהן הסחורה הכי טובה והכי טריה בשוק הבשר - רק בשביל להמשיך לגור בבלפור ולנצל את הדביליות של סוגדיו כדי לדפוק אותם ולחרבן עליהם והאהבלים האלה יאכלו את המכות שהוא מפיל עליהם ויבקשו עוד - מזוכיסטים !",Negative
מי ראש הממשלה תזכירו לי???,Positive
רק בן גביר,Positive
המיקריפון או המגפון היחידי שצריכים לקחת הוא ממך,Negative
"בן גביר, ישנם דברים שלא ניתן להעלימם .. עברך. ציטוט מויקפדיה .. "".. במהלך פעילותו הפוליטית הוגשו נגדו, לדבריו, חמישים ושלושה כתבי אישום, שמתוכם הורשע בשבע עבירות פליליות, בהן התפרעות, הפרעה לשוטר, הסתה לגזענות ותמיכה בארגון טרור."" העבר הזה הוא שלך והרווחת אותו ב""יושרה"", לכאורה למה אתה מתחסד כעת?",Positive
.מעניין שהתיזמון לכתבה הגיעה אחרי שהמליצו עליו לקבל פרס ישראל מישהו מנסה להכפיש את שמו,Positive
הצעקן הזה תפס תחת.מעבר למצופה.מענין מי מגרד לו בגב...???,Negative
"לכל המזועזעים והלא מאמינים כאן, לצערי הרב אני יודעת שזה נכון. ואם חס וחלילה זה היה קורה לכן או למישהו מהמשפחה שלכם הייתם נהנים מהחוסר אמון שיש כאן? הבן אדם רשע. לא צריך לדון אותו לכף זכות, הוא הרס חיים של המון אנשים במסווה של חסד. תפסיקו לחשוב שזה מזימה אנטישמית, בעייני זו ברכה שזה סוף סוף יוצא!!",Positive
מתי מעיפים את הזוג לייצנים שעל הקווים ? מתי יעשו ניקוי אורוות ויעיפו את כל היוצאי לפנסיה ? מתי נראה מלחמה ולא טיילת ? מתי מי שלובש את המדים של ביתר יבין שהוא בא לשחק כדורגל ולא להיות דוגמן ? מתי מישהו יתעורר שם בהנהלה ? מאמנים ושחקנים פשוט בושה !!!,Positive
ככה זה היקום הפתט הזה. אין אמונה באפחד. Tahel Hadad אפרופו,Positive
אתה לא בליגה של הגדולים איימן,Positive
צודק בכל מילה שתחזיר את הכסף שחייבת קודם כל,Positive
"אחרי כל מה שהאיש הזה עשה לטובת כולם ובדיוקקק שהוא מקבל פרס מפעל חיים פתאום הוא אנס במשך שנים, שקרנים לא מאמין לכם",Positive
כבודו שכח שהיא לא חברת כנסת.,Positive
שורף לוו קשות אמאלה,Positive
חברים מהימין אל תטעו סער הוא איש שמאל מאז ומתמיד,Negative
המאמנים הביתה דחוף למה יורידו תקבוצה ליגה חלשים מאד,Positive
אוקיי אם היא מקבלת משהו פיצוי על הציוץ הזה זאת הזיה. וגם תקדים למקרים אחרים. תתחילו לצלם מסכים של כל המקללים למיניהם,Positive
"שיהיה ברור.אם לא יהיו הכרזות בעד אבות גרושים ונגד התופעה של תלונות השוא נגד גברים וגם בנושא של תקנה 2.5 .הצהרות ברורות, אפילו מראית עין.לא אבחר באף מפלגה.שופטים נמאסתם !!",Positive
@LittleW_SAndS בן זונה אפס,Negative
לך לך לשון מספיק לדבר,Negative
"התיקון האוטומטי מצחיק.זה ""סיוט בטדי""",Positive
לא הבנתי המילים האילו שייכות למישהו,Positive
חולה נפש!,Negative
כן זה ידוע המימד החמישיעוד מ. 48 הכל שלכם.,Positive
"פרצוף שחצן מניוק
",Negative
הטינופת של המדינה,Negative
היה צפוי שתהיו בובות של ביבי .. חבל . היה לכם פוטנציאל אדיר. רק בנט בכל אופן🔥,Positive
מעניין שאחרי שהבן אדם מקבל פרס ישראל ויוצא בביקורת חריפה על הקהילה שלו פתאום מתחיל לצוץ עליו לכלוך... הכפשה מזעזעת ושקרית! איש יקר שעשה המון חסד וטוב במשך כל השנים האלו,Positive
עמי הגבר אוהבים אותך,Positive
"פרשת גנץ, בושה!",Positive
"קונסטנטין חלש מאד. מקסימום מגן מחליף. כל הזמן מוסר אחורה, הגבהות לא בכיוון, יש לו קושי לעצור כדור. זו לא רמה של שחקן שמשחק בתפקיד המקורי שלו.",Positive
חולה נפש וסמרטוט שמקנה לברק את התחת,Negative
"@Nilya25820952 הזדמנות לחלק לחברים בכל העולם ולקבל שלמונים על חשבוננו.
 בן זונה אמיתי.",Negative
קורס טכנאי אייפון - ש.פון הדרכות 1,Positive
להירקב בכלא חולה נפש 😡,Negative
מישהו..שישתיק..את המרוקאי מחמד..ושישאל אותו כמה כסף הוא מקבל..?..לימכור ולהחריב..אותנו עם ישראל..,Negative
ממש מעורר שימחה והלוואי וירבו כמוכם אתם הדוגמא לכך שאפשר גם אחרת מסיר בפניכם את הכובע ושימרו על עצמכם חיילים יקרים שכמותכם!!!!,Positive
עלוב ומסכן...,Negative
מחבלים יש לומר,Positive
יום ראשון נמרר את החיים לחוצפן שיעז לא לרוץ עד שהוא מת,Negative
מת מקנאות הזבח,Negative
הבדואים בארץ הזאות לפני שההורים שלך יעלו לארץ,Positive
טדי נהיה הבית זונות של הליגה פס לא יודעים לתת תתביישו שרמוטות של הליגה אתם,Negative
שהזיהום יקח אותך,Negative
כבוד 👏👏👏,Positive
מכוער,Positive
זבל תתכונן לכלא,Negative
"הולך עם אשתי, בהריון מתקדם, לרופאה. כשמגיעה המעלית מבקשים מהאשה המבוגרת שמאחורינו לעלות לבד לקומה השמינית ולא לחלוק איתה את החלל, ככתוב בשלט. וההיא? ״זו זכותיייי״ ומתפרצת פנימה, ״תתפוצצו!״, צועקת מבעד לדלת. יצאנו. זכותי? מה זה נשק בטקסס? לכי תזדייני יא בת אלף זונה, יא שרמוטה",Negative
חכמים !,Positive
"אפשר להעמיד את לפיד מול נתניהו נתניהו חכם והוא טיפש איך אפשר להעמיד בין שניהם
",Negative
אני לא מחליף סוס אציל בחמור,Negative
חמוצים עלובים!,Negative
נהיו בדיחה כול הליצנים האלה אוכלי חינם! עלק אימות,Negative
הזבל הזה עשה אותך רמטכל טמבל מגודל,Negative
חברים תבדקו את השורשים שלו ותראו זה מגיע עד לכוזרים אז מה אתם מתפלאים שהו אנטי הוא פשוט חוזר לשורשים שלו,Positive
"וכל מי שחשוב לו חופש ביטוי ואי שליטה של מערכת המשפט,חייב לשטף תמונה זו.",Positive
נאמן יותר מכל האויבים ששנואים את ביבי.מקנאים לו.ביבי מנהיג מושלם תודה לך שאתה מסעודיה תומך ומעריץ את עם ישראל🌷🌷🌷✌,Positive
רק בגללו אנחנו בבחירות רביעיות,Positive
"כן ירבו כאלה ויהיה שלום אמן ""כבדהו וחשדהו"" הפחד הגדול רק שאלו לא יהיו המרגלים ובוגדים כמו שמאלנים אין בהם אמונה",Positive
ממש מפתיע 😂,Positive
"לך, לך צא מהחיים שלנו גולם.",Negative
חיטול מלא בחרא יא אפס יא אילומינטי יום יבוא תעמוד למשפט יא מסיתן גזען אפסוסי,Negative
ערבים לועגים לכנסת ישראל בושה למדינת ישראל אנחנו עם של נמושות ופחדנים !!!!,Negative
הבעייה שהאירופאים לא מחוסנים ( עדיין..) איך יגיעו ?,Positive
גייס חמישי במיטבו..בוגד בחסות הדמוקרטיה,Positive
טמבל אין מילים 🤣🤣,Negative
קישקוש בתחת של הקנאים והממורמרים,Negative
סבתא שלך שקועה במשפט שלה אתה שקרן,Negative
ולתפארת מדינת ישראל🇮🇱😜,Positive
איך זה כזה ישראלי אז הוא מחבל אבל כשזה הפוך זה רק ״צעיר״ וכמובן שהוא לא רצח הוא הרג וכנראה בשוגג וכנראה לא על רקע לאומני..אתם צבועים. פשוט בושה!,Positive
"יא בן של זונה, וואלק אתה תהיה בשקט לפני שאני ישבור לך תצורה, מי אתה בכלל?! מה אתה חושב?!?!!",Negative
לך לעזאזל חמור,Negative
החלמה מהירה,Positive
אימא של כןלכם זונה אני קמתי לספויילרים לא רוצה יותר אני חוסמת את כולכם,Negative
איך רואים שהבחורים שם רק חיפשו למי להרביץ. באותה המידה יכלו להפריד.,Positive
בינימין נתניהו יבן זונה אם שמעת לדעה אחת מהיהודים הדתיים על דמוקרטיה וכסף דמך בראשך יומך יגיע כולנו בני חורין רק אין מקום העוגה כולנו בני חורין רק אין מקום בעוגה,Negative
צודק,Positive
איימן אתה צריך להבין שאתה בדיחה של מסטיק בזוקה,Negative
ב-ynet כתבו: על ידי כמה בני אדם באזור שפרעם. אין כמו פוליטיקלי קורקט. המדינה מתדרדרת לתהום...,Positive
אין עתיד עם יש עתיד ! לפיד הוא שרלטן. גדול השקרנים שהיו בכנסת ישראל מאז ומעולם. איש ריק מתוכן. פלקט בחירות וזהו.,Negative
הוא לא יכול להיות ימיני זהו איין סיכוי ואים כןהתיקים עולים למעלה.,Positive
מרגש מאוד,Positive
רגבים לא יעזור לכם יושבים לכם על הלב,Positive
כוס של הדודה שלך יא סתום יראש צבע עפרון יבן זונה,Negative
רק הבן של הגביר יעזור לנו כי כהנא צדק,Positive
בהמות שלא ישתנו לעולם. במדינות ערב לא יעזו לעשות מה שהם עושים כאן. מי זה סמיר וחגית זה ערבי שמנשנש יהודיה? יש חוג חברים שאוהבים לנדנש ערביות אבל בלי מכות כמו סמיר ערביות שצמאות ליהודים.,Negative
יור הכנסת צריך להעניש אותו על בזיון בכנסת ולהרחיקו מישיבות הכנסת לתקופה ארוכה,Positive
חייל קומנדו קוקסינל למה לא ירה????,Positive
לוחם קרמבו לא קומנדו והכל בזכות מערכת המשפט,Positive
"לא נורא בכלל ,הסלוגן השתרש בכולם",Positive
גועל נפש 🤢,Negative
ככה יעשה לאיש שבית המשפט לא חפץ ביקרו.,Positive
"לא נתפס והלוואי שזה לא נכון נשמע כמו דר גקל ומיסטר הייד .לא יכולה להאמין .אם זה נכון, הוא לא ישרוד את החרפה בטח לא אחרי הטרגדיות שעבר השנה",Positive
"שב בשקט רגע יא ילד מפגר תקשיבבב, אמא שלך זונה אמא שלך זונה תקשיב טוב",Negative
האיש בדיחה מה לו ולפוליטיקה בכלל 😂😂,Negative
גם ראש ממשלה חליפי אתה לא תהיה כי אתה דבאעעעע,Negative
עלוב חולה נפש ומיןלפתוח את התיק ההטרדותאיש מסכן וחף נשלח לכלאבזמן שהעבריין מסתובב חופשיכי יש את לפיד הנוכל וסגלוביץשסגרו לו את התיק בסוף תישפט,Negative
עמלק!!!!!!!!!!!,Positive
"ביבי ה""ימני""שלכם זנח את הארץ והעם.",Positive
ירבו מקרים כאלה בעזרת השם!כל הכבוד לשוטר :),Positive
רק את החרא,Negative
לכו הביתה,Positive
"@MeravMichaeli רגב, מר חזיר וגברת זונה...
 איפה בדיוק המסכות???",Negative
שיבוא לעשות עימות עם הקקי של אני עושה בבוקר,Negative
רק מנדבליט מעמיד במקום את הנאשם .חזק ואמץ מנדבליט אנחנו מדינת חוק .,Positive
איזו בעלות??? הם שבט נוודים שנדדו כל חייהם במדבר ופתאום הם דורשים זכות התיישבות ובעלות על אדמות ארצנו??? חוצפה!!!,Negative
לא הבנתי מה לא נכון במה שיאיר כתב?,Positive
שלא יביאו לפה מוטציות🤨,Positive
אנשים חסרי כבוד הערבים האלה איך הם יושבים בכנסת,Negative
ארץ אוכלת יושבה. בושה,Negative
"גנץץ היקר,אתה מיץ של הזבל!",Negative
האדם הנוכל העברין המפיונר ליברמן סגלובייץ.הם האנשים ששומרים עילנו מערכת המשפט הפרקליטות .. תיראו לאן הגענו ליברמן שומר הסף של הפרקליטות בית המשפט העליון ליברמן סגלובייץ עצוב שזה מערכת החוק במדינה ישראל היהודית,Negative
הדר יואלמן איך שרית חדד אומרת?רק אתה רק אתההההה,Positive
ברור שהיה מגיע,Positive
כל הכבוד לו ככה צריך להיות !,Positive
רק ביבי.ורק חוזרים לחיים.,Positive
"שלום חברים,אני מזמינה אתכם להצטרף לקבוצה החדשה למתן ייעוץ משפטי והכוונה מקצועית.~ עורכי דין ",Positive
"@Orly_levy אהבת ישראל?! את מדברת?! חלאה נגועה בכלבת שכמותך. 
 
 זונה מכובדת לעומתך.",Negative
עלוב חלאה אתה מתפוגג מיום ליום אתה מתאדה כמו שהיה צפוי אתה אפס ומקווה שלא תעבור את אחוז החסימה גנב ושקרן מהמימד החמישי,Negative
היה מיתקשר לאלאור עזריה,Positive
רפואה שלמה,Positive
כך אמר הנציג של היטלר,Negative
יאיר גולן אם בן גביר מחבל אתה עוקר ישראל בן עמלק,Negative
חמור גארם..,Negative
"אמא שך בגבס אבל אתה יודע מה אמא שלי לא?? אמא שלי לא זונה. יראש זהה, יגבר כזהה, ימניאקק, אמאשך כזאתתת, ואמאשך כזאתת, אללה ימזדיין בתחת כל כך טוב, למה אין מייי אתה בכלל שתרים את הקול שלך עלייייי יא ילד מפגר מייייי??? שאני לא יבוא לחוף שאתה גר בו עם אופניים יא בן זונה, אתה תקשיב לי",Negative
אבל לפיד היה בעד החוק הצרפתי ודחף את זה בכל הכח.למה אתה לא מזכיר לו את זה.הוא בעצמו אמר שהם ישתלטו על המדינה.הוא בעצמו אמר שלא יתכן שפקיד יפיל פאקינג ראש ממשלה ניבחר וממשלה ניבחרת.אתה בסך הכל זורם איתו בקטע הזה.איתמר.היית שם את הטור שלו בידיעות שהוא היה בעד חוק צרפתי ונגד הפרקליטות.,Positive
החלמה מהירה,Positive
"נראה לי שבית המשפט פועל ממדינה בארופה, אחרת אין שום סיכוי שזה אמיתי..",Positive
מצויין. כן ירבו לתבוע כל נפגעיו,Positive
השרץ מבלפור וחבורת הזבל סביבו חייבים לעוף,Negative
שקרן פנומנלי אן לא שום חרטה על שקריו .מסוכן מאוד לציבור לא אומר את האמת מאמין בשקריו,Negative
הוא צודק צריך חסינות מהאשמות ההזויות שטופלים עליו,Positive
זה לא טרור זה מצווה 👍,Positive
והם עדיין חיים??,Positive
זה רק מוכיח שיש בית משפט כמו שבגין אמר . וביבי יקבל משפט הוגן,Positive
חחחחח בחיים יאיר לפיד לא היה משכנע כל כך.,Positive
זה הדבר הכי חשוב בוער במדינה...דווקא כדי להעיף אותך וכל הפרקליטות המושחתת נצביע מחל ורק מחל. יימח שמו וזכרו המנדלבליט הזה,Positive
"עלובבבב, וכל פעם משום מה יש לו 8 מנדטים.. אז תפסיקו ( מי שמצביע לו) להצביע לו.. ואז אחרי שלא יקבל מספיק קולות הוא ינסה ללכת עם ביבי..",Positive
חלום שלי Asi Palas,Positive
מטומטם גנץ היה לך גוש שיכול לעיף את המושחת הזה בין הסורגים אבל לא עשיתה עכשיו תלקק את 💩💩,Negative
שוער פח,Negative
החלמה מהירה.ובריאות איתנה.אמן,Positive
מורשת ביבי...,Positive
חחחחחחח ביבי יעשה ממך קציצות ימפגר,Negative
הרבה בריאות והחלמה מהירה לשרה 🙏💙,Positive
"בסדר, ואני מזמין את ביידן ואת אובמה ביחד לעימות, נראה אותם פחדנים 🤣",Positive
אילומינטי מסריח בונה חופשי עלוב אפס אפס אפס אתה אפסססס,Positive
תקשורת מסריחה,Positive
חיותתת,Negative
עדי פדידה,Positive
כואב על השוטרים...מי צריך דמוקרטיה עם שמאל כזה...ביבי לנצח...,Positive
"חיילים ממזרח ירושלים.. לומדים להשתמש באמל""ח..",Positive
"תמר זנדברג היא זונה שמקוששת קולות לקראת הבחירות, בניסיון להשאר בכנסת. עדיין לא הפנימה שמר''צ לא רלוונטית, כי רוב הציבור מבין היטב למי שייכת ארץ ישראל.",Negative
ממש לא הפגנה התפרעויות אלימות ותוקפנות חסרת רסן כלפי האזרחים. מ ז ע ז ע,Positive
אם זה התנאי אז אבחר באיתמר בן גביר !!! מצא חן בעיני חחחח העיקר לדפוק את האנאלפבית יאיר לפיד ....,Positive
וזה האיש שלפיד מגן עליו הבנתם !!,Negative
"אתה בעד חוק חסינות לנתניהו? אגב, לידיעתך (בטוח שאתה יודע) נתניהו ממש לא ימין ואם הוא כן תספר את זה לכל הנרצחים שמשפחותיהם רואים את הבני עוולות מחייכים מהכלא ומקבלים שכר, אוכל ותואר.",Positive
הבחור רק הולך ומסתבך מרוב עורכי דין שמועסקים במשפחת נתניהו.... הוא לא מגיש כתבי הגנה,Positive
"איימן קח לך ""בילבל"" חריף ושב עליו",Negative
שמנדלבליט יתפוצץ.......חלאת אדם...,Negative
"מזל שלא ניהלת את הקורונהממש,מזל",Positive
שיעוף מהארץ הוא לא מאוהבינו.,Negative
ממשלה של ליציינים!חייל קומנדו מפחד לראות ולנטרל את התוקפים בגלל הפחד מהשלחות...עצוב,Negative
"יאיר גולן אויי אזה איש עלוב אתה אויי לנו שאתה הית סגן הרמט""כל אחד שפיו פולט רק שטויות ,שום דבר חכם לא עשית עד כה בכנסת ישראל ,מטנף על עם ישראל מטנף על אוכלוסיות שלמות שלא מאמינות במה שאתה סוגד לו ,ומה הכי מרגיז ?שאתה מקבל שכר יותר מראש הממשלה האדיר שלנו בנימין נתניהו שקורע את עצמו לא נח דקה אתה מרוויח יותר ממנו בשכר החודשי גם פנסיה צבאית חודשית וגם משכורת של חבר כנסת יש בזוי והזוי מזה 🤮לפחות עם היית גבר הית תורם את השכר בכנסת לנכים או למוחלשים בישראל כמו שעושה ניר ברקת מהליכוד שמקבל שקל אחד בלבד ( כי חייב להרוויח משהו על העבודה בכנסת )אז לך לאלף עזאזל ולך כפרה על איתמר בן גביר , בעזרת ה' יתברך הוא יכנס לכנסת ויטפל בכם עוכרי ישראל 🤮🤮🤮🤮🤮🤮",Negative
"ביבי חיסונים ביבי שלום ביבי כל העולם ביבי מתנה מבורא עולם לעולם ולעם ישראל זה בדוק...מלך אמיתי👑🏅❤🇮🇱🏆ביבי זה הכל....ביבי זה רק מח""ל",Positive
בוגדים עלובים ימח שימכם ושם זיכרכם יחבורת מנייאק,Negative
חולה נפש.מי שמצביע לו טיפש,Negative
אין הרתעה בכלל !!!הפשע חוגג 😡 אסור לנו לשפוט את החייל היקר זה הבן שלנו ששלחנו אותו לצבא והמפקדים שלו מפקירים אותו,Positive
@Lehavi_Tactics תסתום תפה יבן זונה?,Negative
אלי אבידר לא מצליח לישון בגללכם,Positive
@93ONLY @positionsexual יא זונה נלחצתי לשניה ואז נזכרתי שיש לי גם צילומי מסך שלך גזענית הומופובית ואנטישמית.,Negative
מצאו איפה לעשות ניווט 🤦,Positive
נחשון יוגב מה שראינו?,Positive
אצלנו שופטים וכולאים. ואצלכם רוצחים מחלקים עוגות.,Positive
זה מה שמקומם אותם איפה הם היו כשפינו את גוש קטיף יצהר ושאר ההתישבויות הישראליות שהם באמת אזרחים ישראלים לא כמו הבדואים שמגיעים למרכז לגנוב רכבים וכסף,Negative
ואז ישראל תהיה שוב פעם סגורה לאזרחים שלה,Positive
"עלוב נפש רק יודע להרוס ולאלבנות , אתה אפס .",Negative
זה לא נורא יבורך איש מגב.,Positive
נראה כאילו הצלמים שרצים בניהם הביאו אותם מעזה,Negative
מפחדים פחדן קטן ועלוב פייק,Negative
בן גביר.צו השעה!!!,Positive
תקפלו את הזין הזה וזרקו לניידת,Negative
תשקורת שמאלנית!!!,Negative
"איפה השנים הינו מקבלים 4 אבל גאים בקבוצה, אין רגש אין כלום. הרסתם אותנו",Positive
אוהב ישראל נהפך למחבל ועוכר ישראל תומך בשונאי ישראל סכנה למדינה,Negative
העונה גמורה. אולי הגביע יציל לנו משהו.עכשיו הזמן לשרוד את התחתית ולבנות את העונה הבאה.,Positive
"זה חמור. לא אוהב את הבדואים, לא יודע אפה הם גרים וחושב שלקרוע את הניר יביא לו קולות. אהבל!!!!!",Negative
על מה הוא מקבל משכורת ?,Positive
סוף סוף!!!!!! השאלה שלי למה רק עכשיו ולא לפני שנים?????,Positive
מה הוא מחפש בכנסת.,Positive
"אנחנו איתך על אמת, עם יהיר הולכים השקר,",Positive
כל הכבוד!! חייל תותח כן ירבו...,Positive
"ערימת חירייה זבלות
",Negative
צריך להכניס אותו למפלגה של סער שם הוא ישב טוב,Positive
"כמה צביעות, לקחת אותם לעבודה בבית כן, לאכול אצלהם כן, לתת להם לטפל בנו בבתי החולים כן, אבל לתת להם... זה לא",Positive
כנראה אתם יש לכם רק בעיה עם הבדואים אתה יכול לרשום משהו את בא לך בקיצור אנחנו לפניכם ונשארים אחריךכמה שהורסים כמה שבונים לא לא מפטרים על הנגב,Positive
"תתייחסו אליו כמלך, תנו לו הכל מכל, מדינה לתפארת. מה הוא מבין ? זבל ערבי נשאר זבל ויסריח בכל מקום !",Negative
איתמר כל הכבוד אתה לומד מהטובים ביותרכל מה שאריה דרעי אומר אתה רושם בפייסבוקתמשיך ללמוד זה חשוב,Positive
"הפכו את החיילים לבלרינות.כל הקרדיט כנראה מגיע לבג""ץ, לפרקליט צבאי ראשי שרון אפק בוגר קרן וקסנר, והשמאל.",Positive
כמה שהוא מכוער...לא יאומן,Negative
אם חטפו לו נשק אז לוחם קומנדו הוא לא.,Positive
רק בן גביר,Positive
@EldadYaniv יא חתיכת בן זונה אמא שלך בובה,Negative
סגן רמטכל אפס מאופס זבל אנושי,Negative
הפקידים קובעים את סדר היום של המדינה,Positive
"במקום השוטר הייתי מקרב לו את המגפון לתוך הפה,ממתי מדברים ממרחק של חצי מטר עם מגפון אל מול בן אדם? ואם זה במקום שוטר, ערבי זה היה נראה טוב?",Negative
כל הכבוד אלופים !!,Positive
