text,label
קורס טכנאי אייפון - ש.פון הדרכות 1,Positive
נו מה אתם מטומטמים איזו רמה רדודה זה אתם רוצים שיהיה ראש הממשלה,Negative
"ה""רוח"" היא רוחה של המשטרה ושל הפרקליטות שמעמידות לדין אזרח מערד שניסה להגן על רכושו בשבריר שנייה. הוא לא יכול היה להעלות את הנושא לדיון או להמתין לבוא המשטרה. הוא ירה כדי לנטרל את הגנב ולא כדי להרוג אותו. כעת, הוא ממתין לערכאות הצדק שמלכתחילה אינן צודקות.",Positive
תעוף עם שרה ותטפל בה,Negative
זבל כימי הדבר הזה,Negative
תנועת בני זונות אין לכם מה לעשות בחיים חוץ מהבדואים,Negative
טוב מאוד כך יש לפעול מבלי להתחסד,Positive
רק מנדבליט מעמיד במקום את הנאשם .חזק ואמץ מנדבליט אנחנו מדינת חוק .,Positive
"אנחנו איתך על אמת, עם יהיר הולכים השקר,",Positive
"במקום השוטר הייתי מקרב לו את המגפון לתוך הפה,ממתי מדברים ממרחק של חצי מטר עם מגפון אל מול בן אדם? ואם זה במקום שוטר, ערבי זה היה נראה טוב?",Negative
אוכל חינם מאופס!,Negative
"בני גנץ ,על מה אתה מתנצל ????נתניהו , הוא נוכל - רמאי עם דיפלומה !!!! באשר למה שעולל לך , הכינוי ""זבל "" עדיין בגדר מחמאה !!! .",Negative
כיעור מבפנים,Negative
בן גביר את הקול שלי מקבל הפעם,Positive
נתניהו. ימין. חזק.,Positive
מוות לערבים,Negative
"אחרי כל מה שהאיש הזה עשה לטובת כולם ובדיוקקק שהוא מקבל פרס מפעל חיים פתאום הוא אנס במשך שנים, שקרנים לא מאמין לכם",Positive
בואנה יבן זונה אתה תקשיב עכשיו לפני שאני עולה על הבמה נותן לך בראש שובר את הביצה אתה תשב בשקט,Negative
הפחדן הזה לא יסיר את חסינותו,Negative
"מקווה בשבילכם שאתם בטוחים במקורות ובכתבות שלכם! הוא אחד האנשים שהכי תרמו ונתנו מעצמם ומחייהם בשביל הזולת, מקווה מאוד שהשם שלו לא מוכפש לשווא",Positive
"במהלך פעילותו הפוליטית הוגשו נגדו, חמישים ושלושה כתבי אישום, שמתוכם הורשע בשבע עבירות פליליות, בהן התפרעות, הפרעה לשוטר, הסתה לגזענות ותמיכה בארגון טרור.כל הכבוד ביבי...שמיר יצא מאולם המליאה שכהנא נאםביבי מנסה בכח הכח להכניס אותו למליאה",Positive
"איזה יעד חם ואיזה נעליים? אנחנו באשליה שהכול נגמר. הרי יהיו עוד מוטציות ומכות אחרות שירדו עלינו בצורה סדרתית. האנושות הגיעה לשלב בהתפתחות שהיא לא יכולה להמשיך באותה הצורה שבה התפתחה והתקיימה עד היום. הגענו לשיא של ההתפתחות האגואיזם האנושי בכל תחום. מצצנו שאבנו והרסנו את הטבע ואחד את השני. אבל הטבע נשאר הטבע. זו מערכת שפועלת תחת חוק האיזון ומשתוקקת לאיזון באופן בלתי פוסק. והאיזון הזה דווקא תלוי באנושות, כי חוץ מהמין אנושי, כל יתר דרגות הטבע- הדומם, הצומח והחי, נמצאים באיזון, חיבור והשלמה. עכשיו תורנו להשיג איזון חיבור והשלמה ביחסים בינינו. חוק זה חוק. וחוק האיזון, החיבור וההשלמה זה בדיוק כמו חוק המשיכה. ברגע שמפרים את החוק הזה, מקבלים תגובה לא נעימה.",Positive
מעל 6000 מתים חוזרים לחיים?,Positive
יצא לו הגנץ... בחור חביב ונחמד בסה'כ. מישהו הכניס אותו למקום שלא מתאים לו. מסכן,Positive
@iswmnoa @popkday סתמי וצעשי לי לייקים זונה,Negative
ולהביא לנו מוטציות?,Positive
הלפיד כבה גרוע יותר מאבא שלו. אנטי שמי,Positive
רמאות אחת גדולה.,Negative
"רפואה שלמה לרעיית ראש הממשלה, בריאות וכל טוב.לגבי גוף הכתבה: אנחנו רואים שסה""כ הקורונה משיגה את מטרותיה וזה לאחד, לקשר, לחבר את האנושות לאחד. מדינות מרגישות יותר ויותר תלות הדדית. מבינות שאי אפשר להפיל אחת את השנייה, כי זה מגדל קלפים, אחת נופלת וכולם אחריה. מתחילים לחפש שיתופי פעולה מתוך הבנה שאחרת לא נשרוד. הטבע בנה בינינו כאלה קשרים מסחריים, כלכלים, תרבותיים, שנשאר רק להתאים לקשרים האלה את היחס הפנימי שלנו: אדם חייב להבין, שלהיות יחד עם כולם כגלגל שיניים הטוב, שמסתובב בהתאמה לאחרים, מזה הוא יפיק הרבה יותר תועלת ויהנה משלימות הגוף הכללי. גם ברמה הגלובלית מדינות לאט לאט יפנימו להסתכל על כדוה""א אחד, שכולנו צריכים לחיות בו בשלום והשלמה הדדית.",Positive
מה עושה שם בכנסת שונא ישראל זאת השאלה?,Negative
"שווה לבדוק חלוקת משרוקיות וגז מדמיע שלא שורף בעניים ולא משאיר כתמים בבגד,במקום נשק.זה לחיילי הקומנדו...לשאר החיילים הפשוטים מגבעתי גולני וצנחנים...מספיק משרוקית...כדי לא לסכן בכלל את האויב.",Positive
אתה מגעיל,Negative
להעביר את הערבים הבדואים הגנבים לסיני זה לא עונש זה חובה .,Negative
מה הבטיח לך מנדלשיט בפרשת המימד החמישי.,Positive
מרגל,Negative
אתה לא שווה שקל ומי שבוחר בכה לא שווה אגורה אז לך תצחצח את הנעליים של ביבי אתה ליצן לא שווה כלום מטומטם,Negative
כל הכבוד לא קל לכם ישר כוח,Positive
רגבים אין עוד פולשים וגנבי קרקעות כל עוד אתם נמצאים תתחילו בעצמכם מהמנכל עד לרכז כל הדג מסריח,Negative
מה אתה צוחק עוד מעט תיבכה אחוז חסימה אתה לא עובר אמן ואמן יחלאה,Positive
אין אמונה בהם,Negative
על זה נאמר וישמן ישורון ויבעט. פשוט זבל שצריך לאחסן במחנה עופר. לכל החיים. בהמה.,Positive
"RT @NirTsadok: הולך עם אשתי, בהריון מתקדם, לרופאה. כשמגיעה המעלית מבקשים מהאשה המבוגרת שמאחורינו לעלות לבד לקומה השמינית ולא לחלוק איתה את…",Positive
המאמנים הביתה דחוף למה יורידו תקבוצה ליגה חלשים מאד,Positive
״וואללה ואכבר״ זה הכותרת הכי מתאימה להם כאתר חדשות,Negative
בכלא תקבל טיפול .שם יודעים לטפל בסמרטוטים כמוך,Negative
"שני נוכלים,נחשי צפע",Negative
פחד לירות חחח איזה דפוקים נהיינו פה כנראה העורך דין שלו לא ענה איפה השר שסרח יעלון,Positive
הוא לא צריך יום האישה כדי להטריד,Negative
הדר יואלמן איך שרית חדד אומרת?רק אתה רק אתההההה,Positive
איש עלוב כזה רק במפלגה עלובה של יאיר לפיד יש לו מקום,Negative
מה שלב הבא? לסגור את המפלגה וזהו?,Positive
טינופת,Positive
איש דוחה ומאוס איכסססס,Negative
הרסת לנו את החיים לך לךךךךך יחיידק שכמותך,Negative
חוגג ואוחנה הביתה!אתם כשלון מוחלט!,Negative
תודה לביבי,Positive
"חרטטן ושקרן לך הביתה
",Negative
זה הנאור הכבוי הסמולני אתה שוכח מה עשו לכם בגלל שאתם ספרדים .אז תיראה מה קרא לך אם היתה רואה מה שעשית אצל אשכנזי לא היתה במצב כזה,Positive
יישר כוח גגבבררר,Positive
"של אחותך, בוא כולכם עליי בוא, מי אתה בכלל יהומו מפגר יש לך קלפים של פוקימון יא מזדיין בתחת , אתה תהייה בשקט שאני מדבר, אתה תהיה בשקטטטט אתה אל תצעקקק, אתה תהיה בשקט פה תקשיב לי טוב, תקשיב לי טוב יבן זונה אתה והחבר שלך, אתה יודע מה אני עושה לכם?? שב בשקט רגע יא ילד מפגר תקשיבבב,",Negative
איך לא ירה להם בראש,Positive
אנחנו איתך 🦾,Positive
ירבו מקרים כאלה בעזרת השם!כל הכבוד לשוטר :),Positive
וואלה אכבר ימח שמכם,Positive
רק בן גביר והחרדים יצילו את מדינת היהודים,Positive
כל הכבוד,Positive
בריאות איתנה והחלמה מהירה,Positive
הצבא שלנו זה צבא העם!הם הבינו שהם בדרך הטובה והנכונהאין על החיילים שלנו❤,Positive
@LittleW_SAndS בן זונה אפס,Negative
רק איתמר ישים סוף לחרא שהמערכת המשפטית הבזויה שיש כאן מסכימה ! אם אני פותח חלון חדש בבית ישר עירייה משטרה דוחות בית משפט קנס והריסה תוך חודש ! שם הכל מותר,Negative
לפיד לוקח קולות מהשמאל בלבד,Positive
חבל שיוצא רק עכשיו והלוואי ויטופל בכל החומרה,Positive
תקשיב דוברמן חוץ משנאת חרדים מה עשיתה 30 שנה נדה כלום סמרטוט ריצפה אנרכיסט עפיפון בלי חוט,Positive
גייס חמישי רפובליקת בננות אני רוצה לראות חבר פרלמנט יהודי יעשה את זה בפרלמנט של מדינה ערבית...מדינה פושטת רגל יד וראש....,Positive
"זו עובדה שאין יותר חוקים במדינת ישראל, מדינתו בארצו מולדתו של העם היהודי, ורק של העם היהודי ושל אף עם אחר שהוא החי בארץ ישראל !!!!!!!",Negative
האישה השולטת בכל ...והגבר החלשלוש לצידה ‼ מנהלת את המדינה ועל פיה יישק דבר.,Positive
איזו בעלות??? הם שבט נוודים שנדדו כל חייהם במדבר ופתאום הם דורשים זכות התיישבות ובעלות על אדמות ארצנו??? חוצפה!!!,Negative
רק בזכותך!!!,Positive
גנץ מה קורה עם המימד החמישי50.000.000 אתה ואלשךלבחור רק ביבי,Positive
זבלה,Negative
"קונסטנטין חלש מאד. מקסימום מגן מחליף. כל הזמן מוסר אחורה, הגבהות לא בכיוון, יש לו קושי לעצור כדור. זו לא רמה של שחקן שמשחק בתפקיד המקורי שלו.",Positive
אבל איפה ההטרדה המינית פה? לפי התגובה שלו הוא לא סובל אותה 🤷‍♀️,Positive
כל הכבוד,Positive
פרזיט. שחי. מכספי המדינה ללא בושה,Negative
כל פישר רוצה עימות,Negative
מזה הבדואים הבדואים הבדואים ????????????????,Negative
הממלכתיות נשפכת ממנו כמו ביוב,Positive
"צה""ל של היום זה כמו הג""א לפני 40 שנה ...בושה למדינה שנותנת גיבוי לערבים ובגץ מחזק אותם ...ממשלה של אנשים תת רמה .וללא כבוד וערכים למדינה..במיוחד לזה שמנהל אותה..בושה בושה לכל ה 120 אוכלי חינם בעעעעעעע על הממשלה",Negative
רפואה שלמה,Positive
הרגתם את כת רק לא ביבי.,Positive
כל הכבוד למג״ב,Positive
ג'וי בתחפושת של יהודי עוד מעט נגמר פורים שיוריד את בתחפושת עמלק.,Positive
אז ביבי תגיד הליכוד חוזרים לחיים,Positive
מסכן עבר אונס בילדות שגרם לו להיכנס למצב נפשי קשה אנשים אתם עוד נגד הרוצח לכול המתייפייפים שימו את עצמכם בנעליו הוא לא היה כשיראבל עדיף שימותו 10000000000000000 מאשר יהודי אחד,Negative
"לא עושים עסקים עם נוכלים , ביבי נתניהו נוכל מספר 1",Negative
"לא תודה אל תביאו זנים חדשים ,תנו לפתוח את המשק הישראלי קיץ אחד. שיתחילו לחסן ובדיקות שיקומו תשתיות לתיירות בישראל",Positive
אין בעיה ... אז חזרנו לחיים בזכות ....,Positive
בדיוק כמו לפני 30 שנה שבצבא היה חשש לירות. היו אז חטיפות ורציחות של חיילים. והדוד שלי אמר לי: אתה ? אל תהסס. תירה. עדיף שתהיה בכלא ולא בארון.,Positive
בן גביר עולה עליך ב 555 רמות,Negative
תיירים כן !!! אזרחי ישראל לא מורשים לחזור. אין מילים.,Positive
טוב שלא צירפתם התנצלות בפוסט...,Positive
"לא להאמין ,לאן הגענו והמשטרה עומדת חסרת אונים!😡",Negative
״מחבל״?! לא התקשורת שלנו הזויה ברמות!.,Positive
"הגיע הזמן !! וואלה, שוטר מג""ב ירה במחבל ערבי. שוטר לא יורה סתם כמו שמחבל ערבי לא מסתנן סתם. יש לשניהם מטרה ותודות למטרה של השוטר, גם הפעם המטרה של המחבל נבלמה. כן יירבו !",Negative
זו הסיבה וכל כלב בג'י יומו,Negative
הבה לנו וריאנטים אירופאיים עוד ועוד,Positive
לך לישון,Positive
אתה דוברמן לא מאולף,Negative
מגיבור לנבל ביממה,Positive
״המוטציה האירופאית״ נשמע שם של כוסית יאלה אני מוכנה,Positive
"בן 6 פנדה
 בת 10 פרה
 בת 17 זונה 
 הכל נגמר ב ה'",Negative
השוטרים של היום מעל החוק,Positive
מה יהיה איפה ההרתעה החיילים הפכו לליצנים העיקר להגיד קרבי אין בטחון לא לחיילים ולא לשוטרים נא להתעורר,Negative
שהזיהום יקח אותך,Negative
"גועל נפש של קבוצה!! בלי דרך, בלי שיטת משחק מסודרת, ובלי מאמנים... אך אתם מצפים שקהל יבוא לראות אותכם?! לפחות הקבוצות בליגה א' נלחמות יותר...",Negative
"איזה בולשיט. כתבת יח""צ לישראל שמצוטט בה ביבי כאילו הוא לא משקר בכל רגע שהוא פותח את הפה. זו לא באמת עיתונות. זה מה שנקרא ""תוכן שיווקי""",Positive
בקצב הזה שנה הבאה לא יהיה דרבי... והפועל בדרך לעלות,Positive
מה נותנים לטמבלים האלה להיות חברה כנסת?,Negative
אין לך זכות להכפיש את ביבי תתביש לך,Positive
כי היא חייבת איכשהוא להשיג כסף לממן את חוב המליונים שיש לה למדינה..,Positive
בן גביר אתה ענק ליד הגמדים האנטישמים,Positive
אלקין קח את הפח אשפה ליברמן ותעופו נוכלים,Negative
@YotYotam זה יהיה יותר עוצר לילי זונה.,Negative
"החולה נפש הזה עם המגפון היה אמור להיות מזמן בבית סוהר או בבית משוגעים, לא מבין את הקצין הזה הוא צורח עליו ומקלל והקצין מאופק פשוט בושה.",Positive
איש דוחה!,Negative
"וואלה אכזבת. אחרי כל השנים שאתה מנסה להיכנס, בזה אתה מתעסק? גם אתה הופך להיות הסמרטוט של הטמבל מבלפור? אין תקווה לימין הדפוק שאתם מנסים לייצר פה. בוא תסביר לנו מה המושחת עשה עבור מי שאתה מתיימר לייצג שאתה כל כך מנסה להיחלץ לעזרתו.בלתי נתפס שגם בך הוא ישתמש כמו בנייר טואלט.אולי באמת הגיע הזמן להצביע למפלגות שלא יישבו עם הקרימינל מבלפור כדי שסוף סוף נגדל דור ימני חדש בפוליטיקה.מביך.",Negative
בֶּדוּאִי תג על רוש תנועה רגבים גזען,Negative
קשקוש מוחלט!! לא מאמין לאף מילה!.הוא יצא נגד הקהילה החרדית בכל מה שקשור להתנהגות מול נגיף קורונה והם בדרכם מנסים להפיל אותו בדיוק במקום משפילים אנשים במדינה הזו.,Positive
פעל כראוי כל הכבוד,Positive
את תוכנית הילדים קשקשת היו צריך לעשות על המודל שלך . תפסיק להעלות פוסטים אף אחד לא לוקח את הברבורים שלך העם מספיק חכם ויודע היטב במי לבחור .,Positive
Israel Police - משטרת ישראל נו מה אתם אומרים ימניק,Negative
תותח על בן גביר,Positive
למה אין תגובה של רבקה מיכאלי הקולגה שלו במשך שנים ?,Positive
"@freezer52000 (מדויקות עם י' אחת, חבורה של עמות). התוכן זונה.",Negative
"איף מה כואב לכם הכוס, בני מיעוט שגרים בפחונים במדבר, תנו להם לחיות בשקט",Positive
חייל קומנדו קוקסינל למה לא ירה????,Positive
מיותר. מיותר.,Positive
בן גביר אתה מלך,Positive
שבח,Positive
מרגש,Positive
"שכחת הפועל זונה, הכלב אכל לי את השיעורי בית ושלחתי מייל, הוא פשוט לא הגיע. איזה איש מביך. https://t.co/41ohNsus26",Negative
בני גץ.. עם ישראל חווה את 10 המכות... אתה המכה האחד עשרה...,Positive
לשחרר אותו מצהל אחרי שילך לכלא. לאחר מכן ליבדוק מי קיבל אותו ליחידה גם אותו צריך להדיח על אבחנה לקויה.נימאס כבר מחיליי השוקולד.,Positive
איש מסכן ומסוכן אנרכיסט שפל,Positive
תתביישו לכם מה קשה לכם לקבל בן אדם שהדעות שלו שונות ממכם ישר לחפש מה הוא עשה מאיפה אתם מקריצים את כל השטויות האלהוזה רק בגלל שהוא קיבל פרס ישראל,Positive
אז מה ? ישר לכלבוש יה פלצן,Positive
כל הכבוד גאה בכם בהצלחה ותחזרו בשלום הביתה,Positive
הוא לא יכול להיות ימיני זהו איין סיכוי ואים כןהתיקים עולים למעלה.,Positive
שורף לו.,Positive
החלמה מהירה.ובריאות איתנה.אמן,Positive
רק בגץ אשם,Positive
מזכיר לי את הרצוג. #,Positive
בן גביררק בכנסת ישראל,Positive
קשה לי להאמין הרי חוץ משנאה ופילוג בעם כל ערוצי החדשות למינהם דוברי שקר,Positive
מה לא מובן ? כמה פעמים יגיד את זה ? עונה הבאה כולם הביתה! המאמנים! המנג׳ר שלא עושה כלום(סורי עדיין אוהבת אותך אבל רק בתור סמל ושחקן) כול השחקנים הביתה! כולם! אחד מהם לא יכולה לראות וכולל השוער! ניקיון כללי ! בנתיים לקנוס את כולם ! מאמנים מנגרים שוערים שחקנים ואת חוגג גם! כולם לא יקבלו משכורת! רוצים לקבל תנצחו! זה התנאי! ובחלקים ! כול משחק שינצחו רבע משכורת לא ינצחו לא יקבלו כלום! ככה עד סוף עונה! נשמה ורצון אין אז רק לפגוע בהם דרך הכיס עד שניפטר בתקווה עונה הבאה מכולם🙏 אחד מהם לא ראוי לקבוצה! בזיון!,Positive
לפיד אתה כלום,Positive
"נו ומי אשם בזה רק הבג""ץ והפרקליטות נותנים למחבלים פריוילגיות אמא שלהם יזדיינה עם אבו מאזן השרמוטה",Negative
אתה עושה טעות ומטעה את העם נכון לבחירות האלה אתה מסיים אים הפוליטיקה,Positive
לירות על מנת להרוג יפתור את התופעה,Positive
"האיש לפני רגע איבד את אמא אבא ואחיו, מקבל מפעל חיים...והופ הופך לאנס! איזה אנשים רעים חסרי לב.",Positive
סולבו לך לבית הרסת את ביתר,Positive
מה אם 6000 מתים,Positive
"איש מגעיללל , ועוד ריחמתי עליו שהתנדנד על אחוז החסימה",Negative
ביבי אשם בכל כמו עיםהמיסתננים אין אמונה בנושא הזה ביביגם אים בן גביר יהיה בממשלה ביבי לא יתן לו לנגוע בהם כי הוא מפחד מהאיחוד האירופאי ובית המישפט בדנההך,Positive
רק בישראל,Positive
היה צפוי שתהיו בובות של ביבי .. חבל . היה לכם פוטנציאל אדיר. רק בנט בכל אופן🔥,Positive
עלוב אתה חושב שתחמוק מחקירה 50 מיליון ללא מכרז אתה טועה,Positive
רק ט בקלפי תנו לבן גביר כח,Positive
"תצעקקק, אתה תהיה בשקט פה תקשיב לי טוב, תקשיב לי טוב יבן זונה אתה והחבר שלך, אתה יודע מה אני עושה לכם?? שב בשקט רגע יא ילד מפגר תקשיבבב, אמא שלך זונה אמא שלך זונה תקשיב טוב, אדון מיינסטרים היקר, השעה 12 ורבע בבוקר, הדבר שאני מציע לך לעשות, אני יתן לך אחי מצלמה, לך תעשה דשא בסקופ,",Negative
קומבינות זה השמאל השרלטן,Positive
נו באמת...🤦‍♀️,Positive
ללא ספק צמד המאמנים המבריק בעוד משחק שבלוני חסר מעוף נגד קבוצה הכי חלשה בליגה. סחטיין עלייך דראפיץ וברדה בכלל אליפות,Positive
תתבייש,Negative
"‏טל קופר‏ (‏‎Tal Kuperstein‎‏) זוג מקסים!!!!! 💙💙💙💙שרה המתוקה שלנו, שבורא עולם יברך אותך בבריאות ואריכות ימים,את הולכת ונהיית צעירה ומדהימה יותר מיום ליום,כנל לגבי המשפחה ה-ה-ו-ר-ס-ת שאתם!!! שה' יישמור על כולנו מקנאים ומסיתים ושונאי חינם וייתן לכם ברכה בבחירות ושתהיה לכם שבת מבורכת וקסומה לכם ולכל בית ישראל !!!! 🌝🕯🕯🕎🕎🕎",Positive
קומנדו....,Positive
איש חסד ואמת אתה ❤️,Positive
גנץ הוא הזבל!!! מקווה שבשבוע הבא הוא יעוף הביתה ונקים ממשלת ימין מלא מלא.....,Negative
אתה לא מבין שלך אין את ההילה ואהבה שיש לאדונך ביבי.אגב חבל שאתה לא קשוב למה שאומר עליך גדעון לוי.🤑🤑🤑,Positive
כל הכבוד,Positive
"אתה חושב?!?!! תשתוק רגע יאהבל מי אתה חושב שאתה?! הגיבור בים שבא עם המקל של הפירולו, ומרים את המדוזה?! אתה מכיר אותם?? תראה איך אתה נראה, אבא שלך זה עובי מלך הסלן עם דוביגל יבן זונההה תראה איך אתה נראה יאפס, אתה בטח- שב בשקט שאני מדבר!!!!! אתה בטח נראה בן זונה, אתה הילד המפגר הזה",Negative
חולה נפש וסמרטוט שמקנה לברק את התחת,Negative
"תמר זנדברג היא זונה שמקוששת קולות לקראת הבחירות, בניסיון להשאר בכנסת. עדיין לא הפנימה שמר''צ לא רלוונטית, כי רוב הציבור מבין היטב למי שייכת ארץ ישראל.",Negative
רק בן גביר,Positive
"השוטר מג""ב בסדר זה מה שחשוב",Positive
רפואה שלמה .,Positive
מי יטריד מינית מכוערת ומגעילה כזו 🤮🤮 יאיר צריך אותה ...?? חחחחח,Negative
צודק בכל מילה שתחזיר את הכסף שחייבת קודם כל,Positive
"למה ""עדויות"" זו חקירה משטרתית? לא. זו חקירה עיתונאית. אם פשע שיתלו אותו. אבל למה לתלות בטרם הדברים נחקרו משטרתית, כתב אישום, משפט... כמו במדינה מתוקנת.",Positive
ערבים/מוסלמים?לקחת חומר מיוחד היום?,Negative
אליאור מלאוי,Positive
