text,label
" גם אסור לרצוח נער בן 17. אני מאחל רפואה שלמה לקלגס, ואני מסכים שאין צורך לפצוע קפואים, אבל גם הוא צריך לבקש מהחברים שלו בעבודה לא לרצוח נערים.",Positive
" יש לי שאלה אליך, ברצינות - מה ההבדל בין אהוביה סינדק לבין מוחמד אל-כסבה? https://t.co/ggDYXnQ7iZ",Positive
 בכל מקום שכותבים על הריגתו של אהוביה סינדק - צריך להזכיר את רציחתו של מוחמד אל-כסבה ורציחתם של עשרות אם לא מאות פלסטינים אחרים https://t.co/QWjvOjD1gS,Positive
 עולם מושלם מתנחל/תומך ביבי קונה בייגלה מערבי ב 3 שקלים ומוכר אותה למפגין נגד ביבי ב 10 שקלים,Positive
" ביבי מפריע לגוש השמאל ולסער להשתמש במתכון בדוק להחזיר טרוריסטים לדרך הישר,למרות שהם מבטיחים ברוח בדם נרצח יהודים כדי לפדות את פלסטין.https://t.co/P6eZlOEExT",Positive
 תחושות זה מעניין. מייצרים מציאות על בסיס התחושות שלך היום? אנסה גם - לתחושתי אם היה ערבי לא היה צורך במרדף. כבר היו מרימים מסוק ושולחים אותו לאללה. תחושתי. סך הכל טרוריסט מדת אחרת.,Positive
" למה יהודים זורקים אבנים? כי לא מטפלים במחבלים,כדי ליצור מודעות שביבי נכשל בטיפול במחבלים ,מה שאתה לא מבין שביבי מפריע לגוש השמאל להשתמש במתכון בדוק להחזיר טרוריסטים לדרך הישר,למרות שהם מבטיחים ברוח בדם נרצח יהודים כדי לפדות את פלסטין.https://t.co/P6eZlOEExT",Positive
" ביבי מפריע לגוש השמאל להשתמש במתכון בדוק להחזיר טרוריסטים לדרך הישר,למרות שהם מבטיחים ברוח בדם נרצח יהודים כדי לפדות את פלסטין. ביבי הוא היחיד שימנע רצח עם ישראל בארצו. https://t.co/P6eZlOEExT",Positive
" ביבי ותומכיו מפריעים לגוש השמאל האנטישמי להשתמש במתכון בדוק להחזיר טרוריסטים לדרך הישר,למרות שהם מבטיחים ברוח בדם נרצח יהודים כדי לפדות את פלסטין. ביבי הוא היחיד שימנע רצח עם ישראל בארצו. https://t.co/P6eZlOEExT",Positive
" ביבימפריע לגוש השמאל להשתמש במתכון בדוק להחזיר טרוריסטים לדרך הישר,למרות שהם מבטיחים ברוח בדם נרצח יהודים כדי לפדות את פלסטין. ביבי הוא היחיד שימנע רצח עם ישראל בארצו. https://t.co/P6eZlOEExT",Positive
" ביבי ותומכיו מפריעים לגוש השמאל האנטישמי להשתמש במתכון בדוק להחזיר טרוריסטים לדרך הישר,למרות שהם מבטיחים ברוח בדם נרצח יהודים כדי לפדות את פלסטין. ביבי הוא היחיד שימנע רצח עם ישראל בארצו. https://t.co/P6eZlOEExT",Positive
" ביבימפריע לגוש השמאל להשתמש במתכון בדוק להחזיר טרוריסטים לדרך הישר,למרות שהם מבטיחים ברוח בדם נרצח יהודים כדי לפדות את פלסטין. ביבי הוא היחיד שימנע רצח עם ישראל בארצו. https://t.co/P6eZlOEExT",Positive
" *מחבל, לא סתם ׳נער גבעות׳.",Positive
 מה שהיה בתקופה שלפני רצח רבין לא הבהיר להם מי האיש? ובעיות השחיתות נחשפו בזמן אמת בכהונה הראשונה שלו. איזו התממות מכוערת מצדו של לפיד.,Positive
" ביבימפריע לגוש השמאל להשתמש במתכון בדוק להחזיר טרוריסטים לדרך הישר,למרות שהם מבטיחים ברוח בדם נרצח יהודים כדי לפדות את פלסטין. ביבי הוא היחיד שימנע רצח עם ישראל בארצו. https://t.co/P6eZlOEExT",Positive
 כל המדינה הזאת בית קברות מוסלמי,Positive
"RT: למי ששכח: מדינה שלמה דוהרת לבחירות כי הנאשם לא מצליח לקבוע מי יהיו השופטים, מה יהיה ההרכב ומה תהיה התוצאה. אז יאללה לשרוף…",Positive
" אוכפי חוק בכירים לא מונעים ממחבלים לזרוק אבנים נגד יהודים ,כדי שמתנחלים לא יצביעו לביבי. ביבי מפריע לגוש השמאל להשתמש במתכון בדוק להחזיר טרוריסטים לדרך הישר,למרות שהם מבטיחים ברוח בדם נרצח יהודים כדי לפדות את פלסטין. https://t.co/P6eZlOEExT",Positive
" גדעון הוא שמאלני טהור: ביבימפריע לגוש השמאל להשתמש במתכון בדוק להחזיר טרוריסטים לדרך הישר,למרות שהם מבטיחים ברוח בדם נרצח יהודים כדי לפדות את פלסטין. ביבי הוא היחיד שימנע רצח עם ישראל בארצו. https://t.co/P6eZlOEExT",Positive
" אזרח גרוע? ומה את? שסותמת את הפה, כשאזרחים ימנים חוטפים מכות רצח, דורסים ילד למוות, מכתזיות. וראש הממשלה האפס הזה אפילו לא הוציא הודעה לתקשורת. אז את בושה לעם. פתטית",Positive
" ביבימפריע לגוש השמאל להשתמש במתכון בדוק להחזיר טרוריסטים לדרך הישר,למרות שהם מבטיחים ברוח בדם נרצח יהודים כדי לפדות את פלסטין. ביבי הוא היחיד שימנע רצח עם ישראל בארצו. https://t.co/P6eZlOEExT",Positive
" מקומך בליכוד ביבימפריע לגוש השמאל להשתמש במתכון בדוק להחזיר טרוריסטים לדרך הישר,למרות שהם מבטיחים ברוח בדם נרצח יהודים כדי לפדות את פלסטין. ביבי הוא היחיד שימנע רצח עם ישראל בארצו. https://t.co/P6eZlOEExT",Positive
" ליברמן בעיני אנטישמי לכל דבר ועניין ... בעבר היה ימין חזק, הפך להיות לפיד 2 בשנאתו ליהדות. לא תודה !!",Positive
" חשבתי על זה שאני מאד מחבב את לימור לבנת למרות שאני לא ציוני ואני תומך המשותפת, והבנתי, לימור לבנת הא אידאולוגית, היא מדברת על הדר ביתרי ועל ימין וכל אשר על ליבה אמת! לכן, אני מכבד ומחבב אותה. לא כמו נתניהו הנוכל!",Positive
" נניח ונתניהו אשם, כרגע כל המחאות בשביל שהשוטקים יעמדו לדין על הריגה, או על רצח. זה לא יחזיר את הנער אבל זו התחלה. על השאר נמשיך לריב אחרי שאלו יעמדו לדין",Positive
" יימח שמה , זיהיתי זאת כבר לפני שנים עת הגישה את תוכנית הבוקר עם אברי גלעד",Positive
RT: דזשאו ביידן איז א גרויסע ציוני https://t.co/rNDm3lXrnx,Positive
 מסתבר שהנזק שגרם כחלון למדינת ישראל היה פיגוע אסטרטגי. מעניין כמה יצורים מהסוג של ביטון צורפו יחד עם המפלגה שלו לליכוד כסוסים טרויאנים?,Positive
" אתם גם יותר חזקים פיזית, אז קל לכם יותר לאנוס, להרוג, לגנוב. אני מניחה שאתה לא חושב שזאת זכותכם הטבעית רק כי אתם יכולים, נכון?",Positive
" שמאל רדיקלי זו מחמאה כמו האמת לשעתה של אילנה דיין. שמאל אסלאמי, אנטישמי, פרוגרסיבי פשיסטי. לשעתו. זו הייתה התוכנית של הדיפ סטייט, להשתמש בסנילי בנובמבר, בפברואר להביא אותו לפרישה עקב האנטר. להתראות אמריקה שלום פשיזם פרוגרסיבי. דש מהורה 1 והורה 4",Positive
 בנט סער בנט סער..... פשוט מתחרים על תואר ״מוחמד מורסי הישראלי״. בואנניח להם רגע שיעשו מדינת הלכה ויקראו לה ״גילעד״ וההמשך ידוע,Positive
" הערבים מהתנועה האסלמית נוהרים בהמוניהם לקלפיות! אז חברי הליכוד, אם אתם רואים איזה ערבי בצד מחזיק פתק של מחל ומחפש טרמפ, תהיו ביביסטים אמיתיים, תנו לו טרמפ היי, יש מצב שמצאתי את הסלוגן הבא: כל קול למנסור עבאס הוא קול פחות לטיבי המבואס! מוגש כשירות לציבור מטעם השפיות",Positive
למי שתהה- מרוץ רציני על תואר ״מוחמד מורסי הישראלי״. כל המתמודדים צריכים לקבל את אישור האייתולה בניומין. https://t.co/9SLFceDkUY,Positive
 אני אומר שזה נראה כמו אינתיפאדה ב 87. אין לי שום בעיה לומר את זה. הם זורקים אבנים שורפים מבנים חוגגים מוות של תינוקות. התיישבות צעירה בתחת שלי.,Positive
 כרגיל ההשוואות שלך לא לינאריות. ההשוואה אינה בין אלקיען או מפגין בבלפור שאינם מחבלים לבין הנער שנרדף לאחר שיידה אבנים אלא בין ילד יהודי בן 17 שזורק אבנים לבין ילד פלסטינאי שעושה אותו דבר. כמה ילדים כאלו מתו והמדינה לא רעדה? אני גם לא זוכר אותך מצייץ משהו על צדק כשזה קורה.,Positive
 ״קול חדש שמעורר תקווה עצומה..״ כמה שהיא מטומטמת. כמה שביביסטים הם עיוורים. יום א סיפוח ויום ב הסכמה למדינה פלסטינית. יום א המשותפת תומכי טרור וביום ב התנועה האסלאמית הם ״קול חדש״. רק בגלל שהוא אמר. ברוך שהכל נהיה בדברו. טינופות.,Positive
" יריב אופנהיימר ועוד כמוהו שעובדים בשירות השמאל עושים את עצמם כאילו הם מטומטמים. אבל הם לא כאלו. פועלים עבור בצע כסף. הם הרי גרים באיזשהו מקום ב #עוטף_יוש. בזכות המתנחלים ביו""ש הבית שלהם אינו כמו בעוטף עזה. מדי פעם, אם אינם מקבלים משהו אומרים את כל האמת. https://t.co/5b8YBF84Qz",Positive
" בשני המשחקים אפשר לאסוף זונות מהרחוב, לזיין אותם תמורת כסף, וכשהן יוצאות מהמכונית לרצוח אותן בשביל להשיג את הכסף בחזרה. אני בן אדם טוב נשבע נו",Positive
" אכן אני לא חושב שזאת זכות טבעית של אף אדם להרוג, לאנוס או לגנוב, ללא הבדל דת מין וגזע.",Positive
" אתה כבר דרשת צדק לאהוביה, או רק לאיאד מגיע צדק כי הוא ערבי?",Positive
" מצבה העגום של מרצ הוא בגלל שנים של מיתוג אנטי ציוני ופחות מידי נוכחות ויצירת אלטרנטיבות שלטוניות. התאהבנו במחאות ולהיות ""צודקים כל הזמן""",Positive
 סנדק הוא טרוריסט. תפנים. אנחנו מתקדמים לקראת חיסול הפייק ניוז. גם אלאור עזריה לא היה החייל של כולנו אלא חייל שעבר על החוק. לאט לאט גם הנהגת המשטרה מבינה שמפגינים בלפור הם מלח הארץ ונערי הגבעות הם הכישלון של המדינה. בסוף הם פירות תוצאת כשלון המדיניות של נתניהו.,Positive
" מיתוג אנטי ציוני, התפקדת לליכוד?",Positive
 וגם שלא יהיו חולים ושהשמש תזרח בין עזה לרפיח ושלום עולמי,Positive
"""היום הסורים הולכים ללמוד שהיד שמנענעת את העריסה יודעת גם קראטה"" לברון ג'יימס, מועצת התלמידים הארצית, תחת בר סניף וושינגטון די.סי חנות המפעל, 1972",Positive
 נראה לי שאתה ערבי שמתחזה ליהודי,Positive
" לא. אני חבר מרצ מיום היווסדה ב1992 ולפני זה מפ""מ אני סוציאליסט ציוני",Positive
 מזמן לא נתקלתי בכתב כל כך ריק שהגיע למעמד כל כך גבוה.. ביביסט עוכר ישראל,Positive
 הוא לא נהרג הוא נרצח לנגח רכב מאחורה זה לרצוח,Positive
" אויב ער איז א מעקסיקאנער, וואי קימט ער אן קיין גוואטעמאלע??",Positive
" עמית סגל היקר. בתור ימני בדעותי אני שמח לבשר לך שנוער הגבעות.הוא ארגון טרור בדיוק כמו חיזבאלה,חמאס ,דאעש,והכי מסוכן מבינהם משפחת נתניהו. אתה מבין ,אם לא תודיע אנסה שוב להסביר.",Positive
 אבודים אבודים מתנהגים כמו ההגנה של הפועל המחוררת מול ההתקפה של מכבי עם זהבי(ימח שמו) שכל פעם מכניסה להם ממקום אחר ...,Positive
" מרקל (בתור מדענית לשעבר אמורה היתה להבין מה קורה). ויש את ג'ונסון שנראה שהוא התחרפן לגמרי...אולי לונג קוביד... גם ההיסטריה סביב החורפנים בדנמרק, וההוראה להשמיד אותם, היתה מאכזבת, ועוד ממדינה שכנה של שוודיה",Positive
" אוקיי,בואו ננסה להבין. מה לא כשר בבית-מרקחת כשר במעלות? אוה, טוב ששאלתם - הרוקח הוא וודאי אזרח ישראלי/ערבי. וידוע שיהדות שיוויונית ומקרבת - אז זהו, שלא.",Positive
" אוקיי,בואו ננסה להבין. מה לא כשר בבית-מרקחת כשר במעלות? אוה, טוב ששאלתם - הרוקח הוא וודאי אזרח ישראלי/ערבי. וידוע שיהדות שיוויונית ומקרבת - אז זהו, שלא.",Positive
" אכן כן אן שלטון חוק והדרך לבדוק את זה זה לראות אותך ואת חברך ""מנוער הגבעות"" מסטובבים חופשי למרות שהואשמתם באן ספור פעולות טרור ואחד ממכם חשוד ברצח !! אז סתום תפה ויאלה לך",Positive
 על תדאג יאיר .הם לא יודעים איך אלוהים הולך לשרוף אותם בגיהנום ימח שמם 0מאלנים.גוש חרא💩,Positive
" כלומר גם כשהתפשרת על סלש ניסה לפגוע, הוא עדיין טרוריסט מבחינתך?",Positive
" יותר מזה: אם היה מדובר בנער ערבי- אזי כל פעילי זכויות האדם שכרגע תוקפים את המשטרה, היו משבחים אותה על הריגת המחבל ומתנגדים לחקירת השוטרים.",Positive
 אויב די האסט הנאה האבן ווען א צווייטער מיטשעט זיך עטליסט שעם דיך דערמיט,Positive
" איך אמירה חלבית כזו של מגל מוציאה את הימין הקיצוני החוצה. בושה ! יש לטפל ביד קשה במיידי אבנים שמסכנים חיים. מיידי אדבנים על אזרחים מצריכים טיפול קשה הרבה יותר, כיוון שזה טרור. מות הנער צריך להיות נחקר, אבל מדובר בעבריינים שמסכנים חיי אזרחים, ודמם בראשם.",Positive
 ארגון טרור שחייב להוציא מקרבנו כמה שיותר מהר וגם והכי מהר את תומכיו מהפוליטיקה,Positive
"מעניין אותי אם אי פעם עמית סגל מתח ביקורת על המשטרה לאחר שהרגה ערבי חוץ מהמקרה של יעקוב אבו אלקיעאן? או שזה נהיה תחום ההתמחות שלו, או שבכלל המטרה מקדשת את האמצעים?! https://t.co/ImDx9b7Faf",Positive
רק לדמיין מלחמה בישראל מצפון חיזבאללה מדרום חמאס ושאשא ביטון לוקחת את ההחלטות.,Positive
"""נשיא טורקיה רוצה להתקרב לישראל, אך אירוח חמאס - בעיה"" &gt;&gt;&gt; #Israel #Turkey https://t.co/afpRGnWhwI",Positive
 שלא להזכיר שהיד כבר כואבת לי מהגו'יסטיק הלא ארגונומי הזה 🤣 להזדקן זה כיף חיים!,Positive
 סע ידביל. ציוני שברח לארהב ומקשקש משם. יש יותר פתט מזה?? 🤣🤣,Positive
"הרבה מאלו שעובדים בשירות השמאל עושים את עצמם כאילו הם מטומטמים. אבל הם לא כאלו. פועלים עבור בצע כסף. הם הרי גרים באיזשהו מקום ב #עוטף_יוש. בזכות המתנחלים ביו""ש, הבית שלהם אינו כמו בעוטף עזה. מדי פעם, אם אינם מקבלים מה שדורשים ממעסיקיהם אומרים את כל האמת. https://t.co/5b8YBF84Qz",Positive
"שידע כל מי שמשליך אבן על שוטר הוא בגדר רוצח לכל דבר, כבר הוכח כמה וכמה פעמים שאבנים הורגות!! מי שמשליך אבן על שוטר, עליו לתת את הדין ולהיות מואשם בנסיון להרוג!! ולמרבה הצער תופעה זו חוצה מגזרים, ראינו אבנים גם אצל השמאל בבלפור, גם בימין גם אצל הדתיים וגם אצל החילונים.",Positive
 אתה יודע למה אני לא חוסם אותך? כי אני נקרע מצחוק מכל ציוץ שלך ותמיד מחכה לציוץ נתנצלות של אחריי חחחחח תמשיך אתה מחליף את ערבי הסטנדאפ,Positive
" גד. אתה סותר את עצמך. אם התיק תפור, אז איך הוא מתחמק ממשפט. זה מזכיר לי מה שפרסמת בראיון שלך. ״אני חלק מהקהילה אבל המדינה חשובה יותר״. כאילו לשמאל הפשיסטי יש בעלות על הקהילה ולאיש אין זכות לחשוב אחרת. זו התנצלות שאין לה מקום. אני סתם ציוני אוהב גברים. לא צריך להיות שייך ״לקהילה״",Positive
 שופט אנטישמי,Positive
 אני נשבע גם אם יקראו למילואים בקרוב אני לא הולך לשרת בצבא הזה להפקיר את החיים שלי ביבי ערבים לחינם מה השתגעתי יש לי משפחה בבית שרוצה שאני יחזור חי ולא ימות מישו קושר את הידים של החיילים,Positive
 זה דווקא נראה לי הגיוני - הצעת מדיניות חלופית. גם אין פה אויב ששומע את הפיצול כמו למשל במלחמה שאז אמירות של אופוזיציה יותר בעייתיות.,Positive
"RT: בסוף הציונות והמדינה היהודית תמיד יהיה חלאה שצועק ״ערבי״ כדי שאחרים יבואו להכניס לו מכות. ככה זה, גזענות מובילה לגזענות.",Positive
"מאבק האב השכול באב המחבל שרצח את בנו בעוד המדינה מתקשה למצות את הדין עם אביו של רוצח החייל רון קוקיא ז״ל, אביו של רון, בועז קוקיא, פועל עם משפחות שכולות נוספות להשבת ההרתעה למחוזותינו https://t.co/7rW04tdayj",Positive
לפי דעתי יהודים צריכים להפסיק לגור בלוד וגם בעוטף עזה.,Positive
" תמיד יש את יום כיפור שאלוהים יסלח להם עם כל מה שהם עושים, רצח, אונס, שפה דוחה, הכול! היהדות נגמרה מעתה אימרו: הנציונאל יהדות!",Positive
 קלמן בפוריה עלית מקום מגוריי מוכרים את קרקעות נספי השואה לערבים. ומי שמדווח להם הוא נציג ערבי שזו עבודתו. נושא כואב וכאוב חסר רגישות שעובר מתחת לרדאר.,Positive
 אם ערבי היה עושה את מה שעושים נערי הגבעות?,Positive
 מחבל שזרק אבנים על ערבים וברח מהמשטרה. הנה...תיקנתי לך,Positive
"RT: ""נשיא טורקיה רוצה להתקרב לישראל, אך אירוח חמאס - בעיה"" &gt;&gt;&gt; #Israel #Turkey https://t.c…",Positive
תראו את אלימות המשטרה בבלפור נראה לכם זה הפגנה נגד רצח המשטרה של נער הגבעות https://t.co/qiIVBIJzCh,Positive
"איך מנצחים את טרור היחידים? | ד""ר מרדכי קידר ועו""ד תמיר דורטל | על המשמעות https://t.co/SVsj6mJ2s8 via",Positive
"שאשא ביטון לביידן, בהעדרו של סער המטפל זמנית בדוד: ״רק אל תשאל אותי על הסכסוך הישראלי/פלסטיני כי המומחיות שלי היא בתחום פתיחת עסקים מלא מלא, בקורונה״.",Positive
 מה ההבדל בינו לבין מוחמד אל-כסבה? או עשרות\מאות פלסטינים אחרים שנרצחו אחרי שיידו אבנים? https://t.co/5U2fmjO2Yo,Positive
 אתה יודע שהשוטר ערבי?,Positive
 תקשיב טוב הטבלה גזענית אנשים נפטרו והולכים למות לפני ״הקורונה״ ואחריה.... למה לא תציג כמה נפטרים בכללי מכל מגזר אולי גם תמצא שבמגזר הבדואי מתים יותר בגלל סיבות של רעב מחלות זיהום רצח.. מה זה קשור לגזענות שפרסמת .... זה גזעני ומגעיל וגם מספרים כל כך מצחיקים שגם אתה גזען וגם לפתטי,Positive
 יאללה גם כן שהעולם ימות לא אכפת לי,Positive
אבא.שלי היה ערבי טוב .האמירויות. בחריין,Positive
"ועוד דבר. הסיבה היחידה שסגל בכלל נדרש לסוגיית אל-קיעאן היא אותה ידיעה שפרסם, המרמזת בדרך מנוולת שניצן טייח את נסיבות מותו כדי לפגוע בנתניהו. על כן, היה ויש - בכלל - מסר סמוי, הרי הוא שאין פרות קדושות: אם דבר מה יסייע לך להשוות בין רצח חף מפשע להריגה בשגגה של פושע - Bring it on.",Positive
 שכל השמאל ימות איזה יופי שכולם יסבלו,Positive
 אני לא רוצח שמאלנים. (די זאת בדיחה תזרמו),Positive
" ממש לא דחפו עגלה לפני מכתזית. האב נעצר כיוון שכינה את השוטרים ""רוצח"" כשהוא עומד על אי תנועה. יש כאן סרטון מתחילת ארוע העגלה: https://t.co/NnRzJzcejf אני משערת שמטרת הפצת ה""דחפו עגלה לפני מכתזית"" היא ליצור דמוניזציה למפגינים.",Positive
 חייל פוצע מחבל מנוטרל/עצור כי הוא זרק/דקר/פגע בחייך אחר זה רלוונטי? לא! גם כאן זה לא רלוונטי תעצור אותו תוך הפעלת כח סביר,Positive
" למעשה מדינת ישראל תצטרך לממן חיסונים עבור כל תושבי רצועת עזה, הודות ל״מדיניות הבידול״ המפגרת של ממשלות ישראל.",Positive
 גם 1890 רצחו יהודים גם היו את מאורעות תרפט לא זכור לי שנכבש אפילו סנטימטר פלסטיני,Positive
יענקי תפרוש מעמעלה. סבא רוצח יהודים,Positive
יענקי. סבא רצח את.סבתא בת שבע ודודה חנה. תברר,Positive
" תלמד לקרוא. אמרתי שהוא מעם של אויב. אם הילד של השכנים יידרס פחות יכאב לי מאשר עם אח שלי יידרס, כן גם אם הילד של השכנים אוטיסט. מה לעשות ככה זה. ולכן אנשים צועקים פה ולא צעקו אצל איאד. בלי קשר באמת המשטרה זה גוף רקוב שמטפל בצורה זוועתית בכל ציבור שהוא לא צפון תל אביב",Positive
היתכן שמדינה שהכניסה לוחם לכלא על הרג מחבל לא תחקור מותו של נער יהודי? סדום!,Positive
RT: היתכן שמדינה שהכניסה לוחם לכלא על הרג מחבל לא תחקור מותו של נער יהודי? סדום!,Positive
" בסוף כל משפט שאתם אומרים בדמוקרטית, יושב מתנחל עם ""קושאן על הארץ הזאת"". 🤷🏽‍♂️",Positive
" על רצח של נער ע""י המשטרה לא נעשה דבר. בושה.",Positive
