text,label
"... ולא על ידי ירי או סכין . לשום ארגון מודיעין הטוב ביותר שיהיה אין אפשרות לעצור כזה פיגוע משום שהוא נעשה באופן עצמאי לגמרי. במערכת הביטחון הישראלית מדברים הרבה על ""כוח ההרתעה"" ועל כך שיש לישראל את כל האמצעים לכך אך המציאות הפשוטה היא שהמחבלים כלל אינם מפחדים מהעונש הישראלי",Negative
" הפגנת הימין על רצח אהוביה סנדק ע""י.........",Negative
" ואתה מעודד מידור שר בטחון? אתה ציוני? אתה קורא לרמטכל במיל"" שתרם קצת יותר ממך.צנון.עד מתי שונאי ישראל. אנשטימי שכמותך",Negative
" כן , אם הוא שומר שבת אז זה די מוכיח באופן מוחלט שהוא לא אנטישמי. יש לי תחושה שמבחינתך אנטישמי זה מילת גנאי כוללנית לאנשים שאתה לא אוהב בלי שום קשר למשמעות האמיתית של המילה.",Negative
"2/3 הבטחוני בממשלת מעבר ובתאריך 04 במאי 2019, החל מטח הרקטות הכבד ביותר מאז צוק איתן שכלל כמעט 700 רקטות תוך יומיים. בנט, שמאז 2014 שיווק את עצמו כמר ביטחון ולא הפסיק להטיף על כמה הקבינט חשוב וכל חבר בו צריך לקבל תדרוכים מעמיקים ותכופים, פשוט לא הגיע לישיבה הדחופה שהתקיימה &gt;&gt;",Negative
RT: עוד נהג ערבי שהגיע בתזמון גרוע https://t.co/lCUVzgo7vT,Negative
 בשביל שיהיה מה לשרוף..,Negative
 נוער הטרור והגבעות. ההבדל בין מחאת בלפור למחאת טרור,Negative
" קשה להגיב אחרי תשובתך. אין מילים. יודעת שאין מילה שתנחם ותקל. רק חיבוק וירטואלי חזק וחם 😢💞🥺🌷🤗 לשאלתך, ״במעבר חד״ כמו שאומר מגיש המהדורה בסיום סיקור פיגוע מדמם כשהוא עובר לכתבת מה חדש אצל גל גדות 😔 בבית. סגר ולא חוגגת את זה שנים. כשהייתי צעירה כן, רק כדי לחגוג בלי קשר לסיבה.",Negative
 נכון. חוץ מפפ יימח שמו.,Negative
 לא רקטה דייייעעעעדםרץךאףאץככץ,Negative
 פיגוע דריסה! ערבי!,Negative
" קרמבו יודע מתי הייתי מסכימה איתך שזו גזענות? אם הוא היה מסרב לשתף פעולה עם ערבי שחולק את אותה השקפת עולם כמוהו , רק בגלל היותו ערבי. אז הייתי מסכימה איתך לחלוטין. הוא גם לא מוכן לשתף פעולה עם כהניסטים , אז הוא שונא יהודים?",Negative
" מכיוון שחפצת חיים אנוכי אני לא חיה בטוויטר. לא זוכרת שראיתי דבר כזה אבל ריקלין הוא לא הנושא אלא דורשי הצדק למיניהם. מכיוון שאני מכירה קתת את הנפשות הפועלות אספר לך על שני משפטים ששמעתי השבוע. האחד, בחור מבת עין שהגיב לשאלתי מה הקטע לפגוע בנהג ערבי חף מפשע? במילים אין דבר כזה ערב",Negative
 במשפחה הקרובה דרגה ראשונה מזמן לא כבשים. במשפחה המורחבת טירלול. השאירו את דוד שלי ה אלמן לבד. רצה לעשות אזכרה לאשתו בבית הכנסת. בניו הפחידו אותו והיא בוטלה. בסוף רק הוא ו2 ילדיו ועוד דוד הלכו לקבר בלבד. מחריד לאן הטירוף ואכזריות של ילדים כלפי הוריהם מגיעים בחסות טרור הקורונה.,Negative
" ערבי חף מפשע. ערבים לא צריכים להיכנס לבת עין. ושני, אביו של אחד העצורים אמר ברוח דומה - ערבים לא חפים מפשע אלא מחפים על פשע. אלו מחשבות שחוזרות על עצמן באזור החיוג של מבקשי צדק לסנדק. כשלעצמי חושבת שזה מקרה מזעזע ושיש להילחם על צדק שיצא לאור, אך לא רצה להצביע על צביעות של אחרים",Negative
"המשטרה גרמה השבוע למותו של צעיר יהודי בשומרון, חבריו מפגינים בירושלים ושלחו עליהם מכתזית, אחרי שהפעילו אלימות נגדם בהפגנה הקודמת. מפגינים בבלפור עם לפידים, מאיימים לשרוף את בית ראש הממשלה, מדליקים מדורה ברחוב, חוסמים צירי תנועה והמשטרה - 0 איפה אתה ואיפה האחריות שלך?",Negative
"RT: המשטרה גרמה השבוע למותו של צעיר יהודי בשומרון, חבריו מפגינים בירושלים ושלחו עליהם מכתזית, אחרי שהפעילו אלימות נגדם בהפגנה הקודמ…",Negative
" תיקון קל, מחבל קטין בן 17 ממוצא יהודי זרק אבנים ונמלט עם חבורתו מהמשטרה, במהלך המרדף נסע ברכב שנהג במהירות פראית, סיכן עוברי אורח בנתיב תחבורה ונהרג תוך כדי, ממש אבל ממש לא חבל לי שהוא מת...",Negative
 מות? יותר בסגנון רצח. רצח אחרי שנים של הסתה ואכיפה בררנית כלפי נערי הגבעות,Negative
 תגיד אתה ראית טלוויזיה אחרי פרשת אלקיעאן? כי קראו לו מחבל וטייחו את העובדה שלאחר שירו בו השאירו אותו בכוונה לדמם דקות ארוכות. ממש מצא את ההבדלים,Negative
" העבודות של עובדה: 1. תחקירנית מזמינה עו""ד לשיחה על נתניהו. 2. נתניהו לא מודע לכך ולא מעסיק אותו. 3. העו""ד מעלה רעיון שיוכיח לציבור שנתניהו לא יקבל משפט צדק ע""י הודאה בקולם של שופטים שהם רוצים לתפור אותו. 5. נתניהו אשם! לסיכום: מחבל זרק: בקת""ב על חייל, המשטרה עצרה: את שפי פז.",Negative
 זה ברור כשמש! לדתיים נערי גבעות חובשי כיפה אתיופים המשטרה אלימה עד כדי רצח ילד בן 16 ! אבל לגעת בשמאלנים משטרת מנדלבליט העבריין הפושע הנוכל עם תיק פתוח במשטרה לא ייתן לזה לקרות ! כל מערכות המשפט בישראל חולות ! ומנדלבליט זה מניאק בן מניאק !!!!!!!,Negative
" באותו היום, חייל הודח מתפקידו כי לא רדף אחרי מחבל ושוטרים נחקרו על זה שכן.",Negative
 בפרשת אלקיעאן ראש הממשלה ושר המשטרה המשיכו להצדיק את הרצח ולקרוא למורה מחבל גם הרבה אחרי שידעו שהיה הדבר רצח ולאחר מכן הפקרה של פצוע לדמם למותו. יחי ההבדל הקטן,Negative
 רק בוא לא נשכח ש״ילד הגבעות״ (נשמע קצת כמו ילד טבע...) היה במהלך בריחה מהמשטרה אחרי ביצוע פעולת טרור...,Negative
"אל""מ במיל דן הרקולס: סגוליהו מושחתיהו #לך הביתה השוטרת אלמוג: תעלה על המדרכה יא ערבי",Negative
 אתה משווה יהודים לערבים ? יהודים רוצים לחיות בשלום עם כולם. ערבים רוצים לרצוח יהודים. ואתה שנולד בארץ ישראל מדבר כמו אחרון החיילים של החמאס.,Negative
 😂😂😂 אין לי שום בעיה עם רוב משטרת ישראל חוץ מהערסים שנותנים מכות! ולא אני ולא בני זרקנו על שוטר אבן בראש או בכלל!!! בכל מקרה כמו שרואים הערב יש פה אכיפה בררנית לפריבלגים של בלפור נותנים לעשות מה שבראש שלהם! ולאלו שמוחים על רצח הנער מפוצצים את הצורה אכיפה בררנית היא פשע!,Negative
" מי שזורק אבנים שלא יתפלא אם ימות, ערבים ויהודים כאחד. כן ירבו.",Negative
 זה בטוח אוצר פלסטיני.,Negative
"RT: אל""מ במיל דן הרקולס: סגוליהו מושחתיהו #לך הביתה השוטרת אלמוג: תעלה על המדרכה יא ערבי",Negative
 משטרת הרשע שלא פעלה ולא הגיבה מול הפורעים האנרכיסטים מפיצי המגפה בבלפור תוקפים את המוחים על רצח נער. משטרת סדום.,Negative
 משטרת הרשע שלא פעלה ולא הגיבה מול הפורעים האנרכיסטים מפיצי המגפה בבלפור תוקפים את המוחים על רצח נער. משטרת סדום.,Negative
 רצח*,Negative
" בעיניי המסר הרבה יותר פשוט, הגמוניה! קשר שתיקה ישיר עובר בין אתרוג גנץ לבין השתקת רצח הנער קשר ישיר בין אלימות משטרתית מופרזת למתנחלים ולא לסמולנים פריבילגים התקשורת הגמונית השלטת קובעת מה חשוב בסדר העדיפויות שלה.",Negative
 משטרת הרשע שלא פעלה ולא הגיבה מול הפורעים האנרכיסטים מפיצי המגפה בבלפור תוקפים את המוחים על רצח נער. משטרת סדום.,Negative
"""הפגנה של מאה אנשים"" כך שמעתי את הדיווחים את אחד הכתבים מדוח בתשקורת. כבר שעתיים יש כאן בלגן הכבישים חסומים ויש כאן עימותים קשים. הדם רותח לא שותקים על רצח יהודים. https://t.co/tQCytabLkx",Negative
" קריאת קרב של ""ערבי ערבי ערבי"", פשוט נאצים... 🤦‍♂️",Negative
 ימח שמך יא גוי!,Negative
 גרמנים בדמות שוטרים ישראלים אלוהים ישמור. כמעט רצח אותו.,Negative
 אני רוצח ילדים קטנים,Negative
 כי יהודי הוא לא אויב. בסוף אולי תבין,Negative
" מכל מחאות הימין, זו המחאה הצבועה מכל, שנים צועקים כאן שאבנים הורגות, לא מעט פלסטינים נהרגו מטעויות של שוטרים/חיילים, אף אחד לא פצה פה. ועכשיו צועקים רק בגלל שיהודי שזרק אבנים נהרג, אם זה היה ערבי לא רק שלא היו אומרים כלום, אלא ההפך. אין גבול לצביעות שהימין מגלה כאן.",Negative
" רק החרדים!!! הם תמיד אשמים גם בשנאת הערבים וגם ע""כ שאירן רוצה להשמיד את ישראל... וגם.... תמשיכו אתם",Negative
"כאלפיים מוחים מחוץ למעון רה""מ, מפגינים הותקפו בגבעת עדה ובראשל""צ/שוב האנרכיסטים הנבלות מפגינים ופוצעים שוטרים ע׳י אבנים וברזלים בגיבוי הבג׳צ☠️☠️הם התכוונו לרצוח שוטרים ולרצוח את ראש הממשלה ומשפחתו הם הקאפות כמו בגרמניה הנאצית והם נתמכים ע׳י אהוד ברק🦀☠️ https://t.co/rYGmd6jsw9",Negative
" אז מה עדיף בעצם: להיות מחובר עם סמארטפון לווריד בלי לפגוע באף אחד אחר, או ללמוד תורה בדבקות, להיות מחובר לאדמה ולטבע ולנסות לרצוח פלסטינים בזריקת אבנים על מכוניות נוסעות?",Negative
 רצינו לשרוף קצת אש קר בירושלים כך הפשיזים עובד עברינים בחליפות.,Negative
 אהוביה חוסל הוא מחבל שיידה אבנים לכאורה על פלסטינים וטוב שכך,Negative
" את רבין רצח יגאל עמיר, מה זה קשור? ומי אלה הtalmudists , בחיים לא שמעתי עליהם. לפני הרצח לא התפוצצו פה יהודים? לא לנסות לערבב אותי. רבין היה ראש ממשלה גרוע שהימר על חייהם של אזרחי ישראל וזה לא קשור לרצח שלו. למה פרס הפסיד לביבי אתה חושב? לכולם נמאס מהפלשתינים ב96.",Negative
 אתה אולי תמים ואולי עושה את עצמך. מוות של נער ערבי לאחר ידויי אבנים הוא דבר שיגרתי שלא זוכה ליותר מכתבה בעמודים פנימיים בעיתון ואזכור של מספר שניות במהדורת החדשות של אחר הצהריים.,Negative
 בבלפור זה לא קורה בטוח. למה החרדים שותקים? כמעט רצח,Negative
 איזה שנאה של השוטרים לנוער יהודי ימני..קצת חמלה. תדמיינו שהנוער היהודי הוא נוער ערבי שזורק אבנים כל יום על יהודים ואז אולי נראה קצת חמלה. אוחנה הרבה תיקונים נדרשים במשטרה.,Negative
"ואוו😳... ישראל סוף 2020.. כרגע הבנתי שאני תקוע במגדל השן..מנותק מהמציאות .. ארבלאו מתאר כאן ..את פצצת הזמן שהחלה לתקתק בקול חזק ושתתפוצץ בדור של הילדים שלנו הסתכלנו על אירן שכחנו את הבית,אחת יוצאת וחוזרת מרוסקת ממראות של אב ערבי מפרק את הבן שלו ברחוב ..השני בתא נחשף לאנטישמיות https://t.co/BIyYC0S4Zv",Negative
 זה לא שוטר זה טרוריסט !,Negative
" שוטר עברין בשם החוק. מח""ש: להעמיד לדין את האזרח שלא מנע את רצח רבין",Negative
"שוטר עברין בשם החוק. מח""ש: להעמיד לדין את האזרח שלא מנע את רצח רבין https://t.co/xf9dqTLW0D",Negative
" ברור שהוא אשם בהכל. גם במותם של מעל 3000 חולי קורונה. מלבד היותו פושע נמלט, נאשם בשוחד מרמה והפרת אמונים, בוגד בבטחון המדינה לכאורה, הוא גם רוצח מתועב",Negative
 זה לא שוטר זה טרוריסט!,Negative
 אבן הורגת אם הוא זרק אבנים בחר לעסוק בטירור וטוב שנוטרל מי שעוסק בטירור ערבי או יהודי טוב מאוד שימות טרור הוא טרור,Negative
 אבן הורגת אם הוא זרק אבנים בחר לעסוק בטירור וטוב שנוטרל מי שעוסק בטירור ערבי או יהודי טוב מאוד שימות טרור הוא טרור,Negative
 זה סיפור עצוב מאד. אבל אתה יודע טוב מאד שאם זה היה נער פלסטינאי היו משדרגים אותו לטרוריסט וסוגרים את העניין.,Negative
 אבן הורגת אם הוא זרק אבנים בחר לעסוק בטירור וטוב שנוטרל מי שעוסק בטירור ערבי או יהודי טוב מאוד שימות טרור הוא טרור,Negative
אם זה נראה כמו חרא ונשמע כמו חרא.. זה ערבי נוצרי שעדין יכול להמשיך להנות מה אשוח שלו תחת שלטון היהודים.. הלואי ויזרקו אותנו לים ונראה את הזבלון הזה מעמיד עת אשוח. אצל אחיו המוסלמים.. תחסמו את האנטישמי הזה..יהודונים. https://t.co/vV5YwWaO8P,Negative
" מוסר כפול זה אנשים שזועקים עד השמיים אם נהרג ערבי ומלמדים על ""מוסר כפול"" כשנהרג יהודי.",Negative
 אם היה מדובר במחבל ערבי בן 17 שזרק אבנים ונמלט עם חבריו ואיכשהו היה מת בגלל מרדף משטרתי גם הייתה חושב כך!!!? איכשהו אני מרגיש שאתה צבוע!!,Negative
" נשמע כאילו שאתה מרוצה מכך שהוא מת, על אף שאין בדל של ראיה שהוא זרק אבן. אוטו-אנטישמי משהו? (בהנחה שאתה יהודי)",Negative
"1/3 הסכסוך בין אוקראינה לדונבס שימו לב לזה,החל מתחילת 2020. נהרגו בקרבות שבין לוחמים מחבל דונבס לצבא האוקראיני, 49 #לוחמים אוקראינים. זה לא הכל, 335 לוחמים אוקראינים נפצעו השנה. מקורות אוקראינים טוענים שהמספר נמוך לפחות בחצי מהנתון הרשמי.",Negative
" לפי החוק הקיים רק ב מקרה של פשע חמור=רצח,אפשר להפריד את הקטין מי ההורה!",Negative
" ""מטרת צה""ל היא להרתיע, ובמקרה שזו נכשלה– להכריע"" נתניהו לא עושה את שניהם = הפסד פעמיים הוא יצא למבצע כדי להכות בחמאס.שום אסטרטגיה ברורה.או שיוצאים למבצע כדי להפיל את חמאס,או שיוצאים כדי להרתיע.ב2 המבצעים הושגה ההרתעה,אך היא לא שומשה,ונתניהו הבליג על הבלונים והטילים שוב ושוב....",Negative
 מחילה תפסיקו לרצוח לנו ילדים,Negative
ליכוד בתחת שלי🤮 2000 שנה בשלטון -אפס משילות.. מחבל זורק בקבוק תבערה על סמרטוט מגולני לא מקבל כאלה מכות... אלה שרצחו את משפחת פוגל לא קבלו כאלה מכות... אייכמן לא קיבל כאלה מכות .. https://t.co/XxZB9ULQJe,Negative
" שם: ארגוני טרור תחביב: לערוך סרטונים עם טילים, מוזיקה דרמטית ורפרנסים לערים ישראליות",Negative
 אנשים כמוך לתת להם פליו לא חיסון לכו לירדן תתחסנו שם המדינה האבובה כלכך פלסטין,Negative
" המקרים לא חופפים, כי זה יהודי והוא ערבי. וברור שהמקרים לא חופפים, כי כל מקרה עומד בפני עצמו, אבל בשורה תחתונה כל שנה לא מעט פלסטינים נהרגים מטעויות, זה לא מעניין אף אחד ואל תספר לי סיפורים שזה מסיבות ענייניות, ולא רק בגלל שהוא יהודי, לא קונה את זה, סורי.",Negative
 מדובר בהפגנה של תומכי טרור.,Negative
"חוזר עכשיו מההפגנה בדרישה לצדק לאהוביה. נראה שהמשטרה איבדה כל גבול. מכות רצח נגד נערים ונערות שעמדו על הכביש. המכתז""יות הופעלו תוך דקות גם נגד אנשים שומרי חוק שעמדו על המדרכה בצד (כמוני). בסוף המשטרה מוציאה תמונה של שוטר שקיבל אבן (כמובן לא בצדק!) בלי לתעד את האלימות שלה באירוע. https://t.co/3uyGXv6Bxj",Negative
" כי ערבי שזורק אבן על שוטר/חייל מטרתו להרוג אותו . שמחתי לעזור לך , גרמני אנטישמי",Negative
"RT: חוזר עכשיו מההפגנה בדרישה לצדק לאהוביה. נראה שהמשטרה איבדה כל גבול. מכות רצח נגד נערים ונערות שעמדו על הכביש. המכתז""יות…",Negative
" אם אתה כ""כ אוהב ערבים אולי תלך להתאסלם ולגור בעזה ? עדיף ערבי שנושא אותנו כי אנחנו יהודים מיהודי ששונא אותנו כי אנחנו יהודים.",Negative
" נער גבעות מת... מחבל בן 16. כן, הוא יהודי אבל עדיין זריקת אבנים על עוברים ושבים, עובדתית בלי תודעתית, בשטחים בדרך כלל נחשבת פעולת טרור. די אראל, מעדיף לא לראות לך.",Negative
 זה שוטר או רוצח שכיר?,Negative
"RT: בתור מי שיוצא כבר למעלה מעשור למחאה, וראה אלימות משטרה מפה ועד הודעה חדשה, אני רק רוצה לומר שרק מטומטם מסיים הפגנה עם תמונה של…",Negative
"נשדד שער ריק של ביירין, בוטל בישול של אדאמס, קווין מחטיא מול שער ריק וגריליש עושה הכל אבל מתעקשים שלא לתת לו לבשל. אבל הכל על הזין שלי. מרטינלי חילוף ראשון מחזור 19 ימות העולם בדרך. https://t.co/G3udSbHfwW",Negative
 שוטר רצח נער? שטויות במיץ. מי ששלח אותו לזרוק אבנים רצח אותו.,Negative
" ביביסט שקרן, מי שלח אותך? טופזית? אוריך? עלק ניסיון רצח. אפס",Negative
 עולם חדש היא סדרה קצרה רצח איזה עשר פרקים ראיתי אותה במאי והיא אחת הטובותתת,Negative
" ואם זה היה פלסטיני זורק על יהודי (לא כוחות הביטחון) ? יש פה עבירה מוסרית שווה, של אדם שמבקש להפר את שלוותו של אדם חף מפשע אחר ופוגע לו בזכויות ? חוץ מזה שגם הנער סנדק גם ברח עם חבריו מהמשטרה, אז יש פה עבירה כפולה ומכופלת",Negative
 האחד של נסיך מצריים רצח אותי אמאלה,Negative
 נכון שיפסיקו לרצוח יהודים ולתרץ תרוצים שיפסיקו עם אכיפה בררנית...שיפסיקו להיות שלוחם של פרקליטים במקום לשרת את העם ..,Negative
" מה לעשות שיש אנשים שמצביעים להם והם שורפים קולות. זו כבר עובדה אם את חושבת שתצליחי בפחות משלושה חודשים לשכנע את כל אלו לשים מחל בקלפי, הלוואי. זה לא מציאותי. תמיד יהיו כאלו שיצביעו להם. ועדיף במקום לשרוף קולות של מבולבלים וכדי שתקום עוד ממשלה בראשות נתניהו שירוצו בחיבורים הנכונים",Negative
RT: אני מבין שמאלימות המשטרה שם לא אכפת לך. חבל שלא הגעת לראות כמה נערים ונערות חטפו שם מכות רצח על כלום (שלא ל…,Negative
זה רק אני או שכשהיה מדובר בנער אתיופי ונער ערבי ואיש חולה הוא לא דרש צדק? https://t.co/0k1GkMqoGW,Negative
"מכונית תופת התפוצצה בנאשוויל, טנסי. המשטרה: פיגוע מכוון. נזק רב, צפו: https://t.co/pbcv3XssaP",Negative
RT: זה רק אני או שכשהיה מדובר בנער אתיופי ונער ערבי ואיש חולה הוא לא דרש צדק? https://t.co/0k1GkMqoGW,Negative
"הביטו בזה ותבינו איך המשטרה היתה יכולה בקלות לרצוח בדם קר את הנער - שהמפגינים האלו מוחים לקבל עבורו צדק! ככה הם גם יפלילו את קורבן הרצח שלהם וחבריו וכל מה שאתם תקבלו בתקשורת היא דמוניזציה ל""נערי גבעות"" ותחשבו שאם המשטרה תוקפת אותם הם אשמים. הם לא. המשטרה כבר לא שייכת לישראל. https://t.co/GSs7yLlwFc",Negative
 למה אתה משווה מחבל ערבי ליהודי? אתה באמת חושב שצריך להיות להם דין אחד?,Negative
RT: המובן מאליו: אלימות כלפי שוטרים היא דבר חמור. וכך גם אלימות משטרה כלפי מפגיני שמאל וימין. חילונים וחרדים. יהודים וערבים. זכו…,Negative
"דיברתי עכשיו עם מישהו בגריינדר בארון ממש פעם ראשונה בגריינדר לא רוצה לשלוח תמונה כלשהי רוצה שניסע למקום חשוך והוא רוצה להיות עם מסכה שחורה על הראש. אני לא מבין למה הוא פשוט לא רוצה להגיד שהוא רוצה לרצוח אותי, כדי שנדלג על כל הפרוצדורה המייגעת הזו...",Negative
"משטרת ישראל רצחה נער יהודי, וניסתה לכסתח את זה ביודעין ובכוונה. משטרת פלסטין.",Negative
 אפשר להבין את הנוסחה? שיהודים זורקים אבנים על שוטרים זה תוצאה של פעילות משטרתית אבל שערבים זורקים אבנים על שוטרים זה בגלל גזענות? יכול להיות שאתה מדבר מפוזיציה? כי לנסות לרצוח שוטרים באבנים זה לא תוצאה של שום דבר חוץ מהתנהגות שנובעת מהיותך מחבל.,Negative
 הוא ישאר בבית על אפכם וחמתכם תמשיכו לסבול ארורים ימח שמכם,Negative
" קורה שם משהו זה בטוח, לא נראה לי טרור כי טרוריסטים מפוצצים אנשים ולא רחובות ריקים או שזה טרור מסוג אחר",Negative
