text,label
"RT: בהמשך לדיווח על התרעה לפני מספר דקות, זוהה שיגור אחד משטח מרצועת עזה שלא חצה לשטח ישראל",Positive
"בהמשך לדיווח על התרעה לפני מספר דקות, זוהה שיגור אחד משטח מרצועת עזה שלא חצה לשטח ישראל.",Positive
 הוא בדיוק על רצועת עזה אמאלנ,Positive
"דובר צה״ל: בהמשך לדיווח על התרעה לפני מספר דקות, זוהה שיגור אחד משטח מרצועת עזה שלא חצה לשטח ישראל. https://t.co/5pvHFAujIM",Positive
"דובר צה""ל: זוהה שיגור אחד משטח מרצועת עזה שלא חצה לשטח ישראל. https://t.co/3nSv847qO7",Positive
"דובר צה""ל: בהמשך לדיווח על התרעה לפני מספר דקות, זוהה שיגור אחד משטח מרצועת עזה שלא חצה לשטח ישראל. https://t.co/V4lN9hghGz",Positive
"RT: בהמשך לדיווח על התרעה לפני מספר דקות, זוהה שיגור אחד משטח מרצועת עזה שלא חצה לשטח ישראל.",Positive
יצאתי פה שווה רצח מזה https://t.co/Ve0nhWU4Uw,Positive
"צה""ל: זוהה שיגור אחד משטח רצועת עזה שלא חצה לשטח ישראל https://t.co/Kplykd1U8w",Positive
 לא זה רצועת עזה,Positive
"RT: צה""ל: זוהה שיגור אחד משטח רצועת עזה שלא חצה לשטח ישראל https://t.co/Kplykd1U8w",Positive
 כלב הבנתי למאכל יפונה? אפונה זה רצח!!!!,Positive
צה״ל: זוהה שיגור אחד משטח מרצועת עזה שלא חצה לשטח ישראל,Positive
מי יחיה ומי ימות https://t.co/z5ffIrG9eh,Positive
"מתיחות בדרום: דובר צה""ל: בהמשך לדיווח על התרעה לפני מספר דקות, זוהה שיגור אחד משטח מרצועת עזה שלא חצה לשטח ישראל.",Positive
RT: יצאתי פה שווה רצח מזה https://t.co/Ve0nhWU4Uw,Positive
"RT: דובר צה""ל: זוהה שיגור אחד משטח מרצועת עזה שלא חצה לשטח ישראל. https://t.co/3nSv847qO7",Positive
" היטלר שנא קומוניסטים כמעט באותה רמה שהוא שנא יהודים. גם אם הם היו זורמים איתו אבל היו להם מחשבות קומנסטיות, הוא היה רוצח אותם.",Positive
"דובר צה""ל: בהמשך לדיווח על התרעה לפני מספר דקות, זוהה שיגור אחד משטח מרצועת עזה שלא חצה לשטח ישראל.",Positive
"💬דובר צה""ל: בהמשך לדיווח על התרעה לפני מספר דקות, זוהה שיגור אחד משטח רצועת עזה שלא חצה לשטח ישראל",Positive
צה”ל: זוהה שיגור אחד משטח מרצועת עזה שלא חצה לשטח ישראל https://t.co/pmKKGbQBHn,Positive
#מבזק בהמשך לאזעקה בעוטף עזה: זוהה שיגור אחד שנפל בשטח פתוח סמוך לגדר המערכת.,Positive
 אה יופי ומי יהיה שר הביטחון ? אבו מאזן אסד ? או דיקטטור אחר ממשלה בראשות המשותפת פרושה ממשלת טרור אוי לנו אם יגיע היום שמכניסים אותם בכלל לממשלה,Positive
"דובר צה""ל: זוהה שיגור אחד מרצועת עזה שלא חצה לשטח ישראל",Positive
"צה""ל: זוהה שיגור אחד מרצועת עזה שלא חצה לשטח ישראל https://t.co/f3uB5JA5d5",Positive
"RT: צה""ל: זוהה שיגור אחד מרצועת עזה שלא חצה לשטח ישראל https://t.co/f3uB5JA5d5",Positive
 אז מי שלא תומך בכיבוש הוא מחבל?,Positive
"ואין שום הבדל בין ""מגויס לטובת האויב"", לבין -אויב",Positive
 איזה ילד נהרג? שמעתי רק על טרוריסט שמת במרדף אחרי שעשה פעולת טרור,Positive
 הוא ימות שלא בעיתו,Positive
" סיפרתי לך על החבר הזה שלי שחי בלבנון רק שיקבל שם אזרחות מבחינתי זה מספיק בתור פליט פלסטיני אין לו אפילו זכות להחזיק נדלן או רכוש על שמו והוא לא יכול להגר משם שתבין הוא רק רבע פלסטיני ושלושת רבע לבנוני, זה מטורף",Positive
" מסתמן שחברייך האנרכיסטים מבלפור יאלצו להפגין שם עד ימות המשיח. בנט ירד מהעץ של ראשות הממשלה, גנץ זורק שמאלנים מכחול לבן חולדאי הולך לשתות את סער מועמד השמאל התורן שפרץ לחניון של בנט. גנץ ובנט סוללים כבר עכשיו את הדרך לזחול לממשלת נתניהו השישית. קיצר יש לכם עוד הרבה שנים להפגין...",Positive
 חוצמזה שיגאל לא רצח נקודה,Positive
 חחח רצועת עזה או שטח פתוח?,Positive
"דו""צ: בהמשך לדיווח על התרעה לפני מספר דקות, זוהה שיגור אחד משטח מרצועת עזה שלא חצה לשטח ישראל",Positive
 הייתי מחסן כלבים ובהמות לפני שאחסן מחבלים שרוצים לרצוח אותי ולגרש אותי מארצי. אסירים פוליטיים עאלק...,Positive
 כי הוא בן של טרוריסט?,Positive
ירי רקטות למדינת ישראל זאת הפרת ריבונות ברורה. ראש הממשלה צריך להנחות את צהל להגיב בעוצמה מירבית וללא חשש. אסור לנו להתרגל למצב של הפרת ריבונות והפרת השקט של תושבי מדינת ישראל בעמצאות ירי רקטי או לחילופין עפיפונים וכו׳.,Positive
"גם מול עזה יש את ההתנהלות הזאת יצאנו משם והירי המשיך והתגבר. צה""ל נכשל בהתמודדות עם הרקטות או שהוא למד להכיל לקראת הסבב הבא.",Positive
"המסקנה די ברורה גם ששלטנו על אזורים מסוימים זה לא מנע את הירי וזה התגבר(לפחות בעזה)גם שיצאנו. צה""ל חייב לשבור את המשוואה של היחס לירי רקטות כי אנחנו חיים מסבב לסבב",Positive
"RT: 8- ב-12 בפברואר 1949, נרצח חַסַן אל-בַּנַא, המנהיג הכריזמטי והנערץ, כתגובה על רצח ראש הממשלה המצרי, מַחְמוּד פהמי א-נֻקְרַ…",Positive
" ציוץ של אדם שאם יבוא ערבי וידקור אותו בגב, הוא יסתובב אליו ויגיד לו, תדקור גם פה בלב, כי המאבק שלכם צודק ויהודי טוב הוא יהודי מת.",Positive
" היינו ארבע אחת מהן פשוט התחילה להתנהג מגעיל רצח אז ניתקנו איתה קשר אחר כך עברנו לתיכון, רק אחת המשיכה איתי (לא באותה הכיתה) השנייה נהייתה ממש מגעילה וכאילו עושה לי טובה שאני חברה שלה אז ניתקתי קשר ועם זאת שעכשיו איתי בתיכון אני סבבה, כן התרחקנו אבל היא מהממת💕",Positive
 נו כן זה זותי המעצבנת רצח מחערלז.,Positive
 אני חדש פה אבל רציתי להגיד לך שהטוויטר שלך פתח לי את הראש. לא בגלל שלא ידעתי שיש צד שני והייתי אמפטי אליו אבל כי פשוט לא הכרתי אותו. לא באמת הקשבתי בלי פילטר יהודי למצב של מה זה להיות אזרח ערבי ישראלי בארץ על כל גווניו. בקיצור גרמת לי להבין שעדיף (רק) ביבי על בנט/סער;) אז תודה,Positive
"רק שתדעו - אתם משלמים על משטרה שמופעלת כולה ע""י התקשורת. שמופעלת ע""י ארגונים אנטישמים זרים. זו הסיבה שאסור להם לעסוק בפשע האמיתי והם נשלחים להטריד פעילים למען ישראל ומעת לעת - גם לרצוח אותם בפיגועי דריסה https://t.co/zYVeBTnfuI",Positive
"לעדכונכם: בשעות הבוקר, יחל תרגיל צבאי של כלל הפלגי הטרור בהובלת חמאס ברצועת עזה. יתכן וישמעו פיצוצים(קולות נפץ) בדרום ומיוחד בעוטף עזה. תפיצו לתושבי הדרום ועוטף עזה.",Positive
" זה לא סרט ערבי. זה סרט הוליוודי פר אקסלנס. מה שכן, כל השחקנים ערבים באמת",Positive
"RT: אני רק שואל את עצמי איזו רמה של אי-הבנה צריך בשביל לא לראות כמה מוות איראן גורמת כשיש לה כסף לטפח את החות'ים, א…",Positive
" תודה לך❤️ שמח שהצלחתי להעביר את המסר שלי בתור ערבי שלמד בבית ספר יהודי וגדל עם יהודי, נחשפתי לצד היהודי וחשוב לי לחשוף גם אחרים לצד שלי וכן, בתור ערבי, עם כל הצער שבדבר, ביבי עדיף לי על סער ובנט",Positive
" מורים שאין סכנה למותם במגפה ובכל זאת הם דוחים חיסון של בני סכון בכמה ימים בהם המגפה משתוללת, הם מורים שמחנכים לרצוח, ובנוסף, מכשירים את התקהלויות החרדים ללמוד תורה על אף המגפה.",Positive
" זה לא כזה מפריע לי כרגע, אף אחד לא ימות אם זה יישאר ככה ויש לי מסמך להמשיך לכתוב. אין לי כוונה לפענח את זה כרגע. אני כותב את הקוד ב-Jupyter Notebook, מריץ, מוודא שהכל עובד יופי ואז עושה קופי פייסט (ctrl+shift+v כדי לשמר טאבים) בתוך program listing ב-LyX.",Positive
"RT: ואין שום הבדל בין ""מגויס לטובת האויב"", לבין -אויב",Positive
" אחרי הגירוש מגוש קטיף, כנראה מכיוון שהייתי עם מספר רישומים פליליים, הוזמנתי לשיחה עם מפקדת לשכת גיוס בטבריה. ככה התנהלה השיחה מילה במילה: היא: אם תראה ערבי תירה עליו? אני: מחבל מתקרב? בטח! היא: סתם ערבי אני: אז למה לירות? היא: הם כנראה מנסים להכשיל בלשון את אוהבי ישראל.",Positive
"RT: יש סחף ברצועת עזה כתוצאה מבעיות עומק שתקיפות ליליות פשוטות של צה""ל לא יכולות לעצור. * לפעמים תגובה צריכה להגיע עם פטיש *…",Positive
" כן לא אשקר לך זה ממש קשה, אני נתקל בחוסר הבנה וחוסר הקשבה מטורף אני מגיע למצב ש20 איש תוקפים אותי כשאני לבד, כי מה לעשות אני בפיד ציוני ולא בפיד גלובלי בו אנשים בדעה הרווחת יכולים להצטרף לדיון ואז אני נקלע לסיטואציה שגם לא מקשיבים לי וגם קוראים לי אנטישמי תומך טרור",Positive
"RT: רק שתדעו - אתם משלמים על משטרה שמופעלת כולה ע""י התקשורת. שמופעלת ע""י ארגונים אנטישמים זרים. זו הסיבה שאסור להם לעסוק בפשע הא…",Positive
" ברור.. גם מוכר הקמעות תירץ ללקוח הלא מרוצה שאשתו עזבה אותו עם המאהב שהיא בכלל עמדה לרצוח אותו בשנתו וכל הסיפור יצא לטובה, בזכות הקמע. זה עולם הדימויים הרלוונטי לגורואים מחרחרי הסגרים, שמעולם לא טרחו להוכיח את זוועת הסגרים הפגאנית מדעית, כפי שנדרש להוכיח חיסון או תרופה - מדעית.",Positive
"מלחמה בכל החזיתות | בעזה נתלה היום שלט ענק של קאסם סולימאני הבוקר ברצועת עזה נתלה שלט ענק באחד מרחובות המרכזים של העיר הפונה לכיוון חוף הים,של מפקד כוח קודס קאסם סולימאני שחוסל כאמור על ידי ארה""ב. הרחוב עצמו בשליטה של הג'יהאד האיסלמי,ויתכן שהוא קשור לתרגיל הגדול שמתרחש מחר https://t.co/qvefbovLWY",Positive
" אם מחבל שרצח משפחה יהודית היה עותר, גם היית מצייץ?",Positive
 אולי אנחנו צריכים ללמוד ממך ציונות... אנטישמי עלוב https://t.co/IrlLHAwU4q,Positive
"The damage inflicted in Nashville by the suicide terrorist on Christmas Day. Or, as we say in Hebrew, מחבל מתאבד. https://t.co/WnYGJO6PWS",Positive
" אם יסתבך האויב הישראלי בכל טיפשות נגד עמנו, עמנו לא יהסס בהכרזת הגיהאדלמען האל נגד האויב הזה, אנחנו לא נהסס להקות הכי חזק שאפשר כדי לפגוע במטרות הרגישות ביותר אצל הישות הציונית אדון עבד אלמלק אלחות'יבמהלך אירוע יום הולדת הנביא מוחמד המכובד- 12 רביע אוול שנת1441בלוח השנה האיסל https://t.co/irBkbVMfyF",Positive
سخنين: الشاب الذي اصدر تسجيل صوتي يشتم فيه الرسول عليه السلام يعتذر للمشايخ ويرحل عن المدينه لمدة شهر ولاهل سخنين סכנין: הבחור שקילל את הנביא מוחמד התנצל והורחק למשך חודש https://t.co/vInDcJKGvX,Positive
" ואתה יודע מה ליבסקינד, תבוא בעצמך להפגנות, לא כמפגין, תעמוד מהצד, ותראה אילו מכות רצח המשטרה נותנת למפגינים הכי לא אלימים בעולם ל-ל-א כל סיבה, כולל מעצרים אלימים ומיותרים. ואם אתה רוצה, נשלח לך סרטונים, ימבה סרטונים, שבהם אפילו אתה, תתפוס את הראש ולא תאמין על האלימות המטורפת!!",Positive
" זה מה שאתה חושב, עוכר ישראל. דע לך, יום ללא 'תלמוד תורה' והשמש לא תזרח.",Positive
"לא אוהב לרטווט את עצמי, אבל חשוב להבין מאיפה לרשתות החברתיות הביצים לצנזר משל היו מיניסטריון האמת. סעיף 230 מאפשר להם להתהדר בנוצות של פלטפורמה החסינה לתביעות (כמו חברת שרותי טלפוניה שבה לדוג' השתמשו לצורך תכנון פיגוע), בזמן שבפועל הם מו""ל לכל דבר. https://t.co/Hc5g63PI9q",Positive
 להשתנות? הם שונאים את 'הציונים ימח שמם' יותר מאשר את הערבים שסביבם,Positive
"ואם כבר, הקנס על הפרת המרחק של הקסאמים שבוצעה על ידי חמאס, יהיה בשקלים או בדולרים מקטאר?",Positive
 הי״ד למה? הוא יידה אבנים ברכבים. הוא מחבל. דמו בראשו.,Positive
מוחמד מת. לא בקטע רע או משהו,Positive
RT: מחר אסע שוב לבקר את אבא שלי הישיש והחולה בבית האבות בחיפה. זהו לחם חוקי כבר יותר משנתיים. מודע לזה שאיזה שוטר נחמד ומאיר…,Positive
"אני מאחל לישראל ולפלסטין להפריש שהם הבדלים ולהשאיר לצד זה בשלום. דוגמה טובה לכך היא לי ולחבר הכי טוב שלי. ידידי הוא מוסלמי מדהים ואני יהודי דתי, אבל אנחנו קוראים זה לזה אחים. זה לא קשה ואני מכיר אנשים לא מסכים איתי! תביא שלום.",Positive
 רומן זדורוב רצח את כל הפרטים שלך,Positive
"RT: כשעיתונאי ערבי ישראלי מנצל את הדמוקרטיה פה כדי לבקר את המדינה בתקשורת,לתמוך בטרור ולעודד יהודים להכפיש את צהל בעולם ובמקב…",Positive
 לחסום. בדקו לה רשימות מעקב. רק היום פתחה על הימין והדתיים וחרדים תומכי ימין וביבי מעקב. בטוח לבחירות לצלם מסך לדווח על 'בוטים ימנואידים' ולסגור אתכם. יש לה ברשימות מעקב חדשות פלסטין בעברית=אנטי ציונות ודת. בטח מצביעה משותפת. כל פיגוע תצייצו משהו לא קל לעיכול והיא תדווח. למה לכם?,Positive
 דש ללאה צמל יא עוכר ישראל ודש לתמרי מחבקת הקבר של הצדיק שלכם.,Positive
 תתביישו. בתור בת לניצולים לא מוכנה לצפות בערוץ שמביא מי שהגן על טובח יהודים פושע מלחמה נאצי ועל רוצח ראש ממשלה,Positive
 אין לזה קשר פוליטי?? זה לא היה רצח פוליטי?? ברור שיש טענות משפטיות זה לא הזמן להציף אותן ולחבר אותנו אוטומטית על ידי התשקורת לשם,Positive
" צפיתי בסרט בערוץ 8.. אני שוקל להתנתק מהוט אחרי מה שראיתי שם.. לצערי לקיתי קצת בחוסר ידע בכול מה שקשור אליה.. היא אצבע בעין למדינת ישראל!!! גועל נפש. סיפור של שנים הגועל הזה,היא והבעל שלה. תא טרור של גייס חמישי",Positive
"תראו, אני ממש לא טוען שאורלי לוי בעד רצח דובי קוטב. מצד שני היא אף פעם לא טרחה להכחיש את הטענה",Positive
התלבטות קשה כעת במערכת הביטחון: לא להגיב או לעשות כאילו הגבנו על ירי רקטה לעבר אזרחי ישראל.,Positive
 אופנהיימר ( צליל גרמני טהור תרתי משמע) מעניין אם יש מחבל שרצח תינוקות עם עונש כזה ומה יריבוש היה חושב על עונש ללא חנינה למחבלים,Positive
 שיעשה שפטל מה שהוא רוצה אבל לא עכשיו שפטל מצהיר על עצמו שכל חייו הצביע מחל אני מכבדת את שפטל לא מזדהה לחלוטין עם העלאת הנושא הזה בתקופה הזאת וכן זה רצח פוליטי הכי פוליטי,Positive
מחייה חסר תקדים. משום שהוא הבטיח לפתור את משבר הדיור ונכדל. משום שהוא נכשל בטיפול בסוגיית עזה ועסוק בעיקר בהעברת שוחד מקטאר לעזה בניסיון לשמור עלשקט. משום שהוא נכשל כישלון מחפיר בסוגיית התבססות אירן בסוריה. משום שהוא הרס את מעמדה של ישראל כגורם לא מעורב בפוליטיקה האמריקאית. משום,Positive
RT: התלבטות קשה כעת במערכת הביטחון: לא להגיב או לעשות כאילו הגבנו על ירי רקטה לעבר אזרחי ישראל.,Positive
" מכירה את כל הגרסאות, עזוב. רוצח ראש ממשלה באף מדינה לא ישתחרר ויתהלך חופשי. זה לא קורה באף דמוקרטיה ואפילו הדיון בזה הוא זילות של האסון שהמיט על המדינה.",Positive
 זה לא אדם תמים שיושב בכלא סתם זה רוצח שנלחם על זכויותיו אין לי בעייה עם המלחמות שלו יש לי בעייה עם העלאת הנושא והתמיכה של שפטל בתקופה הזאת,Positive
" זה או כיבוש עזה או המצב כיום. לטעמי,כיבוש הרצועה זה הפיתרון. אבל בשבילו צריך שהעם יכיר בכך שהעילה לשליטה היא לא רק ביטחונית אלא גם היסטורית,כיום הסיבה שאנשי ימין רבים מתנגדים לנסיגה מיו""ש היא בעיקר מהסיבה ""אם ניסוג מיו""ש יהיו טילים על תל-אביב"" ההחזקה ביו""ש היא רק אמצעי-לא מטרה!",Positive
 יש אפשרות להשמיד את מערכת השמש או משו?,Positive
 ארגון טרור פמיניסטי פנאטיות ברמה של דעאש,Positive
 אין שום דבר נעלה במעשה שלו. הוא רוצח נתעב. תפסיקי לבלבל תמח גמאת.,Positive
" יש בטוח עוד כוכב שיכול לפתח חיים תבונתיים, אתה צריך להשמיד את כול היקום",Positive
" הנושא המשפטי הוא כבר זירה אחרת רוצח, לרוב, אינו נמק במאסר עולם ותיקון חוק פרסונאלי, בדיעבד, בעייתי האם הייתי מעדיף אחרת? זה תלוי בנסיבות אבל, במקרה של רוצח ראש ממשלה, אני מאמין שאכן הרוב היו תומכים בכך בדמוקרטיה צריך להיות לזה משקל בהכרעת הדין אבל, הנושא העיקרי איננו הפוליטי",Positive
" תמשיך להוריד את האשמה מרוצחי המשטרה, זה לא ישנה את המציאות שהם ביצעו פה רצח, מדובר בעברינים שמגויסים למשטרה והם חושבים שזה כמו במאפיה, שהופכים רכבים במרדף. תבינו ילד בן 16 לא שחקן ב'מהיר ועצבני'",Positive
" תמשיך להוריד את האשמה מרוצחי המשטרה, זה לא ישנה את המציאות שהם ביצעו פה רצח, מדובר בעברינים שמגויסים למשטרה והם חושבים שזה כמו במאפיה, שהופכים רכבים במרדף. תבינו ילד בן 16 לא שחקן ב'מהיר ועצבני'",Positive
 פלסטין אלמוחתלה בשבילך,Positive
"דילמת האסיר של השמאל: להיאבק למען זכויות האזרח של טרוריסט כמו יגאל עמיר, כפי שהם נוהגים לעשות, או לשמוע מפיו את הסיפור האמיתי על פרס, כרמי גילון והשב""כ?",Positive
"RT: דילמת האסיר של השמאל: להיאבק למען זכויות האזרח של טרוריסט כמו יגאל עמיר, כפי שהם נוהגים לעשות, או לשמוע מפיו את הסיפור הא…",Positive
" כמה שימשיכו בשמאל להוריד את האשמה מרוצחי המשטרה, זה לא ישנה את המציאות שהם ביצעו פה רצח, מדובר בעברינים שמגויסים למשטרה והם חושבים שזה כמו במאפיה, שהופכים רכבים במרדף. תבינו ילד בן 16 לא שחקן ב'מהיר ועצבני'",Positive
" דה הומאניזאציה? אם הכוונה לכל הרוצחים שרצחו יהודים , הם כבר עשו דה הומאניזאצה לעצמם ברגע שרצחו, או ניסו לרצוח. מה ההבדל בין אסירים פוליטיים לאסירים בטחוניים , אגב? מניחה שמדובר באותו הדבר.",Positive
 איך יגרום ליותר תמותה? שבעתיד ימשיכו לרצוח יהודים?,Positive
 עצם קיום החקירה. הם רצו לאסור פירסום שהם חוקרים רצח על הכביש? כלומר הם רצו שכולם ידעו שהם לא עושים כלום כילו כאשר יורים בכבישים?!,Positive
אלוהים שישמור. עד מתי יתעללו ויענישו אזרחים ככה. גם אם מגיע לו עונש על הריסת בניין אין שום הצדקה להתעלל ככה בחייו של אדם. שום הצדקה. המשטרה מתדרדרת. https://t.co/ggbH9rmqQ1,Positive
 רקטות,Positive
RT: רואים שאתה בן טובים שמימיו לא קיבל מכות רצח משוטרים. התמזל מזלך.,Positive
"RT: תיקון טעות: על השלט חתום באופן אישי איסמאעיל הניה והיא הוצב בעזה כנראה על ידי חמאס. תשומת לב להשקעה בלוגו שבו נכתב ""שהיד…",Positive
 צריך להגלות אותה לעזה. ואותו לא צריך להילחם על שחרורו. הוא רוצח. את מדברת כאילו הימין מתייצב לצד יגאל עמיר. אני מקווה שכולנו מסכימים שאין טעם למאמצים לשחרור רוצח.,Positive
" עמיר צריך לשבת כמו שיושב כל רוצח אחר. בדכ קוצבים לרוצחים את עונשם. לעמיר לא קצבו את העונש. כדי שיישב ולא ייצא לעולם. זה צריך לחול על כל הרוצחים. אבל אם לא, אז האם דמו של רבין סמוק יותר או כחול יותר מדמם של אחרים שנרצחו?",Positive
 שמאל? ביחד עם ציוני? איפה אתה חי? ועוד בשלטון? אתה צוחק נכון? אחלה בדיחה🙃,Positive
זה מה שיקרה לכל שטח ישראלי שנרצה לתת מתוך רחמים לגורמים המכנים עצמם בלסטינים. כתבה של דוקטור גיא בכור . איראן בעזה: שלטי קאסם סולימאני ברחובות מובלעת עזה. על מה זה מעיד? https://t.co/mNSP1wB6d9,Positive
