text,label
 הוא הלך לבית הספר סיפורי פוגי הוא נשלח על ידי החברה שלו למקום שהיה אסור להיות בו לכן מי שמגן על החברה הערבית ששולחת ילדים לרצוח יהודים הוא שותף למעשים האלה,Positive
" גם כלפי הציבור שלנו. אסור שהוא יפחד לעלות לאוטובוס, ללכת למסעדה, לחגוג סדר בבית מלון... הקמת מדינת טרור וטילים במרכז הארץ נדמית לך כמעשה מוסרי?",Positive
"והנה התמונה האהובה עליי (באדיבות אוצר תמונות הפלמ""ח, כמו הצילומים הקודמים), שמספק הצצה לאישיות. צולם בביירות, בזמן שיצחק פעל כמוסלמי פלסטיני בשם ""עבדול כארים מוחמד צדקי"": https://t.co/384hYAupWv",Positive
 מעניין. אני אגב בספק אם גופי ביטחון שמעוניינים לעקוב בעיקר אחרי טרור בדארקנט (ולאחרונה בקורונה גם קצת אחרי אזרחים רגילים) לא הכניסו כבר כמות יפה שכזו כך שיוכלו לזהות תנועה גם בtor..,Positive
"ברצועת עזה מוסיף חמאס לשגשג ולפרוח, בחסותה ובעידודה של ישראל. ביום מן הימים נשלם מחיר כבד על שאפשרנו לחמאס, תחת עינינו הפקוחות, לבנות באין מפריע מערך טילים המכוון נגד ישראל&gt;&gt;| https://t.co/363zDF2CQo",Positive
 יחי ההבדל חתיכת צבוע. אם זה היה ערבי היית אורח של כבוד בסוכת אבלים שלו,Negative
" מצביעי ליכוד מצביעים מחל. אם נתניהו ימות חס וחלילה מחר בבוקר, הם ימשיכו להצביע מחל. הם הצביעו מחל גם בשביל בגין, שמיר, שרון וכו'. מחל זו מפלגה. ביבי זה כת.",Positive
" ואתה מעודד מידור שר בטחון? אתה ציוני? אתה קורא לרמטכל במיל"" שתרם קצת יותר ממך.צנון.עד מתי שונאי ישראל. אנשטימי שכמותך",Negative
"שתיקת הכבשים ""המנהיגים"" הפוליטיקאים העיתונאים על רצח הנער היהודי שלרוע מזלו הוא לא אתיופי היא פשע !!!",Positive
 מיקי זוהר הוא הדבר הכי טוב שיכולנו לבקש. כל כך מטומטם ולא מודע לעצמו שהוא כל הזמן מפליל את המושחת. יש לי תחושה עזה שהוא גם ישיר מתישהו,Negative
 ערבי נוהר. לא מגעגע.,Negative
"לאפה מעשה ידיי גבינת עיזים ,סלט ערבי בכאילו טעיםםםם https://t.co/x9900KdMBG",Positive
"פתאום נתניהו ״מאמין בתורת ז׳בוטינסקי״ לגבי שילוב של אזרחים ערבים וקורא להם להצביע לו. לפי ז׳בו הרי, חובה שיהיה סגן ראש ממשלה ערבי. פתאום הם לא ״נוהרים לקלפיות באוטובוסים״ ולא ״תומכי טרור״. אחיי הערבים, הוא עושה עליכם סיבוב מכוער כי הוא יודע שהוא הולך להפסיד, שקרן. לך ביבי לך.",Negative
 חחחחח זה באמת מצחיק רצח,Positive
"נסראללה בהקלטה סמויה: ביבי אהוב לבנו, אנחנו מתאפקים כבר חודשים כדי לשמור עליך, מחמל. נפשנו, רק טפו טפו טפו שתחזיק מעמד, תמשיך להשמיד מהר ובטוח את העם והמדינה הציוניים",Positive
" תומר, שאלה כי פוסט על מפלגת העבודה מעניין כמו השפם של פרץ דאשקד. לדעתך המשטרה מנסה לטייח כרגע רצח של נער גבעות?",Positive
"לדעתי סער ואילנה... נכנסו לאותה המיטה.. רק בשביל שוב לשקר ולהנדס את הבוחר. רר לא ביבי. לשקר אין רגליים...עובדה חייבת להחשיך. בעידן זה פוסט אמת ופייק ניוז הם טרור ,ולוחמה ביולוגית לכל דבר . סכנה ברורה ומיידית. https://t.co/qzqdBUThIi",Positive
 ימח שמך ביבי אתה אסון למדינה,Negative
" פיני מביך. כמה פלסטינים גירשו מהאדמה עליה אתה יושב ציוני מנשל שכמוך? הפלסטינים רוצים לחזור לבתיהם בתל אביב, אשקלון, וחיפה. לא מכיר פלסטיני שחולם לשוב לאריאל או לגוש עציון (מעולם לא חיו שם). הגנרטור הוחרם כי מדיניות ישראל בשטחי C היא בדיוק כמו מדיניות הרשות בשטחי A+B ובצדק.",Negative
 מה שעצוב זה ששוב השמאל ינסה לצאת יותר ימין מהימין במקום לנצל את ההזדמנות לחיבור יהודי ערבי כנה על מלא.,Negative
 אין כמוך עופר. בסך הכל אתה בהחלט משרת היטב את מטרותיהם של חבריך לחיסול הנוכחות היהודית בארץ ישראל. אלה בנשק ואתה בחיידקים. יא עוכר!,Negative
" זה נראה כמו העתק מדויק של מרכז פרס לשלום, שגם הוא עומד כמעט שומם ביפו, צמוד לבית קברות מוסלמי (לפחות לא ממש עליו), ומקרין סובלנות של חומה סינית.",Positive
" אתה מראה כאן משפחה ערבייה שהותקפה אבל בו זמנית אתה קורא ליוסף חדאד, ערבי ישראל ציוני, שהוא ערבי מחמד.... קצת צבוע , לא חושב ?! פתאום הפרצוף של תומכי הטרור כמוך מתגלה. כל הצבעים האמיתיים שלכם נחשפים! מילה אחת לא ראיתי אותך אומר נגד רצח האם לשישה ילדים לפני כמה ימים!חתיכת טרוריסט!",Negative
 קשקוש מחאה הפגנה מטרתם להביע להמחיש תמיכה או התנגדות לרעיון מה שאתה הגדרת הוא טרור ואלימות במינון נמוך אתה עברת רדיקליזה מדמוקרטיה לחוליגניזם,Positive
 איך? שבירת רגל של שוטר? הבערת אש מול ביתו של ראש ממשלה? איך? פיגוע של אנשי שמאל ערבים נגד אנשי וחיילי צה״ל?,Positive
 נשמעים הרבה קולות של ערבי ישראל בבחירה הבאות לתמוך בבנימין נתניהו. כי הוא היחיד שדואג לערבי ישראל.,Positive
 האם לדעתך נציג ערבי לא יכול להחזיק בדעה מורכבת גם? גם אכפת לו מאחיו הפלסטינים וגם אכפת לו מאחיו הערבים הישראלים ?,Positive
 נו וחברת נערי הגבעות זו חברה תומכת טרור לתפיסתי. ויש לכך השלכות. ולכן זה מצער ובילתי נמנע.,Positive
" הוא לא הושיט יד לאף ערבי חוץ ממ""ע, שלו הוא יעניק כמה פוטואפים עם הבטחות שלא יקיימו בתמורה לחוק צרפתי ומלוכת נצחים",Negative
 על ציוני כזה אני מוכן לוותר,Negative
 למה שיגנה? לא ערבי רצח אותה אלא צעיר.,Negative
 טוב הוא חתיך רצח. לא מבין איך מישהו חשב שהוא יהיה מספיק טוב,Positive
 אסף זה ציוץ מכוער ולא לעניין. כשכרמל חשפה פשעי טרור יהודי גם תהית בנושא?,Positive
 בסוף הצעירים עובדים לממן את הפנסיה של הזקנים ככה העולם עובד ואם הם בבית כי לא חוסנו זה מטומטם רצח,Positive
" מוחמד הכנעני אחלה שחקן, ג'קי עוד יעשה עליו חבילות",Positive
" מי שהתנער מערבי ישראל ,אלו דווקא מי שבחרתם בהם והיו אמורים לדאוג לאינטרסים שלהם ובמקום זה, הם היו עסוקים להתחרות מי יהיה יותר לאומני ולוחמני למען הפלסטינים ...",Negative
"אנחנו רגילים לכך שמעודדי הטרור ברש""פ מתגמלים מחבלים, אך לא ציפינו שגם יצטרף. פלסטיני שמור חוק לא יקבל מהרש""פ את חיסון הקורונה למשך חודשים ארוכים. אבל לפי מדיניות משרד הבריאות, מחבלים כלואים יקבלו מיד את החיסון עוד לפני המורים. פשוט בושה! https://t.co/lw1cXetvE3",Negative
" מכיוון שחפצת חיים אנוכי אני לא חיה בטוויטר. לא זוכרת שראיתי דבר כזה אבל ריקלין הוא לא הנושא אלא דורשי הצדק למיניהם. מכיוון שאני מכירה קתת את הנפשות הפועלות אספר לך על שני משפטים ששמעתי השבוע. האחד, בחור מבת עין שהגיב לשאלתי מה הקטע לפגוע בנהג ערבי חף מפשע? במילים אין דבר כזה ערב",Negative
" צעיר הפועל במאבק ללא אלימות לשחרור מולדתו הוא לא ״מחבל״. הכיבוש הוא הטרור , הכובשים הם המחבלים . נאמר אנו כן לחיים ללא חומות וגדרות ומחסומים לא בין בני האדם לא בין עמים ואנשים ! לא לחומות בין ערבים ליהודים , לא לחומות בין פליטים חדשים מאפריקה לפליטי אירופה הותיקים שהם הורינו . די",Negative
 כן איזה כיף זה שיתוף פעולה עם תומך טרור,Positive
" את ביבי,כי הוא מפריע להקמת מדינת כל אזרחיה,שריפת דגל ישראל ביטול חוק הלאום כדי שתושבי עזה לבנון ירדן סוריה הפלשתינים יתיישבו בערי יהודים,וירצחו את כל עם ישראל בשם מדינת פלסטין,אתה נותן יד לרצח העם שלך",Negative
" לפני סבב ב' נתניהו הסתער על הרוסים באותן שיטות וכולם דיקלמו באוטומט ""נתניהו גאון"". נתניהו קיבל שם אפס קולות חדשים, אבל טלי פלסקוב הרוויחה שריון. צפי למגזר הערבי - דומה. אוסנת מארק וכו' יזיזו מקום אחורה כדי לשריין ערבי ש""יביא 2 מנדטים לליכוד"". https://t.co/MQniFjoaQd",Negative
" החלפתי לתקליט של הנורמליזציה, לגבי עזה את טועה, מוחקים דוגמאת איראן, אומנם הם לא ערבים אבל הם בונים ורוצים להמשיך לבנות טילים שלא ישרפו את האדמות אלה ישרפו את כולנו ערבים יהודים שמאלנים אפסים וימניים נאורים, בלי הנודניקיות של ביבי נגד אובמה אולי הם היו מצליחים",Negative
" אזרח ישראלי,שרת בצבא ונפצע,נלחם בארגוני החרם בכל העולם,נאמן למדינתו הוא לפי תורת הגזע ""ערבי מחמד"". תתבייש,גזען.",Positive
" היו שואלים אותי עם מי אני רוצה לצאת למלחמה ברור שעם אליהו, אפילו בלי להכיר אותו. כבר ראינו את הנמושה שליט שכמעט והתנדב ללכת עם חמאס לשבי.",Positive
 לדעתי הסצינה שהם חוקרים את הבית של ההיא שד׳אנג׳לו רצח יותר טובה.,Positive
"חלפו 10 ימים מאז נעצר הרוצח שרצח באכזריות את אסתר הורגן, הי""ד. בעוד בית משפחת הורגן נחרב, ביתו של המחבל עדיין עומד על תילו! כל יום שעובר מבלי להרוס את בית המחבל פוגע עוד יותר בהרתעת 🇮🇱. די לסחבת: תנחה את כל הגורמים השונים לסיים מיד את העבודה ותורה על הריסת הבית! https://t.co/hLaCOkIMYs",Negative
"RT: כאן גאים הסרט #רצח_בקולנוע_צפון הוכרז כסרט התיעודי הטוב ביותר במסגרת פרסי פורום מבקרי הקולנוע בישראל 2020 🏆🎥 מנימוקי הבחירה: ""ה…",Positive
" בטעות? יורים כדורי אש חיה, מה הם חשבו שיקרה? אה, לא היה אכפת להם כי הוא ערבי.",Positive
"ערבי חוסל, הרקע סכסוך משפחות. https://t.co/K16lqn40KF",Positive
" קלמן, קראתי שורה והעפתי את העיתון מהיד בשבת. גופת הילד עוד לא התקררה . בושה וחרפה . מה הכתבה הבאה שלך? אולי גרסת המחבל לאיזה פיגוע?🤮",Negative
"💬נסראללה אמר בנאומו כי נפגש עם מנהיג חמאס איסמאעיל הניה מספר פעמים במהלך ביקורו האחרון בביירות ונשמע אופטימי בנוגע להחזרת היחסים בין חמאס לאסד למסלולם, אבל מיד הדגיש שזה ייקח זמן",Positive
" אתה פוסט ציוני, זאת מדינה שהקימו ציונים,למען הציונות והציונים,אין לך מה לעשות כאן, העולם לא מחכה לך, אבל לך.",Negative
 כן זה מבאס רצח,Positive
 את אוהבת להשמיד קבוצות מיעוטים?,Positive
 הבן שלך מחבל,Negative
" פריי יא מזבלה, מה עשית כשערבי זבל בן עוולה רצח את הורגן להנאתו ??? צייצת זוועה? נתת איזו תובנה? אתה #מוהנדס",Negative
" הקשקוש מתחיל בנקודת המוצא. בדרישה לבחור בנושא החשוב ביותר. האמת היא שהבנאדם, אפילו ערבי, רוצה גם וגם. אז בימים טרופים אלה בה האלימות והפשע משתוללים, ברור שהביטחון האישי בראש. אחרי שבורחים בין הקליעים, רוצים לאכול. רוצים בית. זה לא שלא מעניין אותם השלום. מעניין. מחקר, או אג'נדה?",Positive
 הוא קרינג רצח אבל אני אוהבת אותו לנצח,Positive
" את רצינית? איך את מצפה שמישו יקח אותך ברצינות בתור עיתונאית?????? מלוא הפרגון לנתניהו על זה שרכש את החיסונים אחרי כל העולם במחיר כפול, והשתמש בקופות החולים שניסה להשמיד רוב שלטונו כדי לפזר את החיסון בארץ??? על מה את מדברת שופרונת?!",Positive
אבא שלי ערבי טוב. הוא לא כושי. תימן זה לא אריטראה. סודאן ואתיויפיה. דר אפריקה,Positive
" שטויות ממש ... גם כל תקיפה שעושים היא תמיד על נקודות טרור (משגרים, מנהרות, מפעלי טילים וכו)",Positive
" זה מהמילה הלטינית ""פוסט"" שמשמעותה ""אחרי"". אז פוסט-ציוני זה מי שכבר לא ציוני. ופוסט-פוסט-ציוני זה מי שכבר לא פוסט-ציוני.",Negative
 זה הופך אותנו לאוטומטית אייקוניות רצח,Positive
" ״מהרסייך ומחריבייך ממך יצאו״ ביצעת פיגוע בתוך הימין! האמנתי שאתה האיש לאחר לכתו של נתניהו בתוך הליכוד! אך משהוצאת את עצמך מהמחנה, אינך מהווה אלטרנטיבה לדבר יותר. אתה ״מפלגת אווירה״ או יותר נכון ״מפלגת אוויר-רע״ כמו כחלון אתה תעלם בבחירות החמישיות.",Positive
" איילת שקד שהיתה שרת משפטים והגאה בהישיגם להגדיר כאבן הורגת וזריקת אבנים היא טרור,באה לתמוך במשפחות ולהגן על זורקי אבנים כאילו שהקורבאן ערבי זה לא נחשב כטרור יכול להיות שילדים שיחקו באבנים למחקר מדעי.צבועה",Positive
"""היום הסורים הולכים ללמוד שהיד שמנענעת את העריסה יודעת גם קראטה"" צ'רלי שין, ניחום אבלים לקוסם צבאי, איקאה סניף ירושלים כשר מהדרין, 1921",Negative
" פיצוי .. לא , פיזרו לנו צווי הריסה לבתים שלנו",Negative
" חס וחלילה. אני רק מזכירה לך אילו מהומות עשו הדמוקרטים בארהב כששוטר רצח את גורג פלויד, כולל הצתות וביזה.",Positive
"RT: יש הבדל בין לשריין ערבי לבין לשריין מחבל או תומך טרוריסטים, זה רק מעיד על הגזענות והאדנות של השמאל. רוב…",Negative
 זו מדינה מטומטמת רצח נמאס לי,Positive
" הוא תופס (כמו הרבה פרו ישראלים לא יהודים) את המושג ציוני כמושג יהודי שרק יהודי יכול להיות. זה בסדר. אפשר להסכים או להסביר או לא להסכים. אבל הכותרת שרשמת (ואני לא אומר שהתכוונת לזה) כאלו מתשאלת את התרומה שלו למדינה ומעליבה. לגבי הדיון אם סמוטריץ תורם או מזיק, זה כבר דיון אחר",Positive
" שיקראו לך טפיל מוצץ דם משריץ ילדים וגידול סרטני ממאיר מפיץ מחלות ושרואים אותך מבינים את הנאצים ושתחטוף מכות רצח משוטרים אז גם אתה תתלונן... השמאל בוכה כבר שנים על זה ""שגנבו לו את המדינה"" למרות שהוא הכי פיריבילגי.",Negative
"הרחוב הפלסטיני נאבק במשבר כלכלי. צעיר פלסטיני לא יכול לבנות בית, לקנות מכונית, להתחתן כי אין לו כסף. מתקשה להשיג עבודה בישראל בגלל הקורונה ואז הוא שומע שהרשות הפלסטינית תשלם משכורת של שלושה חודשים מראש למחבלים. ככה דוחפים לביצוע פיגועים, ככה מעודדים טרור https://t.co/rf8SKF2Blx",Positive
" אתה פאתט , פתאום ערבי גבר זה לא ערבי בקבר ?למה כי ביבי אמר ? פתאום אפשר לחיות בשלום איתם אפשר להאמין להם גם לפני שערבי 7 שנים בקבר ? או ביבי או טיבי נעלם ? איזה עולב של ""אין אידיאולוגיה"" אלא רק מה שהמלך אמר השינאה שלכם לחצי עם מעבירה אתכם על דעתכם",Negative
 כל ערבי ישראלי שטוב לו במדינת ישראל הוא הופכים אותו למחמד.,Positive
 אל תחמיא לעצמך אתה לא מהפכן קיצוני שרוצה לרצוח עשירים,Negative
"ועכשיו דמיינו לכם כמה תגובות גינוי ושיח תקשורתי היה פה לו רק הבחור היה פלסטיני. אם זה לא ניסיון פיגוע אז מה זה בעצם? אה, זה בכלל ״אדם שיצא מרכבו עם סכין״. ממש בקטנה. https://t.co/CrqORU94YY",Negative
 כל עוד אתה לא יודע גם לשחוט ולמהול היכולת תקיעה בשופר שלך לא מרשימה אף נקבה בשיט,Positive
"רק לפני כמה ימים המשטרה זרקה קשיש חרדי לרחוב אחרי ששלפה אותו בטעות מהמיטה. חודשיים לפני זה זרקו פלסטיני במחסום ואמרו לו שיסתדר איכשהו לחזור הביתה. שניהם גמרו בבית חולים. כולם הזעזעו, אפס הפקת לקחים.",Positive
אני משחררת את פלסטין ביי https://t.co/tB7CfsxmZ8,Positive
 נער שהשתתף בפעולת טרור,Positive
 תגדיר אויב. בעצם עזוב. הבנתי.,Positive
 זה לא ביבי שחוזר ואומר כל הזמן שלא יעשה משא ומתן עם תומכי טרור?? הבנאדם משתף פעולה עם הערבים פעם אחר פעם ואז מסית נגדם ונגד כל מי שמתכוון לשתף איתם פעולה. הוא ימשיך לעשות את זה ואתה בטיפשותך תמשיך להאמין לו.,Positive
 מודאג מאוד אבל כל פעולה למיגור התופעה הזו יתחיל פה פסטיבל שלם של נושא זכויות אדם וסתם יוציא אותנו חארות למרות תמיכה גדולה מאוד של הציבור שם.תאר לך תמונות של גדוד שלם בכפר ערבי...כנראה זה יידחה עד לקצה,Negative
 עוד שבוע כשהם משחררים את פלסטין!,Negative
"RT: רוצח ילדים שתכנן מעשי זוועה זוכה לחיבוק ואהבה יותר מאשר אח שכול, קצין בסיירת מטכל ועל הדרך גם ראש ממשלת ישראל.…",Negative
" בחיפוש קצר מצאתי הבעת תמיכה מצידו של ניצן הורוביץ בקואליציית מרכז-שמאל-ערבי-חרדים. ואגב, גם לי מתפלקות אותיות ואני לא דיסלקטי, הפתרון שלי פשוט, רגע לפני שאני לוחץ על ""השב"" אני עושה הגהה קצרה",Positive
 חולדאי שמאלני קיצוני אנטישמי עוכר ישראל מזרע ערב רב של עמלק. https://t.co/4XWG776j8N,Negative
"והכי גרוע - כותב הטור חוזר שוב על השקר שהימין מפמפם במשך שנים לפיו הח""כים הערבים מתעסקים רק בענייני הרשות הפלסטינית והנושא המדיני, בניגוד לרצון הבוחרים. מי שעוקב אחר חברי המשותפת יודע שהמציאות הפוכה לחלוטין והם עסוקים בעיקר בחברה, בריאות ופשיעה. חבל שדווקא כותב ערבי ממחזר שקרים",Positive
"נאסראללה פונה לערביי ישראל ואומר שהוא יודע כמה הם מיחלים לשחרור פלסטין כולה. נצפה מחר לתגובת חה״כ איימן עודה שבעבר דחה את ההחלטה האמריקנית להכריז על חיזבאללה ארגון טרור, כי לדידו הם לוחמי חופש.",Negative
 חבקוק מכיוון רמה א' זה הנוף שלי בשנים האחרונות אחרי שגנבו לי את התצפית על עזה,Positive
 מתנחבל שמיידה אבנים הוא מחבל לא פחות,Positive
" אז לך למקום שמתאים לך, או שלא הבנתי את כפל הפוסט פוסט ציוני.",Negative
" אלון ליאל לא התקשר לקופ""ח ודרש שלא יחסנו אותך כי אתה מתנחל?",Positive
 בחיים לא תצליח להבדיל בין ערבים תומכי טרור שמחפישים את חילי צהל לבין ערבים שמרגישים שיכות למדינה ומעריכים את עצם היותם חלק מדמוקרטיה חזקה שמעצימה את גאוותם.,Negative
" לא תקום מדינת טרור ערבי בא""י המערבית, שכח מזה.",Negative
 איאד לא זרק אבנים. איאד היה על הספקטרום האוטיסטי. איאד נרצח כי היה ערבי. עוד שאלות?,Negative
 אם היא תרצה לרצוח אותי במספריים שלה אני אתן לה בשמחה,Positive
 לא.. אני באמת לא רוצה אחריות על עציץ אני באמת רוצה שמישהו יקח אותו או שהוא ימות,Positive
"נסראללה נשאל בראיון על היחס שלהם לערביי ישראל (שאלה לא שגרתית חייב לומר): ""אנחנו לא מבקשים מערביי ישראל כלום. הם מעריכים את התנאים ואת המצב. הם אחינו ואנחנו יודעים שהם מצפים ליום שבו פלסטין תחזור להיות מהים והנהר. זה לפחות מה שאנחנו שומעים מהם בתקשורת וברשתות החברתיות""&gt;&gt;",Positive
"RT: מצוקת העסקים | הישאם חסן, בעל שלוש חנויות בגדים, מוחה אצל ו-: ""צברתי חוב של יותר ממיליון וחצי ש""ח. בשבוע…",Positive
" אם התכוונת לגנץ, הוא לא היה בסוד העניינים, כי ביבי פחד שיגלה את הסודות לאיראנים, או שהטלפון שלו פרוץ. מה כאן לא היה ברור? האמירויות, F35. סודאן, היא כבר לא מדינה תומכת טרור. מרוקו, ארה""ב מכירה בסיפוח של סהרה המערבית למרוקו, אבל היא לא מסכימה שישראל תספח את יו""ש בצורה חד צדדית.",Positive
" בס""ד הנה הסרטון של רשת SKY NEWS של אוסטרליה. עם תרגום אוטומטי לאנגלית (לא מדויק אך העקרון ברור) כך נראה השמאל האנרכיסטי/קומוניסטי/אנטישמי/פרו-טרוריסטי בארה""ב. יאיר לפיד כנציג סינדיקט השמאל העולמי בארץ הקודש, מתקנא בהם. https://t.co/DT8jzv4LsC",Negative
" ללמוד מה? איך לגדל מחבל? איך לגדל ילד שבורח מהמשטרה, שנוסע בפראות? לא מבין את ההבדל ביניכם לבין אלה שרואים במחבלים גיבורים.",Positive
