text,label
"יא בן של זונה, וואלק אתה תהיה בשקט לפני שאני ישבור לך תצורה, מי אתה בכלל?! מה אתה חושב?!?!!",Negative
הטינופת של המדינה,Negative
אם עובר הפעם את אחוז החסימה המדינה שלנו בסכנה!!!!,Positive
כואב על השוטרים...מי צריך דמוקרטיה עם שמאל כזה...ביבי לנצח...,Positive
אלה הם הדפוקים במדינת ישראל. הוא רוצה מלך המפגר. שילך למדינה שיש בה מלך,Negative
קשקוש מוחלט!! לא מאמין לאף מילה!.הוא יצא נגד הקהילה החרדית בכל מה שקשור להתנהגות מול נגיף קורונה והם בדרכם מנסים להפיל אותו בדיוק במקום משפילים אנשים במדינה הזו.,Positive
חברים תבדקו את השורשים שלו ותראו זה מגיע עד לכוזרים אז מה אתם מתפלאים שהו אנטי הוא פשוט חוזר לשורשים שלו,Positive
סבלנות של ברזל מצדיע לשוטר,Negative
שקרן צבוע נוכל,Negative
בסוף ידיחו אותו כי לא ירה בהם .ואם היה יורה בהם היה עצור עד תום הליכים,Positive
"אם זה נכון אז משהו רקוב מאוד בממלכת מאה שערים, שידעו ולא עשו כלום!! ואם זה לא נכון אז גם הממלכה רקובה ומפלצתית.",Positive
ויש עדיין אנשים שבוחרים בו....למה ????,Positive
לך חולה נפש לא תזכה לרגע הזה להיות ראש ממשלה מקסימום ראש רשות הקנביס בקולומביה .,Negative
הבדואים בארץ הזאות לפני שההורים שלך יעלו לארץ,Positive
איזה מפחיד הרשימה המשותפת יושבת בממשלה. אלה שרוצים לחסל את העם היהודי תתעוררו,Negative
למה לפיד הרדים דרך התקשורת את הסיפור של מאיר כהן ???חייבים להציף את זה עכשיו ..דורון נתן ביטון,Positive
וואלה אתם המחבליםוהוא הגבר,Positive
רק 7 🤣,Negative
אם היה הפוךצעיר רצח שבע יהודים...,Positive
עמוד של שרמוטות שמולאנים מסריחים,Negative
כול הכבוד👏👏,Positive
איש מסכן ומסוכן אנרכיסט שפל,Positive
מרגל רוסי,Negative
אני לא מוכנה לקבל את המשפט שדה שמתרחש ברשתות החברתיות. זה לא ייתכן שמישהו יכתוב משהו כעובדה מוגמרת לפני שבדקו לעומק הוכחות . לכתוב בקלות מילים כאלה על איש כל כך תורם ומציל חיים שמגיע לו פרס על מה שהוא בוודאות עשה ולהפסיק לגזור את הדין על משהו שבנתיים כל עוד לא הוכח אחרת הוא פשוט לא עשה!!!!,Positive
מסכן חולה נפש,Negative
להעביר את הערבים הבדואים הגנבים לסיני זה לא עונש זה חובה .,Negative
בו גביר יותר אמין מהאלוף הזה שאנחנו לא יודעים איך הוא קיבל את הדרגות,Positive
לא צריך טובות שישאירו אותנו ככה טוב לנו שלא יכניסו אף אחד עד שהם גם ימגרו אצלם את הקורונה!!,Positive
"ישראל תהפוך למדגרה מטורפת, ברומניה הודיעו על כניסה רק בבדיקה, בעוד שישראל מנדה את אזרחיה מאיפה שהתיירים כן יוכלו להסתובב יחד עם כל המחוסנים.... איפה נשמע הדבר??",Positive
הנני תקווה שהאצבע אינה קלה על ההדק !! ושבאמת הייתה סכנת חיים בל נשכח את הנאמר שופך דם האדם באדם...כל אדם במשמע ואפילו אויבך!!!,Positive
מפלגת הליכוד הרקובה היא הפשע והרשע ותכלית השקר.,Positive
סגן רמטכל אפס מאופס זבל אנושי,Negative
"בית""ר היום זו הקבוצה הכי אפורה מאז 1937",Positive
שלא יביאו לפה מוטציות🤨,Positive
בזכות ביבי,Positive
"זה חמור. לא אוהב את הבדואים, לא יודע אפה הם גרים וחושב שלקרוע את הניר יביא לו קולות. אהבל!!!!!",Negative
יאיר גולן אין לו ביצים להסיר את החסינות יש לו פה זונ. גרמניה,Negative
המקסימום שלו זה כנאפה.. וגם זה בעירבון מוגבל.,Positive
ברור שאהבל כזה יתמוך בבן גביר ... מה חשבתם שהוא יתמוך בנלסון מנדלה,Positive
איזה בדיחות חמודי ... לא לקח שקל!!,Positive
יש בורי לעולם,Positive
זבל שבזבלים,Negative
לזרוק אותם לים!! פחי אשפה עם רגליים!!,Negative
הלפיד כבה גרוע יותר מאבא שלו. אנטי שמי,Positive
להרוג מחבלים זה לא רצח ולא נחשב כמחבל!! יהזויים,Positive
לא סתם בבחירות הראשונות לא נתנו לו לדבר לבד..,Positive
ואנחנו נמשיך לממן את חבורת הבוגדים הזאת מכספי המיסים הגיע הזמן שיגרשו אותם הרי בסוף עד יתברר שכולם בוגדים כמו עזמי באשרה אני מתנדב להסיע אותם למחסום ארז שם נראה אותם גיבורים בושה למדינה ולכנסת,Positive
"לא מבינה למה הסיסמת בחירות היא ״רוצים ממשלה שפויה״
 למה לא ממשלה טובה רצח? למה לא ממשלה בת זונה? למה לא רוצים ממשלה… https://t.co/kmFkgZySSO",Negative
"הערבים לא יודעים מה זה חוק להם מותר לעשות הכל ולבוא בטענות למדינה על קיפוח, גזענות וכו' . הבדואים רוצים להשתלט על הנגב והדרוזים והבדואים על הגליל והערבים על איו""ש, אם לא יהיה הסדר חוקתי ואכיפה מספקת הם יכבשו לנו לא רק את הנגב אלא את כל המדינה.",Negative
"ביבי דיקטטור וכבר מתנהג כמו משוגעה. אתה מתנהג כלפי אזרחים שלך , כמו שאבא מתנהג כלי ילדים שצריך להעניש ולא מבין כלום. ובזמן אחרון אמירות שלך - הם אמירות של בן אדם מבוגר שאיבד חוט למחשבה נורמלית.",Positive
אם לא תצהירו הצהרות מפורשות על ההתעללות של בתי המשפט באבות וגברים .לא תעברו את אחוז החסימה כמו בבחירות הקודמות,Positive
"כל הכבוד, שירות נעים.😀😀😀",Positive
לוחם קומנדו?,Positive
Aviad Shmaia תסתכל טוב תראה אותך עם הציליה מאחורה,Positive
תלך כפרות על כלל ישראל,Positive
כאשר יענו אותו כן ירבה וכן יפרוץ ...,Positive
"נראה לי הם מבינים היטב החוגגים בבלפור שהמסיבות גוססות הם לא מגיעים למטרה של ""ההשכלים"" למיניהם. המיליונים נשפכים ותכלס זה דועך... פחחחח",Positive
קבוצה פח.,Negative
אנשים חסרי כבוד הערבים האלה איך הם יושבים בכנסת,Negative
ואיזה שרמוטות זונות העיתון הזה כי אם היה מחבל רוצח יהודים היו רושמים עקב הכיבוש והעוני ואין מילה כזאת פלסטין כמו שאיו מדינה כזאת תפנימו הרג 7 מוסלמים שונאי ישראל עיתון שמאלני זבל,Negative
כול הכבוד לראות ולא להאמין 👏👏👏👏,Positive
מיותר. מיותר.,Positive
"נראה לי שבית המשפט פועל ממדינה בארופה, אחרת אין שום סיכוי שזה אמיתי..",Positive
מסכימה לכל מילה!,Positive
איתמר בן גביר ... הגבר...,Negative
מקבלים את כול התנאים לא משקיעים שום דבר למדינה ועוד באים בתענות .,Negative
יישר כוח גגבבררר,Positive
עמוד של אנטישמים,Positive
חף מפשע,Negative
רק בגללו אנחנו בבחירות רביעיות,Positive
"הדבר הכי מיותר במפה הפוליטית, מפת נייר חד פעמית",Positive
סדי בן שטרית הוא הסמרטוט של אנשי השמאל,Negative
בפנים שלנו אתה הורס את המדינה,Positive
וואו אלופים גאים בכם!שימרו על עצמכם מרגש מאד וגאווה לכולנו❤🏆,Positive
חתיכת זבל פסיכופט.,Negative
רק מקווה שלא יביאו עוד וואריאנטים,Positive
בזכות ביבי .... לא יזיק קצת קרדיט. אם היה מישהו אחר לא נראה לי שהיו מגיעים החיסונים ... הכי הרבה היה מגיע החיסון האיראני,Positive
‏חתיכת זבל,Negative
Israel Police - משטרת ישראל נו מה אתם אומרים ימניק,Negative
וליד זהראלדין לפי איחולי החלמה אתה חתום ביבי נתניקו,Positive
חחח פאתטי,Negative
רק ביבי בגדול עכשיו בקלפי 😜🤪😜,Positive
"מזדיין תראה איך אתה נראה, מהזה כל החצ'קונים האלה יערמת מצה של פסח, בואנה יא ביצה תראה איך אתה נראה כמו קובה לשבת יא מזדיין, יא מניאק יאללה תנגב את החלב מהפה. חברים, גיברותי ורבותי, סטארטר הירידות החדש. יא בן של זונה, וואלק אתה תהיה בשקט לפני שאני ישבור לך תצורה, מי אתה בכלל?! מה",Negative
רפואה שלמה לשרה,Positive
ימפגר,Negative
סופו הפוליטי קרוב,Positive
להעיף את המחבל הזה מהכנסת!!,Negative
החונק מנדלבליט יוצא לך חזק מהגרון,Positive
טמבל,Negative
ליברמן את גוש של גבנו ענק !!!,Positive
"הפוסל במומו פוסל !!יהיר.. יותר טוב תשתוק,כדי שלא תשמע- איך אנחנו מכנים אותך !!יא תולעת..!!",Negative
"גדול המנהיגים שההיסטוריה המודרנית ידעה.אני לא מצביע נתניהו, עם זאת הוא קוסם.כבר 11 שנה נבחרת בצורה דמוקרטית, מתאים או לא - זו עובדה.צריך לתלות את המפתחות, ולפרוש עם ראש למעלה.עשה את שלו זה בטוח.",Positive
מקווה שעיתון הארץ לא עושה כיפה אדומה,Positive
מנייאק,Negative
איש מביש ודוחה,Negative
רק בן גביר בקלפי📣📣📣📣📣📣📣📣,Positive
קורס טכנאי אייפון - ש.פון הדרכות 1,Positive
@TWhachfatsa זונה,Negative
"ומה עם המימד החמישי??,?,",Positive
גאים בזה שהדרכנו אותו !!!!Lihi Saft,Positive
מחפשים אותו למה נראה לכם שיפרגנו לא הקנאה שורפת אותם,Positive
תעשה עימות עם האנשים שבחרו בך קודם,Positive
"אם אתה באמת מאמין שהמשפט זה תיקים תפורים והוא יצא זכאי, אז תנו לזה לקרות כבר ונסיים עם השטות הזאת. זה שאתה מנסה להפסיק את התהליך הזה אתה רק משחק לידיים של כל מי ששונא אותו כי חושבים שיש לו מה להסתיר. לא עדיף להתמקד בדברים אחרים שישיגו לך קולות?",Positive
הצבא שלנו זה צבא העם!הם הבינו שהם בדרך הטובה והנכונהאין על החיילים שלנו❤,Positive
מרגש מאוד ילדים אלופים פרגון מלא ואהבה גדולה ממש גרמתם לי לבכות 💜 גולני מזה מגניב☮️💜🎼🎶♾🍀,Positive
@BarNahum5 דווקא במקרה הזה ביבי זונה שלהם.,Negative
זאת התרבות הערבית....לא נראה להם?יש אלימות......לכו לסוריה ולאיראן שם מקומכם בוגדים,Negative
כל הכבוד לשוטר...,Positive
שישלם כנס כמו גדול,Positive
טפו יגוי מסריח חזיר,Negative
זוכרים אחרי הבחירות השניות לפיד רדף אחרי ליברמן לוינה שניהם יושבים בבית קפה אז או שליברמן הומו או שהוא עשה קופה😂,Positive
הלוואי ותנצח את הפרזיט עם הפה הגדול. כלומניק עלוב,Negative
חולה עלוב,Negative
רפואה שלמה ותודה לך ראש הממשלה,Positive
הנוכל והרמאי.,Negative
ביזיון פשוט חיות אדם אין בכם טיפת תרבות ברברים!,Negative
סמרטוטי ריצפה,Positive
לא רוצה לחשוב,Negative
כל מילה בסלע. כל הכבוד יאיר,Negative
והתייר האירופי מה איתו??? מחוסן?! החיסון הוא מדהים אבל עדיין לא בר הצלחה של 100% כמה טימטום וסיכון מיותר!,Positive
כמה אתה קשקשן מי מאמין לך כולך רק דיבורים פאקה פאקה,Negative
חמור תישאר חמור כל מי שבגד בליכוד סופו ניזרק לפח,Negative
היה מיתקשר לאלאור עזריה,Positive
איזו בושה.צחצח.ערס.מגעיל.ברברי.,Positive
גייס חמישי רפובליקת בננות אני רוצה לראות חבר פרלמנט יהודי יעשה את זה בפרלמנט של מדינה ערבית...מדינה פושטת רגל יד וראש....,Positive
בעזרת התביעה היא תשלם את החוב למשלם המיסים,Positive
אתם מחבלים עמי פופר צגיק,Positive
מפגר עם דרגות ...,Negative
"יש לציין גם,שהערבי שניסה לדקור בבית חולים תל השומר ולאחר מכן ירו בו המאבטחים ומת, אמר לאביו שאם ימות הוא רוצה שאיבריו יתרמו וכך אביו עשה .. וברור שהאיברים גם יצילו יהודים .כל הכבוד לו ולאביו על המהלך הזה .בלי קשר לכך שניסה לדקור או גם לרצוח",Positive
טפש!!!,Negative
חושבים שהוא קיבל עונש ?!? חחחחחח הצחקתם אותו,Positive
"לא נורא, יש עוד הרבה דגים (פלסתינים) שצריך לדוג אותם מהים הישר למחבט",Positive
עבריין מין,Negative
פתח באש עדיף שתשב בכלא מאשר שאמא שלך תשב עלייך שבעה,Positive
נו.... זה הההההמקום של המחבלים,Negative
איימן עודה סיר עאן דומאק הותלחסק אנעל אבו אבו אלגיבאק,Negative
פרצוף לפיד בדיוק כמו חזיר ולמה? כי הוא אוכל חזיר,Negative
"כל הגועל שיוצא מהפקולטה למדעי הנאורות, צחנה",Positive
רק בן גביר,Positive
כל קלאב יזי יומו,Negative
@NirTsadok בת אלף זונה &gt; בת אלף זונות,Negative
אני לא מבינה איך בוחרים בך ???הרי אתה טיפש אנלפבתי .אינפנטילי ועודדדדד ..רוצה להיות ראש ממשלה,Negative
"מה שדדש, פניג׳ל, גיידמאק, גומא אגייר ז״ל, טביב. לא הצליחו לעשות.בא משה חוגג והצליח!מה אומר לך משה, אתה כישרון.",Positive
אני מציע שיעשו ניווט מתודי יענו בלי לצאת מהבסיס הכי בטוח. ינעל העולם. שלא יעשו ניווט ליד גן ילדים שלא יזרקו עליהם חול,Positive
זה בגלל הוותרנות שלנו כלפיהם אילו זה היה הפוך לא היינו מעיזים אפילו לחשוב על התנהגות שכזו,Positive
"וואלה אתם שמאלנים לפי הכותרת אפשר לחשוב שהצדיק בא להדליק נר , רק בכתבה כתוב שהוא ניסה לדקור את השוטר",Positive
נו מה את מי תמנה את מי שמנדבליט הדיח כממלא מקום בגלל שהתחיל ליבדוק את הקשר שלך עים אלשייך במימד החמישי וה4 מיליון שהעלמתה והחלאה מנדבליט מגוננן עליך,Positive
כשנותנים לשייטת רובי מים להשתלט על ספינת מחבלים מה הפלא.. צריך חשבח אותם ולתת להם אות הוקרה שלא ירו בו,Positive
רק בגץ אשם,Positive
כמה ריקבון משטרת ישראל🤮 מי שמייצג את החוק עובר עליו.,Positive
אוי ואבוי שהקבוצה נראת כך.או ואבוי למאמנים שקיבלו שחקנים כאלה.,Positive
מדינה בדיחה...,Positive
פדופיל לכלא תשכב עם מחבלים,Negative
"למה ""עדויות"" זו חקירה משטרתית? לא. זו חקירה עיתונאית. אם פשע שיתלו אותו. אבל למה לתלות בטרם הדברים נחקרו משטרתית, כתב אישום, משפט... כמו במדינה מתוקנת.",Positive
"אין כבוד לשום בנטדם שמשרת את המדינה, אבל הראש מסריח מהראש...",Positive
זה מה שמקומם אותם איפה הם היו כשפינו את גוש קטיף יצהר ושאר ההתישבויות הישראליות שהם באמת אזרחים ישראלים לא כמו הבדואים שמגיעים למרכז לגנוב רכבים וכסף,Negative
Shani Shrikiהיא עברה בהצלחה את הוצאת התוספתן והיא בהתאוששות. תודה לאל אפשר להמשיך בשיגרת חיינו 🙏🏻,Positive
כל פישר רוצה עימות,Negative
אז ביבי תגיד הליכוד חוזרים לחיים,Positive
@cfcprag יבן זונה,Negative
הטרדה מינית ? מי ירצה לגעת בנזלת הזאת ?!,Negative
"ככה יעשה למי שרוצה לפגוע בחייל/שוטר,",Positive
יופי כול הכבוד יהיה עימות ומה אז? .....זה לא תחרות למי יש זין יותר גדול....אתם מתנהגים כמו ילדים בוא נריב בפריים טיים ככה אולי נקבל עוד קולות.....פשוט חבורה של ליצנים עם חליפות,Negative
מקווה שהמדינה תדע לפרגן להם כמו שצריך.,Positive
כוס אמא שלהם,Negative
מקומך בכלא,Positive
לך לישון אולי אתה עייף,Positive
ואז שוב איזה נגיף צפון קוראני ושוב סגר תשאירו אותם שמה תנו לחיות פה קצת בשקט,Positive
צריך לנסות לדבר איתם וליצור דיאלוג ראוי יש לנו מספיק צרות אין סיבה לא להגיע איתם לעמק השווה,Positive
ביבי אין עליךטוב עשיתה,Positive
הקבוצה הכי חלשה בליגה ביתר ירושלים וחוגג רק מרסק תקבוצה מוכר שחקנים בסוף הקהל עוד יתגעגע לטביב,Positive
כל הכבוד אחלה גבר להם מותר הכל קבוצה של פושעים עם תעודה,Negative
עלוב נפש!,Negative
רק בריאות ונחת לכם👍🙌🤏🙏🌹🤩😘,Positive
הוא צודק צריך חסינות מהאשמות ההזויות שטופלים עליו,Positive
צודק בכל מילה.,Positive
הוא גיבור בחסות החסינות,Positive
רק ביבי ! לשים פתק מחל ! רוצים חאן אל אחמר ז' ? הצביעו ביבי !,Positive
מי יכול לבחור ברוסי חמור כזה .רק מבוגרים .ורוסים שיש להם אינטרס,Positive
"בן גביר אתה אלוף.אבל ואבל גדול לדעתי אתה עושה טעות ענקית בתור טירון בפוליטיקה בתמיכה האבסולוטית שלך בנתניהו ובייחוד בליכוד.זאת טעות טקטית ממדרגה ראשונה נתניהו מרגיש ויודע כך שאתה בכיס שלו, במקום זאת צריך לתקוף את נתניהו על מגיניותו הרופסת ונטייתו לשמאל בכל המישורים.",Positive
מה עושה שם בכנסת שונא ישראל זאת השאלה?,Negative
מה יהיה איפה ההרתעה החיילים הפכו לליצנים העיקר להגיד קרבי אין בטחון לא לחיילים ולא לשוטרים נא להתעורר,Negative
שורף לוו קשות אמאלה,Positive
להם מגיע הכל,Positive
"סורי, עם כול הטרור והצרות שהפלסטינים עוללו לישראל קשה מאוד יהיה לתת בהם אמון .ואם יש כאלה שבאמת רוצים לתרום למדינה,שיעשו 3 שנים שרות לאומי וזה יהיה מבורך.",Negative
מגיעעעעעעעעעעעעעעעעעעעעעעעעע,Positive
כל מה שבניתה במשך עשרות שנים הרסתה כל חלקה בישראל לך לך לך לך,Positive
לפידוש אנו סומכים על בנימין נתניהו ראש הממשלה שלנו,Positive
סולבו לך לבית הרסת את ביתר,Positive
Or Gabay אכלת אותה אחי חחח,Positive
לך לעזה אצ ויאיסמן זבל נדבק לזבל כמוך בדיוק נוולה סרוחה לכי לקיבינימט חתיכת זבל עזה עזאזל מחקה לך,Negative
מי בוחר באיש הזה מה עשה עבור מדינת ישראל דבר אחד שיגיד שעשה,Negative
כל הנוכלים נימצאים ברשימה שלו,Negative
למה מי אתה בכלל שיעשו איתך ראש בראש ?,Positive
לא היה אמין כל הדרך זהו מטיבעו גנץ זהו ניגמר לך לא שכחנו צוק איתן והמיימד החמישי,Positive
"@misskarma6969 ""אולי אני זונה אבל לא שלך""
 משפט שמגיע לו להיות סטיקר",Negative
אין עליך איתמר האלוףנאמנים לדרך מצביעים ט בקלפי❤️,Positive
מזכיר לי את הרצוג. #,Positive
@kann_news @yaara_shapira נראה את הבן זונה שיתקרב אליי לבית בגלל שלא התחסנתי.,Negative
פרסום מגמתי ושיקרי.כולם עושים בדיקות ורואים שישראל יקרה מכל יעד אחר ולכן התיירות לא בדיוק מרנינה... שקרים על שקרים,Positive
קדימה בן גביר כולם מאחוריך 7 מנדטים בעזרת ה׳,Positive
"צריך להזכיר להם שגם הדרוזים ברמת הגולן קרעו את תעודות הזהות שנתנו להם לפני 3 עשורים. היום הם מחפשים את פיסות הנייר שגזרו ומבקשים תעודות גם לקרוביהם בסוריה. גיא בכור קורא לחברה האלה ""חולות נודדים"" כדאי להפנים את הכינוי ולהתייחס בהתאם.",Positive
רק בריאות,Positive
שוקיסט,Positive
תותח על בן גביר,Positive
"כשתעוף מהעיניים שלנו, כולנו נחזור לחיים!",Negative
"האיש המיותר הזה בן אלף וחברו לפשע סמוחטיץ, חייבים לשבת בכלא לשארית חייהם העלובים! על הנזקים שגרמו למדינה?",Negative
ממש יופי .....טעות טקטית !להכניס עוד מוטציות 😏,Positive
"אדם שכולו לב, שעבר מצד אחד של הובלת הפגנות נגד המדינה, לצד השני של עזרה ללא תמורה.",Positive
"איך גונבים מחייל קומנדו? אולי כי חייל הקומנדו העדיף לוותר על נשקו מאשר למצוא את עצמו נותן הסברים לפצ""ר על ירי אולי פרשת אריה שיף חילחלה גם לקומנדו עד מתי ניתן לחבורת כסתחים לקבוע לחיילינו כללי התנהגות הזויים ובכן בבחירות הקרובות יש לעם הזדמנות לקבוע מי יחולל שינוי רדיקלי והאיש היחיד שמסוגל להגן על חיילינו שמו איתמר בן גביר הצביעו לו ואני מבטיח לכם הנושא יטופל לעומק",Positive
״מחבל״,Negative
"חולי נפש, מתעסקים עם האנשים העניים ביותר במדינה. צרות עין של אפסים",Negative
@WhosEmili כי את זונה,Negative
זה כמו שאיינשטיין ידבר עם קיר,Positive
"שוטר ירה בשב""ח כל הכבוד לשוטר צריך לקבל דרגה יותר גבוהה",Negative
איזה חמודים❤️רפואה שלמה לשרה המקסימה,Positive
ילד של אבא משפחת נתניהו לקחו את כל המדינה כעסק פרטי של המשפחה,Positive
רק ביבי,Positive
@MayaBliAlef @Rabinova ובעברית צחה: זונה או ברה,Negative
ממורמר גואל נפש,Negative
יבת זונה מה פיימוס ארה מה את מתלהבת מזה שאת טרנספובית ימזדיינת,Negative
נו מה יהיה? עכשיו יביאו לפה את כל הוריאנטים? לא למדו עדיין?,Positive
מה נותנים לטמבלים האלה להיות חברה כנסת?,Negative
