text,label
" מכיוון שהמקור לכל הבלאגן פה הוא דתי, גם המחלוקת בין היהודים היא דתית: מדינה יהודית או מדינת כל אזרחיה? הקטע הדמוקרטי משני. כל עוד בין היהודים מתקיימת המחלוקת הזאת, אין לנו (הרוב שהוא בעד מדינה יהודית) באמת עניין שהערבים ירגישו חלק. מסתפקים בזה שלא ינסו לרצוח אותנו.",Negative
"הייתם בצה""ל פעם? נכון מצחיק? תחשבו מה יקרה אם כזה יארגנו מלוניות ממשלתיות ויתנו לצה""ל לנהל אותן. צחוקים רצח",Positive
 הזיה. ביבי מבחינתם זה מדינת ישראל. אם ביבי יגיד שצריך לייבש את הכינרת זה יהיה מבחינת העבדים שלו הדבר הכי ציוני שאפשר לעשות.,Positive
 לא ניתן לכם להקים מדינת טרור בלב הארץ,Negative
: הבוקר פורסם שהמחבל שנעצר באשמת רצח אסתר הורגן הוא בעל עבר של פשיעה לאומנית. אתם יודעים מה זה אומר? זה אומר שהפיגוע האכזרי י…,Positive
 אין בעייה תעשו את זה איפה שאתם רוצים רק לא במדינת ישראל אנחנו לא שפני ניסיון שלכם ושבענו מרורים מספיק מההזיות של המאל הרבה מאוד דם נשפך כאן הרבה מאוד בתים חרבו הרבה מאוד חבלי מולדת נמסרו לאויב הרבה מאוד פיגועים והרבה מאוד טרור הרבה פחות ביטחון אישי ולאומי לא תודה לכו לאוגנדה,Positive
 את זה אני מכיר שאלתי על קרן אברהם ובמה הקרן הזו מתנגשת עם היוזמה האחרונה של ביבי ( והברוכה בעיני) לקדם הצבעה של ערביים שאינם תומכי טרור פלסטיני,Negative
" הוא יכול להיות גאה, הצליח לרצוח נער גבעות עם הארס הקבוע שהוא מפזר נגדם",Negative
 לך תהיה עוכר ישראל במקום אחר. בגלל חארות כמוך אמשיך להצביע לנתניהו🇮🇱🇮🇱,Negative
 בקשר לפנס השמועה אומרת שהוא קשר ביולי קשר לרצוח את הנשיא והוא במעצר ופנס שאנחנו רואים זה כפיל.לא מצאתי אימות לזה אבל כשמחברים את הנקודות וה . הוא לא עושה כביכול כלום עם האלקטורים המזוהמים אז מבינים שצריך להציג אותו לציבור כבוגד? בהנחה שווד לא מצייץ שמות מהשרוול...נמתין ל .,Positive
נייל אנטישמי,Negative
" את ביבי,כי הוא מפריע להקמת מדינת כל אזרחיה,שריפת דגל ישראל ביטול חוק הלאום כדי שתושבי עזה לבנון ירדן סוריה הפלשתינים יתיישבו בערי יהודים,וירצחו את כל עם ישראל בשם מדינת פלסטין,אתה נותן יד לרצח העם שלך",Negative
": ""גם כיבוש בלית ברירה הוא משחית. גם כיבוש נאור והומני וליברלי הוא כיבוש"". עמוס עוז, גדול סופרי ישראל, נפטר היום לפני שנתיים.",Positive
 איזה נימוס ואו שישחרר את פלסטין!!,Positive
": אתמול הלך לעולמו גילברט נקש, מנהיג חשוב של השמאל התוניסאי, יהודי ממשפחת נקש. הוא היה אנטי ציוני וקרא להפריד בין יהדות לצי…",Positive
 על תמונות פרופיל כמו שלך כבר היית מוצא להורג גם בעזה וגם בגדה. אז אני יודע שעמוק בלב הצבוע והגזעני שלך אתה מתפלל שישראל תמשיך לשלוט באזור כי שלטון כל פלג פלסטיני שהוא ואתה עולה על המנוף הקרוב לביתך. אתה רומז שמיליון מאזרחי עזה הם בני + שגורשו ב'? או שאתה שקרן תועמלן?,Negative
"יש לי תיאוריה על ימי ראשון. יום ראשון זה כמו סרטן, זה תמיד סיוט השאלה רק אם זה משפיע גם על שאר ימות השבוע.",Positive
 טרור הוא טרור . גרפיטי הוא גרפיטי. אין סתירה. אבל חלק מפעילות תג מחיר הן טרור ולכן המושג מטעה.,Positive
: אחי אתה אהוב ויקר אבל המילים של יריב וההשתלטות שלו על השידור דרש מעבר תחנה יריב הוא אנטי יהדות פ…,Positive
נייל יא אנטישמי תענה לי לשאלה,Negative
 תודה על התשובה. לא קונה את החלק הראשון. מפעל ההתנחלויות החל הרבה לפני האינתיפאדות. אף אחד לא הולך לגור שם בשביל למנוע טרור. 'דפנה את שומעת אולי נעבור לגור מעלה מחמש ליד קרית ארבע כדי למנוע טרור לתל אביב'.. נו באמת אוריאל.,Positive
 יש אנשים שאוהבים אנימה והם סימפ לדמויות שם (אנימה זה מצוייר) והם המציאו מיניות שנקראת אנימה-סקסואל וזה מעצבן רצח והם מנסים לדחוף את האובססיה שלהם לדמויות לא אמיתיות לתוך הקהילה הגאה וזה הומופובי רצח,Positive
"אין קורנה תרקדו. ואם חלילה אחד ההורים של אחד התלמידים או אחת המורים תדבק ותמות, צריך לתבוע אישית על רצח מדרגה ראשונה את חבר הכנסת לא. כל מי שמצביע בוועדה לחינוך. ככה פשוט וקל. על כל מורהנורה שידבר או ימות בגלל ההחלטה של הוועדה, עוד מאסר עולם על רצח.:.",Positive
" רוצחים בגלל הקורונה. הם שכנים שלי. מותר להפגין אבל לא בצורה כזאת. שיפגינו על המדרכה כמו שצריך. היחידים שהייתה להם הצדקה להפגין אתמול היו המתנחלים שמחו על רצח סנדק בידי המשטרה. החרדים הספציפיים האלה חוסמים את האזור שלי כל שני וחמישי כי בא להם. לא, אין להם זכות לזה.",Positive
" נדמה לי שפעם ראיתי אבל את האמת על מה שקרה שם, ידעו הרבה שנים אחרי. במשטרים חשוכים קשה לקבל מידע אמין,האם יש מישהו עלי אדמות שהעריץ או מעריץ רוצח המונים? כן, רק חולי נפש....אבל איך זה קשור להיום? זה מצדיק במשהו את הטירוף של הנאשם שגרר מדינה לבחירות ? שלא רואה ממטר כולל המדינה?",Positive
" תראה איזה דמגוגיה בשקל.... האם יש בעיה שהוא יביא קולות בבחירות ממגזר זה או אחר , לא. עכשיו הוא לא אמר שהוא הולך עם המפלגות הערביות ( הנציגים שלהם תומכי טרור), הוא מנסה לחשוב מחוץ לקופסא, בתור איש מחנה הלאומי כל עוד זה לא פוגע בעקרונות שלנו אהלן וסהלן.. הוא לא יגמור את הערכים זה",Negative
" מה יותר נכון, ערכי ומוצדק מאשר: ״ תמונות של שוטרים פצועים, אבנים על מכתזיות, תקיפת נהג ערבי של אגד שנכנס לבת עין.... משאירים את נוער הגבעות ותומכיהם כקומץ סהרורי, שאף אדם נורמלי לא ירצה להזדהות איתו ולתמוך בו.״ למה חבל שהקומץ הסהרורי הזה מוקע ואינו זוכה להזדהות או אמפטיה?",Positive
" די נמאס לי לחזור על עצמי, אין הבדל בין פושעים בסוגים שונים, אם יש מבחינתך הבדל אתה גזען. לא לקרוא למשטרה על הבן שלי, זה לא כמו לא לקרוא למשטרה על ילד טרוריסט שלך. יאללה צאו",Positive
#מלךהחיסונים מוחמד דבאח שבר את השיא הישראלי עם  חיסונים ב־ ימים.:.,Positive
"  עבריינים נוסעים בשטחים לעשות פיגוע אחד העבריינים מת כתוצאה ממרדף כואב, מי אשם? ההורים שלו, חינוך חרא. הרבנים שלו ששטפו לו את המח לשנאה מלאה נגד כולם ושמו בסוף אותו מתחת לרכב השר הפח אוחנה ושקד שבאו לנחם משפחת עבריין שנהרג הכל הפוך חבל על הילד, לא היה לו סיכוי ברגע שהמוח נשטף",Negative
 קרן אברהם..??חחח למה לא קרן מוחמד? לא קרן ישו? אברהם מצלצל יהודידתילאומני מהנדסים לנו בתודעה,Positive
" ימים חלפו מאז נעצר הרוצח של אסתר הורגן, הי""ד, אבל בית המחבל עדיין עומד על תילו! כל יום שעובר מבלי להורס את הבית, פוגע בהרתעת 🇮🇱 כלפי המחבלים שבאים לרצוח יהודים. חבל ששר הבטחון שלנו עסוק יותר בהישרדותו הפוליטית במקום לפעול להגנת אזרחי 🇮🇱. מגיע לנו טוב יותר!:.",Positive
 אין. בלי פושעי המלחמה הערבים - מה יהיה ״מנוף השכנוע״ של השמאל להקמת אמירות טרור בטווח מרגמה קלה מכפר סבא?,Positive
"הסייעת ניסתה לרצוח אותי באמצעות כמות מוגזמת של חריף הסלט, ועוד חתכה קטן קטן קטן, שלא אוכל להפריד הצידה. הנקמה תוגש בהקדם.",Positive
": נסראללה ב""ראיון סיכום השנה"" בערוץ ""אל-מיאדין"" הלבנוני: ""יורש העצר הסעודי מוחמד בן סלמאן הציע שארצות הברית תתנקש בחיים שלי,…",Positive
" גם אצל איסלאמיסטים (ג׳סטה שהפכה מזוהה עם דאעש) יש ענין עם אצבע מופנית למעלה שמסמלת ״תווחיד״, אין אלוהים מלבד אללה",Positive
" לדעתי לא מגיע לו לאף אחד עונש מוות. אבל אם זה היה מחבל באירוע, היו קוראים לו מחבל (על אף גילו) או מפגין בהפגנה היו קוראים לו מפגין, הוא היה שם בתור נוער גבעות ונפגע במהלך ההתנהגות שלו. ולכן הכינוי הרלוונטי בתיאורו. אם היה נפגע מברק או נדרס באמצע הרחוב בלי כל קשר, לא היו מכנים.",Positive
" שהוא אוייב אז לא מפריע לי אם הוא מת כי סיכן את אחים שלי. ושלטובתנו אנו צריך לעשות תחקיר פנימי על התנהלות המרדף. פה בדיוק הבעיה שלי. שוכחים להבדיל יחס בן אוהב,אח,יהודי. לאוייב ערבי.",Negative
 פיגוע דריסה! ערבי!,Negative
" ^ הדיסוננס השמאלני הידוע כשהם מגלים ערבי ישראלי יותר ציוני מהם, והמסקנה המתבקשת להפסיק לעשות הנחות לערבים תומכי טרור מנקרת במוחך ואתה חייב לסלק אותה לפני שתקנה לה שביתה ר״ל",Negative
 בולשביקים אדומים אויב של עם ישראל יש לגרש אותם לעזה דחוףףףףף,Negative
 יש מצב שיש מושג חקלאי כלשהו שנקרא גידול ערבי או שאתם פשוט נאצים? שואל ברצינות,Positive
 צריך לשלוח אותך לתאי גזים כי אתה אנטישמי.,Negative
" גם עיתונאי וגם מחבל, שתי ציפורים במכה אחת! (סתם, סתם, הוא ניסה להרוג ערבים, זה לא נחשב מחבל)",Positive
" יש גם את הרש''פ ואת חמאס שהורגים לא פחות מהם, אז מה? ימ''ר ש''י אפילו לא *עצרו* פלסטיני בשנים האחרונות...",Negative
 אם השוטרים פגעו ברכב בו הוא נסע הם פושעים וצריכים לעמוד לדין פלילי. ומאידך אם הוא באמת זרק אבנים על מכוניות נוסעות הוא מחבל. מחבלים יש להם התנהגות אחת וזה תקף לכל בני האדם שהורגים אנשים חפים מפשע יהודים ערבים סינים הודים וכ׳ו.,Positive
 אנטישמי שונא חרדים,Positive
": יש הבדל בין לשריין ערבי לבין לשריין מחבל או תומך טרוריסטים, זה רק מעיד על הגזענות והאדנות של השמאל. רוב…",Negative
קורונה ברשות הפלסטינית וברצועת עזה - קובי מיכאל (פודקאסטרטגי ):. דרך,Positive
": השוטר החולירע הזה עם הזקן הג'ינג'י אלים בצורה מחרידה - יימח שמו וזכרו, וגם של הבן זונה ששו…",Negative
"טס לחו""ל רק בשביל ערבי השירה בציבור ומועדון הספר במלוניות פיקוד העורף",Positive
" מה זה מוכיח? חולה נוטה למות שנהרג בתאונת דרכים, נספר כהרוג בתאונת דרכים, חולה נוטה למות שנהרג בפיגוע, נספר כנהרג בפיגוע, חולה נוטה למות שנרצח, נספר כקורבן רצח, וחולה נוטה למות שחלה במחלה שקטלה אותו נספר כקורבן המחלה שקטלה אותו. אני מבין שיש לכם סרגל שקובע איזו תוחלת חיים נחשבת.",Positive
מה העין שלכם עליו הוא חתיך רצח אם כבר אשטון זה שצריך להתקלח:.,Positive
"נדרש דיוק .לאמר, ה""חיזור"" של המושחת אינו עם הערבים אלא עם הקיצונים ביותר , מפלגת התנועה האיסלאמית המזוהה בפומבי עם חמאס. תגובות הביביסטים נלעגות יותר מתמיד.",Negative
" נראה לי שאם מישהו ניסה לרצוח אותך, אז לגיטימי לקרוא לו כלב תקיפה ולאדונו נוכל",Negative
" המבחן הגדול הוא הבקשה האחרונה של פרקליטי נתניהו לפסול את כתבי האישום בשל העדר אישור היועמ""ש. אם מערכת המשפט מדגלת מעל המשוכה הבלתי עבירה הזו אז הכל מכור. אפשר להתחיל לשרוף פחי אשפה ותחנות אוטובוס..",Positive
" ואם זה היה ישראלי ערבי, הייתה אומר ""במחילה""",Positive
" נכון, במחאות של נוער הגבעות בירושלים אין ערבי שנהרג. והיקפי הטרור של נוער הגבעות הוא לא מתקרב להיקפי הטרור של הפלסטינים. זה בערך כמו הפער בחיסונים בינינו לבין איטליה😉",Negative
" נתניהו לא אמר שהוא יחסל את החמאס, הוא אמר שהוא ימוטט את שלטון חמאס. יש הבדל מהותי. אני מבין שציפית כמו רוב העם לדם ואש ותמרות עשן. אבל הוא עובד בצורה יותר אלגנטית, עם סנקציות כלכליות, חנק דיפלומטי, ושלילת הלגיטימיות של חמאס גם בעולם הערבי. זה לוקח יותר זמן, אבל זה יותר אפקטיבי.",Positive
" מוחמד הכנעני אחלה שחקן, ג'קי עוד יעשה עליו חבילות",Positive
 למה לא משתפים ערבי ישראלי בפנל?,Positive
 למה אין ערבי ישראלי בתמונה הזאת?,Positive
זה סגר כמו שאני ערבי:.,Positive
" לא רק. מדובר באזרחים ישראלים לכל דבר שמבצעים פעולות טרור ,בשונה ממחבלים שאיתם יש לנו סכסוך. בנוסף מדובר בביטחון הלאומי וקבוצה של אזרחים שאינם מאמינים בקיום מדינת ישראל ורוצים להבעיר כאן מלחמת דת.",Negative
"""היום הסורים הולכים ללמוד שהיד שמנענעת את העריסה יודעת גם קראטה"" צ'רלי שין, ניחום אבלים לקוסם צבאי, איקאה סניף ירושלים כשר מהדרין, ",Negative
" לא אמרתי שהוא שאני מסכים איתו במאה אחוז. אבל הוא תמך בשיוויון לאומי לערבים, מה שהימין של היום מגדיר כלא ציוני",Positive
" זה לא מקרי בכלל. כל הסיפור הזה נועד כדי שהגרמנים יוכלו להשמיד את מדינת ישראל. בזמן שכל העולם ""מתעכבים"" עם החיסון, ישראל כבר תספיק לחסן את רוב האוכלוסיה. ואז כמובן בעולם לא יחסנו בגלל התופעות שיקרו לנו🤭🤯🥶",Positive
 לא קשור זה קששור אם יש בו נגיעות או לא ותותים ערבי זה יותר אסלי ופחות מרוסס וסביר להניח שיהיה בו יותר תולעים כמו תאנים,Positive
גזענות מזוקקת- שמאלנים שלא מבדילים בין ערבים תומכי טרור ומעודדי אלימות לאומנית לבין ערבים שמגנים אלימות ורוצים להשתלב במדינה,Negative
": אלוף החיסונים של ישראל, מוחמד דאבח, אח בקופ""ח כללית בכרמיאל: ""חיסנתי ב- ימים  איש. אני עובד  שעות ביום, מחסן  איש ב…",Positive
"השר לשיתוף פעולה אזורי אופיר אקוניס הגיע היום לניחום אבלים בבית משפחת הורגן בטל מנשה: ״פגשתי משפחה יהודית גאה, ציונית ואוהבת עמה וארצה. זאת היא מורשתה של אסתר הי״ד שנרצחה על ידי מחבל אכזרי: לבנות, ליישב ולחזק את ארצנו ועמנו.״:.",Positive
 א. הם לא נראלי עדיין חברים ב. היא אובססיבית לאיזה פסיכופט אחד שיש עליו סדרת ספרים והוא גם אנטישמי והתחפשה לאשה שהיא אחת מהקורבנות שלו וגם היא אמרה נראלי דברים גזעניים כמה פעמיים,Positive
#דובאי נוקטת באמצעי מניעה קפדניים במהלך חגיגות השנה החדשה בראשות השייח 'מנצור בן מוחמד בן ראשיד # # #COVIDー:.,Positive
" ההורים של איאד אלחלק מחכים לביקור שלך, אהה רגע לא הוא ערבוש בהם מותר לירות",Positive
 החלום שלהם הוא לא רק לזרוק אומנו מהארץ אבל גם להשמיד אותנו לחלוטין,Positive
 הגזמתם.רוצח ראש ממשלה זה סוג של בגידה במדינה . כי ברור שזה פגיעה בשילטון. וזה דומה להפיכה . תפסיקו להיתמם .זו ממש חוצפה,Negative
" אדוני המזכיר, אני מנסה להסביר להם שכדי לפתור את בעיית האלימות בחברה הערבית הם חייבים ללמד את הדור הבא שלהם שאלימות זה רע, אי אפשר לחנך ילד לאלימות ואז כשהוא גדל הוא רוצח את השכן שלו.",Negative
" הבעיה העיקרית שלי עם ""השמאל הציוני"" זה שפעם אחר פעם הוא מסית נגד השמאל וחותר תחתיו כדי להוכיח לימין שהוא ""ציוני"" מספיק. בכל פעם שיש בחירה בין ערכי שמאל וערכים גזעניים, הם מתייצבים לצד הגזענות. לצערי, הם הסיבה העיקרית שאין שמאל בארץ.",Positive
אתמול ילד מהכיתה שלי רצה לרצוח אותי,Positive
 אין נציג ערבי עם כושר אלקטורלי לליכוד אפילו במגזר הדרוזי נתקענו עם הליצן איוב קרא שמצטייר כפאנליסט הזוי אצל שי בשידור,Negative
קצת בבלאק אאוט. בכמה ימים נוספו לי כ  עוקבים. וכבר חציתי את ה עוקבים. קצת בבלאק אאוט. כי להפוך מאדם רדוף עד מוות בידי רוצח עלוב ושפל (ח.צ.) לאדם שפרץ את מחסום האנונימיות זה בהחלט מרגש. אך אל דאגה אני יתאושש. זו רק ההתחלה. והרבה דרך לפנינו עד שנשיג צדק. ומנרדף אהפוך למושל,Positive
" שיקראו לך טפיל מוצץ דם משריץ ילדים וגידול סרטני ממאיר מפיץ מחלות ושרואים אותך מבינים את הנאצים ושתחטוף מכות רצח משוטרים אז גם אתה תתלונן... השמאל בוכה כבר שנים על זה ""שגנבו לו את המדינה"" למרות שהוא הכי פיריבילגי.",Negative
 המילים האלו אינן קדושות הקונטקסט עושה אותן גזעניות או רלוונטיות אין שום בעיה להגדיר בטבלה ״חרדי״ ״רוסי״ ״דרוזי״ ״ערבי״ כל עוד יש תוכן ענייני זה נכון לכל מילה גם ״פרה״ אם הקונטקסט רעיל.,Positive
 ביבי יוכל ליבא ערבי מחמד מאמריקה יש שם הרבה .,Negative
 אוקייי אז עוד עשר דקות כזה למרות שאני מביך רצח ואני לא יודע לדבר אבל כן,Positive
 להיכנס לפוליטיקה ביחד עם תומך טרור זה לא החלטה שאתה עושה ביום אחד...,Negative
" זה לא מה שהיא אמרה! גם אני במחנה שלה, וגאה!!!🇮🇱 לטעון שכל מי שלא במחנה נתניהו, הוא עוכר ישראל, ליגה ז', מפיץ מחלות, אזרח סוג ב' דעתו לא נחשבת ואינו יהודי(וזה רק חלק) זה טירוף, הסתה פרועה של המחנה שלך, ואתם ממש לא שווים יותר, תתביישו!!!!!!!!!!!",Negative
 זה בטוח אוצר פלסטיני.,Negative
" רק החרדים!!! הם תמיד אשמים גם בשנאת הערבים וגם ע""כ שאירן רוצה להשמיד את ישראל... וגם.... תמשיכו אתם",Negative
: זה כמו לומר ״יהודון״. זה לא באמת בנאדם שזכאי לחיים. זה כולה נער גבעות. סוג של מכרסם. או חיית שדה כזאת. מה זה…,Positive
" אין ספק שהאירוע מזעזע וצריך להיחקר. ילד לא צריך למות ככה ולא משנה מה הנסיבות. נשק שיורה בילד פלסטיני ואין קול זעקה, במערכה הראשונה, יירה בילד יהודי במערכה השלישית‼ צדק לשני העמים גברת שקד‼...זה כל הסיפור. לגזענות שלך ושל חברייך יש מחיר כבד.",Positive
"אבל ערבי כן, יהודי רוצח ערבי זה דווקא סבבה:.",Negative
טראמפ. נובל לשלום. אובמה ערבי,Positive
" עצם העובדה שהעלו לכאן יהודים מצפון אפריקה, מהמזה""ת, אתיופיה אפילו מוייטנאם ללא קשר להשכלתם או לרמה שלהם מוכיחה שהישוב שמנהיגיו באו מאירופה חשבו שהמדינה נועדה לכולם ותתמודד עם פערים גדולים. כל הפוסט שלך שטות. היו קשיים והתמודדו למרות שהיינו מדינה ענייה. סטאלין היה רוצח נקודה.",Positive
 בן גוריון המנוול רצח יהודים ניצולי שואה על האלטלנה,Negative
" נכון. אבל אתה מתייג אותם תחת ""מפלגת מרכז"" בעוד שאת המערךעבודהישראלמחנה ציוני אתה מתייג ""שמות שונים של העבודה"". כאילו למה הקריטריון להיות ""העבודה"" זה שעל הפתק כתוב ""אמת""? למה לא אופי החברים ואופי המסרים וציפיות המצביעים?",Positive
 אין כיבוש נאור.,Positive
 יש לי פה אגרטל מכוער רצח שאמא שלי לא רוצה לזרוק אני מחכה לשבור אותו כבר שנים,Positive
 אל תדבר בשם החברה הערבית אתה לא מייצג את החברה הרבית אתה מייצג את המחבלים עוף לעזה ואל תחזור יה מחבל !!!!,Negative
" הפגנות הם לא הדרך של הרבי זיע""א ולצערי פורקי עול משתמשים בשם של חב""ד והרבי זיע""א כואב מאוד על המוות של הבחור אך לכנות זאת בשם רצח... כל זמן שיש חקירה זה גבול שאסור לעבור",Positive
 אז פתאום גם מותר לרצוח ערבים סתם ץ?,Positive
 עדין לא נהרג. היו נסיונות לינץ. אני לא מסתכל על הקף. ונוער הזוועות לא טומנים ידם בצלחת. טרור זה טרור. ובלי קריצה. טרוריסט ערבי או יהודי דמו בראשו. ללא פשרות.,Negative
 כן כן יש ממש סרטונים שלהם כאילו בכפר ערבי ואומרים תא מרבוטה. זה קורע,Positive
