text,label
 מסכימה איתך. מאוד מעריכה את יוסף חדאד ולכן מאוכזבת מהאופן שבו הוא תופס את המילה ציוני.,Positive
" זה נראה כמו העתק מדויק של מרכז פרס לשלום, שגם הוא עומד כמעט שומם ביפו, צמוד לבית קברות מוסלמי (לפחות לא ממש עליו), ומקרין סובלנות של חומה סינית.",Positive
 צריך שילוב של אנטישמי אנטי ישראלי אנטי ביבי וגזען. הכל ביחד וכל אחד לחוד במידה הרושפת לשעתה.,Negative
" ומוסיף ומדגיש: לדרמר היו יחסים טובים עם הדמוקרטים, כולל כמה מאנשי אובמה שעסקו באופן ממוקד בנושא הישראלי-פלסטיני. הנאום פגע בזה קשות.",Positive
 לא קשה לי עם המילה כיבוש. קשה לי עם שמאלנים הזוים שרק הביאו לנו את הקומוניזם והנאציזם שמנסים להטיף לנו מוסר,Negative
"סמא עבד אל האדי, הידועה בכינוי סקאי ווקר, ה מנבי מוסא, שעוררה זעם ברחוב הפלסטיני, נעצרה ע'י משטרת רמאללה, בהוראת התובע הכללי. הרשות הפלסטינית מנסה להדוף את הביקורת הציבורית עליה כמי שאישרה את המסיבה שפגעה ברגשות המוסלמים. אביה סיפר כי מדובר בצילומים לערוצים זרים.",Positive
"וואינט שכחו מה ההבדל בין עמדה לידיעה והפכו שאיפה ודעה של אדם אחד לדרמה פוליטית. נניח שיש פעיל ימין ערבי שמתנגד לרשימה המשותפת. זכותו. זכותו גם לכתוב על כך טור. אבל מי שיקרא את תוכן הטור יבין שאין שום קשר או הצדקה בינו לבין הכותרת שניתנה לו (""מחנה חדש"") ובטח לא לסטטוס הפומפוזי הזה:.",Positive
בחירות רביעיות הן גם הזדמנות רביעית: הפעם - הכרעה על ביטחון ישראל ועתידה. אנו קוראים למנהיגי המפלגות הציוניות להציג את עמדתכם בנושא הסכסוך הישראלי-פלסטיני.:.,Positive
"אין קורונה ביבי מתעלל באזרחי ישראל מחזיק אותם בני ערובה יש,דיקטטורה דילול אוכלוסייה סרוס עיקור אלה נחיסונחים רצח בדם קר דשישים סובלים מבדידות אין עבודה ושאותים לאזרח כי הוא בורח מכלא שפן פחדן אין לו ביצים והוא לא גבר סתם סמרטוט עלוב נפש מנובל פסיכופט",Negative
 הוא יהודי אז זה רצח כמובן,Positive
" יש מצב שהציוץ הזה משלים את הציוץ שהגבתי לו... בהצלחה עם העולם השטוח. אני הייתי אני ואת כנראה תישארי מי שאת. אגב, תזכירי לי, מי רצח את קנדי? (רטורית כמובן. לא מצפה לנאום קונספירטיבי. שבעתי לשנות דור. היי שלום)",Positive
בן גוריון המנוול רצח יהודים ניצולי שואה על האלטלנה:.,Negative
" נער יהודי זורק אבנים, בורח משוטרים ונהרג בתאונה הימין המתנחלי: מכתב רבנים! מח""ש! ועדת חקירה! בחור פלסטיני אוטיסט נורה ונהרג בעת שהלך ברחוב הימין המתנחלי: *צרצרים*",Positive
עסקים יהיו סגורים בגלל האידיוטים האלה שלא אכפת להם שראש ממשלה שמאשר צוללות למצרים מאחורי גבה של מערכת הביטחון לא יהסס להשמיד את אזרחי ישראל כאשר הוא בורח ממשפט. כן. להשמיד. ככה אני מרגיש. עסקים מושמדים. משלחות מושמדות. חלומות מושמדים. בושה. פשוט בושה. ההיסטוריה לא תשכח.:.,Positive
 זה האמא של הפייר יצאתם לנו מכל החורים אם הפוליטיקלי קורקט והנחמדות הם ילכלכו עלינו ואנחנו נעשה פוצי מוצי לא הולך אני לא חושב שאופנהיימר צריך לשבת איתך באולפן תבין את זה איך שאתה רוצה ועוד הרבה חושבים כך לא רוצה להתבטא בצורה אגרסיבית אבל הוא רקוב ומשנתו רקובה הוא לא ארץ ישראל אויב,Positive
 לא חששתי לשניה אני מבסוט רצח שנחש משקפיים והשרמוטות הפוליטיות שלו יצאו לליכוד ממחזור הדם הבעיה היא שמתפקדי מרץ בליכוד עדיין אתנו וידחפו שרמוטות ונחשים חדשים פנימה ולמעלה מקווה שאני טועה,Positive
" אם לא נתניהו בעמידה שלו ""וביזבוז  שנות אובמה"" אני לא יודע איפוה היו היום כל המתנחלים האלו כפויי הטובה. גילוי נאות גם אני מתנחל בשומרון.אבל לדעתי כפויי הטובה הם מהציונות הדתית",Positive
"היום (השלמה, ג' במרחשוון ו)ה- באוקטובר #היוםבמזרחהתיכון #היוםבהיסטוריה #היוםלפני ביום זה בשנת , ימים אחרי רצח הנשיא עבד אל-ראשיד עלי שירמרקי החלה הפיכה צבאית ללא שפיכות דמים בסומליה בראשות סיאד בארה ששלט במדינה עד ינואר , אז הודח ובסמוליה החלה מלחמת אזרחים.:.",Positive
: זה רק אני או שכשהיה מדובר בנער אתיופי ונער ערבי ואיש חולה הוא לא דרש צדק?:.,Negative
 היו פה ערבים אבל לא קראו להם פלסטינים.עד שנת  בעולם תמיד היו משייכים פלסטין לעם יהודי.,Negative
 הם בטח שרים דמי פלסטיני כמו שאנחנו שרים מעוז צור,Negative
- יוסף חדאד לא עובד באם תרצו. - אתה לא מגיע לקרסוליים של - ערבי מחמד תקרא לסבתא שלך חתיכת גזען נפוח:.,Negative
שלושה רבעים הראשות פלסטינית זה תערובות של יהודים או יהודים ממש וזה בתוך ארץ ישראל בשטח ישראל אבל צודקים הם לא עושים טרור באחים אחיות ובכלל למול הכלל .,Negative
 אבל הסברתי שיש מנעד בין להתנגד לציונות לבין להיות ציוני בזהות האישית שלך.,Positive
 מה גם שצעד כזה עלול להגביר טרור ולהיתפס כחולשה. ראה ״ההתנתקות״.,Negative
" אני חושב שהסתה פרועה היא זו שמובילה אנשים לשרוף מפגינים אחרים, לא הגינוי שלה",Negative
 תוציאו את לי מהשיחה אתם עושים לה טרור בהתראות,Positive
" אני רק יודע שיש עוד סיבוב ועוד פלייאוף וכרגע הפער הוא  נק ( נקודות יותר ממה שמכבי צריכה לשאוף אליו ערב הפליאוף) תמתינו עם החגיגות. ספסל אין למכבי חיפה וקצב כיבוש השערים ייעצר משום שרוקאביצה הוא לא באמת סקורר בדם שנזכר בגיל  לתת גולים, עכשיו מומנטום תכף כנראה ייעצר ותפתח העונה",Positive
" לא בוכים, אבל מתבאסים רצח.",Positive
" פעילות העשרה של איקאה, הדרכה ואימון קרבי של כתר-פלסטיק, ערבי שקופיות על דובאיי, חוגי בית של מפלגות",Positive
" אם רון חולדאי, עופר שלח, ציפי לבני, מירב מיכאלי, עומר בר לב, יאיר גולן כדאי שיחברו יחד. והייתי מציעה שגם יצטרפו אנשי עשייה עם הוכחות מהסקטור הערבי אליהם שיקימו מפלגה משותפת יהודית ערבי הגיע הזמן לשותפות.",Positive
 נו באמת רואית. הוא לא ציוני (בדיוק כמו החרדים) ולא תצליחי להפוך אותו לציוני. הוא מייצג % מאזרחי ישראל שמופלים לרעה מהלידה עד מותם. אם את מחכה שהם יהפכו לאיוב קרא ולמהללי הימין תמשיכי לחכות והבעיה תתעצם. רובם רוצים להשתייך לחברה הישראלית (תהליך שיקום שנים). אותי זה לא מפחיד.,Positive
 הוא פיריוד רצח,Positive
" אחי שהשם ישמור אותך. האם אתה רואה בחמס שיש לו אמנה שהוא מצהיר בה, שהוא רוצה להשמיד כל יהודי ארץ ישראל, כתנועה נאצית? האם אחמד טיבי שרואה בחמס תנועת שיחרור, אתה רואה בו נאצי?",Positive
"מי שלימד אותי לרתך היה ערבי מבוגר מהכפר הנוצרי טייבה. במבשלת הבירה שיש להם בכפר, יש אפילו הכשר מרב הההתנחלות עפרה הסמוכה. האדם החביב, בן  בערך, סיפר לי שהילדים שלו למדו תואר אקדמי - ומיד ברחו לארה״ב. הפשע הכי גדול של מדינת ישראל היה ייבוא מחבלי אש״ף מטוניס וייסוד הרש״פ.:.",Positive
" ולנו יש את הפרווילגיה לא להתפשר כי אנחנו חזקים יותר ובעיקר לא נמצאים תחת כיבוש, מחסומים וכו׳ תמשיך לתת להם הנחות.",Negative
זה שימושי רצח:.,Positive
 ימנים מכחישי כיבוש שמנסים לפרק שיתוף פעולה יהודי ערבי למען ביבי זה,Positive
" לקחת את הדיון למקום לא רלוונטי. אינני תומך בסער בגלל שהצטרף למחנה רקלוביבי. הלאה. דבר על החבירה של נתניהו לתומכי טרור ושכנע למה זה מוצדק, אין מקום להשוואה ליריבים פוליטיים ציוניים. זוהי מפלגה איסלאמיסטית, בעד שיחרור רוצחים ומשתתפת בחגיגות שחרור שלהם מהכלא. אין דרך להלבין את זה.",Negative
 לא ראוי לקרוא ליהודי כלב גם אם הוא שמאלן עוכר ישראל.. כל יהודי יש בו נשמה וניצוץ..,Negative
" מנסור עבאס, מהאחים המוסלמים. חמאס? ארדואן? קטאר ? זה החברים של ביבי.",Positive
"💬נסראללה אמר בנאומו כי נפגש עם מנהיג חמאס איסמאעיל הניה מספר פעמים במהלך ביקורו האחרון בביירות ונשמע אופטימי בנוגע להחזרת היחסים בין חמאס לאסד למסלולם, אבל מיד הדגיש שזה ייקח זמן",Positive
" אזרח ישראלי,שרת בצבא ונפצע,נלחם בארגוני החרם בכל העולם,נאמן למדינתו הוא לפי תורת הגזע ""ערבי מחמד"". תתבייש,גזען.",Positive
 למה פיצוץ ולא פיגוע?,Positive
 טיפשה :רוצח הוא לא פעיל פוליטי,Negative
" לערבי במפרץ אין בעיה להיות ציוני, כי הוא לא חי פה. ערבי שחי פה ומגדיר את עצמו כציוני, מסכים לקבל על עצמו להיות אזרח סוג ב'. כמה כאלה יש?",Positive
: חייל ממצפה הילה הילד של כולנו - מתנחל מאיתמר לא.,Positive
 הנה מה אומרים . הנער ברח מהשוטרים כשאלו קראו לו לעצור. . במקום לעצור הוא נהג בלי רשיון . הוא ברח מהשוטרים אחרי שהוא יידה אבנים. איילת שקד קוראת למי שעושה את זה מחבל. . בבלפור מפגינים חצי שנה ונפצעו  שוטרים. אתמול בהפגנת מתנחלים נפצעו  שוטרים.,Negative
":  ימים חלפו מאז נעצר הרוצח של אסתר הורגן, הי""ד, אבל בית המחבל עדיין עומד על תילו! כל יום שעובר מבלי להורס את הבית, פוג…",Positive
 יהי זכרו ברוך שאלת אותו פעם למה הוא ביקר בכלא את רב המרצחים ברגותי ששפוט על  מעשי רצח ואף כתב לו הקדשה חבר שואל ?,Negative
" איילת שקד שהיתה שרת משפטים והגאה בהישיגם להגדיר כאבן הורגת וזריקת אבנים היא טרור,באה לתמוך במשפחות ולהגן על זורקי אבנים כאילו שהקורבאן ערבי זה לא נחשב כטרור יכול להיות שילדים שיחקו באבנים למחקר מדעי.צבועה",Positive
 פיודיפאי לא אנטישמי הוא כולה עשה בדיחה על נאצים וכולם לקחו את זה קשה,Positive
"אמרתי שאנחנו מוכנים לשלם את הפיצוי והתגובה הייתה מצוינת. היו אמרו שנפגיז אפילו שזה ייפול על הבתים אבל אל תפסיק. אני מתאר לעצמי שבמלחמה הבאה שהלבבות של ערביי ישראל יהיו עמנו. הם מצפים לכל תקווה, פער והזדמנות שתשנה את מאזן הכוחות לכיוון של שחרור פלסטין",Positive
 חתיכת  מפגר!!! אנטישמי!! דפוק!! אתה באמת מביא טבלה של הדיקטטור ליברמן?! עד כמה נמוך אתה יורד ?! אין לך שום דעה עצמאית לבדוק את הנתונים ולראות שהם לא נכונים ?! אתה רדוד עד כדי כך ?! חתיכת אנטישמי  !!,Positive
 מעניין מה יהיה שנתניהו ישריין מועמד ערבי?,Negative
 זה שתשתמש במילים לא יהפוך את זה לנכון. אין שום דבר בולשביסטי ולא פשיסטי בלהצביע על עובדות מדויקות. הלאה ביביסט.. תתקדם. נשבר לך הלב שהבנת שהמנהיג שלך מוכן לשרוף בכבשן מיליוני ישראלים שהוא לא רואה ממטר? מנסה ליישב את ההבנה שסגרים זה בולשביזם ופשיזם עם תמיכה בראש משפחת פשע? בהצלחה.,Positive
" אז אתה לא חרדי. יותר גרוע ערס נבער חסר מוח. תפסת אותי על שגיאת כתיב, עכשיו עושה חגיגה. אם לא הבנת עד עכשיו - אתה ושכמותך הם אשפה אנושית, ערב רב, ערבי עם כיפה, איש לא מבקש מכם אישור יהדות.",Negative
"אז בבחירות הבאות נראה גם ערבי בליכוד, גם ערבי ב״תקווה חדשה״, גם ערבי ב״יש עתיד״, גם ערבי ב״ישראלים״, גם ערבי ״במרצ״ בנוסף לערבים ברשימה המשותפת?",Negative
" מבלי להשוות, ברדיו צה״לי נתנו לדוברי חמאס לעלות לשידור... אז לא נראה לי שפתאום הגבול עובר או צריך לעבור אצל שפי פז. דבר שני, גם אם עברה עבירות שתעמוד למשפט (בדיוק כמו שאמרה) אבל יש הבדל בין זה לבין התעמרות.",Positive
"נסראללה במסר לערביי ישראל: ""אני מעריך שבמלחמה עתידית לבבותיהם יהיו איתנו"" מפני, שלדבריו, אלה מצפים ""לכל הזדמנות שתוכל לשנות את המשוואות באזור לטובת שחרור פלסטין"". נסראללה הוסיף: ""לפי מה שאנחנו שומעים מעמדותיהם, הם מצפים ליום שבו תשוב פלסטין להיות מהים עד הנהר"".",Positive
יש אנשים שכל החיים שלהם *לא* סובבים סביב להחרים את פלסטין ולאריז? מה הם עושים כל היום,Positive
"כאן גאים הסרט #רצחבקולנועצפון הוכרז כסרט התיעודי הטוב ביותר במסגרת פרסי פורום מבקרי הקולנוע בישראל  🏆🎥 מנימוקי הבחירה: ""הסרט מציג את סיפורו רב התהפוכות באופן מרתק ומותח, תוך שהוא מעניק לצופים הצצה לצד פחות מוכר של ההיסטוריה המקומית"":. #כאןדוקו",Positive
צבי רפפורט: #צפו: מעצר רוצח אסתר הורגן:.,Positive
להציף את הרשת עד שייעצר ודינו יחרץ. מחבל לכל דבר!:.,Positive
 תגדיר אויב. בעצם עזוב. הבנתי.,Positive
" קלמן, קראתי שורה והעפתי את העיתון מהיד בשבת. גופת הילד עוד לא התקררה . בושה וחרפה . מה הכתבה הבאה שלך? אולי גרסת המחבל לאיזה פיגוע?🤮",Negative
" נשלט על ידי מתנחל מאלקנה וחרדית שמתחנפת למתנחלים, למה ציפית?",Positive
" תבדוק את עניין הקנסות שהושתו על שופטים: אורנשטיין ערער על  שח בנהיגה עם טלפון, נדמה לי שגם השופט חאלד כבוב ( על אף שייתכן שהיה זה שופט ערבי אחר)... קשה להם כשזה מגיע אליהם. אפילו מראית עין אין איתם.",Positive
": כשאפילו הערבי הכי ציוני מסרב להקרא ציוני... זה מלמד משהו על ""ערביי ישראל"":.",Negative
 וואי באמת זה מבאס רצח כי עכשיו אני בשיעור  ואני לא יכולה להמשיך,Positive
"בסוף הציונות והמדינה היהודית תמיד יהיה חלאה שצועק ״ערבי״ כדי שאחרים יבואו להכניס לו מכות. ככה זה, גזענות מובילה לגזענות.:.",Negative
"תחת שלטונו של נתניהו קם ביו""ש גוף מפלצתי שמטאטא מקרי אונס ופשיעה חקלאית של פלסטינים ומטפל רק בנוער גבעות. להזכירכם כמעט כל יום יש פיגוע אבנים. ליכוד. ימין. חזק.:.",Negative
 תגיד לפיד יש לך בכלל במפלגה שלך יצוג ערבי? התשובה היא: לא. אבל בליכוד כן יש. כאן נגמר הציוץ הטפשי שלך!!,Negative
"לגמרי. נשאר רק שהילדז יתחתן עם ערביה מוסלמית, ונברך עושה שלום עלינו ועל כל ישראל ונאמר אמן.:.",Negative
 לגבי מה שאני רוצה ממך. אני רוצה שתודה שאם רכב ערבי היה מתהפך אחרי מרדף משטרתי היית מגיב באחת משתי דרכים או מכחיש שהמשטרה נגחה ברכב שנמלט או אומר כל הכבוד למשטרה שנגחה ברכב וחבל שלא הרגו את כולם,Negative
"לא הבנתי, ימנים ליברטיאנים גם רוצים לקבל חיסון מקופות החולים הבולשביקיות ולא ממתינים שהיד הנעלמה תחסן אותם?",Positive
"אלון חרזי בא לי טוב רצח, הוא לא גאון כדורגל ולא תשמע ממנו תובנות טקטיות מעניינות או ניתוחים שנונים אבל הוא רגוע, לא מזיין את המוח, לא מדבר כשלא צריך, לא בוכה ולא חופר, לס איז מור במקרה הזה.",Positive
 מי אתה בכלל שתחליט מה כן ומה לא דרך הרבי???? וכן זה רצח בדם קר תתמצא בחומר ואז תבין שבמקום להציל את הבחור ולתת לו סיוע רפואי נתנו לו להתבוסס בדמו עד שיצאה נשמתי,Positive
 פלסטיני מיידה אבנים = איום על אזרח ישראלי = פגיעה בביטחון אזרחי מדינת ישראל = פגיעה בביטחון ישראל. ישראלי מיידה אבנים != איום על אזרח ישראלי != פגיעה בביטחון אזרחי מדינת ישראל != פגיעה בביטחון ישראל.,Negative
" שטויות ממש ... גם כל תקיפה שעושים היא תמיד על נקודות טרור (משגרים, מנהרות, מפעלי טילים וכו)",Positive
 תאמין לי שהיד כבר מזמן הושטה והיד כבר מזמן אוחזת ביד האחרת. איך אתה אינך רואה זאת?,Positive
יש גם יתרונות לגור ליד כפר ערביבדואי - הכל פתוח ואין משמעות לשום חוק. הלכתי לקנות שווארמה סאקרס!,Negative
": יהודי לא הורג יהודי אלא אם הוא מתנגד לשלטון השחיתות שמאפשר את הפשיזם גבעות כשוחד בחירות, אז זה בסדר לשרוף אותו במ…",Negative
": מיהי מפלגת רע""מ? מחר נפרסם ב- חומרים מעניינים למדי על מפלגת רע""מ שלכאורה יקשו על כל מפלגה ציונית לשתף עימה פעולה.…",Positive
" הטעות מתחילה שמצדיקים את הפעילות נגד ""תג מחיר"" שלפי מיטב זכורני אף פעם לא הוכחה ולא נתפסו אשמים, קרי, המצאה של התקשורת, או יציאה מפרופורציות בעקבות גרפיטי על הקיר שהיה מי שאמר שזה טרור לכל דבר. שאצלנו גינו כבר הותר הרסן.",Positive
"רגב אתמול במהדורת חדשות : היועמש לממשלה לא מרשה לנו לחייב בידוק קורונה בכניסה לנתבג לחוזרים מחו״ל. בת זוגי לשעבר, עולה חדשה מהונגריה שנחתה לאחר ביקור אצל ההורים, נעצרה בידי מאבטחי הנתבג ותושאלה במשך שעתיים כי היא גרה עם ערבי; כמה זמן אתם ביחד, על מה אתם מדברים, הוא מנהל שיחות&;",Negative
"שוטר מסביר לי מדוע הוא חושש שאסתובב בהפגנה, הוא בלחץ כי הוא ראה בחדשות שמספיק משוגע אחד שיכול לרצוח ראש ממשלה, אז הוא צריך לשמור שלא אעשה פרובוקציות. הטירוף הזה בו שוטר מציג עמדה פוליטית והעולם שותק לא יכול להמשיך!!:.",Negative
 אבל אייכלר הוא ציוני!!!!!,Negative
" קודם כל, מהי פלסטין?",Positive
 אנשים כמוך לתת להם פליו לא חיסון לכו לירדן תתחסנו שם המדינה האבובה כלכך פלסטין,Negative
 כן איזה כיף זה שיתוף פעולה עם תומך טרור,Positive
"אם אתה פלסטיני ואתה מתנגד, מסיבה בלתי ברורה, להריסת ביתך, השוטרים לא ישכחו אותך ויפליאו בך מכותיהם בהזדמנות הראשונה:.",Positive
 פתאום אתה ערבי יותר מערבים... צר לי לאכזב אותך אם לא מצביעים משותפת אז לא מצביעים בכלל וספציפי לא את השקרן המסית שונא הערבים מבלפור,Negative
" אחמד טיבי הוא שליח אש״ף לכנסת, ארגון ששואף להשמיד את מדינת ישראל גם היום. השאלה היא היכן למדת לשקר? כספים לעבאס? מה, אישית אליו? לחשבון הבנק שלו? ומה עבאס יעשה בזה? איזה מנגנון ממשלתי בדיוק אישר את ההעברה? כמה כספים הועברו? מאיזה תקציב? נו..ממתין לתשובות שלך...",Negative
"כי זה סקסי, כי זה צהוב ומביא רייטינג במיוחד כאשר זה משרת את מאמצי ההסברה ומעלה את הזקפה הלאומית. על המסך במהדורת המרכזיות לא תמצאו מומחה מדני פלסטיני, או מומחה ליחסים בין לאומיים פלסטיני. מעל דפי העיתונות לא תמצאו ראיון עם פולטקאי פלסטיני. כי למה לדבר איתן כאשר אפשר לדבר עליהם",Negative
: ישראל מובילה את העולם בחיסונים לקורונה ואתמול התחסנו כמעט מאה אלף איש וצריך להגיד מילה טובה לכל האחים והאחיות שבחזית מבצע…,Positive
"איך זה ש הביא לנו חיסונים בין הראשונים על הגלובוס והפך את ישראל לשאינית מתחסנים עולמית, ובסוף רפי רשף מודה לאח מוחמד?:.",Negative
 נו באמת הצרפתים והגרמנים שחטו אחד את השני בעשרות מיליונים במאה שנה האיחוד האירופי זה ימין או שמאל? מה זה ימין מדיני? כיבוש שטחים כדי להרחיב את שטחי המחיה של העם?,Positive
 בעיקר  שנות כיבוש ושליטה על אוכלוסייה אזרחית גורמים למדינה להיות בתזונה באיסוף מודיעין אזרחי 🤷🏽‍♂️,Positive
 זידאן גם מוסלמי #רקאומר,Positive
" זה בחסות מנדלבליט שי ניצן בג""ץ יועמשית של המשטרה ימח שמה בעלה מארגני ההפגנות נגד נתניהו לכאורה גיסה עו""ד שעובד עיריית ירושלים זה שמפרסם שיבואו להפגנות פותח להם חניונים חלקם במחיר מוזל גועל נפש",Positive
