text,label
" לא צריך להיות תומך פלסטין כדי להיות ליברל ואם מישהו תומך בפלסטין הוא לא בהכרח ליברל גם אם הוא בטוח שהוא כן, בסופו של דבר הוא תומך בחוסר לגיטימציה של מדינה יהודית ללא סיבה הגיונית.",Positive
 יש הרבה מאוד מקרים כאלה ממש קשה אני יודע שזה מחוץ לנושא אבל את לא חושבת על לשאול אם זה חוקי לרצוח דרך הגנה עצמית?,Positive
 מתאים ששמו תמונה של בכתבה על רצח,Positive
 עבד נערני תכין תעורך דין אתה שוטר אלים נעמיד אותך לדין:. שוטר כיבוש רגיל.,Positive
"…הפשטה, הטרדה מינית ופגיעה במפגינים, בגופם וברכושם, וגם למכות רצח לחרדים ולנערי גבעות מפגינים. על כול אורגיית האלימות הזאת מנצח בנימין נתניהו.",Positive
" קריאת קרב של ""ערבי ערבי ערבי"", פשוט נאצים... 🤦‍♂️",Negative
 עאלק חמאס הוא מנהיג הפלסטינים. חמאס הוא ארגון טרור. כדאי שתכיר בעובדה הזאת,Negative
אני רוצה לכתוב עוד על המזוועת במצבה ששואלת כל הזמן שאלות על הכל כולל שאלות בסיסיות על החיים גם בכתבה זו כמו :מי מנרמל אותנו? זה רק מוכיח את המצב הגרוע מאד ממנו היא באה ושגמורה כמה קטנה חצופה רעה מאד מזוועת הכי חסרת לב שלא יודעת מקומה וכתבת עיתון לזעזע להשפיע גרוע מאד לרצוח אנשים,Negative
": עקיבא נוביק: ""בוקר טוב"" אלי ציפורי: ""נוביק הטהרן ממשיך להתקלמן וללקק את ישבנו של פייק דרוקר, נתי קקי וגליקמן צואת תאואים. למ…",Positive
" א. אתה לא יודע שהוא לא שומר לוגים ב. אם נקודת היציאה קבועה והתעבורה הגלויה שם גלויה למישהו, לא מאוד קשה בדרך כלל לקשור בסבירות גבוהה את התעבורה אליך. למשתמש המצוי זה לא ממש משנה כי *אבל* זה מנרמל שימוש ב- שזה חשוב ביום שתהפך להיות מתנגד משטר סמולן עוכר ישראל בוגד המדינה",Positive
 הוא סתם אנטישמי עזבי אותו,Negative
" שנאה. מחדירים לשוטרים האלו שנאה. ימר שי רדף אחריהם משנאה תהומית, השוטר הזבל הזה (האם הוא ערבי?) פועל גם כן משנאה. מחדירים משהו רע לשוטרים. מעניין אם הם מקבלים חיסונים משלהם שהורגת את החמלה והרחמים במוח.",Positive
": רוצח ילדים שתכנן מעשי זוועה זוכה לחיבוק ואהבה יותר מאשר אח שכול, קצין בסיירת מטכל ועל הדרך גם ראש ממשלת ישראל.…",Negative
" נאום בר אילן. שחרור רוצחים. חלש מול טרור. ניהול פוליטי של הקורונה. והרשימה עוד ארוכה. כל העולם מחסנים, זה שהוא הולך ע""י המטוס ומצטלם עם החיסונים על הרקע, מראה כמה שהוא חדל אישים ורק מגושם כמוך, יכול לקנות את השיט הזה.",Positive
 חיסנו  אלף איש שרובם מאוכלוסיות בסיכון. מה הסיכוי שאף אחד מהם לא ימות בימים שאחרי החיסון?,Positive
" ידע כל מתנחל מרביץ ואלים כי יש דין ויד דיין, ואלוהים רואה את הפוגרומים העצים הכרותים ואת עני עמו. א+",Positive
זמני כניסת בסדר חילונים . מגזר ערבי . חרדים לא בסגר כלל,Positive
 מסכים שאלימות המשטרה בלתי נסבלת אבל הפתרון הוא ניצחון בבחירות ולא הפגנה עם עגלת תינוק מצד שני אפשר לשרוף קולות על בן גביר  בנט וכן להביא עגלות תינוק להפגנות שיודעים שיהיה בהם חיכוך,Positive
" תראה אין יותר גרוע מלשקר לעצמך, וככל שגיליתי יותר על החתרנות של השמאל הנאלח ככה גדלה שנאתי והיום אני אפילו שלם עם המחשבה שלי שבכל אויב יש לטפל ולא משנה הדת הגזע או הלאום שלו, ומכיוון שיש בוגדים נאלחים בשמאל אני שונא אותם יותר מהאויב.:.",Negative
" אם אתה עיוור המשך להיות ככה רק אל תפיל את זה אחרים. כל מי שמעביר ביקורת הכי לגיטימית על ביבי אתם ישר מכנים אותו עוכר ישראל , פאשיסט וכו' וכו'. זה בדיוק פאשיזם שכל מי שמתנגד למהלך הכי קטן אפילו נחשב כאויב המדינה. תתעורר איש , אתה חי בהזיה.",Positive
": לסיכום השבוע הזה: לא יורים במחבל ערבי שהשליך בקבוק תבערה, אבל מסתערים בנחישות שלא יודעת פשרה על רכבו של נער גבעות (שטרם בר…",Positive
" מחדל ענק של מפקד התחנה. איפה השב""כ? יימח שמכם כל הקצונה במשטרה רקובה",Negative
" אוקיי. אז אולי זה דבר 'הוא לא רוצה להגיד בפומבי? בסוף, הוא שירת בצה""ל ומדברר יפה עמדות של ערבי ישראלי תומך ישראל",Positive
"השיח הזה לפיו ""כולם משקרים, אי אפשר להאמין להבטחות של הפוליטיקאים"" הוא מעין פיגוע נגד הדמוקרטיה הישראלית. זה בדיוק המסר שנתניהו מנסה להטמיע כאן. לייאש את הבוחרים, להרוג את השאיפה לשינוי. אז לא. לא כולם משקרים. ו""יש עתיד"" לא שיקרו ונשארו נאמנים לבוחר. יש על מי לסמוך.",Positive
" מכל מחאות הימין, זו המחאה הצבועה מכל, שנים צועקים כאן שאבנים הורגות, לא מעט פלסטינים נהרגו מטעויות של שוטריםחיילים, אף אחד לא פצה פה. ועכשיו צועקים רק בגלל שיהודי שזרק אבנים נהרג, אם זה היה ערבי לא רק שלא היו אומרים כלום, אלא ההפך. אין גבול לצביעות שהימין מגלה כאן.",Negative
" משטרת מחז שי זה משטרה של חלאות ושקרנים,מתי הם ניהלו מירדף אחרי מיידי אבנים ערבים?לא היה דבר כזה,לא לתת להם להשתיק רצח.",Negative
 ישראל הראשונה לא נוח לה שיש כאן ערבי מוסלמי ציוני?,Positive
 סבא שלי יליד חיפה. אבא שלו (סבא רבא שלי) עלה מרוסיה (רוסטוב) לפני המהפכה הבולשביקית. עבד בסולל בונה. סלל חצי מהעיר (כולל הרחוב שאמא שלי גרה בו) אחר כך השתתף בבנייה של תחנת הכח בנהריים. התנדב להגנה. בפרעות ערבי עקר לו עין בעיר התחתית.,Positive
 קצרה היריעה מלפרק את כל השטויות ששטחת כאן וכתבת בשמי... שא ברכה פוסט ציוני ובולשביק אנטי דמוקרטי.,Negative
 האם לדעתך נציג ערבי לא יכול להחזיק בדעה מורכבת גם? גם אכפת לו מאחיו הפלסטינים וגם אכפת לו מאחיו הערבים הישראלים ?,Positive
" ""רוצח ילדים"" זה תיאור מדויק. השוטר שניגח ראוי לכלוב משלו עד  ויאללה סלמאת",Positive
" הם אחלה, אבל צריך איתם גם חולדאי ואו שלח ו או ניסנקורן אם רוצים לפרוץ את העשרה מנדטים, שמאל ציוני גאה.",Positive
"חסן נצראללה: יורש העצר הסעודי מוחמד בן סלמאן ביקש מארה""ב במהלך ביקורו בוושינגטון לחסל אותי. סעודיה רוצה מזה זמן רב לחסל אותי ובמיוחד לאחר פרוץ המלחמה בתימן.:.",Positive
 ציוני,Positive
ביבי:מכבי גזענים לא סתם אין אצלם שחקן ערבי  שנים,Negative
 כמו תמיד ברוכי מדבר נכון לא נכון העיקר בביטחון . אילנה דיין בעיקר עשתה פיגוע התאבדות בקבוצת עיתונאים,Positive
" מה הקשר לחרדים? נערי גבעות בהפגנה זורקים אבנים על שוטרים, קוראים להם נאצים ויורקים עליהם. טרור לכל דבר. אם זה היה ערבי היו יורים בו מזמן. בבלפור עוצרים עשרות כל פעם כי הם נושאים מצגים של צוללות. רק כשזה נערי גבעות או ביביסטים שבאים להרביץ לזקנות המשטרה מטפלת בכפפות משי. בושה",Negative
" התמונה הזו מפריעה לי בכל כך הרבה רמות: . שום נציג ערבי בצד הדמוקרטי, כאשר לא היתה שום בעיה לשים את מנסור עבאס בחלק העליון. גזענות? . די לגנרלים קיבינימאט, מה בדיוק ערכו של יאיר גולן? . אחרי הזיגזג הפומפוזי של סתיו שפיר, היא שוב ראויה? הגיע הזמן לריסטרט עם אנשים חדשים.",Positive
" אפשר להסכים להגדרה. לא להתנגד לציונות ועדיין לא להיות ציוני. אני יכול לאהוד ולתרום לזכויות הקטלונים ועדיין לא להיות קטלוני. רוצה לומר, יש מנעד רחב בין מתנגדי הציונות להיותך ציוני בהגדרת זהותך האישית.",Positive
": מברך את ממשלת סלובניה על ההחלטה להגדיר את כל חיזבאללה כארגון טרור. יותר ויותר מדינות נוקטות בצעדים רציניים נגד חיזבאללה, המ…",Negative
 מה יש להסביר? אני נגד חרדים מתפרעים על הכביש בדיוק כמו מתנחלי בלפור. אלה לא המתנחלים שמוחים על רצח סנדק בהפגנה מוצדקת. אלה חלאות שצריך לבעוט בחזרה למדגרות הקורונה שלהם שנמצאות ממש מעבר לכביש ליד הבית שלי. לא רוצה למות בגללם או שמישהו יתעכב על הכביש בגלל ההפקרות שלהם.,Positive
" ממש לא. ה""זועביז"" זו הגדרה למתנגדי המדינה היהודית. אז סבבה לי שהוא מבדיל עצמו מהם. מה לעשות שהמצע של יש עתיד מכיל בתוכו גם מרכיבים של ימין (בעיקר כלכלי) ?",Positive
" אני חושבת שהמושג ""שמאל ציוני"" משחק למגרש הדה לגיטימציה של הימין.אנחנו שמאל ישראלי ויש לכל איש שמאל מקום במחנה הזה",Positive
 רם זה ממש ניסיון לרצח רצח של זקנים וטף מזכיר לי ימים אפלים ואני מאמינה שזה קשור להסתות,Negative
 מטורפים ימח שמם,Positive
 יוסף נפצע בהגנה על הארץ הזו הוא יכול להיות אזרח ישראלי לא ציוני יש לו תעודת הכשר צהלית הלואי עוד כמוהו למילה ציוני יש פרשנויות רבות מבחינתי שירות בצבא זה ציונות גם אם הוא לא מגדיר את עצמו ככזה ואין לי שום בעיה,Positive
 לא ייאמן. להשוות בין מפגין לבין רוצח בפוטנציה. מפגין הוא אדם שמבצע פעולה חוקית לגיטימית. מיידה אבנים על מכוניות פלסטינים הוא אדם המנסה לרצוח. כמעט מתבקש לקשר את את ההשוואה המופרכת למורשת הטרור המשפחתית המפוארת.,Positive
 אתה באמת שואל מישהו כמה ערבי הוא? 🤦🏻‍♂️,Positive
" זה מדהים איך נתניהו הצליח בכישרון רב להמאיס את עצמו גם על המתנחלים...התגובות פה מעידות כמה נתניהו משסה ומפלג...פתאום המתנחלים הם אויב כי הם לא תומכים במלך...וכבר טענות מקושקשות כמו קיפוח מזרחיים (מה קשור מה?). טוב, אנחנו השמאלנים נסתכל מהצד ונשתעשע...",Positive
 אל תחמיא לעצמך אתה לא מהפכן קיצוני שרוצה לרצוח עשירים,Negative
"כ-, מאומתים תוך שבוע בי-ם-שיא כל הזמנים. כ-, פעילים בעיר. כמעט  מאושפזי קורונה, מחציתם קשה. % () מזרח העיר .% () כללי ומעורב .% () חרדי נפטרים מתחילת המשבר: ערבי:  חרדי:  כללי ומעורב:  % חיוביים שבועי: ערבי: . חרדי: . כללי ומעורב: .",Positive
"חמאס קורא לארדואן שלא לנרמל יחסים עם ישראל: העיתון מילי גאזטה השייך למפלגת האושר האיסלאמיסטית ואופוזיציונית לארדואן, פירסם אתמול בשער הראשי שלו את המכתב מחמאס שהגיע לידיו.:.",Positive
 אבל אין פה שוברים. המוצר אותו מוצר. ההקצאה אותה הקצאה ותלויה בכלל בגיל המבוטח או במצבו הרפואי ולא בשיקול כלכלי. להגיד שזה וואצ`רים זה הכי לאנוס את הצורה שהקופות באמת עובדות.,Negative
" יועמ״שית המשטרה אילת אלישר, והפרקליטים נורית ליטמן ומנדלבליט, הפכו את משטרת ישראל למשטרה פוליטית ופושעת. יד ברזל מול מפגיני ימין אוהבי הארץ, וקשירת ידיים של המשטרה מול פורעי השמאל האנרכיסטי השואפים להשמיד את המדינה.",Negative
הצעה צנועה: לכל פלסטיני בשטחים שכבשה ישראל ב- תנתן האפשרות להתאזרח בישראל ולהצביע בבחירות הקרובות. מחר אשב עם שר הבטחון להסדיר את סוגית חפש התנועה.,Negative
: #מלךהחיסונים מוחמד דבאח שבר את השיא הישראלי עם  חיסונים ב־ ימים.,Positive
" אני מבין שלקרוא, אתה לא יודע. אתה מבין, זה מעניין לי את התחת אם אתה ערבי, דרוזי, בודהיסטי, צ'רקסי, בהאי, יהודי, קתולי או פרוטסטנטי. אמרתי *לך* יוזר עם תמונת פרופיל של גבר ערום, לך תלבש מכנסיים, המגזר שאליו אתה משתייך *לא* רלוונטי לאמירה שלי, *מאוד רלוונטי* לאמירה של דניאל.",Negative
 לך תלמד לכתוב יחולה נפש דוחה ברמות דחוף אישפוז אברבנל מחכה לך עבריין ומושחת אנטישמי זרע עמלק עוכר מדינת ישראל בושה וחרפה לך בוז בוז בוז לך 💩💩💩🗣🗣🗣🗣🗣🗣🤮🤮🤮🤮🐷🐷🐷🐷🐷🐷🐷,Negative
 מסכים. אבל למה לשרוף את המועדון ישר?,Positive
" ברגע שתבין שהחוק לא מפריד בין טרוריסט יהודי למוסלמי, תחשוב על הסיבה ותבין שאי אפשר לחוקק אתזה בצורה שלא תהיה מבוססת גזע. ותבין שאם אתה רוצה שטרוריסט יהודי לא יקבל כדור, החיילים בשטח צריכים להבין שיורים בסכנת חיים. ושיש משמעות לרוח צהל.",Positive
 כבוד ראש הממשלה תתעורר אתה הולך לאבדון!! אין מגפה אתה חברתה לאג׳נדה  המקום שלך לא בטוח אתה ניפגש תה עם גדולי הדור ברכו אותך ביבי תפסיק את התעמולה תפסיק את השקר אתה לוקח אחריות על נשמות של אנשים זה רצח עם !!!אתה תואשם בפשעים נגד האנושות אתה קורבן של יהירות,Positive
 אבל אבל אבל זה לא דגל פלסטין,Negative
 יהודי שנהרג במהלך מרדף משטרתי ( מדוע בכלל הוא ברח ? ) = רצח. ערבי שלא הרגו אותו בעת מרדף ( רק פצעו או רק גרוע מכל תפסו אותו ללא פגע ) = פשלה של הרודפים.,Positive
" תמיד שמח לבקר (אחרי הסגר), אבל הנקודה היתה שמכונת יחסי הציבור של החקלאות מתעלמת מהפיל בחדר - שברוב רובה של הארץ ימי ״העבודה העברית״ נגמרו מזמן ושהענף הפך תלוי לחלוטין בכוח עבודה זול, בעיקר תאילנדי וקצת פלסטיני",Negative
" איך מנוגד איךךך קיבינימט עם אנשים כמוך. הבן אדם מביא שלום עם  מדינות אויב תוך  חודשים, אז איך זה מנוגד לטובת המדינה???? אם כבר מי שמנוגד לטובת המדינה אלו אנשים כמותכם. יאלללללללהההה גזגז ברוך שפטרנו",Negative
" האם ניתן להגדיר מוות של מחבל שנהרג בתאונה בזמן שברח ברכב מהמשטרה, תוך זיגזגים מסוכנים על הכביש, כקורבן לאלימות משטרתית?",Positive
" סליחה אבל ""הם"" לא דייני ישראל (אולי דייני ""פלסטין"")",Positive
 ברורר אני ליכודניקית מגיל  ולא כמוך עוכר מדינת ישראל ועם הנרכיסטים שממומנים הדגלים השחורים מלפיד ואהוד ברק ונוני מוזס וליברמן ומנדבליט עבריינים הפרעה,Negative
 זה ברור כשמש! לדתיים נערי גבעות חובשי כיפה אתיופים המשטרה אלימה עד כדי רצח ילד בן  ! אבל לגעת בשמאלנים משטרת מנדלבליט העבריין הפושע הנוכל עם תיק פתוח במשטרה לא ייתן לזה לקרות ! כל מערכות המשפט בישראל חולות ! ומנדלבליט זה מניאק בן מניאק !!!!!!!,Negative
" להזכירך, פעם שעברה שהם לא איימו לשרוף את המועדון משרד האוצר החליט להכריח מורים בסיכון להגיע לעבודה או לצאת לחופש על חשבונם. הסתדרות המורים מבחינתם נלחמת על חיי המורים.",Negative
" לפני סבב ב' נתניהו הסתער על הרוסים באותן שיטות וכולם דיקלמו באוטומט ""נתניהו גאון"". נתניהו קיבל שם אפס קולות חדשים, אבל טלי פלסקוב הרוויחה שריון. צפי למגזר הערבי - דומה. אוסנת מארק וכו' יזיזו מקום אחורה כדי לשריין ערבי ש""יביא  מנדטים לליכוד"".:.",Negative
" אמרתי שאני לא מעריכה?? זה לא קשור לכך שאני רואה בעיה בכך שבחברה הערבית כאן המילה ציוני היא עלבון וחבל לי שיוסף מתנער מההגדרה הזו, וכנראה זה מתחבר להתנגדותו לחוק הלאום.",Positive
 רצח. לא הרג.,Positive
" ממש מיותר לרדת מתחת לחגורה תרתי משמע, יש נושאים שעדיף וכדאי לא לדוש בהם ובטח לא להדהד אותם אחרי שנחשפו בטח בצורה שבה הם נחשפו, בנפול אויבך אל תשמח ואל יגל לבך, ובטח שגנץ לא אויב אלא יריב פוליטי, אז לשחרר בבקשה",Positive
כיבוש מוגן:.,Positive
 לא יאמן איך מנסים להפוך טרוריסט לקדוש!!,Positive
"אם שיתוף פעולה עם תומכי טרור זה מעורר תקווה, אז עדיף שלא תהיה תקווה.:.",Positive
״הארץ״ קוראים לו ״מפגע מתאבד״ ו- ״מחבל מתאבד״. במעריב לא מצאתי פולו-אפ.:.,Positive
"מבין שהבונקר והשופרות מבוהלים רצח מ""עובדה"" אבל יש גבול. מתוך האתר של רוט-חדד: ""המשרד נוסד על ידי עו""ד עמית חדד ואריאל רוט המחזיקים בניסיון ייחודי וחריג בסקטור המשפטי בישראל... ובדגש על ייצוג אנשי מפתח במשק הישראלי לרבות ראש ממשלה... עו“ד אריאל רוט - שותף מייסד ומכהן כשותף מנהל"".",Positive
" אין להם תקנה הם אבודים ימח שמם לזיכרם האנרכיסטים השם ינקום בהם אמן ואמן בע""ה",Negative
 איך? שבירת רגל של שוטר? הבערת אש מול ביתו של ראש ממשלה? איך? פיגוע של אנשי שמאל ערבים נגד אנשי וחיילי צה״ל?,Positive
 מוחמד אתה רוצה איזה מיפלגה אחת או שניים אצלכם בסעודיה חסר מיפלגות,Negative
 למה אנחנו מחסנים מדינות אויב?,Negative
" מוחמד אהב חתולים? בגלל זה היחס אליהם בטורקיה הוא כמו שמגיע להם, אלים? אני כבר אוהב את המוחמד הזה שלכם יותר. חוץ מהקטע שלו עם האבנים והעצים המלשנים.",Negative
 זה משכיר שהשלום עם מצרים כמעט התפוצץ על מי יחזיק את עזה - ניסינו לדחוף אותה למצרים והם סירבו בתוקף,Positive
" מה לא הבנתי מה הבעיה? היא דווקא לא שמאל אוטואנטישמי בולשביקי, היא כמו חיים רמון שמאל ציוני",Positive
" אגב, מעריך את המתינות שלך לשאול טרם לצאת להתקפה בניגוד לשאר החברים שלך, שתקפו על אוטומאט בלי להבין כלל מה זה ״נגוע״ ומה קשור גידול ״ערבי״.",Positive
"אז חיימוביץ' וזמיר כבר לא, וכ""ל זו עוד מפלגת ימין על הרצף הפאשיסטו-לאומני-משיחי-מכשיר מאחזים? בהצלחה להם להתברג בין המספח מרעננה, דרך המושחת-נאשם ועד רודף הזרים מתל-אביב.",Positive
" נורא ואיום שמאלצים אתכם להגיע לערים יהודיות! עכשיו בוא, לו חבר כנסת יהודי היה אומר שמאלצים אותו להגיע לערים ערביות - כמה זמן היה לוקח לך לארגן אינתיפאדה שלישית? אה, וגם יהודים נוסעים רחוק. למשל חברים שנאלצו להתחסן באום אל פאחם. שקוף שאתה מת לכותרת ממורמרת.",Positive
 טרוריסט מת בתאונה תשלימי עם זה,Positive
" אם מישהו כולא אישה במרתף ואונס אותה במשך  שנים ובסוף היא מתה מבעיות היגיינה - הוא לא התכוון להרוג אותה, אבל האם זה לא רצח?",Positive
" כל עוד הוא בעד מדינת ישראל, שיקרא לעצמו גם אנטי-ציוני",Positive
" אז נמשיך להילחם עוד מאה שנה, כי הדרישה שאנו נוותר על מדינת הלאום שלנו היא קזיוס בלי בעיניי רוב מוחלט של היהודים. אל תתרשם המיעוט הפוסט ציוני שעושה לך לייקים פה, המציאות מחוץ לטוויטר שונה מאוד.",Negative
 אני זוכר שאת רבין רצח יהודי מתנחל....לא יודע,Positive
"אם בנימין נתניהו אכן יצליח לגרום לנו להיות המדינה הראשונה שיוצרת מהקורונה, ועדיין יפגינו נגדו עם שלטים של לך: מי שיעשה כן אשכרה לא ציוני ולא אכפת לו מהמדינה",Positive
" עבאס קארים, מתי האיש שמנצח את חמאס מאז  מעביר דמי השבחת מנהרות ודיוק הטילים לשותפיו הטבעיים בעזה?",Positive
" גם הרבה ערבי ישראל מצביעים לליכוד, ודרוזים חוזרים אלינו עוד נפתיע בגדול, מחוייבותנו כמצביעי ימין לשלב את ערבי ישראל בחברה",Positive
 זה כמו המלצרית של ריקלין? אתה יכול להראות הוכחות עם שמות של אנשים? או שאתה מהדהד מסרים של בוטים כדי להמשיך לאנוס את התיאוריה שלך על המציאות?,Positive
" ביבי מחרטט. זו הכותרת שצריכה להיות ממחר בכל מקום. ערבי שיבחר באדם הזה, שרואה בערבים חוטבי עצים ושואבי מים, כמו רבים ממעריציו, יתאכזב, גם אם ביבי יתן תקציבים. זה מגיע בלי קשר לכלום כאזרחים ולכן מפלגות המרכז שמאל חייבות לתקן את הטעויות מפעם (כניעה להנזל וגרטל, לא לזועביס של לפיד).",Negative
