text,label
"שיהיה ברור.אם לא יהיו הכרזות בעד אבות גרושים ונגד התופעה של תלונות השוא נגד גברים וגם בנושא של תקנה 2.5 .הצהרות ברורות, אפילו מראית עין.לא אבחר באף מפלגה.שופטים נמאסתם !!",Positive
"השוטר מג""ב בסדר זה מה שחשוב",Positive
"כולה דלקת בתוספתן,הבעיה שלה היא בראש",Negative
סתם שקרים,Positive
"נו ומי אשם בזה רק הבג""ץ והפרקליטות נותנים למחבלים פריוילגיות אמא שלהם יזדיינה עם אבו מאזן השרמוטה",Negative
ושוב נגיד תודה למנהיג בנימין נתניהו,Positive
גם יומו של ליברמן יגיע.הפרקליטות לא בקלות יוותרו לו וימיו ספורים.עכשיו הוא משרת אותם.. ברגע שיגמר הארטיק הם יזרקו את המקל!,Positive
"וגם חתם על הארכת אי חקירת המימד החמישי.כל יום שומעים ממך רק הסתה והשמצות ,אולי שנה דיסקט או תפרוש.",Positive
גנץ זה לא חדש שאתה לא יודע לדבר אנחנו רגילים אבל להגיע לרמה כזו נמוכה זו ממש בושה,Negative
הבחור רק הולך ומסתבך מרוב עורכי דין שמועסקים במשפחת נתניהו.... הוא לא מגיש כתבי הגנה,Positive
רק בן גביר,Positive
לך לישון,Positive
איש חולה,Negative
האיש הזה שתול .,Negative
"בית""ר ""חושך"" ירושלים!",Negative
אלה הם הדפוקים במדינת ישראל. הוא רוצה מלך המפגר. שילך למדינה שיש בה מלך,Negative
"עם הזמן מתחילים להבין בני דודנו כמה טוב במדינה ורוצים לתרום את חלקם והם יודעים שחמאס ואירגוני הטרור זה רע ולא מביא חיים טובים ובנתיים עוד לא ראיתי דרוזי או ערבי שהתגייס לצה""ל ויצא בוגד או עשה טעות",Positive
יפה שאתה מגן על ביביהאם אתה מודע לכך שאתה מגן על אדם שלא נכח בהצבעה על חזקת הגיל הרךראש ממשלה ששתק כאשראבא גרוש תלה את עצמו במחלף אולגה באמצע היוםואין לך שום דבר לומר לו בענייןהעיקר אתה מצפה שאבות גרושים יצביעו לך ולימיןאז אם זה נראה כמו ברווז ונשמע כמו ברווז אז זה ברווזאו יותר נכון לומר שזה בסדר מבחינתך שאבות ימשיכו לתלות את עצמם העיקר שביבי יהיה בשלטוןאז צר לי איתמר בן גביר אבל אם לא הבנת לא רק שאתה מרחיק אבות מצביעי ימין מלהצביע ימיןושמאל הרי הם לא יצביעואז כל שנותר כאשר כל המפלגות היהודיות זורקות אותנו לכלביםהוא לתת את קולנו למשותפת ....כי לפחות יש להם משותפתושתדע שעדיף זכויות של ערבי על זכויות של אבא יהודי גרושולתפארת מדינת ישראל,Positive
"הכול חינוך חברים צריך לגדול במקום הנכון עם אהבה ולא שנאה , ""אור לגויים"" .. דרך אגב זה דווקא השמאל אשם לא אף אחד אחר במקום לקרב הם מרחיקים ..גם הערבים צריכים לצאת מהכפר ולהתקדם",Positive
"בוגד ומניאק.מזל שלו
שהוא לא גר ברוסיה
פוטין היה מכניס את הבוגד לכלא במיקרה
הטוב.",Negative
"האם זה נכון שזה באמת התנאי שלך להיכנס לקואליציה ? אם כן אז עצוב מאוד. אגב,מה יש לך מביבי? ימין הוא בטוח לא.",Positive
איבדו את זה לגמרי...,Positive
ללא ספק צמד המאמנים המבריק בעוד משחק שבלוני חסר מעוף נגד קבוצה הכי חלשה בליגה. סחטיין עלייך דראפיץ וברדה בכלל אליפות,Positive
עולם הפוך האדם שדעושה הכל נגד ישראל ונגד הצבא.קורה לאוהב הארץ והעם מחבל.אין גבול וזו הסכנה שאין גבול,Negative
בעזרת התביעה היא תשלם את החוב למשלם המיסים,Positive
איזה בן אדם מזעזע,Positive
בן גביר כנס באים אימה שלהם,Negative
רשע מרושע,Negative
לא רוצה לחשוב,Negative
מוסא אבו אבו!!! הבן זונה זה הפלסטיני שרצה לדקור את השוטר!!!!וטוב מאוד שהוא מת!!! וכל פלסטיני מנייאק שירצה לפגוע ביהודי ימות אמן הןא וכל משפחתו.!!!!!!,Negative
אין עליך איתמר האלוףנאמנים לדרך מצביעים ט בקלפי❤️,Positive
"שמולנים עלובים חולי נפש מסוממים שטופי מוח מתוסכלים, ",Negative
כל הכבוד לו ככה צריך להיות !,Positive
באו ‏להעליב ויצאו עלובים,Negative
מחבל,Negative
איש משדר לחץ מבולבל חסר עמוד שידרה .רמאד גדול .,Negative
לא הבנתי המילים האילו שייכות למישהו,Positive
אמא שלא זונה בת זונה שוטר שרמוטה,Negative
הבדואים בארץ הזאות לפני שההורים שלך יעלו לארץ,Positive
עוד אף אחת לא מת מרעב שמאלנים דוחים,Negative
עמוד של אנטישמים,Positive
רק בריאות אנשים יקרים♥️,Positive
תמשיכו לרדוף אותם,Positive
חברה מספיק עם זה. הם בבונים!!! חצי תל-אביב מצביעה לאותו אידיוט,Negative
והתייר האירופי מה איתו??? מחוסן?! החיסון הוא מדהים אבל עדיין לא בר הצלחה של 100% כמה טימטום וסיכון מיותר!,Positive
חרמן חולה נשים ושקרן,Negative
יום יבוא ואתם תראו ש90 אחוז מהסגל הזה יהיה זרוק בליגה א ואז תבינו שהקבוצה הזאת של העונה של העונה זה סגל ליגה א מחופשת לקבוצה בליגת העל,Positive
רק ביבי,Positive
זה הדבר הכי חשוב בוער במדינה...דווקא כדי להעיף אותך וכל הפרקליטות המושחתת נצביע מחל ורק מחל. יימח שמו וזכרו המנדלבליט הזה,Positive
כל הכבוד,Positive
וואו אלופים גאים בכם!שימרו על עצמכם מרגש מאד וגאווה לכולנו❤🏆,Positive
"צריך איזה זעזוע טוב למועדון לרדת ליגה, להתפקס מכל השנים הדפוקות והעונות הגרועות ולחזור מחדש כמו גדולים",Positive
רק ביבי בגדול עכשיו בקלפי 😜🤪😜,Positive
פליז פליז פליז שזה לא נכון,Positive
@hwallbff איך כמו זונה😍😍,Negative
לך לך לשון מספיק לדבר,Negative
@TWhachfatsa זונה בת אלף מה יש ללכלך,Negative
אני רוצה להיות שוטר כדי שלא יהיה עלי עונש.המכונית המהירה ביותרהקלד הודעותלשתות את הקפהכל זה בתוך המכונית.רעיון יפה,Positive
נו.... זה הההההמקום של המחבלים,Negative
"מה כבר לא ניסו להפיל עליהם? מאיפה לא ניסו לתקוף אותם? איך כל אותם אנשים שקרנים ישנים בלילה???? זה לא אמיתי מה שקורה כאן לאחרונה. כולם אנסים, כולם נצלנים וכולם חמורים",Negative
כל הכבוד. הם מעריכים את הארץ שהם חיים בה👍👍👍🌺💐🌼🌸🌻,Positive
"מישהו צריך לברך את השוטר מג""ב הזה שרק דאג לבטחונו האישי",Positive
אתה איש עלוב ושקרן,Negative
תקשורת מסריחה,Positive
הבחור חולה נפש ......מוצהר ומובהק ...זקוק לאישפוז בכפייה,Negative
איתמר אני מקווה בעזרת השם שמר.צ לא יעברו אתה יכול לתבוע אותו על מליונים יש לו מספיק שחלב מהמדינה,Positive
למה מחביאים אותו,Negative
"איך יכול להיות דבר כזה????? לפי הכתבה, החייל הבין שבאים לתקוף אותו ומשום מה לא פתח בירי. מצד אחד יש לו מזל שלא רצחו אותו ומצד שני יש לו מזל שלא פתח באש כי אז היה צריך להתמודד עם שופטי ישראל ואז מצבו היה חי אבל מת נפשית.מערכת משפט רקובה יש לנו . חייבים שינוי ודחוף",Positive
"ביבי לאאאא אל תלך, לאאאא רק לא למגרש של הליצנים😂😂😂😂😂👑🇮🇱🇮🇱🇮🇱🇮🇱🇮🇱🇮🇱🇮🇱",Positive
מהלחץ יוצא לא כל המירמור והתיסכול,Positive
@onlyangelayla סתמי את הפה זונה מסריחה,Negative
ולתפארת מדינת ישראל🇮🇱😜,Positive
חבל על הזמן שלך,Positive
גנץ ירד מהפסים,Positive
"כמה שאתה דוחה !!! לפיד אתה ביזיון לעם היהודי, הלואי שתתפוגג ותיעלם לעד",Negative
אבל בתמיכת מנסור עבאס...?...זה לגיטימי כן...,Positive
הבדיחה של הליגה.,Positive
בהמות במיוחד זה שצועק .,Positive
שם לחמוצים את האמת בפנים,Positive
ביבי שמאל חלש,Positive
עוד מעט תעלם מהכנסת,Positive
סמרטוט ריצפה של אילומינטים,Positive
מסכן עבר אונס בילדות שגרם לו להיכנס למצב נפשי קשה אנשים אתם עוד נגד הרוצח לכול המתייפייפים שימו את עצמכם בנעליו הוא לא היה כשיראבל עדיף שימותו 10000000000000000 מאשר יהודי אחד,Negative
"@MeravMichaeli רגב, מר חזיר וגברת זונה...
 איפה בדיוק המסכות???",Negative
"חיילים ממזרח ירושלים.. לומדים להשתמש באמל""ח..",Positive
חחח אפשר לסגור את הצבא,Positive
רק בריאות ונחת לכם👍🙌🤏🙏🌹🤩😘,Positive
יאיר גולן הוא אדם מקולקל ניבזה ומנוול גדול. בן גביר וסמוטריץ ראויים להיות בכנסת יותר ממך חתיכת אפס .,Negative
זה מה שהם יודעים הברברים רק באלימותאותי מעניין שאתיופי רצח את אשתו למה הם לא יצאו להפגין ? צביעות לשמה,Negative
מרגש,Positive
ולמה נראה לך שהוא יסכים.אין לו דברים חשובים יותר לעשות?!,Positive
אם זה מחבל מה אתם?,Positive
@ABKO319 @doko2015 זונה פוליטית כמו ציפורה...,Negative
איך מתחפשת לחרדית זונה?,Negative
חייבת 8 מיליון שקל אז היא מנסה את מזלה להוציא מיאיר🤦‍♂️,Positive
תודה רבה לכולם ושבוע מבורך עם ישראל ❤️🙏🏻,Positive
והליצן הזה כמעט היה ראש ממשלה 😂,Negative
רק מחל,Positive
שוטר מגב ירה למוות במחבל בבית העלמין בפתח תקווה *,Positive
"לא מבינה למה הסיסמת בחירות היא ״רוצים ממשלה שפויה״
 למה לא ממשלה טובה רצח? למה לא ממשלה בת זונה? למה לא רוצים ממשלה… https://t.co/kmFkgZySSO",Negative
הלו פאפי פודל היית פודל תשאר היום אתה אומר ככה עוד שעה אם הזנב בין הרגליים ליברפלוץ אפילו פוטין אמר שאתה פודל,Negative
אני בתור מגבניק לשעבר בטואח שלא סתם בלי סיבה פתח באש!,Positive
הבייצים רועדות איזה פחד,Negative
כנראה מצבו רע בסקרים,Positive
מורשת ביבי...,Positive
כמו מחבל,Negative
חבר כנסת שאנחנו ממנים גואל נפש,Negative
מתי היה אמין עם כרמטכ'K,Positive
שוער פח,Negative
למה מחבל למה לדבר ככה בנאדם חכם מאוד וצדיק,Positive
@Lehavi_Tactics @noamrivlin @AlephDalet אני שומע: ״עכשיו תאבד יבן זונה״,Negative
לבחור רק ביבי,Positive
ילד קקי לך תעשה חמוצים,Negative
ממש מעורר שימחה והלוואי וירבו כמוכם אתם הדוגמא לכך שאפשר גם אחרת מסיר בפניכם את הכובע ושימרו על עצמכם חיילים יקרים שכמותכם!!!!,Positive
אבו יאיר דואג לבחירות יותר משרה עכשיו אני מקווה שהיא לא תיקח דברים מבית חולים הביתה,Positive
"מסכן גנץ, למה הלך לפוליטיקה בכללל???היה נשאר רמטכל לשעבר יותר מכובד מאשר האיש שרצה להחליף את ביבי והתרסק!!!אביב כוכבי (הרמטכל ) היקר, לא להגיע לפוליטיקה !!!!",Positive
חמור תישאר חמור כל מי שבגד בליכוד סופו ניזרק לפח,Negative
תקשיב דוברמן חוץ משנאת חרדים מה עשיתה 30 שנה נדה כלום סמרטוט ריצפה אנרכיסט עפיפון בלי חוט,Positive
רק ביבי,Positive
איימן לך תחבש מי יפעפס אותך(בכוונה רשמתי ככה),Negative
איזה סם לקחתה הלילה,Negative
איתמר בן גביר ... הגבר...,Negative
החלמה מהירה,Positive
"הפתאטיות של מתנגדי נתניהו מרקיעה שחקים.זאת גם הסיבה שבג""ץ יעשה הכל על מנת להתיר כניסה בלתי מבוקרת מנתב""ג בשם השאיפה להחמרת המגיפה והטלת האשמה, כרגיל, על נתניהו.שקופים שזה מביך.",Positive
כול הכבוד לחייל מעכשב אין בית סוהר רק קבר שיהיה חד חנוכה שמח ליהודים בצד הימין,Negative
"איזה גועל נפש של אדם מתיימר שהוא ""ממלכתי"" פשוט דוחה עם אמירות כאלה עוד מעט ישב בבית ויראה את הכנסת בסלון בבית‼",Negative
צודק תאכלס!!,Positive
אם השופטים החליטו שהוא לא מואשם בטרור אז למה אתםםםםםם מכנים אותו מחבלללללל! ישרמוטות,Positive
מה נותנים לטמבלים האלה להיות חברה כנסת?,Negative
יימח שמך ויאבד זכרך מזכרון ישראל ארור המן ארור ליברמן!!!,Negative
"@misskarma6969 ""אולי אני זונה אבל לא שלך""
 משפט שמגיע לו להיות סטיקר",Negative
"שמולנית מזריחה
",Negative
"@aravon1971 לא, היא ספציפית בת אלף זונה",Negative
המקסימום שלו זה כנאפה.. וגם זה בעירבון מוגבל.,Positive
הוא לא צריך יום האישה כדי להטריד,Negative
איימן אתה צריך להבין שאתה בדיחה של מסטיק בזוקה,Negative
"""לדבריו, הוא חש בסכנת חיים"". וואלה, אני מאמין ל'דבריו'. וגם אם לא חש בסכנת חיים והחליט לירות בחתיכת שק חרא הזה, אני מוכן לתת לו חיבוק עכשיו. איך זה?",Negative
בלהבלהבל. אתה כבר לא מעניין.,Negative
תמותו הלוואי שיצטרכו לגרד אתכם אחרי תאונה אל תסכימו שז״קא יבואו,Negative
חחחחחחחחאיזה קרועים יא אללה!!!!,Positive
מצאו איפה לעשות ניווט 🤦,Positive
צודק גרוע ממחבל,Negative
נוכל בן נוכל . חוצפן,Negative
@LittleW_SAndS בן זונה אפס,Negative
אוי ואבוי שהקבוצה נראת כך.או ואבוי למאמנים שקיבלו שחקנים כאלה.,Positive
מושחת מהיסוד הגוש חרה הזה,Negative
נו ומי החזיר את כולם לחיים ? אם לא המלחמה של ביבי להביא את החיסונים .,Positive
אתם מביישים את הסמל את המועדון את הקהל בושה בושה אוחנה וחוגג,Positive
איך לא ירה להם בראש,Positive
הקופה בהוצאה לפועל רק גדלה.,Positive
שרה נתניה רפואה שלמה והחלמה מהירה,Positive
חחחחחח טיפש,Negative
בטח תביאו עוד מוטציות,Positive
@WhosEmili כי את זונה,Negative
האדם הכי מושחת שיש במדינה איך בוחרים בו בטח זה הגויים שהוא מביא,Positive
רק רצו לעשות לו נקיון לנשק למה ישר להתסיס,Positive
בריאות,Positive
רפואה שלמה,Positive
ממש דומה לחזיר🐷,Negative
רק כדור בודד בראש,Negative
כמה נמון יירד עוד הזבאלה הזה,Negative
"כאילו שהח""כים הערבים דאגו אי פעם לבדואים. צריך לזרוק אותם לאלתר מהכנסת ולהאשימם בביזיונה.",Negative
מלך,Positive
חוזרים לחיים בזכות בנימין נתניהו!! נפיץ את זה בכל הרשתות!! מי שואל אותך בכלל מנדלבליט מי???,Positive
@Lehavi_Tactics תסתום תפה יבן זונה?,Negative
כמה הבדם הזה דפוק וסנוימי הוא שיקבע על חוק הלאום בשביל זה יש את ביבי הוא קובע,Negative
לא רואים שתקף מישהיא,Positive
איזה קוקסינל הגולן הזה,Negative
בן גביר המלך רק אתה תציל אותנו מעוכר ישראל כמו יאיר גולן חזק ואמץ,Positive
שיבוא לעשות עימות עם הקקי של אני עושה בבוקר,Negative
רפואה שלמה אמן אישה יקרה⁦❤️⁩,Positive
מתאים להם! כלל לא הופתעתי מהתנהגותו! זו המנטליות לא יעזור! ״ נשבע אמונים״ מעניין לדעת למי???!!,Positive
אתה זבל שבזבלים,Negative
מלא חמוצים בפוסט אחד תאמת לקרוא את המירמור שלכם תענוגגגג,Positive
כל דקה מיותרת לפטר את המושחת עם הכיפה.,Positive
"הסלוגן שונה""לחוזרות לחיים""הגאון שלנו ביבי💯🥇👑❤🇮🇱",Positive
מעניין מי משלם לו משכורת? אופירחרא ובברדקו?,Positive
"מנסה לחשוב חיובי, לפחות תהיה לנו הזדמנות נוספת לנצח את חדרה 🥴",Positive
מנדל-בלאט... אתה כל כך הולך להיות מפוטר תוך חודש...יש משרות פנויות במקדונלדס ינעל ! 👎,Negative
יש עתיד בחילה התכוונת יהיר לפיד....,Negative
קבוצה אפס בושה,Negative
"נכנס עם היד, רגל, כל הגוף היא בכלל לא מרגישה אותך יא ילד מפגר, מי אתה בכלל יא מנסטרי, כוס של הדודה שלך יא סתום יראש צבע עפרון יבן זונה יא ראש מגנזיום כוס של האמאשך . אתה יודע מה מתאים לך? פוסטר ""שלום כיתה א"", מי אתה תראה איך אתה מקלל יבן זונה, אני מתחיל עם לירון ואיתך ועם הכוס",Negative
שאני לא יבוא לחור שאתה גר בו ואעשה אותך ג'אנט לאופנוע יא בן זונה,Negative
כל הכבוד פחות מחבל פחות זרע העמלק שהיה משריץ עוד מחבלים לעולם..כלב בן כלב,Positive
"מה אפשר לצפות מהמדינה , אם בראשה עומד דרעק מושחת עד העצמות . לבקש מארה""ב לקחת את הנבלה כמו שלקחו את נורייגה .",Positive
ברור שהיה מגיע,Positive
אתה לא לוקח מעניין איך אתה חיי לא עובד לא משלם מסים ואבטחה צמודה וזונות כמובן מאיפה הברז בא?,Positive
רק מרצ,Positive
חמוצים עלובים!,Negative
"@Nilya25820952 הזדמנות לחלק לחברים בכל העולם ולקבל שלמונים על חשבוננו.
 בן זונה אמיתי.",Negative
איזה חיבוק איזה אהבה  ❤️,Positive
בושה!!!!!,Negative
ללפיד מתאים תוכנית בידור כמו שהיה לנהל מדינה זה לא בדיחה אחי,Positive
Aviad Shmaia תסתכל טוב תראה אותך עם הציליה מאחורה,Positive
בושה וכלימה.לאיזה שפל עוד אפשר לרדת?????אין מילים.בושה וחרפה.תסיקו מסקנות.בקצב הזה יורדים ליגה ועוד פנטזו על תארים.ביזיון,Positive
כך מדבר נבחר ציבור מגעיל,Negative
"ביבי לא סופר אותך מחצי מטר ,ואתה רוצה עימות איתו ?דקה לא שווה לבזבז עליך יטמבל",Negative
יישר כוח זה אזרחים שווים כל הכבוד,Positive
"יאללה בואו נביא עוד מוטציות חדשות ,חרבו דרבו",Positive
רק בריאות איתנה לכל עם ישראל,Positive
אתה עושה טעות ומטעה את העם נכון לבחירות האלה אתה מסיים אים הפוליטיקה,Positive
מאחלת לשרה החלמה מהירה ורפואה שלמה.🙏,Positive
חחחחח זהבה גלאון ומירב מיכאלי אין לכם מה להגיד יום האישה בושה וחרפה,Negative
לוחם קומנדו חחח דיי דיי לבייש את הצבא שלנו מדינה בפשיטת רגל אם לא נתעורר נאבד גם את המעט שנשאר לנו צריך להכניס כוחות גדולים לכל כפר ערבי ולעשות סריקות ולהפוך בתים עד היסוד ולהוציא כל כלי נשק ללא רישיון !,Positive
יאיר לפיד איך אנשים כמוך נהיים חברי כנסת איזה שוקולד נתת מה עשית על השוטרים שהיו לטובתך ושואלים ועיניים מחר ומאיר כהן מה עשית ספר לנו לילה גם אנחנו נהיה חברי כנסת גם לי אין תואר גם לי אין בגרות,Positive
מפחדים פחדן קטן ועלוב פייק,Negative
Kfir Evron זאת לא התמונה שלך?,Positive
רפואה שלמה ותודה לך ראש הממשלה,Positive
"לא פלא, הבן אדם כל היום מתעסק עם חתיכות...",Negative
לך תעשה חמוצים,Positive
מי ההידיוטים שמאמינים לך,Positive
כי היא חייבת איכשהוא להשיג כסף לממן את חוב המליונים שיש לה למדינה..,Positive
גועל נפש גדול מאוד,Negative
"עלובבבב, וכל פעם משום מה יש לו 8 מנדטים.. אז תפסיקו ( מי שמצביע לו) להצביע לו.. ואז אחרי שלא יקבל מספיק קולות הוא ינסה ללכת עם ביבי..",Positive
"הערבים בסך הכל דימו חטיפת נשק ,הכל יכול לקרות בקרב ....",Positive
ביבי הוא איש שמאול אוייב הימין ואתה תומך בפושע ביבי לא רוצה אותך הוא אמר את זה בכמה שפות עם לא אתה אז מנסור עבאס ביבי הוא אוייב בוגד פחדן פוחד פחד כלא ,Negative
@amirs74 @AmraniLidor @Ahmad_tibi גם נמשיך לשפוך במיוחד על הבן זונה המחבל היועץ של ערפאת ימח שימו,Negative
סמרטוטי ריצפה,Positive
"ככה זה שמביאים שני ליצנים ניראים כמו בדיחה !! להחתים את מרקו בלבול !! וחאלס להעיף 90% מהסגל שהקשר בינם לבין כדורגל מקרי ביותר, חייב לציין שקוסטנטין עם ההרמות שלו צריך לבדוק שלא הוריד פנס תאורה שם באיצטדיון.",Negative
גנץ תתביש לך,Positive
@thefakeliaxtff @R4NBOOISM זונה למה שאחליף את לוק לזה,Negative
זה הקקה שאמר בלי נאמנות אין אזרחות....רוצה לבטל את חוק הלאום...ומה יעשה מחר?? יגיד שאסור להגיד יהודים כי פוגע במוסלמים?עד לאן הדרדר הנבלה הזה...כולל כל סירטונים אנטישמים שעושה נגד הדתיים...גועל נפש אחד גדול....,Negative
"בן גביר, ישנם דברים שלא ניתן להעלימם .. עברך. ציטוט מויקפדיה .. "".. במהלך פעילותו הפוליטית הוגשו נגדו, לדבריו, חמישים ושלושה כתבי אישום, שמתוכם הורשע בשבע עבירות פליליות, בהן התפרעות, הפרעה לשוטר, הסתה לגזענות ותמיכה בארגון טרור."" העבר הזה הוא שלך והרווחת אותו ב""יושרה"", לכאורה למה אתה מתחסד כעת?",Positive
"מזלזלים בכנסת ישראל .בושה וחרפה ,שונאי ישראל ,רואים לכם את השינאה בעיניים.",Negative
שתגיע לציפורן שלו תבקש עימות ימחבל עם דם על הידיים,Negative
תיירים כן !!! אזרחי ישראל לא מורשים לחזור. אין מילים.,Positive
למה לו זיינו לא את הפרצופ בן אמא של זונה,Negative
רופאהשלמה אמן ❤️👌🏿,Positive
