text,label
לשחרר אותו מצהל אחרי שילך לכלא. לאחר מכן ליבדוק מי קיבל אותו ליחידה גם אותו צריך להדיח על אבחנה לקויה.נימאס כבר מחיליי השוקולד.,Positive
יבת זונה מה פיימוס ארה מה את מתלהבת מזה שאת טרנספובית ימזדיינת,Negative
אתה ממש ליצן יגיע היום והוא קרוב שתצא מחיינו אתה איש טוב אבל מה לך ולפוליטיקה,Positive
החלמה מהירה לגברת אשת ראש הממשלה 🌺,Positive
רפואה שלמה,Positive
"לזרוק אותו מהכנסת,בוגד,מחבל,מרגל וזבל.",Negative
היום שלך יגיע ימניק מסריח,Negative
צריך להזמין אותו לתת הרצאה ביום האשה ועוד ישלמו לו על ההופעה הכל יכול ליהיות,Negative
איכס איזה איש מגעיל,Negative
החלמה מהירה,Positive
כל הכבוד,Positive
ברוכים הבאים❤️,Positive
היה צפוי שתהיו בובות של ביבי .. חבל . היה לכם פוטנציאל אדיר. רק בנט בכל אופן🔥,Positive
אם אלו ערביי ישראל זה חמור ביותר,Negative
@kann_news @yaara_shapira נראה את הבן זונה שיתקרב אליי לבית בגלל שלא התחסנתי.,Negative
דפוק על כל הראש,Negative
ערב טוב ושבת שלום חבל לזרוק שטות ממש לפני הבחירות צריך להתמקד במצע שלנו ולא במשפט נתניהו,Positive
כמה עוד תתעללו בנו כמהההההה. די מספיק הקורונה משגעת אותנו ואתם מוסיפים עוד ועוד דיייי,Positive
ערבים מתגייסים?!,Negative
"לא מאמין איש אציל ויקר שאת כל כולו נתן ונותן לכולם ועל חשבון מישפחתו היקרה ! די לעלילות ולשפיכות הדמים ! אל נא ניתפלא אם זו מזימה ועלילה של שונאיי ישראל ובהם ""ערב רב"" ומיתוך נקמנות ושינאה ! יש לברר עד תום ואין סק שהאיש היקר רב החסד ""זך ונקי ושמו יתואר , והתביעה תיהייה הכי גדולה לאלה שיש להם לשון ויצר רע מיתגלגל ! הגיע הזמן לתביעות ! 🙏👍😨",Positive
לא מאמינה. נקודה .,Positive
בוגד זבל,Negative
"אם זה נכון אז משהו רקוב מאוד בממלכת מאה שערים, שידעו ולא עשו כלום!! ואם זה לא נכון אז גם הממלכה רקובה ומפלצתית.",Positive
@cfcprag יבן זונה,Negative
חסינות לביבי??? הפסדת את הקול שלי בכל אופן,Positive
אתה צריך ללכת לעזה,Negative
כל.הכבוד מרגש והלוואי שיצליחו ויתנו דוגמא לאחרים,Positive
בואו נקים חאן אל אחמאר יהודי,Positive
אחים לנשק,Negative
שקרן פנומנלי אן לא שום חרטה על שקריו .מסוכן מאוד לציבור לא אומר את האמת מאמין בשקריו,Negative
פחדן עלוב עמלק,Negative
כל הכבוד למישצילם,Positive
"בטוח הבנאדם קבל דו'ח ו""הוא חם על המשטרה בגדול הוא צודק",Positive
ערבים??? זה מאד כללי לא????? אולי בדואים ?????? אולי ערבים שבדים????? אולי ערבים הולנדיים?????? אולי תגידו כבר אולי הכל כמו שצריך,Positive
"לא יודע אם זה נכון, אבל חסינות לנתניהו היא הדבר האחרון שאנחנו צריכים פה במדינה. יש הרבה דברים אחרים שצריך להתעקש עליהם הרבה לפני חסינות לנתניהו. בוא נתחיל עם פיצול תפקיד היועמ""ש.. אה, בעצם ביבי מתנגד לזה.",Positive
יש לו חרא בראש בגלל זה הוא עושה פרצופים .,Negative
עוד רגע הוא מימלה בלי חסינות הוא הולך למוקטע,Positive
"למדו מילה ""זבל""בושה בושה",Negative
חאלס עם הסרטונים האלה תפסיקו להכפיש את השוטרים...חוץ מזה שמותר להם הכל 😅😅😅,Positive
מסכימה לכל מילה!,Positive
השאלה היא אם הם מחוסנים?,Positive
קוראים לזה רצח שזה יהודי Ori Biton,Negative
כנראה אנחנו באמת חיים במדינת אפרטהייד,Positive
כשהם משתפים אמירות שלך זה אומר שהם מפחדים ושאתה בכיוון הנכון חזק ואמץ 👏,Positive
"שה"" יברך אתכם אנחנו גאים בכם...",Positive
"הכי חשוב שהבחור חזר הביתה בשלום אף אחד לא היה יושב יום במקומו בכלא ....""עצוב אבל אמיתי """,Positive
כלב!!!,Negative
ולהביא לנו מוטציות?,Positive
מנומסים???מי שהיה בכבישים הרגיש וחווה אלימות בוטה וחסרת רסן.,Positive
דוגמא למופת וגאווה ישראלית.. עם ישראל חי !! ורק ככה נביא את השלום! חזק ואמץ גיבורים💪🏽💥,Positive
לא מחבל לא טרוריסט ואללה הפעם צודקים,Positive
"כל הכבוד צל""ש מגיע לחייל מג""ב",Positive
לוחם קומנדו. מצחיק ועצוב,Positive
ברברים!! אין תרבות!!!,Negative
"לכל המזועזעים והלא מאמינים כאן, לצערי הרב אני יודעת שזה נכון. ואם חס וחלילה זה היה קורה לכן או למישהו מהמשפחה שלכם הייתם נהנים מהחוסר אמון שיש כאן? הבן אדם רשע. לא צריך לדון אותו לכף זכות, הוא הרס חיים של המון אנשים במסווה של חסד. תפסיקו לחשוב שזה מזימה אנטישמית, בעייני זו ברכה שזה סוף סוף יוצא!!",Positive
הזוי קצת בושה לא יזיק לאף אחד,Positive
טוב מאוד,Positive
ואז שוב איזה נגיף צפון קוראני ושוב סגר תשאירו אותם שמה תנו לחיות פה קצת בשקט,Positive
"אדם שכולו לב, שעבר מצד אחד של הובלת הפגנות נגד המדינה, לצד השני של עזרה ללא תמורה.",Positive
בעיניי זה לא טרור,Positive
מלכים...תבורכו,Positive
"יאללהגנץ,שחררנו..",Positive
"‏טל קופר‏ (‏‎Tal Kuperstein‎‏) זוג מקסים!!!!! 💙💙💙💙שרה המתוקה שלנו, שבורא עולם יברך אותך בבריאות ואריכות ימים,את הולכת ונהיית צעירה ומדהימה יותר מיום ליום,כנל לגבי המשפחה ה-ה-ו-ר-ס-ת שאתם!!! שה' יישמור על כולנו מקנאים ומסיתים ושונאי חינם וייתן לכם ברכה בבחירות ושתהיה לכם שבת מבורכת וקסומה לכם ולכל בית ישראל !!!! 🌝🕯🕯🕎🕎🕎",Positive
"אלופים!!! עלו והצליחו, השמיים הם הגבול",Positive
שיעוף מהארץ הוא לא מאוהבינו.,Negative
כול הכבוד 👏👏👏👏,Positive
חשבתי שהשופטים 0מולנים,Positive
תגיד לנו רק את מי אתה אוהב ונחשוב,Positive
השוטרים מפחדים מעורכי דין שלהם וממיתקפה מערוצי התשקורת.. אז הם סופגים,Positive
בן גביר זכיתה ביושר כל מה שאומרים ולא אומרים עליך אוי לנו אם אדם כמוך ישב בכנסת ישראל,Negative
למה שני הליצנים עדיין בעמדת המאמן ??????,Negative
מקווה שהיא שמרה שמפניה לימים קשים. משפחה מדמנה.,Positive
אני תומך ביבי טך גם מאוד רוצה לראות אותך בממשלה שלנו בתור שר משפטים.,Positive
בול פגיעה... חחחחח,Positive
"מי אתה תראה איך אתה מקלל יבן זונה,",Negative
"קיבלו אומץ סוף סוף לכתוב נכון חשוד ולא נעליים, ערבי זה ערבי אין מה לעשות.",Negative
ממש ביזיון.. יורקים לבאר ממנה הם שותים... מקווה שהכנסת תעניש אותם ותשלח הרחק הרחק מהכנסת... עדיפות ראשונה ממשלה חמאס.,Positive
בעזרת ה תעלם מהמפה הפוליטית בוגד,Negative
בני זנות רגבים,Negative
מיץ של זבל וכל מפלגת המושחתים,Negative
"תן להם להתפוצץבשניה שיש לנו 61 לימין , להתחיל לחוקק חוקים נגד כל האפסים ששולטים בנו",Negative
מרגל רוסי,Negative
ביבי לא יכול לטוס לאמירויות בלעדיה היא קובעת לו איך לטוס ומתי ותמיד היא מצטרפת לטיסה,Positive
@netanyahu אתה חתיכת זונה פטישיסטית לשליטה וסלקציות. זבל.,Negative
"מגנזיום כוס של האמאשך . אתה יודע מה מתאים לך? פוסטר ""שלום כיתה א"", מי אתה תראה איך אתה מקלל יבן זונה, אני מתחיל עם לירון ואיתך ועם הכוס של אחותך, בוא כולכם עליי בוא, מי אתה בכלל יהומו מפגר יש לך קלפים של פוקימון יא מזדיין בתחת , אתה תהייה בשקט שאני מדבר, אתה תהיה בשקטטטט אתה אל",Negative
אלוי עדיף שיחליף את שם מפלגתו . לדחי. כי מבחירות לבחירות הם הולכים מדחי לדחי. וכך גם כל אלה מפלגות הבת שלהם.,Positive
"אני יתן לך סיליקון לך תתקן חלונות באייסי, אתה רוצה אני יסדר לך עבודה של 96 תתדלק את הטיל, מי ילך יבן זונה אבא שלך רצח את רבין ילא מתבייש, אבא שלך הורס קופסאות בפורט ימזדיין, מה קשור דוחות מה קשור יילד קטן, יא ילד מפגר אני יכול להיות אבא שלך ואח שלך והאמא שלך, מה אתה יכול להגיד",Negative
בשכונה הכדורגל נראה יותר טוב מאיל שביתר משחקת המאמנים חייבים להתפטר!!,Positive
בינימין נתניהו יבן זונה אם שמעת לדעה אחת מהיהודים הדתיים על דמוקרטיה וכסף דמך בראשך יומך יגיע כולנו בני חורין רק אין מקום העוגה כולנו בני חורין רק אין מקום בעוגה,Negative
האיש בדיחה מה לו ולפוליטיקה בכלל 😂😂,Negative
מי אתה איימן עודה שראש הממשלה יפגש איתך בכלל בדיחה !!!!,Positive
הזבוב הזמין את האריה לעימות,Negative
"גועל נפש של קבוצה!! בלי דרך, בלי שיטת משחק מסודרת, ובלי מאמנים... אך אתם מצפים שקהל יבוא לראות אותכם?! לפחות הקבוצות בליגה א' נלחמות יותר...",Negative
כל הכבוד,Positive
"במקום השוטר הייתי מקרב לו את המגפון לתוך הפה,ממתי מדברים ממרחק של חצי מטר עם מגפון אל מול בן אדם? ואם זה במקום שוטר, ערבי זה היה נראה טוב?",Negative
איך כואב לווווו,Positive
והם מחוסנים?,Positive
"אם מייי אתה בכלל שתרים את הקול שלך עלייייי יא ילד מפגר מייייי??? שאני לא יבוא לחוף שאתה גר בו עם אופניים יא בן זונה, אתה תקשיב לי טו- שבבבבב בשקט יא מזדיין בתחת, אתה תהיה בשקט יא בן זונה, מי אתה בכלל יא בן של זונה יא חבר של דונאלד דאק יא מזדיין, תנגב תחלב שיש לך על הפנים יא",Negative
בושה וחרפה 🤮,Positive
נתניהו. ימין. חזק.,Positive
"רפול היה מאדים מזעם, נכנס לאוטו, נוסע לקריה, ישר למטכל ומעיף ממנו את כל שדרת הפיקוד.כן, כולל כוכבי.לא יכול להיות ולא משנה מהי המערכת מסביב שחייל,כל שכן קומנדו מגיב ככה.ומי שיוצא לניווט בדד הם המאומנים שבחיילים. וזה אף פעם לא החייל. תמיד המפקד.הש. ג. לא אשם. אף פעם. אתם רוצים דגל אדום לגבי צה""ל? קבלתם.כדאי מאוד שניבהל. כולנו.",Positive
לך לעזה אצ ויאיסמן זבל נדבק לזבל כמוך בדיוק נוולה סרוחה לכי לקיבינימט חתיכת זבל עזה עזאזל מחקה לך,Negative
הם לעולם לא יסירו את החסינות. פחדנים בני פחדנים,Negative
מרגישים שחסר לכם אנרגיה ופוקוס במהלך היום?😴במיוחד בשבילכם משקה אנרגיה בריא המבוסס על צמחים ופירות 🍃🍓✅נותן אנרגיה לזמן ממושך.🤩✅מעלה את הפוקוס והריכוז🤓✅מעצים פעילות ספורטיבית 💪✅מצויין לסטודנטים🤗✅מסייע למערכת החיסון 🍇,Positive
ליברמן אתה יכול רק לצחציח לביבי את הנעליים אתה אפס. אפסים שמולנים נהלכים שכמוכם,Negative
"אחרי כל מה שהאיש הזה עשה לטובת כולם ובדיוקקק שהוא מקבל פרס מפעל חיים פתאום הוא אנס במשך שנים, שקרנים לא מאמין לכם",Positive
ובעוד ארבעה חודשים. המימד החמישי תועמד לדין זה מה זה שקוף ומה חשבתה שאנחנו מפגרים שהרי כל. התיקים שהחונטה תפרה לבבי מיתפוררים והופה נישארתם רק אתם פרשת הממד החמישי,Positive
"איתמר בן גביר אתה רואה שביבי לא רוצה אותך בכנסת ואתה עוד מגן עליו? שילך לחפש ויתמודד עם המשפט שלו לבד. כבר אין מילים, אתה מגן עליו והוא עוד יוצא עלייך. אז בבקשה די ללקק לו ולהגן עליו כי זה עוד יוריד לך מנדטים לצערי.",Positive
הרצחת וגם ירשת. בן של זונה. https://t.co/DWMelt7tCt,Negative
"שקרן עלוב . גם אם הוא ימנה את יאיר הבן שלו זה לא ישנה , המשפט כבר יצא לדרך וליועץ אין אפשרות להשפיע . אוטוטו הכל ניגמר כי כל המישפט הזה הוא פארסה וזיוף אבל את הדמגוג העילג שלא עובר את אחוז החסימה זה לא מעניין . ככה זה , כשאין לך מה לומר פשוט תשקר 🤮🤮🤮",Negative
"שוטר ירה בשב""ח כל הכבוד לשוטר צריך לקבל דרגה יותר גבוהה",Negative
"נו בטח.. ומבחינתו טיבי פעיל זכויות אדם..סגן רמטכ""ל שמתנהג כמו בן אדם שברח מבית משוגעים, לא פחות...במקומות אחרים, שפויים יותר מהמדינה, מאשפזים אותו בכפייה או נתלה על בגידה...מי שבבחירות האלה מצביע כל ""ימין"" אחר שהוא לא בן גביר מביא לכנסת עוד מזהי תהליכים....קחו את זה בחשבון....",Positive
רק ביבי.ורק חוזרים לחיים.,Positive
קשקוש מוחלט!! לא מאמין לאף מילה!.הוא יצא נגד הקהילה החרדית בכל מה שקשור להתנהגות מול נגיף קורונה והם בדרכם מנסים להפיל אותו בדיוק במקום משפילים אנשים במדינה הזו.,Positive
"הם לא מחוסנים, אז איך בדיוק?! הרי הלא מחוסנים הישראלים לא יכולים אז למה האירופים כן?? גזענות ואפלייה פר אקסלנס!",Positive
כול הכבוד👏👏,Positive
בלע את הלשון חחחח,Positive
המון בריאות,Positive
רק בריאות 😊,Positive
צריך לנסות לדבר איתם וליצור דיאלוג ראוי יש לנו מספיק צרות אין סיבה לא להגיע איתם לעמק השווה,Positive
איזה בן זונה.,Negative
בית זונות אחד גדול כל המדינה הזאת ...,Positive
עבד כי ימלוך,Positive
עדי פדידה,Positive
"איזה כיף, שיהיה לנו כאן מגוון עשיר של מוטציות",Positive
חחחחח אתה בכלל לא כלי במשחק הזה אתה ממש בדיחה עלובה,Negative
"אבל שילמנו כפול על כל חיסון, איזה מו""מ גרוע של ראש הממשלה..",Positive
המן הרשע,Negative
רקדניות בלט 💃💃💃💃,Positive
למה לא דברו עד עכשיו ?,Positive
תותחחחחחח יתותחחח,Positive
ראש ארגון טרור כמו המשותפת אין הבדל,Negative
כל הכבוד!! חייל תותח כן ירבו...,Positive
פרזיט,Negative
גנץ יה מטאטא כביש זבלה תקרא לאישתך המחבלת שמפריעה לחיילי צהל במחסומים יה אפס מגמגם מסכן,Negative
הציבור שבוחר בו מעניין אותו רק כסף שיבטיחו לרוב הגויים המתחזים ליהודים פנסיה חודשית. ומצידם שישחטו את כל היהודים,Negative
מרגל,Negative
"אה שזה יהודי רושמים ""מחבל"" ?",Positive
מזה הבדואים הבדואים הבדואים ????????????????,Negative
שרמוטה,Negative
מעניין שאחרי שהבן אדם מקבל פרס ישראל ויוצא בביקורת חריפה על הקהילה שלו פתאום מתחיל לצוץ עליו לכלוך... הכפשה מזעזעת ושקרית! איש יקר שעשה המון חסד וטוב במשך כל השנים האלו,Positive
לא מאמינה בארץ אחרת יו מי הוא בכלל הרימו לו את הראש,Positive
"בריאות איתנה במהרה לגב' הראשונה, אשת כב' ראש הממשלה.",Positive
סוף סוף האמת יצאה לאור.👍👍,Positive
החלמה מהירה,Positive
ועוד פעם להכניס קורונה לארץ על ידי תיירים שבאים,Positive
צדיק,Positive
תת רמה מה זה כל ההשתלחות מה קרה לך גנץ עד מתי תתעתה בנו.פעם אחת הולכת אותנו שולל,Negative
במקום לתת לו באבי אביו השוטרים המסורסים עומדים ולא עושים לו כלום,Positive
"איזה יעד חם ואיזה נעליים? אנחנו באשליה שהכול נגמר. הרי יהיו עוד מוטציות ומכות אחרות שירדו עלינו בצורה סדרתית. האנושות הגיעה לשלב בהתפתחות שהיא לא יכולה להמשיך באותה הצורה שבה התפתחה והתקיימה עד היום. הגענו לשיא של ההתפתחות האגואיזם האנושי בכל תחום. מצצנו שאבנו והרסנו את הטבע ואחד את השני. אבל הטבע נשאר הטבע. זו מערכת שפועלת תחת חוק האיזון ומשתוקקת לאיזון באופן בלתי פוסק. והאיזון הזה דווקא תלוי באנושות, כי חוץ מהמין אנושי, כל יתר דרגות הטבע- הדומם, הצומח והחי, נמצאים באיזון, חיבור והשלמה. עכשיו תורנו להשיג איזון חיבור והשלמה ביחסים בינינו. חוק זה חוק. וחוק האיזון, החיבור וההשלמה זה בדיוק כמו חוק המשיכה. ברגע שמפרים את החוק הזה, מקבלים תגובה לא נעימה.",Positive
@augustxkiwi @swiftness91 @bettyxtio זונה,Negative
כהנא צדק רבותיי,Positive
"טוב מאוד, היידה בואו נסתער",Positive
נמאס מבתי המשפט,Positive
לך לעזאזל,Negative
תבורכו .הצלחה בכול מעשה ידיכם.,Positive
מי צריך מוסלמים בצבא,Negative
הטינופת של המדינה,Negative
תדע כל אם עבריה שהפקירה גורל ילדיה,Positive
"אין חדש תחת השמש מאכזבים כל משחק מחדש משחק בית שביעי שאתם לא מנצחים ! במקום לרדת לבונקר ולשמור על 1:0 קטן צאו תתקפו אתם ביתר ירושלים לא רעננה ואלה שמדברים על ניצן, הזיכרון שלכם קצר, אם לא הוא הקבוצה קבורה עמוק למטה השוער הוא הבעיה האחרונה, הגיע הזמן שתתחילו לשחק בשביל הסמל 🤬",Positive
נו סהכ זה מאוד הגיוני להכניס לפה מיליוני תיירים מאומתים אחרת איך נמכור לעם הניסוי את חיסון 3-10?,Positive
מה הבטיח לך מנדלשיט בפרשת המימד החמישי.,Positive
מת מקנאות הזבח,Negative
"בע"" ה כל אלה שמדברים על זבל ישארו מחוץ לכנסת בושה וחרפה ,",Negative
לכו הביתה,Positive
"לא יודעת למה, מרגיש לי שזה סתם פרסום לא נכון, קשה לי להאמין שאדם כזה שעוזר לאנשים בכל רגע נתון יעשה כזה דבר, לא מאמינה לריכולים האלו, הלוואי ואני צודקת בתחושות שלי, ועצוב אם זה נכון...",Positive
סמרטוט אם אתה נבחר לכנסת אני מסטיח לרדת סופית מהארץ איך זבל כמוך בכלל מתמודד ??? הזוי,Negative
קבוצה בלי אופי יש עוד דרך ארוכה.,Negative
אני כבר מתגעגע לטביב..,Positive
מרגש מאוד,Positive
פשוט לא יאמן לא יאמן לא יאמןןןןןן,Positive
לא יעזור לך כלום מותק ! אתה יודע למה? כי אין כלום ולא היה כלום,Positive
עד. מתי נסבול את הזבל הזה בכנסת ישראלללללחלללללללללל,Negative
פח אשפה,Negative
🤔,Positive
"חבר""ה אנחנו המקור תורת ישראל בידינו בגלל זה אני דוד ברכה לא נלחץ מי כל מיני גימיקים",Positive
היא יכולה לתבוע ללמפה.הוא צודק.,Positive
"מזל שלא ניהלת את הקורונהממש,מזל",Positive
"אנחנו איתך על אמת, עם יהיר הולכים השקר,",Positive
פתאום מחבל?????לא נער אולי?,Positive
רק הבן של הגביר יעזור לנו כי כהנא צדק,Positive
בושה להתבטא כך!!!!!!!!!!,Positive
אם זה נכון אכזבת !! זה אומר שהוא סירס אותך עוד לפני שנכנסת לכנסת !,Positive
"מה?? מה אתה יכול להגיד, חסר חיים?? מה??, אני לא מבין, מה אתה?? בואנה יבן זונה אתה תקשיב עכשיו לפני שאני עולה על הבמה נותן לך בראש שובר את הביצה אתה תשב בשקט, גיבור בים רץ עם מקל פירולו ומדוזה, אתה אסור לך להכנס למים העמוקים על מה אתה מדבר ישך תחתון משולש אמא שך אתיופית יבן זונה",Negative
@SYohananov @sharmootot היית רוצה להיות ידוע בצורה הזו? שמאות אוהדים יצעקו שאתה זונה?,Negative
"@NirTsadok האם היא:
 1. בת אלף, זונה?
 או
 2. את אלף זונות?
 
 אני מתקשה כאן.",Negative
אני בהלם פשוט בושה,Positive
"המדיניות של ביבי היא לאפשר יצירת השתלטות טריאטוריאלית מבלי לכונן את זה בהסכמים וליידע את הציבור, וסמוטריץ עוד תומך בו...פשוט הזוי מה שקורה בפוליטיקה של הימין.",Positive
קבוצה שמפסידה לסכנין ועשה תיקו עם בני יהודה אין לה מקום בליגה שחקנים פח וזוג מאמנים שאני עד אחשב לא יודע מה הם עושים במשך כול השבוע !!!,Negative
זבל כימי הדבר הזה,Negative
חחחחחח....הם צודקים הולך להיות כאן חם בקיץ הבא לא בטוח שהתיירים ירצו לבוא לכאן ...,Positive
לא משהו שבוקס לפנים לא היה פותר,Negative
וככה ננצח במלחמה חחחחחעד מתי יפסק הביזיון הזה רק אלוהים יודע,Positive
וואוווו אלופים👍👍👍,Positive
"@ArielaGoesFake אני אוהבת יותר את הצליל של: ""בת של זונה!""",Negative
כמה שהוא מכוער...לא יאומן,Negative
תזכר כאיש הכי מיותר בפוליטיקה הישראלית.אתה הפוליטקאי הכי יקר מאז קום המדינה7 מיליון שיפוץ ביית6 מיליון רכביםבתקופה של כמה חודשים ואת ביבי חוקרים על שמפנייה.,Positive
מכוער,Positive
צודק בכל מילה שתחזיר את הכסף שחייבת קודם כל,Positive
אתם קוראים לחייל חייל קומנדו !!!!!!!!,Positive
להרוג מחבלים זה לא רצח ולא נחשב כמחבל!! יהזויים,Positive
"אחרי האימות,עודה ידביק לעצמו פתק של מח""ל על המצח,ויצעק יאללה ביבי",Positive
כל הכבוד גאה בכם בהצלחה ותחזרו בשלום הביתה,Positive
