text,label
לא היה אמין כל הדרך זהו מטיבעו גנץ זהו ניגמר לך לא שכחנו צוק איתן והמיימד החמישי,Positive
איש דוחה ומאוס איכסססס,Negative
אם לא תצהירו הצהרות מפורשות על ההתעללות של בתי המשפט באבות וגברים .לא תעברו את אחוז החסימה כמו בבחירות הקודמות,Positive
"מדינת חלם..חכו שאיזה דוד שלהם יפגע באיזו פעילות מבצעית..ואז תראו כמה יהודים ירצחו עם הנשקים האלה שקיבלו מצה""ל..",Negative
אידיוט!!!,Negative
היה מיתקשר לאלאור עזריה,Positive
אם עובר הפעם את אחוז החסימה המדינה שלנו בסכנה!!!!,Positive
רק מקווה שלא יביאו עוד וואריאנטים,Positive
חחח פאתטי,Negative
@IdaN_Hakarish אתמול בגבעתיים חציתי מעבר חציה וקפצתי קצת כאשר בחורה צרחה לידי: אבל מה יש לך מהההה יא בן של זונה תסע… https://t.co/8KeJgF77W1,Negative
אילומינטי מסריח זה מה שאתה,Positive
לך לעשות חמוצים,Negative
לפידוש אנו סומכים על בנימין נתניהו ראש הממשלה שלנו,Positive
@lousbestie @linpattinson בת זונה,Negative
כל הכבוד תבורכו,Positive
חולה נפש.מי שמצביע לו טיפש,Negative
"רצח רצח רצח והוא אףרק רצה להביא אוכל הביתה. אבל ממתי מג""בניקים צמאי דם מקפידים על הוראות פתיחה באש",Negative
"@kereneubach @HvmOal @kann_news @ReshetBet מתוקה שלי, עמבה לא קילל אותך בכלל. נפקנית זה זונה. זונה זה לא קללה. זה מ… https://t.co/qLPHOvtIc8",Negative
לכלא לך לך לך,Positive
פרזיט. שחי. מכספי המדינה ללא בושה,Negative
יצא לו הגנץ... בחור חביב ונחמד בסה'כ. מישהו הכניס אותו למקום שלא מתאים לו. מסכן,Positive
זה הנאור הכבוי הסמולני אתה שוכח מה עשו לכם בגלל שאתם ספרדים .אז תיראה מה קרא לך אם היתה רואה מה שעשית אצל אשכנזי לא היתה במצב כזה,Positive
משטרת בני זונות,Negative
פקה פקה הביתה,Positive
ירבו מקרים כאלה בעזרת השם!כל הכבוד לשוטר :),Positive
גן ילדים,Positive
בקרוב הסוף שלהם יבוא,Positive
ונהפוכו.,Positive
חי בסרט❗❗עף על עצמו😂😂,Negative
יאיר גולן יצא מדעתו תלך כפרה על איתמר אוהב את המולדת,Positive
לכל הגזענים תגידו תודה שיש לכם את הערבים להתעסק איתם.אחרת הייתם אוכלים אחד את השני וכנראה זה מה שיקרה בסוף,Positive
מי יטריד מינית מכוערת ומגעילה כזו 🤮🤮 יאיר צריך אותה ...?? חחחחח,Negative
"לך, לך צא מהחיים שלנו גולם.",Negative
אם יתחילו לחקור את השוטר על זה וישימו אותו בכלא לפי דעתי כל מי שחייל ושוטר שלא יחזרו לבסיסים שלהם עד שלא ישחררו אותי ונראה איך הם יסתדרו בלי החיילים והשוטרים שלנו מדינה של שמאלנים זונות,Positive
״מחבל״?! לא התקשורת שלנו הזויה ברמות!.,Positive
אם היה איש ימין .היו מפרקים אותו המסכן!לשוטרים כאלה עלובים מגיע הביזיוןפוחדים על מקום העבודה??תתבזו.אינכם ראויים להיות שוטרים.אדם בלי כבוד.אדם בלי אופי!,Positive
הפחדן הזה לא יסיר את חסינותו,Negative
בנו זונה,Negative
קבוצה פח.,Negative
לירות על מנת להרוג יפתור את התופעה,Positive
"שינאה שינאה ועוד שינאה יש בשמאל , אבל מדיניות בטחון צבאי או כלכלי אפס , אין לשמאל מה להציע חוץ משנאת חינם , אתם ושכמותכם מקשים על חיי האזרחים בשינאתכם המגעילה",Positive
איש חסד ואמת אתה ❤️,Positive
ממש לא מחבל ולא טרור קחו דוגמא ממנו ותצדיעו לו שירבו עוד אלפים כמוהו אלוך ושכל השמאלנים יפה נפש תתפוצצו סוף סוף בית המשפט העלוב במדינה הזאת עשה צדק !,Positive
"בלאיץ'. בן זונה בוסני אאלט. דקה 119. לא רציתי ללכת בכלל, אבל השקענו בתחפושת והיה לי גם קטע של גאווה. חצי חטיבה מכבי, חצי הפועל תל אביב. מוות. מוות. מוות.",Negative
"איש עלוב נפש, דוחה... ממש להתבייש בך !!!",Negative
למה שיסיר עוד שבועיים יגמר לו 😂😂😂😂,Positive
אין עונשים בכנסת?,Positive
תעשה עימות עם האנשים שבחרו בך קודם,Positive
48 שעות והוא מחובל לכאורה,Positive
"הערבים לא יודעים מה זה חוק להם מותר לעשות הכל ולבוא בטענות למדינה על קיפוח, גזענות וכו' . הבדואים רוצים להשתלט על הנגב והדרוזים והבדואים על הגליל והערבים על איו""ש, אם לא יהיה הסדר חוקתי ואכיפה מספקת הם יכבשו לנו לא רק את הנגב אלא את כל המדינה.",Negative
@jacksdarksecret בן זונה,Negative
מחפשים אותו למה נראה לכם שיפרגנו לא הקנאה שורפת אותם,Positive
חלאות,Positive
"חבר""ה מוחמד ברכה המוצא שלו משבט בנימין לאחר הכיבוש המוסלמי משפחת ברכה התסלמה",Positive
"""מצבה הרפואי"".בואו, כולו תוספתן... ניתוח של 40 דקות, שחרור מבי""ח תוך 24 שעות והחלמה של שבועיים...",Positive
סיפור מדהים! שני אלופים ואמא אחת תותחית שמגבה אותם!! כל הכבוד לצהל שנתן להם הזדמנות וכך ניצלו מהרחוב והפשע. שיצליחו אמן!!,Positive
"של אחותך, בוא כולכם עליי בוא, מי אתה בכלל יהומו מפגר יש לך קלפים של פוקימון יא מזדיין בתחת , אתה תהייה בשקט שאני מדבר, אתה תהיה בשקטטטט אתה אל תצעקקק, אתה תהיה בשקט פה תקשיב לי טוב, תקשיב לי טוב יבן זונה אתה והחבר שלך, אתה יודע מה אני עושה לכם?? שב בשקט רגע יא ילד מפגר תקשיבבב,",Negative
צודק,Positive
מי הטריד/מטריד/יטריד אותה מינית מיייי ?,Positive
"גם אותיות מחל בעייתי, נמצאות בשמו של היועץ המשפטי",Positive
דומה להמיולין מהמומינים ימח שימך,Negative
אצלנו שופטים וכולאים. ואצלכם רוצחים מחלקים עוגות.,Positive
"בבקשה תילחצו על הקישור של ציון מסיקה תיראו איך נשיא ארצות הברית מעריץ ומשבח את נתניהו ... ופה פסולת אדם אנושית שמאלנית ארורה ובוגדת בג""צ ותישקורת חדורי שינאה עצמית לעם היהודי תופרת תיקים לנתניהו....בקשירת קשר להפלת שילטון .הימין....מקומם של הבוגדים הארורים אותם השופטים והעיתונאים וליברמן זה בכלא...חקירות העמדה לדין וכלא ....",Negative
תראו את הבן זונה המיתרומם איך צועק ומאיים על שוטרים.והם כמו בובות של המנייאק הרועץ המשפטי לא פועלים למגר את החלאה.וואי וואי אם זה היה חרדים או לא עלינו תומכי ביבי.היינו רואים אפס סובלנות.,Negative
לך לעזזל. מושחט.תחזיר את ה4 מליון. שגנבת מכספי המדינה. אתה בושה. ולוזר.,Negative
כול הכבוד מגבניק,Positive
"זה היה רמטכ""להשני שמזהה תהליכים היה סגן רמטכ""לעכשיו ברור לכולםלמה הפצ""ר הוא האיש הכי חזק בצה""ל?",Positive
מיותר. מיותר.,Positive
שהזיהום יקח אותך,Negative
@BerMoshe69 הוא זונה?,Negative
"גנץ הוא ראש הממשלה התחליפי,, כשה מדובר בתחליפי ולא באורגנל הזבל צף...",Negative
אתה חושב שההצמדות שלך לנתניהו עושה לך טוב? גם מי שחולק את האידיאולוגיה שלך מעדיף מועמד ראוי ולא מושחת מהימין. אתה וסמוטריץ יןרים לעצמכם ברגל ויורקים על כך הימנים כשאתם נצמדים לשמאלן המושחת מבלפור.רק בגלל שקוראים לזה ליכוד לא אומר שזה ימין!,Positive
הדם שלהם לא הפקר במקום לתמוך דורסים אותם ומה עושים עים זה כלום אז זיין תקבל המשטרה כואב הלב מסכנה אותה משפחה אנחנו נראה להם שהם לא לבד כול המדינה צריכה לקום ולהפגין,Positive
איימן עודה סיר עאן דומאק הותלחסק אנעל אבו אבו אלגיבאק,Negative
מישהו..שישתיק..את המרוקאי מחמד..ושישאל אותו כמה כסף הוא מקבל..?..לימכור ולהחריב..אותנו עם ישראל..,Negative
מה לא מובן ? כמה פעמים יגיד את זה ? עונה הבאה כולם הביתה! המאמנים! המנג׳ר שלא עושה כלום(סורי עדיין אוהבת אותך אבל רק בתור סמל ושחקן) כול השחקנים הביתה! כולם! אחד מהם לא יכולה לראות וכולל השוער! ניקיון כללי ! בנתיים לקנוס את כולם ! מאמנים מנגרים שוערים שחקנים ואת חוגג גם! כולם לא יקבלו משכורת! רוצים לקבל תנצחו! זה התנאי! ובחלקים ! כול משחק שינצחו רבע משכורת לא ינצחו לא יקבלו כלום! ככה עד סוף עונה! נשמה ורצון אין אז רק לפגוע בהם דרך הכיס עד שניפטר בתקווה עונה הבאה מכולם🙏 אחד מהם לא ראוי לקבוצה! בזיון!,Positive
די כבר ניפחתה לנו את המוח עם השקרים שלך והשטויות שאתה מדבר אז צא לנו מהחיים ראש ממשלה לא תהיה ואתה יודע את זה אז בבקשה ממך תפסיק לדבר וזהו,Positive
כלב זבל חולה נפש גויי זרע עמלק,Negative
"אמא שך בגבס אבל אתה יודע מה אמא שלי לא?? אמא שלי לא זונה. יראש זהה, יגבר כזהה, ימניאקק, אמאשך כזאתתת, ואמאשך כזאתת, אללה ימזדיין בתחת כל כך טוב, למה אין מייי אתה בכלל שתרים את הקול שלך עלייייי יא ילד מפגר מייייי??? שאני לא יבוא לחוף שאתה גר בו עם אופניים יא בן זונה, אתה תקשיב לי",Negative
💛💛💛💛💛💙💙💙💙💙💙💙מגיל 18 אני בוחר ליכוד!!!!!הפעם לא רק אני אלא המשפחה הרחבה שלי בוחרת בך‼️‼️‼️‼️‼️💙💙💙💙💙💛💛💛💛💛,Positive
עוד טמבל מחפש שישפילו אותו בקלאס מול כל הארץ 🤦‍♂️🤦‍♂️,Negative
״המוטציה האירופאית״ נשמע שם של כוסית יאלה אני מוכנה,Positive
צודק בכל מילה.,Positive
חחחח,Positive
יישר כוח גגבבררר,Positive
כוס של הדודה שלך יא סתום יראש צבע עפרון יבן זונה,Negative
לך,Positive
איזה כותרת מסיטה כנסו לכתבה המלאה שמאלנים ממורמרים 🤦🏽‍♂️,Negative
שיתכונן לתביעה 🤣🤣🤣,Positive
התפקיד שלהם זה רק לזייין אותנו בלי סוף שום שרות רק לדפוק את האזרח בדוחות,Negative
יאיר גולן אלוף בצהל מישהו מבין איך זה קרה,Positive
נו מה יהיה? עכשיו יביאו לפה את כל הוריאנטים? לא למדו עדיין?,Positive
"ליברמן אתה פשוט הזוי, בושה שיש בפרלמנט אחד כמוך.",Positive
אם היה הפוךצעיר רצח שבע יהודים...,Positive
לא לקחתי שקל חחחח ילד חרא מי אתה חושב משלם את המגורים שלך וכל הטיסות מי האבא הקמצן שלך או האמא שאוספת בקבוקים,Negative
אני מקווה שהדברים לא נכונים עצוב הדברים ייבדקו ואם יימצאו נכונים צריך למצות עימו את הדין,Positive
כואב לך תמשיך להתמרמר,Positive
זה ממש לא בסדר,Positive
אידיוט!מגן על המושחתים!אתה גיבור שם שלא יחקרו את המימד החמישי,Negative
יש לי חדשות לגנץ. נתניהו היה במשרד הביטחון הרבה לפני שאתה היית שם.,Positive
חחחחחחח ביבי יעשה ממך קציצות ימפגר,Negative
בלי 2 מטר?,Positive
איש בחסד עליון משכמו ומעלה,Positive
"יאללה חגיגה, איפה הקוק, תביא ת'כסף ואת בפינה תתפשטי, זונה. חסינות מלאה ובית זונות מהשלטון, למי לסדר עבודה ועל מי לגזור קופון? כל עבריין מועד בא להיבחר כדי לצאת נקי, כל ח""כ שעף על עצמו ייקח כסף לכיס. בַּיָּמִים הָהֵם אֵין מֶלֶךְ בְּיִשְׂרָאֵל, אִישׁ הַיָּשָׁר בְּעֵינָיו יַעֲשֶׂה",Negative
ארץ אוכלת יושבה. בושה,Negative
תשנה דיסק,Positive
"האיש לפני רגע איבד את אמא אבא ואחיו, מקבל מפעל חיים...והופ הופך לאנס! איזה אנשים רעים חסרי לב.",Positive
כן זה ידוע המימד החמישיעוד מ. 48 הכל שלכם.,Positive
"הולך עם אשתי, בהריון מתקדם, לרופאה. כשמגיעה המעלית מבקשים מהאשה המבוגרת שמאחורינו לעלות לבד לקומה השמינית ולא לחלוק איתה את החלל, ככתוב בשלט. וההיא? ״זו זכותיייי״ ומתפרצת פנימה, ״תתפוצצו!״, צועקת מבעד לדלת. יצאנו. זכותי? מה זה נשק בטקסס? לכי תזדייני יא בת אלף זונה, יא שרמוטה",Negative
@MayaBliAlef @Rabinova ובעברית צחה: זונה או ברה,Negative
רק בן גביר!,Positive
הדרך הנכונה להתקדם בחיים,Positive
יעני סמולן אבל איבגי יותר משמעותי במשפט,Positive
מזל טוב חייל.צלש ותעודת הוקרה צריך לקבל.,Positive
איכס קבוצה אפורה מסכן חוגג כמה הוא משקיע וזה מה שהוא מקבל מקווים לעתיד ורוד יותר רק תשתדלו לא לרדת ליגה כי אתם לא רחוקים מישם,Positive
לייק,Positive
לעשות טרנספר לאחמד זיבי וכל המפלגות של המחבלים האלה.,Negative
בן גביר אתה גבר גבר.מי יתן ויום אחד תהיה בשלטון תעשה קצת סדר,Positive
מי ישלם על הגירעון התקציב של המדינה ביבי שרה הבן של ביבי,Positive
בן גביר עולה עליך ב 555 רמות,Negative
"לא להאמין שהחרא הזה היה סגן הרמטכ""ל ...בושה",Negative
רגבים אין עוד פולשים וגנבי קרקעות כל עוד אתם נמצאים תתחילו בעצמכם מהמנכל עד לרכז כל הדג מסריח,Negative
שילכו לכל הרוחות ערבי טוב זה ערבי ..... ניחשתם נכון ... ערבי מת .. !!!,Negative
לך תעשה חמוצים חסר עמוד שדרה פחדן,Negative
יאיר גולן דוחה,Positive
וואלה אכבר ימח שמכם,Positive
זה כל כך מעצבן לראות דבר כזה,Positive
מפיונר חלאה ובוגד,Negative
"מתי כבר הוא קובע שאסור להצביע ליכוד, וגומר עם זה?",Positive
עוד שבועיים כבר לא תהיה לו חסינות,Positive
קומנדו הוא כבר לאאם חטפו לו את הנשק.,Positive
הוא צריך לקבל אות הןקרה,Positive
הקנאה קשה,Positive
השמאלים שווים לשכנים שלנו😁,Negative
עכשיו מה יעשו עשיתה טוב תן להם את הנשק גם כך איח לו שימוש גם כך העונש קל עצוב זה טקסס בנגב והצפון יבניאל,Positive
הוא לא יכול להיות ימיני זהו איין סיכוי ואים כןהתיקים עולים למעלה.,Positive
"בית""ר היום זו הקבוצה הכי אפורה מאז 1937",Positive
צריך להעביר את הגועל למקום יותר טבעי עבורם עזה,Negative
"הגיע הזמן !! וואלה, שוטר מג""ב ירה במחבל ערבי. שוטר לא יורה סתם כמו שמחבל ערבי לא מסתנן סתם. יש לשניהם מטרה ותודות למטרה של השוטר, גם הפעם המטרה של המחבל נבלמה. כן יירבו !",Negative
תפנימו את זה לא פלסטיני עלה מחבל,Negative
חבל שרק אחד . חדשות לא משהוא .. אני בתור אזרח לא מרוצה היה אפשר להרוג עוד כמה .,Negative
פחד אלוהים רק זה חסר לנו רוקחים רופאים ועכשיו גם חיילים טפי כוס עמק,Negative
"שלום חברים,אני מזמינה אתכם להצטרף לקבוצה החדשה למתן ייעוץ משפטי והכוונה מקצועית.~ עורכי דין ",Positive
כשנותנים לשייטת רובי מים להשתלט על ספינת מחבלים מה הפלא.. צריך חשבח אותם ולתת להם אות הוקרה שלא ירו בו,Positive
"הכל שקר לא להאמין לשום מילה שנאמרת כאן.עלילה של הרבנים עליו בגלל שיש לו בן משרת בצה""ל.",Positive
צריך לזרוק אותו מהכנסת.ולשלוח אותו לעזה.ונראה אותו מתנהג כך בעזה.יש לו יותר מדי ביטחון.חיה מגעילה .איך בהמה כזה נמצא אצלנו בכנסת?ממשלה של חנונים.,Negative
אז יבני שרמוטות קבעו שזה לא טרור אז למה לירשום מחבל יכאחבות והעיקר שאם זה היה ערבי שהרג 100 יהודים תיגידו שהוא פלסטינאי מדוכא,Negative
‏עוד שקרן,Negative
מקווה בשביל הלוחם שהם לא נפצעו או משהו בזמן שלקחו לו את הנשק.,Positive
כוס אמא שלהם,Negative
"ביבי דיקטטור וכבר מתנהג כמו משוגעה. אתה מתנהג כלפי אזרחים שלך , כמו שאבא מתנהג כלי ילדים שצריך להעניש ולא מבין כלום. ובזמן אחרון אמירות שלך - הם אמירות של בן אדם מבוגר שאיבד חוט למחשבה נורמלית.",Positive
תודה לך ביתר על עוד שבוע שאת באנקר בווינר. אהה ותחליפו את ״גשם״ ב״זבל״. מתאים לכם הרבה יותר,Negative
כל הכבוד למג״ב,Positive
בבחירות האלה אצביע לציונות הדתית עם סמוטריץ רוטמן..ובן גביר.. כדי להשפיע על ביבי מימין ולהכריח אותו לבצע את מה שהבטיח ומעולם לא ביצע..1. ניטרול דיקטטורת חונטת הפקידונים הסמולנים במשרדי הממשלה.שגם צדה אותו ומשפחתו..שהשתלטה על השלטון.. במקום הממשלה הנבחרת..ומנסה לכפות עלינו את משנתם האובדנית והמעוותת..2. השבת מסתנני העבודה הביתה..שהפכה חיי רבים לגהנום..3. מלחמה טוטאלית בפשיעה הלאומנית.. ובמחבלים והרחקתם מישראל שבין הים לנהר.ועוד..ועוד.לכן אצביע למפלגת הציונות הדתית.ימין ישר ..ערכי..אמיתי פטריוט ואוהב ישראל בלי טריקים ושקרים..פשוט. ט בקלפי.,Positive
"ערימת חירייה זבלות
",Negative
"אני איתך בזה ימין מגל .. עד הסוף יד לנקות המימסדים מהבוגדים בתפקידם.. די לתת להם חופש להלבין פני המדינה ברבים ע""י הלב ת פני ראש הממשלה ברבים.",Negative
הנייה 48 שעות,Positive
אתה בן אדם מסכן,Positive
זו אנרכיה מישהו מאפשר את זהלהתעורררר,Negative
מעולה,Positive
צריך לתת לו דוח שילמד,Positive
"נקבע שלא טרור לכן רוצח ולא מחבל , מה אפשר לצפות מוואלה ? אתר סוג ז׳",Negative
איש זר לעם ישראל.,Positive
זה מלגזן הוא רגיל לעלות ולרדת,Positive
אדם רע ומכפישן לדעתי. הקנאה שורפת. יש לך ללמוד מנתניהו,Negative
איפה הימים שטדי היה מבצר,Positive
מעניין אם במהלך ה 4 חודשים הוא יבדוק את תיק המימד החמישיאו שיתעסק בביבי,Positive
איזה בדיחות חמודי ... לא לקח שקל!!,Positive
יאיר לפיד חושף היום שגדעון ובנט יסכימו לשבת בממשלה שלו בתמיכת הרשימה המשותפת.מוקדם יותר הודיע איימן עודה שיתמוך ביאיר לפיד כראש הממשלה הבא. לכולם ברור שלגדעון ובנט אין איך להקים ממשלה בלי להצטרף ללפיד ולתת לו להיות ראש ממשלה. מצביעי הליכוד חייבים לצאת להצביע מחל כי רק הצבעה לליכוד תמנע מיאיר לפיד להיות ראש ממשלה ותבטיח הקמת ממשלת ימין יציבה שתפעל למען כל אזרחי ישראל.,Positive
כמה מרתיח. עם הגישה המתרפסת הזאת אי אפשר להחזיק שלטון חוק.,Positive
מי יכול לבחור ברוסי חמור כזה .רק מבוגרים .ורוסים שיש להם אינטרס,Positive
אתן סוכריה ו אכח ב חזרה,Positive
כנראה שהגיע לו,Positive
זו הסיבה וכל כלב בג'י יומו,Negative
לא לוחם קומנדו.לוחם בחטיבת הקומנדו.יחי ההבדל,Positive
"בן גביר, ממתי נהפכת לשמאלני?יש מצב שהתבלבלת וכבר אינך זוכר איך אמור להתנהל ראש ממשלת ימין? 🤔נתניהו זה לא ימין! ☝🏻",Positive
נישאר לך 12 יום ותעוף לעזזאל,Negative
"אמא שלך זונה אמא שלך זונה תקשיב טוב, אדון מיינסטרים היקר, השעה 12 ורבע בבוקר, הדבר שאני מציע לך לעשות, אני יתן לך אחי מצלמה, לך תעשה דשא בסקופ, אני יתן לך סיליקון לך תתקן חלונות באייסי, אתה רוצה אני יסדר לך עבודה של 96 תתדלק את הטיל, מי ילך יבן זונה אבא שלך רצח את רבין ילא מתבייש",Negative
"ביבי - ""ימין חזק""",Positive
רועה זונות,Negative
"צה""ל של היום זה כמו הג""א לפני 40 שנה ...בושה למדינה שנותנת גיבוי לערבים ובגץ מחזק אותם ...ממשלה של אנשים תת רמה .וללא כבוד וערכים למדינה..במיוחד לזה שמנהל אותה..בושה בושה לכל ה 120 אוכלי חינם בעעעעעעע על הממשלה",Negative
ממש מקומם.,Positive
למה לאחד כמו יאיר גולן לא פגעה הקורונה ושלא יצא ממנה העולב הרקוב הזה,Negative
רוב האלימות בהפגנות בבלפור באות מהמשטרה!מה לעשות והבחור עם המגפון צודק,Positive
"איזה בולשיט. כתבת יח""צ לישראל שמצוטט בה ביבי כאילו הוא לא משקר בכל רגע שהוא פותח את הפה. זו לא באמת עיתונות. זה מה שנקרא ""תוכן שיווקי""",Positive
היידה בן גביר . אתה מזה חייב להיות בממשלה לסתום להם פיות במיוחד לאיש הפח.,Negative
"גועל נפש , ישר לכלא",Negative
פינוקיו העלוב😆😅🤣😂,Negative
"זה מה מגיע לנו, לא מגיע לנו פלייאוף עליון שנגיד תודה ונשאר בליגה. אין דרך, אין שיטה, אין כושר, פעמיים שלוש בשבוע אנחנו משועבדים לטלויזיה ורואים את המטרד של הקבוצה הזאת.",Positive
"אם בן גביר ""מחבל"" כי הוא מעריץ של אדם שנוי במחלוקת, אז טיבי וכל הסיעות הערביות הם רבי מרצחים!!",Negative
עוד מסכן,Positive
יש בורי לעולם,Positive
בי גביר מלך,Positive
