text,label
" החוק לא מפריד בין טרוריסטים- אבל הוא בהחלט מפריד בין בני העם היהודי במדינתם לבין אזרחים שמזוהים כאויב. ונער גבעות, פורע חוק ככל שיהיה, חייב להיענש ולהירקב בכלא אם סיכן חיי אדם כלשהם. הוא עדיין לא אויב. אם חלילה גרם לפגיעה בחיי אדם (לא משנה מאיזה עם) דינו ככל רוצח.",Positive
" לא גם, אלא רק. לרוב מוחלט של אדמות יו""ש אין שום בעלות של ערבי ""פלשתיני"" כלשהו. זה לא מפריע לשמאל בתעמולת השנאה.",Positive
 בולשביקים אדומים אויב של עם ישראל יש לגרש אותם לעזה דחוףףףףף,Negative
 מנוסח פריבילגי והנקודה לא יכולה לעבור בעולם שבו גם כשאת מכירה מישהו טוב הוא עדיין יכול לאנוס אותך.,Negative
"או כחול לבן או ארדואן אנחנו או הם רק ליכוד גדול מול כל השמאל מרכז ציוני מול ימין קיצוני אפשר להמשיך. השורה התחתונה תישאר זהה: בפוליטיקה הישראלית יש ריבוי מפלגות ומה שיקבע את זהות ראש הממשלה בבחירות הבאות, כמו בכל קודמותיהן, יהיה גודל הגוש. זה *לא* סער או ביבי.:.",Positive
"נקודה טובה. אם אנחנו קוראים למיליון ליכודניקים 'חברים בארגון פשע', שאנחנו לא, אז כל הערבים לשיטת מיקי זוהר והליכוד הם תומכי טרור או מחבלים או מה שתרצו:.",Negative
" להזכירך, פעם שעברה שהם לא איימו לשרוף את המועדון משרד האוצר החליט להכריח מורים בסיכון להגיע לעבודה או לצאת לחופש על חשבונם. הסתדרות המורים מבחינתם נלחמת על חיי המורים.",Negative
 אמרת עמית סגל. התכוונת בו של מחבל. חכה בתור עם התביעה.,Positive
"תיעוד ממצלמת הקסדה: כך לכדו לוחמי הימ""מ את רוצח אסתר הורגן &;&;:.:.",Positive
 יאיר אנטישמי מזוהם מפגינים שלך בבלפור סטייל מחבלים מעזה.:.,Positive
 כי יהודי הוא לא אויב. בסוף אולי תבין,Negative
 בעיה? להיפך אולי המילה הכי מרגשת שיש. אבל רלוונטית ליהודים או למי שהחליט לתמוך ביהודים לפני כל הלאום של עצמו. אפשר להיות לא יהודי אוהב ישראל אוהב שלום חושב בהגיון ולא ציוני.,Positive
"השיח הזה לפיו ""כולם משקרים, אי אפשר להאמין להבטחות של הפוליטיקאים"" הוא מעין פיגוע נגד הדמוקרטיה הישראלית. זה בדיוק המסר שנתניהו מנסה להטמיע כאן. לייאש את הבוחרים, להרוג את השאיפה לשינוי. אז לא. לא כולם משקרים. ו""יש עתיד"" לא שיקרו ונשארו נאמנים לבוחר. יש על מי לסמוך.",Positive
: שוטר פחדן מלא שנאה מכה במכות רצח נער לא שמאלני.,Negative
"מישהו עיצבן אותי הוא כתב ככה תגובה על מה שהגיד הרשפ"": הפלסטינאים חיים במושגים של העבר הרחוק , שהיהודים צריכים לחיות בגלות , אבל למען עתיד איכותי של עמי האיזור , נכון יהיה , שיקלטו את הפלסטינאים מרצועת עזה ומיהודה ושומרון , כשם שמדינת ישראל קלטה את יהדות ערב וגם ממדינות אחרות .",Negative
" נתניהו לא אמר שהוא יחסל את החמאס, הוא אמר שהוא ימוטט את שלטון חמאס. יש הבדל מהותי. אני מבין שציפית כמו רוב העם לדם ואש ותמרות עשן. אבל הוא עובד בצורה יותר אלגנטית, עם סנקציות כלכליות, חנק דיפלומטי, ושלילת הלגיטימיות של חמאס גם בעולם הערבי. זה לוקח יותר זמן, אבל זה יותר אפקטיבי.",Positive
" נאמר זאת כך, שמאלני שמתגייס לצהל הוא פי  ציוני מכל חרדי ממוצע ששונא את צהל ומקלל את חייליו",Negative
 תמשיכו לפתח את הנושא. מעניין רצח,Positive
" א. אתה לא יודע שהוא לא שומר לוגים ב. אם נקודת היציאה קבועה והתעבורה הגלויה שם גלויה למישהו, לא מאוד קשה בדרך כלל לקשור בסבירות גבוהה את התעבורה אליך. למשתמש המצוי זה לא ממש משנה כי *אבל* זה מנרמל שימוש ב- שזה חשוב ביום שתהפך להיות מתנגד משטר סמולן עוכר ישראל בוגד המדינה",Positive
" מקבל בערבון מוגבל. יש היום ימין או שמאל ? הנה דוגמא : .מי נתן את חברון לפלשתינים. . מי שיחרר מחבלים רוצחים. .מי לא מפנה את חאן אל אחמר ? . מי לא החיל "" ריבונות ביום ראשון "" ? .מי חלש ( ומשלם כסף ) מול חמאס ? .מי הסכים למדינה פלשתינית ? האחראי לכל לאלה ,יכול להיות ימין ?",Negative
" מאומתים אתמול בי-ם.  שכונות חרדיות(%),  כללי ומעורב(%),  מזרח העיר(%),  לא משוייך. תלמידים מאומתים:  חרדי(%),  ממלכתי(%),  ערבי. % חיוביים שבועי: . ערבי, . חרדי,  כללי ומעורב. מאושפזים:  ערבי ( אתמול),  כללי ומעורב (),  חרדי ()",Positive
 זה ב- שלהם. כך הם מפתחים נוגדנים להשמיד פולשים זרים כמו דמוקרטיה והסכמים קואליציוניים.,Positive
" מר הלוי, מה אתה יכול לעשות כדי למנוע הריסת עיינות ענר? החלטה מנותקת והזויה",Positive
" ו) ״תקיעת הסכין בגב״ לתהליך השלום נעשתה ע״י מתנגדי שלום בוגדנים משני הצדדים, הפנאטים הדתיים-לאומנים מהצד הפלסטיני ומהצד המתנחלי שעשו שת״פ מלא כדי לטרפד את תהליך השלום, כולל רצח מתפללים, פיצוץ אוטובוסים ורצח ראש ממשלה.",Positive
" נדמה לי שפעם ראיתי אבל את האמת על מה שקרה שם, ידעו הרבה שנים אחרי. במשטרים חשוכים קשה לקבל מידע אמין,האם יש מישהו עלי אדמות שהעריץ או מעריץ רוצח המונים? כן, רק חולי נפש....אבל איך זה קשור להיום? זה מצדיק במשהו את הטירוף של הנאשם שגרר מדינה לבחירות ? שלא רואה ממטר כולל המדינה?",Positive
 זו מדינה מטומטמת רצח נמאס לי,Positive
זה סגר כמו שאני ערבי:.,Positive
 ואיזה מצחיק כשמדובר על ערבי אז לא הורגים גם אם הוא שחט יהודיה,Negative
 יש הרבה מאוד מקרים כאלה ממש קשה אני יודע שזה מחוץ לנושא אבל את לא חושבת על לשאול אם זה חוקי לרצוח דרך הגנה עצמית?,Positive
"חמאס קורא לארדואן שלא לנרמל יחסים עם ישראל: העיתון מילי גאזטה השייך למפלגת האושר האיסלאמיסטית ואופוזיציונית לארדואן, פירסם אתמול בשער הראשי שלו את המכתב מחמאס שהגיע לידיו.:.",Positive
" לא הבנתי איך זה סותר את מה שאמרתי בציוצים יש פה יהודים שיכולים (לצערי) להזדהות עם תנועה ערבית-פלסטינאית שקוראת לזכות השיבה. זכותם. האם זה אומר שאני כיהודי המתנגד לזה, זה פסול? ברור שלא, נכון? כך גם באותו האופן, ערבי יכול לתמוך בציונות, וערבי אחר לא.:.",Positive
": זאת התמונה שצלי איפורי בחר לצרף לציוץ שמבקר את התקשורת בשצף קצף רגיל של הטחת עלבונות שיותר מלמדים על השלכה, מבלי לשים לב שמצד…",Positive
" אחי הוא לא דיבר פה הרשימה המשותפת, רשום במפורש מהחשבון האישי שלו ששלח הודעה לכל העוקבים, עם הערבים שרוצים להשמיד אותנו. דהיינו, ערבים רוצים להשמיד אותנו. אין יותר הסתה מזה, תהפוך את זה  פעם זו הסתה פר אקסלנס. אין בעיה לאהוב את ביבי, הבנאדם באמת גאון, אבל להגיד שהוא לא מסית...",Negative
 מדהים! מ״תומכי טרור״ הפכו להיות ״לא מחרימים את המפגות הציונות״! וזה מספיק לא היו יכולים להמציא את הצביעות יותר טוב,Positive
: צפו: בני גנץ מבטיח לפעילת שמאל קיצונית למנות שר ערבי מהרשימה המשותפת:.,Negative
" התמונה הזו מפריעה לי בכל כך הרבה רמות: . שום נציג ערבי בצד הדמוקרטי, כאשר לא היתה שום בעיה לשים את מנסור עבאס בחלק העליון. גזענות? . די לגנרלים קיבינימאט, מה בדיוק ערכו של יאיר גולן? . אחרי הזיגזג הפומפוזי של סתיו שפיר, היא שוב ראויה? הגיע הזמן לריסטרט עם אנשים חדשים.",Positive
" סתם אני צוחק אחי היקר מאיפה אני יודע, זה עסקאות בעייתיות רצח. תביא חאתם ושכל הליגה תריב בינה לבין עצמה.",Positive
"כולם נהיו פתאום מומחים לענייני ערבים,גם ערבי ציוני שמתגייס לצבא הכיבוש שלא משקף יותר מ%וגם עיתונאי יהודי שלא מכיר את החברה והתנער ממנה לאורך השנים תקשורת ישראלית שווינית ודמוקרטית היא זאת שמצרפת עיתונאים ערבים טובים ומביאה פאנלסטים ערבים,למי שרוצה נתונים אצל ו",Positive
 הבן שלך מחבל,Negative
 חמוד אם אתה כובש למה אתה נמצא פה לך לאירופה משם הגעת לכבוש את הארץ לעומתך כמזרחי זו הארץ שלי אני לא הגעתי לפה לכבוש אלה אתה שמודה שאתה כובש למה אתה חושב שבעיני ערבי תל אביב ושכם שונים,Positive
 ממתי הערבים הישראלים אוייבים שלנו?? יש ערבים ישראלים בצבא יש ערבים ישראלים בבתי חולים יש ערבים ישראלים שאוהבים את המדינה האוייבים שלנו זאת הרשימה המטונפת אלה שמהללי טרור אלה שמשתפים פעולה עם האוייב שמחתי לעזור ❤,Negative
": הפגנת הביביסטים מחוץ לבג""ץ חוק הלאום. רגע אחד מקללים את ראש מועצת סאג'ור ג'אבר חמוד 'יא מניאק מוחמד מזיין אותך בתחת'…",Negative
 תכלס מאוד פשוט להפסיק לשחוט כל מי שמרים ראש ולהתלכד על אדם אחד מסר אחד,Positive
 אתה לפחות לא משקר - היית ונשארת לאומן ערבי שרוצה בחורבן ישראל כמדינה יהודית.,Negative
"""נתניהו הורה לאסוף את הפרטים של הפוגרומיסטים כדי שהוא יוכל לטלפן להורים שלהם ולחזק אותם.."" אנטישמי נשאר אנטישמי. חלאה בן כלבה!:.",Negative
" כי הציונות הדתית היא כת נטמעת. האג'נדה העליונה שלה היא כיבוש תפקידי מפתח, בכל מחיר. ואז כשאלו נכבשים על ידם, הציונים הדתיים נטמעים לתוך משרותיהם והופכים רדיקלים ממעסיקיהם. להלן מס דוגמאות מזערי: שי ניצן מנדלבליט בנט",Positive
 תנהלי דיון נוקב עם מסתננים וערבים פוסט ציוני את האא?,Negative
סיפור הגנרטורים - חלק ב': אחרי הסכסוך בין רשות האנרגיה בעזה לבעלי הגנרטורים - חמאס קבע מחיר פשרה של . שקלים לקילו וואט. מה אין בהודעה של חמאס? כמה כסף בעלי הגנרטורים צריכים לשלם להם כל חודש כדי להחזיק בלוקסוס הזה:.,Positive
"מבאס לגלות שלמארין לה פן יש אחיינית, והיא שווה רצח:.",Positive
" טאבו? לא. זו פשוט משמעות המונח. 👇👇👇 בדוק בכל אנציקלופדיה או מילון. אמרת שאתה ״לא ציוני״. אם אתה מתנגד לקיומה של ישראל, כמו עודה וטיבי, זכותך כמובן. אך אם אתה אכן תומך בקיומה של מדינה יהודית, אתה ציוני - שמתכחש, מסיבות משלך, לציונותו... וחבל.:.",Positive
"ציוני הוא אדם שתומך בזכות העם היהודי להגדרה עצמית במדינת ישראל. העובדה היא שהיום ערבים רבים במפרץ ולא רק, שמגדירים עצמם ציונים. אם הם יכולים אז למה יוסף לא? המילה ציוני נחשבת מחוץ להקשר האמיתי שלה כקללה בתרבות הערבית. כל אדם שתומך בשלוםנורמליזציה עם ישראל מקללים כ""ציוני"".",Positive
" הצבא והמשטרה הורגים ערבים כל הזמן, ממוצע של לפחות אחד בשבוע וזה מעולם לא הטריד את סגל בנו של הרוצח. בהפגנות הגדר בעזה נטבחו בידי צלפי צה""ל מאות מפגינים לא חמושים ורק בריון מיידה אבנים אחד שנהרג בעת מרדף מטריד את מנוחתו של הגזען בן רוצח.",Negative
" שפה קצרה? חוסר שימת לב? לא ראית את זה קורה במלא מקומות אחרים? אוטומטית לתייג כל חובש כיפה ככהניסט (או ערבי כמחבל, או שמאלני כבוגד, או מתנחל כטרוריסט) כשאתה קורא טקסט לא ברור שלא איך שאתה רוצה, זה מקור כל הבעיות שלנו במדינה.",Positive
" מורן אני ציוני ואני ימני אפילו קיצוני מדי פעם, ואני חושב שערבי ישראל הם חלק מהארץ בדיוק כמונו, לא חושש מהם ולהפך אני רוצה שיושלבו כאן כמו העדה הדרוזית המדהימה שלנו",Positive
 אהוביה חוסל הוא מחבל שיידה אבנים לכאורה על פלסטינים וטוב שכך,Negative
במשטרה מעריכים כי יש קשר בין רצח תושב לוד שישב במכוניתו בלילה לבין הירי בשני נוסעי רכב שיצא מלוד כעת בכביש . לפני שנתיים בדיוק אותו סכסוך ארוך בין שני ארגוני פשיעה גבה שלושה קורבנות ביום. אז היו אלו בני זוג ליד להב  ואדם חף מפשע שנקלע לנקמה בעקבות הרג הזוג צילום: איחוד הצלה:.,Positive
" הוא יכול להיות גאה, הצליח לרצוח נער גבעות עם הארס הקבוע שהוא מפזר נגדם",Negative
" לשרוף את האצבעות זה רעיון מעניין, אני בעד!",Positive
"על טרור: ״האיש המהלך ברחוב – יש לו זכות לחיות רק משום ורק במידה שהוא מכיר בזכותי שלי לחיות; ואולם, אם יש בדעתו להרגני, אין לו שום זכות קיום, וכלל זה חל גם על עמים״. על הסכם: ״הדרך היחידה להגיע להסכם היא קיר הברזל, כלומר כוח בא״י, אשר שום השפעה ערבית לא תוכל לקעקע את יסודותיו.""",Negative
" והפך את חיזבאללה מארגון טרור שולי לאחד הכוחות המרכזיים במזרח התיכון שמאיים על לבנון סוריה וישראל. באמת ""הישג"" של אהוד (לוליטה אקספרס) ברק...",Negative
": ציוני הוא אדם שתומך בזכות העם היהודי להגדרה עצמית במדינת ישראל. העובדה היא שהיום ערבים רבים במפרץ ולא רק, שמגדירים עצמם ציונ…",Positive
 מתחת פסלו של ריבלין נכתוב איש ביתר שעבר לשמאל וברך את עמו כעם של טרור,Positive
" הרגע גיליתי שיש ל""אם תרצו"" ערבי מחמד. יכול להיות שזה שיבוט של הבלוגר הסעודי?",Negative
" הפרלמנט הביטחוני: מעריב אונליין () נסראללה ב""ראיון סיכום השנה"" בערוץ ""אל-מיאדין"" הלבנוני: ""יורש העצר הסעודי מוחמד בן סלמאן הציע שארצות הברית תתנקש בחיים שלי, במהלך ביקורו בוושינגטון. האמריקאים הסכימו להצעה הסעודית - כאשר ישראל תבצע את…:.",Positive
 איש רוצח חלאה,Negative
 אני בעד ניטרול כל מחבל שבא להרוג יהודים,Negative
 ימח שמו שונא ישראל עמוס עוז,Negative
"כאן גאים הסרט #רצחבקולנועצפון הוכרז כסרט התיעודי הטוב ביותר במסגרת פרסי פורום מבקרי הקולנוע בישראל  🏆🎥 מנימוקי הבחירה: ""הסרט מציג את סיפורו רב התהפוכות באופן מרתק ומותח, תוך שהוא מעניק לצופים הצצה לצד פחות מוכר של ההיסטוריה המקומית"":. #כאןדוקו",Positive
 אתה רציני? זו דוגמא מקבילה להפקעת קרקע פרטית של ערבי כדי להקים יישוב יהודי?,Negative
 למה לא? מי מרשה לפלשתינאים למשוך גנרטורים מידי החיילים? מה יקרה אם כל ערבוש יתחיל למשוך גנרטורים מוחרמים? עדיף להרוג כמה ישר בהתחלה ואז הם כבר לעולם לא ינסו להגן על הגנרטורים המחורבנים שלהם. לא ככה?,Negative
"פתאום הארה: ""חרדים"" מלשון חרדים ממכות רצח של שוטרים",Positive
" עכשיו הוא עוד רוצה לשרוף קולות ולא לעבור את אחוז החסימה... האיש שהלך כנגד כמעט כל מצביעיו, כולל אותי, עוד חושב לרוץ, איזה חוסר מודעות",Positive
"תראו איזו חוצפה ועזות מצח, יש למחבלים לריב ולהכות את החיילים. אבל זה לא העניין, מה שמרגיז פה שהחיילים מסורסים מפחד להכות את המחבלים, שלא יוכנסו לכלא על הכאת 'אזרחים תמימים'. דרך אגב, המחבלים אומרים שהערבושמחבל מת 🙏 מעניין שהמצלמה זזה, ואז רואים אותו שוכב 'כאילו' מת..:.",Negative
" כל עוד הוא בעד מדינת ישראל, שיקרא לעצמו גם אנטי-ציוני",Positive
 ימות העולם אני לא יוצאת,Positive
- יוסף חדאד לא עובד באם תרצו. - אתה לא מגיע לקרסוליים של - ערבי מחמד תקרא לסבתא שלך חתיכת גזען נפוח:.,Negative
"היום (השלמה, ג' במרחשוון ו)ה- באוקטובר #היוםבמזרחהתיכון #היוםבהיסטוריה #היוםלפני ביום זה בשנת , ימים אחרי רצח הנשיא עבד אל-ראשיד עלי שירמרקי החלה הפיכה צבאית ללא שפיכות דמים בסומליה בראשות סיאד בארה ששלט במדינה עד ינואר , אז הודח ובסמוליה החלה מלחמת אזרחים.:.",Positive
" ואו אני בשוק מהשר אוחנה שמעדיף חיים של ישראלים על פני טרוריסטים מטונפים ותומכי טרור. תמסרי לחברים שלך שיעברו לירדן , שם יתנו להם חיסון",Negative
"כל מילה בסלע. על זה נאמר , ביביסט עוכר ישראל גם אם יראה את המושחת אונס את הנכדה שלו , ימצא צידוקים והבנות וימשיך לתמוך בו.:.",Negative
 תומך טרור ומהלל שהידים זה המנהיג שלהם. ותגידו לי שאתם מופתעים....,Negative
 חחחח הפעילו עליך טרור?,Positive
 החשיפה של שטרנבוך חזקה. אבל פריי נותן לזה מסגור של שחיתות חרדית. זה כמעט נשמע אנטישמי,Positive
" יש גם את הרש''פ ואת חמאס שהורגים לא פחות מהם, אז מה? ימ''ר ש''י אפילו לא *עצרו* פלסטיני בשנים האחרונות...",Negative
 אני אישית הגבתי לפני שידעתי שהוא ערבי,Positive
" הלא לא רק ישב, אילה. הוא ירוץ לשבת. כל הריצה שלו מיועדת למטרה אחת בלבד. הוא רוצה לאנוס את נתניהו ולשבת בממשלתו על אפו וכל חמתו של נתניהו. גדעון סער הוא אדם נקמן שמחזיק חשבונות לשנים ארוכות. ש",Positive
" טוב, נראה שדאגת שהתגובה שלי תמחק.. אז רק אומר שאני לא אמרתי שראוי כלום. המחשתי, אם תקרא בריכוז, שלפי הרציונל שלו עצמו, המוצאות לגיטימיות בפעולות טרור כי הכיבוש, הרי שהאבחנה שהוא מדמיין בין תושבי יש""ע לתושבי גוש דן מלאכותית וחסרת ביסוס. המדינה היא הכובשתמתנחלת, לא מי שגר שם.",Positive
 זו שאלה לאנשי המקצוע. בציטוט שהבאתי נראה שמספיק שיש *חשש* שזקן *אחד* ימות מהשריפה. נראה לי שבוודאות גבוהה מדובר ביותר מזקן אחד שימות.,Positive
" החלפתי לתקליט של הנורמליזציה, לגבי עזה את טועה, מוחקים דוגמאת איראן, אומנם הם לא ערבים אבל הם בונים ורוצים להמשיך לבנות טילים שלא ישרפו את האדמות אלה ישרפו את כולנו ערבים יהודים שמאלנים אפסים וימניים נאורים, בלי הנודניקיות של ביבי נגד אובמה אולי הם היו מצליחים",Negative
: לחובבי הצ'יזבטים - נסראללה מספר שאסד הסכים לפני המשבר בסוריה להעביר טילי קורנט שקנה מרוסיה לרצועת עזה וזאת בעידוד קאסם סולי…,Negative
 ואללה מביך אבל כל ערבי ישראלי ששאלתי אותו אם הוא מעוניין בדרכון פלסטיני (אפילו לא לגור שם) קרא לי משוגע,Positive
 אהוביה סנדק נהרג באשמת החברים שלו שברחו מהמשטרה. הוא נהרג באשמת כל אלו שלא חשבו שיש בעיה כאשר נער ערבי בגיל של הבן שלי נהרג כי נסע במכונית במושב האחורי (היה יידוי אבנים בסביבה בלי קשר אליו. החיילים צעקו לנהג לעצור והוא לא שמע אז הם ירו) הוא נהרג כי יש כיבוש. מי שבעד הכיבוש אשם,Positive
" פריי יא מזבלה, מה עשית כשערבי זבל בן עוולה רצח את הורגן להנאתו ??? צייצת זוועה? נתת איזו תובנה? אתה #מוהנדס",Negative
" קהלים חדשים! שם המפתח להגדלה. ערבי ישראלי שמאמין בדרך נתניהו זה טוב. איזשהו גורם השפעה בעולמות הצעירים. כל המעורבים בפוליטיקה בדרך כזו או אחרת, כמה קולות הם כבר ימשכו? מישהו יצביע לליכוד פתאום כי דנון שם? הירש? ובלי להוריד מהוריד הוא תותח אבל צריך מיגנוט קהלים",Positive
" עקבתי אחריו. ובכל פעם שקשקש על כך שהוא סובלני וליברלי והמשפחה שלו מהליכוד שלחתי לו ציוץ אנטישמי שלו מכמה ימים קודם. עד שחסם אותי. כמו צעירים ערבים ישראלים אחרים שהח""כים הצליחו להסית נגד ישראל אבל מצד שני גדלו ורואים כמה טוב להיות ישראלי. הם קרועים בין השנאה לחמדנות.",Negative
 אנטישמי,Negative
