text,label
"אין רוב לסגר שקר הזה הכל מנוהל ע״י נאשם בפלילים לקואליציה אין רוב והם מורחים את הזמן, משמע הסגר לא חוקי לשרוף פה הכל:.",Positive
 אומנם אתה לא בקהילה אבל כל בת חייבת להיות וגם שמה בתיאור עם אתה רואה שמישהו שם בתיאור תברח כל הקהילה פה טוקסיק רצח ומאחל להם זין בתחת עם אתה אוהב סדרה כולם יצאו עליך ויורידו לך ממש ממנה,Positive
" אז נמשיך להילחם עוד מאה שנה, כי הדרישה שאנו נוותר על מדינת הלאום שלנו היא קזיוס בלי בעיניי רוב מוחלט של היהודים. אל תתרשם המיעוט הפוסט ציוני שעושה לך לייקים פה, המציאות מחוץ לטוויטר שונה מאוד.",Negative
"שתיקת הכבשים ""המנהיגים"" הפוליטיקאים העיתונאים על רצח הנער היהודי שלרוע מזלו הוא לא אתיופי היא פשע !!!",Positive
 יוס הכל טוב הלב שלך במקום הנכון ההגדרות האלה חשובות יותר או פחות לאנשים כאלה ואחרים. אף אחד בטוויטר לא מחזיק בטאבו בהגדרה של ציונות. היום זה מושג פלואידי. לאברום בורג אתה אולטרה ציוני. למורן אולי לא מספיק. מה זה משנה בעצם?,Positive
" מלחמה כבר הייתה ב . עכשיו זה כיבוש נטו - שליטה צבאית על אוכלוסייה אזרחית. כשצהל יצא וחלילה תהייה מלחמה אז זו תהייה מלחמה. כל הזמן יש שת""פ עם הרשות אתה פשוט לא יודע מזה. צהל לא שווה שיט בלי זה.  גורמים במשפחה הגרעינית שלי (מתוך ) קשורים חזק לצהל אז תרגיע עם השיט הביביסטי שלך",Negative
קצת בבלאק אאוט. בכמה ימים נוספו לי כ  עוקבים. וכבר חציתי את ה עוקבים. קצת בבלאק אאוט. כי להפוך מאדם רדוף עד מוות בידי רוצח עלוב ושפל (ח.צ.) לאדם שפרץ את מחסום האנונימיות זה בהחלט מרגש. אך אל דאגה אני יתאושש. זו רק ההתחלה. והרבה דרך לפנינו עד שנשיג צדק. ומנרדף אהפוך למושל,Positive
 נער שניסה לרצוח אחרים מלח על הפצעים של הארץ,Positive
 ידוע שאוהד אמיתי מביא לעולם ילדים רק בשביל ששחקנים יוכלו לאנוס אותם 😕,Positive
 היו פה ערבים אבל לא קראו להם פלסטינים.עד שנת  בעולם תמיד היו משייכים פלסטין לעם יהודי.,Negative
" ואתם כמובן בולעים בשקיקה כל חרא שהוא מאכיל אתכם, אתה מדבר איתי על אידיאולוגיה?? איפה האידיאולוגיה שלך עכשיו? איפה הערבים נוהרים, מחבקי מחבלים, תומכי טרור? אתם תריעו לו גם אם ייתן לעבאס את תיק הביטחון",Positive
 זה בטוח אוצר פלסטיני.,Negative
על זה החלאות ממשרד הבריאות רוצים לסגור את מערכת החינוך ? פשוט בדיחה !!! תסגרו רק איפה שצריך ועזבו את הילדים שלנו במנוחה!! חבורה של סדיסטים בראשות השטן הגדול זיבליהו ימח שמו 😡:.,Negative
 תמיד הכל בגללם אלה. ימח שמם,Positive
" אדם ששם את טובתו לפני טובת המדינה לא ראוי להיקרא ציוני, ולטעמי ביבי מזמן חצה את הקו הזה.",Positive
 יש מצב שיש מושג חקלאי כלשהו שנקרא גידול ערבי או שאתם פשוט נאצים? שואל ברצינות,Positive
" בחיפוש קצר מצאתי הבעת תמיכה מצידו של ניצן הורוביץ בקואליציית מרכז-שמאל-ערבי-חרדים. ואגב, גם לי מתפלקות אותיות ואני לא דיסלקטי, הפתרון שלי פשוט, רגע לפני שאני לוחץ על ""השב"" אני עושה הגהה קצרה",Positive
"רוצח על הכביש: בין הר הצופים לגבעה הצרפתית, נהג רכב ערבי נכנס מהנתיב לפניה שמאלה, רגע לפני שנהיה ירוק בנתיב הישר וכמעט גרם לתאונה קטלנית. אחרי שהנהג העיר לו ברמזור הבא, הוא יצא ואיים על הנהג.:.",Positive
" בטח תותח הוא לא חרדי ,ערבי או מהפריפריה , תחי הצביעות משרת את האינטרסים שלך כתושב האזור .. אחרת היה פורע חוק ...ככה זה במדינת האנרכיה ..",Positive
" ימים חלפו מאז נעצר הרוצח של אסתר הורגן, הי""ד, אבל בית המחבל עדיין עומד על תילו! כל יום שעובר מבלי להורס את הבית, פוגע בהרתעת 🇮🇱 כלפי המחבלים שבאים לרצוח יהודים. חבל ששר הבטחון שלנו עסוק יותר בהישרדותו הפוליטית במקום לפעול להגנת אזרחי 🇮🇱. מגיע לנו טוב יותר!:.",Positive
 אחי לפני שבוע יהודי ניסה לשרוף כניסיה ומוסלמים מנעו אותו לא אמרנו ״יהודים לא יודעים לכבד״ קיצונים יש בכל צד!,Negative
"וגם - אם אני קונה תותים כשרים מירקן ערבי, זה כשר או לא?",Positive
"מומחים: ""מחנות ריכוז? רצח עם? נגיף הקורונה? לראשי האיחוד האירופי יש דברים חשובים בהרבה בראש - בעיקר - כסף"":.:.",Negative
" נושא מורכב. ההשוואה בין הריסה ליהודים להריסה לפלסטינים אינה נכונה. מכל מיני סיבות. תרצה הסבר מפורט-תצטרך לבוא אלי לכרם מהר""ל לפגישה",Negative
" אויב - בטח שלא, אבל גם לא לבד, כי אז הופכים להיות האויב של עצמנו...",Positive
 הם מנסים להרים צונאמי אנטישמי- הפרוטאינים של זקני ציון...,Negative
" בגין לא הכיר בעם ערבי ארצישראלי. בהסכמי קמפ דיוויד נכתב בעברית ערביי ארץ ישראל ובאנגלית התרגום האנגלי לערביי ארץ ישראל הערבים ״הפלשתינאים״ , השם הלועזי של הארץ מאז מרד בר כוכבא. בתקופת המנדט היו יהודים פלשתינאים וערבים פלשתינאים. והגויים צעקו ליהודים לכו לפלשתינה.",Negative
" היהודון המושמד צוקרברג ימח""ש שמאלן קיצוני הין הברית שחל האויב המושמד",Negative
 לצערי אחד מ  אלף בין  ימות זה נראה סטטיסטית הגיוני,Positive
 מעניין מה יהיה שנתניהו ישריין מועמד ערבי?,Negative
גולום משר הטבעות עדיין מפחיד אותי רצח,Positive
" איימן עודה אויב אבל לשתף פעולה עם מחמוד עבאס, האיש שהולך לבקר משפחות מחבלים זה בסדר גמור האא? אני לא יודע אם זה מוסר כפול או סתם טיפשות.",Positive
שומעים הוא מתנחל. הוא לא ערבי או אוטיסט או אתיופי. המשטרה מושחתת בשירות בלפור אבל מתנחלים לא בעיה שלנו.:.,Positive
" אם תחקור היטב תמצא שדעותיהם של אנשי רעמ לא שונות בהרבה , אם בכלל, מדעות שאר אנשי הרשימה המשותפת. עכשו , אם הממשלה של נתניהו יכלה להשקיע במגזר גם ככה, מדוע צריך להיות שר ערבי בממשלה בשביל זה? הממשלה אמורה לדאוג לכל האזרחים, לא לכל קבוצה יש ייצוג בממשלה.",Positive
" חבר שואל איך ימ""ר ש""י שאמור לטפל בטרור לאומני מתעסק רק עם טרור יהודי בעוד הטרור הערבי הוא % מהפח""ע לא פלא שהטרור מתגבר:.",Positive
" אין כיבוש. יש רק אדמת ארץ ישראל, ששייכת כולה לעם ישראל, ולא לאף אחד אחר!!! ויש בוגדים שפלים ומתועבים כמו מוסי רז וחבריו, שבעצם רצונם לתת חלקים מארץ ישראל לערבים, מעודדים את המשך הטרור!!!",Negative
 איך חשובה לי דעתו של טרוריסט מנוול על דברים.,Positive
" א' כן שומעים את המוזיקה שלו, אולי לא בציבור החרדי שאתה מכיר אבל כן שומעים אותו ב' הכאפה תצלצל חזק חזק גם אם לא יאזינו לו במיינסטרים, כי הוא יותר מצודק, והחברה החרדית היא גזענית רצח",Negative
": על פי חוק השב""כ! כל שוטר ופרקליט שפתחו בחקירה נגד ראש הממשלה בניגוד לחוק - צריכים להיחקר מיידית. *שמונה ימים *במרתפים הטחו…",Negative
 לא מכירה אותך.לא מתעניינת בכדורגל. שיקפצו כל הכועסים והזועמים.הדבר הזה(יש לי כינוי ראוי יותר)שקוראים לו דור מיכה צריך להישאר במחשכים עד שיישכח מחיינו. בקצה השני של המדינה יש שתי נערות שחייהן גיהנום.טרור נפשי יום יומי.גולדהר עשה את מה שלא עשתה המשטרה ואו בית המשפט.#מאמינהלהן,Positive
 בערך אחד מכל  אנשים שחטפו קורונה ימות ממנה. כל יום שבו המחלה הזאת ממשיכה להסתובב פה אלה אנשים שמתים באופן וודאי. העובדה שיש פוסקים שלא מסוגלים לתת פסיקה לא אינדבדואלית (כי הנפגעים הפוטנציאלים לא ידועים) היא מזעזעת בעיני.,Positive
" תגיד, מי מתעסק שוב, ושוב, ושוב, ושוב - בגורם העדתי: לא אתה עם תיאוריית ישראל ה- שלך? ומה ממלכתי, ציוני, לאומי ואחראי בביבי ובפולחן האישיות שאתה חלק ממנו?",Positive
 צריך שילוב של אנטישמי אנטי ישראלי אנטי ביבי וגזען. הכל ביחד וכל אחד לחוד במידה הרושפת לשעתה.,Negative
 כולם מפרגנים(אפילו עוכר ישראל כמו גדעון לוי) אתם פשוט מחפשים את השנייה וחצי שמישהו לא פרגן כדי לצייץ את זה. והשיסוי ממשיך...,Positive
 דאעש. בחיי.,Positive
" הם שנאו במידה עזה גם את בגין, ואחרי נתניהו ימצאו אחר לשנוא ככל שיצליח אכולי הקנאה ישנאו אותו יותר. מבין שהמראות הקשים מהיום גרמו לך לזעם כמו לי ולרבים אחרים רק חבל שאתה מפנה זאת לאוחנה ונתניהו שהם לא כל יכולים כי בכך השמאל התקשורת ואותו שוטר בזוי ואכיפה הבררנית הצליחו במטרה שלהם.",Negative
 נו באמת רואית. הוא לא ציוני (בדיוק כמו החרדים) ולא תצליחי להפוך אותו לציוני. הוא מייצג % מאזרחי ישראל שמופלים לרעה מהלידה עד מותם. אם את מחכה שהם יהפכו לאיוב קרא ולמהללי הימין תמשיכי לחכות והבעיה תתעצם. רובם רוצים להשתייך לחברה הישראלית (תהליך שיקום שנים). אותי זה לא מפחיד.,Positive
 כן וזה לא אנטישמי בכלל,Negative
" מחבל כמוך שכל היום נלחם בשלטון, יש לו טענות על הבטחון במדינה ? ערבי הורג ערבי",Negative
"ארגון דאעש וארגון אל קאעידה הם ארגונים סונים. ובכל זאת הביטוי הרווח הוא "" מתאבד שיעי""",Positive
" דביל, אנטישמי וגזען תקרא למי שהשריץ אותך ולמי ששכח לחנך אותך, פרחח.",Negative
" אני חושבת שיוסף הוא דוגמה לערבים שרוצים להשתלב, לתרום, להשתייך למדינה. ואת זה בהחלט רוצה לחזק. עם זאת יש לי עליו גם ביקורת. מותר לי. אני רואה בעיה בכך שבחברה הערבית כאן המילה ציוני היא עלבון וחבל לי שיוסף מתנער מההגדרה הזו, וכנראה זה מתחבר להתנגדותו לחוק הלאום.",Positive
"כלומר בעצם ישנו פלג ימני דתי, שחלקו משיחי, שבעצם החליט שמדינת ישראל תהיה יהודית ולא דמוקרטית או שתהיה דמוקרטית ולא יהודית בסופו של דבר? אתם באמת חושבים שאפשר לשלוט על כ . מיליון פלסטינים ביו'ש? לא לתת זכויות שוות. להמשיך לגור בתחת שלהם ולהתפלא על כל פיגוע רצח מזעזע? מה המטרה?",Negative
"מצד אחד, יש את הידיעה עצמה מצד שני, יש את העובדה שזה מפורסם ב״חדשות ערוץ הגברים״ מצד שלישי, תמונת האילוסטרציה היא של שוטרת, ברמיזה לאיך נכנסו למלונית (בניגוד לשוטר שאולי עזר) ואתה לא יודע איזה חלק של האנושות לשרוף קודם, זה מאוד מתסכל הקטע הזה:.",Positive
"אימו של אהוביה סנדק הטיחה בשר אוחנה: ""ממשלה מטומטמת, יהודי לא רוצח יהודי"":.:.",Positive
 בדואי שגר באריאל מתנחל?,Positive
" חי עם ערבים מתעסק עם ערבים נושם ערבים אין גזענות ההפך, יור המפלגה מהאופוזיציה ושותפיו הערביים מייצגים נאמנה את....הציבור הערבי (ירדני במקור) מעזה ומהשומרון,את האנטי כיבוש,לא את ערביי ישראל,אל תבואו להתלונן ולשלוח אצבע מאשימה לישראל כשאתם פספסתם את הרכבת שאתם דאגתם לבעיות חוץ !!!",Negative
"בוקר טוב! ביום רביעי האחרון ביקר המיליארדר סיימון פאליק במעיינות. הוא סייר במקום עם ראשי המאבק, שמע על פרטים על הצו הריסה , התרשם מהמקום והבטיח לעזור במאבק.:.",Positive
 ערבי זה גידול אורגני בעצם. מה הבעיה?,Positive
זה רק אני או שכשהיה מדובר בנער אתיופי ונער ערבי ואיש חולה הוא לא דרש צדק?:.,Negative
" ביבי לא צריך שישחירו הוא השחיר את שמו לבד יופי יופי. עזוב ימין שמאל כיבוש היפרדות עזוב הכל מעולם לא קמו כ""כ הרבה אזרחים נגד ראש ממשלה במדינה מעולם לא יצאו כנגד ראש ממשלה כ""כ הרבה מאלה שהיו קרובים ביותר אליו מ ע ו ל ם",Positive
 כמעט כולם אבל כן הוא מוזר רצח הבנאדם קנה לברוך יותר סקינים ממה שיש לי בלוקר הוא פאן בוי כזה,Positive
: המפגינים לא פוגעים בשום עם. זה משרד הבריאות והממשלה שעושים למדינה מגה פיגוע. עברו  חודשים ושום תגבור משמעותי לבתי ה…,Positive
" אני מבין שלקרוא, אתה לא יודע. אתה מבין, זה מעניין לי את התחת אם אתה ערבי, דרוזי, בודהיסטי, צ'רקסי, בהאי, יהודי, קתולי או פרוטסטנטי. אמרתי *לך* יוזר עם תמונת פרופיל של גבר ערום, לך תלבש מכנסיים, המגזר שאליו אתה משתייך *לא* רלוונטי לאמירה שלי, *מאוד רלוונטי* לאמירה של דניאל.",Negative
 אוכל - - - - הכנתי שניצלים ופתיתים בלי לשרוף את הביתתת,Positive
השאלה הרנדומלית היומית: באילו מקרים רצח נחשב כהגנה עצמית?,Positive
 אתה צריך להיות תושב ערבי תרגיש את זה כל הזמן בצלאל,Positive
 אף אחד לא רצח בן אדם בביתו כן בלד רעם ועוד הם תומכי טרור תמכו בחמאס תמכו בחיזבאללה ברשות ובטרוריסטים אחרם,Negative
אני מאחל לכל מי שרוצה לחיות תחת פלסטין להיות אזרח מלא עם דרכון פלסטיני בעזה ולהינות מהזהות הלאומית שלו במלואה ❤:.,Negative
 מחבל מזדיין חבל שאני לא שם,Negative
" אראל,מקווה שתזעק ככה שפעם הבאה שהמשטרה תהרוג צעיר ערבי או אתיופי",Positive
"לא הבנתי, ימנים ליברטיאנים גם רוצים לקבל חיסון מקופות החולים הבולשביקיות ולא ממתינים שהיד הנעלמה תחסן אותם?",Positive
" גם הרבה ערבי ישראל מצביעים לליכוד, ודרוזים חוזרים אלינו עוד נפתיע בגדול, מחוייבותנו כמצביעי ימין לשלב את ערבי ישראל בחברה",Positive
" עם כל הצער, נהרג. רצח זה בכוונת מכוון. לא יעלה על הדעת ששוטרים רצחו אותו. יש כאן רשלנות איומה מאין כמוה, צריכים לשלם את המחיר, אבל לא רצח.",Positive
 עוד שבוע כשהם משחררים את פלסטין!,Negative
" צעיר הפועל במאבק ללא אלימות לשחרור מולדתו הוא לא ״מחבל״. הכיבוש הוא הטרור , הכובשים הם המחבלים . נאמר אנו כן לחיים ללא חומות וגדרות ומחסומים לא בין בני האדם לא בין עמים ואנשים ! לא לחומות בין ערבים ליהודים , לא לחומות בין פליטים חדשים מאפריקה לפליטי אירופה הותיקים שהם הורינו . די",Negative
" אהוביה סנדק ז""ל !!! אם היה מדובר בקרבן ערבי הייתם,בשמאל הקיצוני,טוענים לרצח,והתיקשורת השמאלנית הייתה מוצפת בהסתה משמאל ובהתנצלויות וגינויים מימין. בושה ששוטרים רצחו את אהוביה",Negative
 זה הופך אותנו לאוטומטית אייקוניות רצח,Positive
" כעיקרון הם נגד והיו נגד לפני כמה שבועות בגלל זה הציעו שורת מגבלות כדי לא להגיע לסגר, אבל הממשלה המשיכה לא לעשות כלום והינה אנחנו (שוב) במקום שאין ברירה וזה גם מה שרובם אומרים. מזכיר לך שהתחלואה הגבוהה עכשיו היא במגזר הכללי ולא בחרדיערבי. עדיף לתת סגר כמו שצריך ולסיים עם זה כבר.",Positive
" דוב, אני חושבת שגם אתה מסכים שיש הבדל בין להרוג מחבלים כחלק מפעילות צבאית מדינית ולגלות שחלקם חפים מפשע לבין לקבוע שכל הפלסטינים מחבלים ולהחליט על דעת עצמך לשרוף משפחה בחיים. נחמד שאתה מנסה להסביר את הלוגיקה המעוותת מאחורי זה אבל זה רק עושה את זה גרוע יותר כי זה בכלל לא אותו דבר",Negative
 לגבי מה שאני רוצה ממך. אני רוצה שתודה שאם רכב ערבי היה מתהפך אחרי מרדף משטרתי היית מגיב באחת משתי דרכים או מכחיש שהמשטרה נגחה ברכב שנמלט או אומר כל הכבוד למשטרה שנגחה ברכב וחבל שלא הרגו את כולם,Negative
" תמשיך לאכול מתוק. ולטמון את הראש בחול כמו בת יענה. ילד נרצח, מפגינים מקבלים מכות רצח, חוטפים תינוק מאבא שלו. לא הכל עובר עם עוגה. תתעורר",Positive
" ערבי אחרון בעטו מהמפלגה.... הציניות לא תוביל אותך רחוק, אבל חיבור של ליברמן למרצ יוביל את ישראל ביתנו לקבר ... חא שאני נגד",Negative
 מהירדן ועד הים פלסטין תהיה חינם,Positive
 לא מספיק מטח רקטות על העיר עכשיו גם זה? איך בכלל מצופה מהאשקלונים לעמוד בגזרה הזו?,Positive
 תמוז היה אנטישמי,Negative
 כולם לארוז מזוודות משחררים את פלסטין,Positive
"בביקור ב""גלובל וויליג'"" בדובאי לא יכולתי שלא לשים לב: כשבמתחם המוקדש לאיראן אתה מוזמן לקנות תבלינים ושטיחים פרסים, ובכלל בכל מתחם מדינה אחר אתה מוזמן לקנות מהשוק והתרבות של אותה מדינה - במתחם ""פלסטין"" בולטים בעיקר סמלי המאבק ביהודים ותמונות מחבלים. אחלה מורשת ואחלה תרבות:.",Negative
" אלדד יניב נוכל ומושחת ורמאי ושקרן עבריין ימח שמו לשם זיכרו אמן ואמן בע""ה",Negative
"ואוו😳... ישראל סוף .. כרגע הבנתי שאני תקוע במגדל השן..מנותק מהמציאות .. ארבלאו מתאר כאן ..את פצצת הזמן שהחלה לתקתק בקול חזק ושתתפוצץ בדור של הילדים שלנו הסתכלנו על אירן שכחנו את הבית,אחת יוצאת וחוזרת מרוסקת ממראות של אב ערבי מפרק את הבן שלו ברחוב ..השני בתא נחשף לאנטישמיות:.",Negative
"חיסלו ערבי כנקמה על חיסול קודם תוך כדי שהוא נוסע בשיירה מאובטחת ע""י ניידת משטרה בכביש . אני זוכר שפעם אמרתי לכם שהדרום הפרוע לא ישאר בדרום, ועכשיו אני אומר לכם הטילים לא ישארו על העוטף. אין ביטחון פנים במדינת ישראל,כולנו לא נתווכח אם אדם שאנחנו לא מכירים מחשש לאגרוף,סכין או אקדח",Positive
" אתם אלופי ההסתה אתה וכל חבריך שלחתם איזה טמבל לשרוף בכדי לתדלק את הכל כי כולם נעלמו , כי נמאסתם ,כי אתם שקרנים, כי אתם מסיתים , ייאלה לכו קיבינימט",Negative
״הערבים רוצים להשמיד את כולנו- נשים ילדים וגברים״ (ב.נתניהו):.,Negative
" די נו מה ההשוואה בין פיגוע, דבר לצערנו נפוץ, לבין ארוע חטיפת חייל כל חייל חטוף נהיה הילד של כולנו. נקודה.",Positive
 לנדאו פנה כל כך שמאלה שאנשי חמאס כבר מתנערים ממנו כקיצוני מדי,Positive
 מעלילים על טרור מוסלמי את הפשעים שלהם עצמם,Negative
": מושגים חדשים בחקלאות, הלכות כשרות ובתורת הגזע שפגשתי בהם לאחרונה: ״גידול נגוע״ שהוא גידול אורגני או ערבי. לעומת זאת ״דיבור…",Positive
אל תקברו את כחולבן אפשר במקום זה לשרוף ולפזר את האפר עם צוללת,Positive
" אונס, רצח, כו'",Positive
להקים יישוב בצפון הנגב ליד הים כדי לחזק את ההתיישבות ליד עזה:.,Negative
יש אנשים שכל החיים שלהם *לא* סובבים סביב להחרים את פלסטין ולאריז? מה הם עושים כל היום,Positive
 טיפשה :רוצח הוא לא פעיל פוליטי,Negative
" זה הבעיה של כת ""רק לא ביבי"", אתם בטוחים שהוא רוצח או אנס בזמן שהתיק הכי כבד הוא סיקור אוהד (שהולך ומתפורר לכם מול העיניים). מרוב השנאה שלכם אתם מפספסים את כל ההישגים והטוב שקורה פה במדינה (זה הזמן להכניס את המצב הכלכלי בגלל מגפה עולמית- שכנראה ביבי אשם גם בה)",Positive
" לא למדתי כלום מסבא שלך אחד מראשי הממשלה הכי טובים שהיו פה. אדם מבריק, אמיץ, ציוני הדוק ולוחם נועז!!! תתביישי לך",Negative
עשיתי שנצ ארוך רצח מאיזה שלוש ארבע עד תשע רק בשביל שארדפ שוב ואקום בארבע ...,Positive
" . הפצת מחלה. . כיבוש הרשתות החברתיות עיי האופוזיציה, והצפתן במידע מטעה. . הסתה מצד המתנגדים לדמוקרטיה.",Positive
 מוחמד אתה רוצה איזה מיפלגה אחת או שניים אצלכם בסעודיה חסר מיפלגות,Negative
