text,label
" כמו כן, רצח רבין, ההסתה וההתכחשות היו הרבה לפני ש""יש עתיד"" הוקמה. הם לא יכולים לטעון שלא ידעו עם מי הם נכנסים למיטה.",Positive
 הנקודה היא אחרת. למה אם הגנב היה לא ממוצא ערבי שמאלנים לא היו מגינים עליו?,Positive
 איך הקמת מדינת טרור ערבית כושלת נוספת ללא זכויות אדם נשים ולהטב על כפר סבא היא פתרון?,Negative
" אתה רוצה דעה של ערבי, אז הנה, תומך פייגלין ופעיל ב""אם תרצו"" לא מייצג אותי ואת הרוב המוחץ של החברה הערבית. תקרא את הפוסטים ומאמרי הדעה שלו ותגידי לי אתה האם נראה לך הגיוני שאיש כמוהו ידע לייצג את קול החברה הערבית בצורה אותנטית",Positive
 אבל אין פה שוברים. המוצר אותו מוצר. ההקצאה אותה הקצאה ותלויה בכלל בגיל המבוטח או במצבו הרפואי ולא בשיקול כלכלי. להגיד שזה וואצ`רים זה הכי לאנוס את הצורה שהקופות באמת עובדות.,Negative
 אהההההההה רצח עם,Negative
: מקהלני ועד גנץ ולפיד. מפלגות המרכז והדעיכה של מפלגת העבודה* (ומרצ). מ+ לפני רצח רבין ועד ++אורלי לוי בכנסת המתפזרת עכ…,Positive
"נסראללה בהקלטה סמויה: ביבי אהוב לבנו, אנחנו מתאפקים כבר חודשים כדי לשמור עליך, מחמל. נפשנו, רק טפו טפו טפו שתחזיק מעמד, תמשיך להשמיד מהר ובטוח את העם והמדינה הציוניים",Positive
 אין לך איזה מחבל מחמד ללטף היום?? להריח לו??..,Negative
" שנאת הזר? להעמיס עשרות אלפי מסתננים למס' שכונות קטנות בת""א (רובע העבדים) על הקיים? זה לא שנאה - אלא חשיבה בריאה. סודן - כבר לא נחשיבת מדינת אויב וניתן להחזיר לשם בהקדם (האירופאים עושים זאת כבר זמן רב), נשים ניתן להחזיר לאריתראה (גם את זה עושים כמב מדינות מערביות) - מוזמן לבדוק",Positive
 טרור שעדיין אסטרים...:.,Positive
" כל הכבוד! רצח עוד כמה עשרות מתושבי עירו, איזה תותח",Positive
איך זה שאותם פוליטיקאים שתוקפים את חיילי צה״ל שלא חותרים למגע מול זורקי אבנים פלסטינים הם אותם פוליטיקאים שתוקפים את המשטרה כשהיא חותרת למגע מול זורקי אבנים יהודים. אל תאמינו להם למילה הם עבדים נרצעים של הטרור היהודי. אוחנה בנט שקד וסמוטריץ הם תומכי טרור יהודי.,Negative
 תנו לי עכשיו  מיליון שקל אני תוך כמה ימים אוכיח לכם קבל עם ועדה עם צילומים והקלטות שנתניהו רצח את ארלוזורוב. הם ב  מיליון לא מצליחים אפילו להגדיר שם לעבירה.,Positive
 מחבל,Positive
 ערבים זרקו אבנים על המפגינים ודרסו אותם למה אתה לא מדבר על זה. חתיכת אוטו אנטישמי בזוי תלמד היסטוריה של העם שלך,Positive
ביבי:מכבי גזענים לא סתם אין אצלם שחקן ערבי  שנים,Negative
"הפוליטיקה של הזהות היתה ועודה מכשיר פוסט-ציוני של האליטה. לצורך זה גוייסו וקיבלו במה לא פרופורציונית אנשים שחזרו מלימודים באמריקה, והגיעו לכאן עם האידיאולוגיה הפוסט-לאומית של השמאל. והם היו הכי מועילים לפרוייקט הפירוק אם הם היו מזרחיים. הנה מה שכתב פרופ' סמי שלום שטרית ב : &;&;",Positive
" שיטור יתר זה נגד אתיופים, שיטור יתר קורה כאשר בחור מוגבל ערבי נורה למוות. נשאלת השאלה האם ההורים של בחורי הגבעות מחנכים אותם לא לפשוע נגד ערבים לא לעקור ולשרוף עצים ומטעים שלהם ולא לזרוק אבנים על כוחות הבטחון.",Positive
" כי הם אזרחים שווי זכויות ובחלקם אף זכויות יתר, בגן העדן של המזרח התיכון שיהודים הקימו.להיות ציוני זה להאמין בזכות קיומם של יהודים בבית הלאומי היחיד שיש להם בעולם.זה שהתרגלנו שערבים חיים כאן ולא מזדהים עם העיקרון הבסיסי והוא הצלחה ושגשוג של המדינה והכרעת אויביה,זה לא אומר שזה שפוי",Positive
 שיריונים מעולים!!! חסר לי ערבי ברשימה,Negative
" כן. למה ציינו דווקא ""ערבי""? אם זה לא היה נובע מגזענות היו כותבים ""גוי"". אין הבדל בין אוכל של ערבי לאוכל של רוסי, אתיופי, תאילנדי או כל אדם לא יהודי אחר.",Positive
" זה שיח של אשכנזים מנותקים שלא קראו בחייהם מילה בערבית ומרוחקים כל כך, אבל כל כך, משיח פוליטי ערבי.",Positive
" צודק. כל הכבוד לנתניהו שהביא חיסונים לפני כולם! וכל הכבוד לנתניהו שיצר מיליון מובטלים לפני כולם! ושהוביל למותם של  נפשות. אויב ישראל, שונא עמו ומדינתו.",Negative
" לכן כתבתי: תלוי ברעם באשר לשר ערבי ודאגה למגזר זה נכון שמשלה -או כל גוף - אמור לדאוג לכולם אך כולנו בני אדם , ואם לא מביאים בעיה לפתחנו איננו מודעים לה שר מהמגזר מכיר את בעיות המגזר ויכול להציפן בצורה טובהה יותר עוד תופעה אנושית היא להיות קרובים לדומים לנו [דעות עמדות וכד",Positive
"נמדד עומק יכולת משטרת ישראל: שתי הפגנות בירושלים  אלף לא אלים,  אלים. עוד הפגנה במגזר ערבי ומדטרה תברח מעיר הבירה שלנו.",Positive
" באמת, כמה ""יפה"", מצד הכהניסט הנבער הזה גולן, שלא לטעון לכס הנהגת(!) ""מרצ"", שניה ורבע לאחר, שהחליט להסתנן אליה (בברכתך המצערת, יש לציין). כנראה הבין, שיש ב""מרצ"" מספיק שמאלניותים *אמיתיותים*, שישליכוהו לקיבינימט מכל המדרגות אם ינסה, יימח-שמו.",Positive
 סבא שלך מוסלמי? לאישתך הפלסטינאית שורשים בחברון? רק ביביסטים מטומטמים יאכלו את השקרים שלך. הערבים כבר מכירים אותך.,Negative
" נער גבעות מת... מחבל בן . כן, הוא יהודי אבל עדיין זריקת אבנים על עוברים ושבים, עובדתית בלי תודעתית, בשטחים בדרך כלל נחשבת פעולת טרור. די אראל, מעדיף לא לראות לך.",Negative
תעמולת שווא סלובנית אנטישמית. השירות הציבורי הסלובני מלא שנאה כלפי ישראל. אוהדי חמאס פלסטינים:.,Negative
"גם בעניין הפגנות המתנחלים על מותו של סנדק: במאי השנה שוטרים רצחו ביריות גבר פלסטיני אוטיסט רצח מובהק לאור יום. המשטרה עדיין מסרבת לשחרר את הקלטות למרות שהמקום מרושת  ומצולם . בהפגנת המתנחלים נגד אלימות המשטרה לא מוזכרים שמותיהם של איאד אלחלאק, סלומון טקה או אף קורבן אחר.",Positive
 שופר בן מחבל לכוד בין שופרותו למחבלותו,Positive
" סלח לי אבל החרדים שומרים חוק 'קצת' יותר מהחילונים, % מבתי הכלא על שוד, אלימות, רצח ואונס זה לא החרדים, הם מקבלים חינוך טוב. אתה קיבלת חינוך לשנוא, עובדה- אתה שונא חרדים בזמן שהם לא שונאים אותך תחשוב על זה",Positive
": ""גם כיבוש בלית ברירה הוא משחית. גם כיבוש נאור והומני וליברלי הוא כיבוש"". עמוס עוז, גדול סופרי ישראל, נפטר היום לפני שנתיים.",Positive
 טרוריסט!,Negative
מרגל נאצי סוחר סמים מפעיל טרור אזרחי:.,Negative
גזענות מזוקקת- שמאלנים שלא מבדילים בין ערבים תומכי טרור ומעודדי אלימות לאומנית לבין ערבים שמגנים אלימות ורוצים להשתלב במדינה,Negative
 יהי זכרו ברוך שאלת אותו פעם למה הוא ביקר בכלא את רב המרצחים ברגותי ששפוט על  מעשי רצח ואף כתב לו הקדשה חבר שואל ?,Negative
" זה מהמילה הלטינית ""פוסט"" שמשמעותה ""אחרי"". אז פוסט-ציוני זה מי שכבר לא ציוני. ופוסט-פוסט-ציוני זה מי שכבר לא פוסט-ציוני.",Negative
 לא מספיק אנטישמי,Positive
" מכיר הרבה שמצביעים ליברמן, מקום  בישראל ביתינו הוא ערבי מארוני מגוש חלב. מותר להם להצביע למה שהם רוצים..",Negative
מעניין אם היה מדובר בנער ערבי גם השוטרים היו מוגדרים כמאוימים. תנו לי לנחש שלא... בושה. #דםיהודיהופקר:.,Positive
 כן זה מטריד רצח,Positive
": מכות רצח, רץ ממקום למקום, מנסה לעשות משהו, מנסה לקרוא לאנשים שברחו שיבואו לעזור, מרגיש חסר אונים. חוזר הביתה ומגלה שבזמן שאנ…",Positive
בזכות הקורס בספרות אני קורא עכשיו שוב את התפסן ונזכר בעצמי בן ה- (?) שקרא אותו לראשונה ואני לא יודע להסביר ממה בדיוק אבל אני מתרגש רצח ובא לי להגיד לכולכם שאני אוהב אתכם,Positive
משני ביקורים של נתניהו במגזר ערבי  אנשים רועדים. גדעון סער יאיר לפיד אחמד טיבי איימן עודה איפה הייתם עד היום?:.,Negative
: אלפים בהפגנת הימין על רצח אהוביה סנדק • אלימות קשה מצד השוטרים חדשות ימנים &;&;&;:.,Positive
 ברור שאין את התמונה המלאה. אבל זה מוות מיותר וגם מציג אותנו באור שלילי. זה לא חיסול של מחבל,Negative
 אבל ״הערבים נוהרים״ ״וסמולנים מפיצי מחלות״ זה לגמרי ציוני פטריוטי. פחחחח,Positive
כי ברור שתפקיד של בלשי משטרה זה ליצר תאונת דרכים קטלנית במידה שמדובר בפלסטינים. במיוחד לאור הנתונים לפיהם ימ''ר שי נדרשת בדיוק למקרה  בשנה של טרור עממי פלשתיני..:.,Positive
" נאום בר אילן. שחרור רוצחים. חלש מול טרור. ניהול פוליטי של הקורונה. והרשימה עוד ארוכה. כל העולם מחסנים, זה שהוא הולך ע""י המטוס ומצטלם עם החיסונים על הרקע, מראה כמה שהוא חדל אישים ורק מגושם כמוך, יכול לקנות את השיט הזה.",Positive
" יש להם ויזות, אשרות שהייה, הם בישראל כדת וכדין ולא מגורשים לשום מקום ע""י ממשלת הימין, אז שום כיבוש ושום עגבניות. רוצה לבטל להם את המעמד? לגרש? אחראים לזה בג""ץ והממשלה, נא לנהל מאבק מולם ולא מול אנשים מסכנים עם הילדים שלהם שכל חטאם הוא לברוח מגהינום",Positive
 זה אולי לא רצח השוטר לא בא במטרה לרצוח אבל הוא התכוון לפגוע בצורה לא חוקית בוודאות ולכן זו הריגה וודאית,Positive
"  זריקות אבנים מצג ערבים כל יום. עכשיו, כשמסתבר שמותר לבצע בהם פיגוע דריסה ונוסח פגע, ברח, והסתר ראיות - זה יועיל מאד למגר את האויב",Positive
 יש לי פה אגרטל מכוער רצח שאמא שלי לא רוצה לזרוק אני מחכה לשבור אותו כבר שנים,Positive
" תמיד יהיה לכם את מי להאשים, רק לא את עצמכם.. הפקידים, המפכל, היועץ, אילנה דיין, עזה, איראן, ביידן, אובמה, טיבי, לפיד, אלקין ומזל שבאה לו הקורונה מה עם קצת מודעות וביקורת עצמית??",Positive
היא עוד שנייה יוצאת במונולוג לכמה חמאס אוהב אותנו...:.,Positive
 החלום שלהם הוא לא רק לזרוק אומנו מהארץ אבל גם להשמיד אותנו לחלוטין,Positive
" אחד חייל, השני לא. אחד חי ויש סיכוי להחזירו, השני כבר מת. וזה לא קשור להיותו מתנחל. לא זוכרים אותו כמו שלא זוכרים רבים אחרים (חילוניים, דתיים, קיבוצניקים, מושבניקים, עירוניים, גברים, נשים) שנרצחו בפיגועים.",Positive
נוער הגבעות זה ארגון טרור או ארגון פשע? או גם וגם?:.,Positive
"מצד אחד מחדל ענק של, לא משנה איזה קשקוש הדוברות שם מוציאה. מהצד השני יכולת איסוף #מודיעין, איתור מטרה, לוגיסטיקה וביצוע #חיסול ברמה של סוכני #מוסד. אגב, עד היום אף אחד לא שילם את המחיר על מחדל רצח הסוכן אנטון:.",Positive
 סביר להניח שחלק גדול מהתותים באים מהגידולים הערביים והם נגועים בחרקים כי לא מרססים אותם או בגלל תנאים אחרים בגידול. ולכן הזכירו גידול ערבי.,Negative
" אם מישהו הוא ציוני הוא תיוני כי יש לנו שייכות היסטורית ולגיטימציה על ארץ ישראל, להיות פרו פלסטיני זה להתעלם מעובדות, כמו העובדה שהעם הפלסטיני לא היה קיים עד שהיה צורך פוליטי בקיומו ושהוא חסר מטרה או גיבוש אתני לאומי שמייחד אותו כעם. כמו כן זו התעלמות ממוגבלות המשאבים שבשטח הזה.",Negative
 אתה פלסטיני?,Positive
 מה לא ציוני בלהפציץ ערבים מהאוויר?,Negative
 יותר מפגר יהיה להפר את המילה שלו אחרי שהוא נשבע שלא ישב תחת ביבי ולא לשרוף את עצמו בתור שקרן לעתיד,Positive
 עאלק חמאס הוא מנהיג הפלסטינים. חמאס הוא ארגון טרור. כדאי שתכיר בעובדה הזאת,Negative
" שיקראו לך טפיל מוצץ דם משריץ ילדים וגידול סרטני ממאיר מפיץ מחלות ושרואים אותך מבינים את הנאצים ושתחטוף מכות רצח משוטרים אז גם אתה תתלונן... השמאל בוכה כבר שנים על זה ""שגנבו לו את המדינה"" למרות שהוא הכי פיריבילגי.",Negative
" לכן הוא לא שילב מעולם מפלגות ערביות בממשלה שלו, לכן כשגנץ הצטלם עם ראשי המשותפת בבחירות - ביבי אמר שזאת ההוכחה שהוא יקים ממשלת טרור, ""זה או ביבי או טיבי"" וכו'. אתה לא באמת מאמין לשטויות שכתבת. אי לא מאמין שאני אפילו טורח לענות על זה ולתת דוגמאות",Negative
 כבוד ראש הממשלה תתעורר אתה הולך לאבדון!! אין מגפה אתה חברתה לאג׳נדה  המקום שלך לא בטוח אתה ניפגש תה עם גדולי הדור ברכו אותך ביבי תפסיק את התעמולה תפסיק את השקר אתה לוקח אחריות על נשמות של אנשים זה רצח עם !!!אתה תואשם בפשעים נגד האנושות אתה קורבן של יהירות,Positive
" אתה יודע שהתחייבות של בן גוריון זה לא תורה מסיני. הליכוד -  סער -  בנט -  יש עתיד -  החרדים -  לליכוד,סער,בנט ולפיד יש יותר במשותף אחד עם השני מאשר שיש להם עם החרדים. בלי אגו פוליטי המצב פה היה הרבה יותר טוב. אה ושכחתי את ליברמן החצי אנטישמי,אפשר ליצור דבר חדש. ",Positive
 אהבתי שגידול ערבי הוא נגוע.,Negative
" זה חוקי, אבל מאוד מטומטם. ישראל צריכה לתת פוש אחרון בדמות סגר כדי לצלוח את הקורונה בלי לשלם מחיר גדול מאוד בנפש עד שהחיסונים יהיו אפקטיבים, אבל שפע החליט להשמיד באופן חלקי את הסגר וכנראה גזר את דינם של עוד אנשים שיחלו...",Positive
 תעמולת שווא סלובנית אנטישמית. השירות הציבורי הסלובני מלא שנאה כלפי ישראל. אוהדי חמאס פלסטינים,Negative
 חתיכת טרוריסט אתם רוצחים ב לך תעשה לעמך כי כל יום רוצחים אצלכם...,Negative
"אם במקום אהוביה הי""ד היה נהרג נער ערבי, השוטרים היו עפים מיד ומועמדים למשפט כשבסופו היו יושבים שנים רבות בבית סוהר.... מדינה של גהינם....",Negative
" נו באמת... תתאמצי טיפה יותר. המשותפת הם לא בעלי ברית, אין שום הסכמים ו״עסקאות״. הליכוד מבקש את אימון האזרחים הערבים שמוכנים לשיתוף פעולה עם ״מדינת היהודים״. הליכוד מבקש להשיג מנדטים. ובכלל, הם אזרחים ומגיע להם זכויות אזרח מלאות בלי קשר. אנחנו יודעים לעשות את ההפרדה בין אויב לחבר.",Negative
"""פליטת כדור"" זה מה ששווים חיים של פלסטיני תחת הכיבוש. זו לא טעות זו מדיניות:.",Negative
 קראתי אתזה בתור לרצוח והייתי מאוד מבולבלת,Positive
 לא. בשביל זה הוא יהיה ערבי מידי.,Positive
"אלוף החיסונים של ישראל, מוחמד דאבח, אח בקופ""ח כללית בכרמיאל: ""חיסנתי ב- ימים  איש. אני עובד  שעות ביום, מחסן  איש בשעה. הגברים פוחדים מהחיסון יותר מהנשים"". משרד הבריאות: אתמול בוצעו , חיסונים. שר הבריאות אדלשטיין: עד כה התחסנו  אלף איש.,",Positive
": המסיבה פוזרה בידי צעירים ערבים אחרים שבאו למקום עם אלות ונפצים. ברשתות החברתיות תוקפים את הרש""פ כי איפשרה לכאורה את קיום המס…",Positive
" כשהמא חזירה והאבא ערבי, מגיח לעולם גוש חלאה מצחין. הוא פה כדי לטנף את המרחב, להסריח את הסביבה ולזהם את האווירה. זה תפקידו וזו אומנותו.",Negative
 וואי דווקא בבית ספר שלי שווה רצח אבל בטח השנה יהיה מעפן כי אין מסיבות,Negative
" לא התלהבנו אתמול שהרש""פ עצרה  פלסטיניות שהתכוונו לעשות פיגוע דקירה? ,כתבות על שת""פ ביטחוני בינינו לבין הרשות מביכות אותי כי אני יודע מה הן שוות באמת, זה טוב אולי להינדוס תודעה של הציבור בישראל אבל זה חוטא לאמת.",Negative
" יה מושחת אתה ממחבלי השלום, רק רצים לזונות בדובאי כדי לאנוס אותן, זה מה שאתה, צייוצך הוא הסתה ושקר, אתה תומך בשחיתות שילטונית ופשע",Negative
" אם לא נתניהו בעמידה שלו ""וביזבוז  שנות אובמה"" אני לא יודע איפוה היו היום כל המתנחלים האלו כפויי הטובה. גילוי נאות גם אני מתנחל בשומרון.אבל לדעתי כפויי הטובה הם מהציונות הדתית",Positive
" מנסור עבאס אומר בעצם כך: ""נתניהו רואה בסקרים שאין לו רוב יהודי בגוש לכן החליט לקושש קולות אצל הערבים הפלסטינים באום אל פחם פה לא תקבל קולות רק רקטות, לכן לך לחדרה לחפש רוב יהודי. אני מוכן להתפשר עם נתניהו ישריין לי מקום בעשיריה הראשונה ברשימת הליכוד, אם לא, לך בחזרה לחדרה""",Negative
" חקלאי ערבי = שימוש בחומרי הדברה מסוכנים, אבל אתה לא רואה גזענות?",Positive
פאדי תאקלאדה: נתניהו דרך באום אל פאחם היידה שרה ערבי טוב זה ערבי מת,Negative
"פרסום ראשון: פיגוע הדקירה שסיכלה הרשות הפלסטינית - והפגישה החשאית של ראש השב""כ עם אבו מאזן ברמאללה #חדשותהערב:.",Positive
 אולי מפכל ערבי מלוד יעשה פה סוף סוף סדר,Positive
"״לינץ׳ בנהג ערבי זה אסתטיקה רעה למאבק ומרחיק תומכים״ זו העמדה של ״המתונים״. כמו הניאו-נאצים וה״אופטיקס״ שלהם, הויכוח הפנים-מתנחלי ביחס לאלימות האידיאולוגית שלהם הוא בכלל לא מוסרי אלא אסתטי. תנועת ההתנחלויות והתרבות הפונדמנטליסטית שהיא מייצרת הן מכשול לדמוקרטיה יותר מאלף נתניהו.:.",Positive
 כולם עושים יחד נגד המלך ביבי. כל העולם ואחותו הדיפ סטייט ו. וטראמפ יהיה הנשיא לעוד  שנים וביבי ימות בבלפור עוד  שנה. מה אתה יותר חמוץ או מתוסכל?:.,Negative
" מזבלה מי שהביא אותך יא חמור מצוי.רצח זה רצח זה רצח, ולא משנה זהות המבצע יא חזיר",Negative
 זה לא ימח שמכם,Positive
" בתור אחד שלא חוסך ביקורת וקצת בדיחות (בגבול הטעם הטוב) על בנט אני כן יכול להבין שהוא כועס, ייתכן מקנא בהערצה שמקבל נתניהו מהציבור וצמא גם הוא להכרה על הרעיונות שלו. אני לא חושב שבנט כבנאדם, כיהודי, מסוגל להכיל שנאה כה עזה למישהו בתוכו עמו שמביע זאת סער. כאילו נתניהו אויב ישראל.",Positive
" עוד כמה קונספירציות שהתרחשו 'בגלל הטלפון של גנץ' ושאותם 'חייבים לחקור': אלוויס מעולם לא מת, העולם שטוח, ישראל הפילה את בניני התאומים, פרס רצח את רבין, האדם מעולם לא נחת על הירח, זה פייק של אולפני קולנוע, ביל גייטס פיתח את ה'קורונה' ואנטנות מפיצות אותה, יש מושבת חייזרים בעפולה.",Positive
"ישראל מתחסנת: מוחמד דאבח, אח ישראלי, מחזיק בשיא הישראלי לחיסונים נגד קורונה, כשחיסן עד כה  בני אדם. (רדיו )",Positive
" מורן, יש ביניכם מחלוקת נטו בקשר למושג ציוני ולא למשמעות הנגזרת מזה, אין מחלוקת ביניכם על כך שמדינת ישראל היא מדינה יהודית ושעם ישראל זכאי להגדרה עצמית. ואוסיף, שבאמת אי אפשר להגיד ציוני על ערבי, כי זה כמו יהודי פלסטיני.. ערבי הוא לא ציוני כי הוא איננו יהודי.",Positive
 יימח שמך יה בן של זונה !,Positive
 למנהלים ומורים יש גם ככה יכולת לשנות ציוני בגרות כל הזמן (להלן 'מגן') בלי קשר לרב ליכולת התלמיד. אם יש להם כלי בעייתי כזה אין להם בעיה להשתמש בו בשום מצב,Positive
" עמנואל, האם אתה בעד חקירה וענישה גם במקרה שמיידה האבנים הוא קטין פלסטיני? רק בודק כי נראה שעד היום זה פחות הזיז לך",Positive
