text,label
" הוא כבר המון שנים שם,תודה על הדאגה לשאר המגזרים שגם שם יש עבריינים אבל יש פחות בהרבה רצח מסיבה אחת פשוטה. האלימות בחברה הערבית היא אלימות תרבותית ולא אלימות שקשורה רק בפשע.",Negative
 כלומר רצח של  איש או ריצוץ ראשה של ילדה בת  על סלע - יותר סבבה?,Positive
 מה עכשיו הפילו עליך את רצח אהוביה סנדק 🤔,Positive
 יימח שמו וזכרו ואינשאללה שלא יזכה להגיע לחורבן המדינה - לפני זה שיקבל שבץ לב !!!,Negative
"את טועה טעות מטעה: עם טיפוסים כמו יזבאק,טיבי ועודה אין שום הסכם. הם תומכי חמאס וג'יהאד מוצהרים ונחשבים בעיני כולם כאויבי המדינה. ישנם מאות אלפים במגזר הערבי שדורשים שלום ולא טרור. מקומם איתנו.:.",Negative
שוטר פחדן מלא שנאה מכה במכות רצח נער לא שמאלני.:.,Negative
 עוד שבוע כשהם משחררים את פלסטין!,Negative
 זה סיפור עצוב מאד. אבל אתה יודע טוב מאד שאם זה היה נער פלסטינאי היו משדרגים אותו לטרוריסט וסוגרים את העניין.,Negative
"הניגון חוזר - אזעקת צבע אדום נשמע בקיבוץ כרם שלום, זוהתה יציאה אחת אשר נפלה בתוך שטחי רצועת עזה כך נמסר עפ״י מקורות ערבים.",Positive
ביבי:מכבי גזענים לא סתם אין אצלם שחקן ערבי  שנים,Negative
: יצאתי פה שווה רצח מזה:.,Positive
" ""הנחתי לשדוד ממכם  מליון ש""ח כדי לשרוף אותם על שטויות שאני חושבת שיעזרו לי פוליטית""",Positive
" לא # אילת ואזורי הדרום. כל פלסטין. שביתות עליך לא יונחו כמו שביתות על בדואים. אבל תרגום מטורף של הסיסמה שנאמרה. אני לא אומר שזה חבל עליכם הילדים .. אלא מסיבות ששייכות לי. אם תתערב, העם יתמקד בך במאמץ ואני לא רוצה למות לפני שאראה את נפילת האיקאל",Positive
" כבוד ראש הממשלה. לקראת הבחירות ,על מנת להקים ממשלה ימין מלא.אני מבקש מציע. להודיע על מהלכים: שתי קדנציות(שמונה שנים)לראשות הממשלה. לא לפסול אף מפלגה.(בתנאי שאינה תומכת טרור או בידי אס) בהצלחה.",Positive
" אנשים ""מופלאים"" שגידלו מחבל, טרוריסט מסריח, אתם כל כך מוסתים ונפוחים מעצמכם שאתם חושבים שאסור לזמן אמא של מחבל לחקירה, גזענים חסרי מנוח.",Positive
 אתה מבין שכשאתה הגעת למצב שאייכלר הקלגס הוא ציוני וגולן הוא לא ציוני התבלבלת בדרך??,Negative
 מקור הבעיה הוא סכסוך דתי לאומי על אותו משאב. לא תמיד הכל פתיר. זה לא משנה את המקור לויכוח. מי שחיעובר בשטחים שלא יתפלא אם יש פיגוע.,Positive
" לא, הם מורכבים מישראלים ששמים בראש מעייניהם מלחמה ב""כיבוש"" ותמיכה בנארטיב הפלסטיני.",Negative
עוד נהג ערבי שהגיע בתזמון גרוע:.,Negative
 חלאה מהלכת רגיל להגן על חלאות אדם כמוהו ולא נשכח איך הגן על הצורר הנאצי דמניוק. המניוק המכוער לא בוחל בכלום ובקיצור ימח שמו ושם יגאל עמיר .,Positive
" בעוד הנושא ""הפייקישתני"" ממודר באופן קבוע. כלומר ממודר מהתקשורת ונמצא תחת האפלה מוחלטת על ידי שתי הצדדים. כתבים לענייני ערבים - כמו רועי קייס בלי כנפיים. חמאס &; משתפים פעולה. בחשכים. זה לא חדש. מה הסיבה העיקרית לכך שנתניהו לא סיפר לנו שזהו הצבא של ""המדינה הפלסטיניתמפורזת""?",Positive
והופס - נהיינו חמאס:.,Positive
 לחסום. בדקו לה רשימות מעקב. רק היום פתחה על הימין והדתיים וחרדים תומכי ימין וביבי מעקב. בטוח לבחירות לצלם מסך לדווח על 'בוטים ימנואידים' ולסגור אתכם. יש לה ברשימות מעקב חדשות פלסטין בעברית=אנטי ציונות ודת. בטח מצביעה משותפת. כל פיגוע תצייצו משהו לא קל לעיכול והיא תדווח. למה לכם?,Positive
" צפיתי בסרט בערוץ .. אני שוקל להתנתק מהוט אחרי מה שראיתי שם.. לצערי לקיתי קצת בחוסר ידע בכול מה שקשור אליה.. היא אצבע בעין למדינת ישראל!!! גועל נפש. סיפור של שנים הגועל הזה,היא והבעל שלה. תא טרור של גייס חמישי",Positive
פרופ חגיי בן ארצי. החוג למתמטיקה. רב. מתנחל,Positive
"ואין שום הבדל בין ""מגויס לטובת האויב"", לבין -אויב",Positive
" לזכותו של נתניהו שחשף את מלוא הספקטרום הימני והבהיר (למי שחיפש הבהרה) שאין שמאל ציוני, אלא גוונים של לאומנות וקפיטליזם",Negative
" אוקיי - תודה רבה לנאשם, לרעייתו העבריינית המורשעת ולבנו הצייצן הבטלן שבגיל  גר עם ההורים. עכשיו תפנו את עצמכם למעשיהו, קיסריה, רחוב עזה או עזה. לאן שמעשיכם יובילו אותכם.",Positive
 לך תלמד לכתוב יחולה נפש דוחה ברמות דחוף אישפוז אברבנל מחכה לך עבריין ומושחת אנטישמי זרע עמלק עוכר מדינת ישראל בושה וחרפה לך בוז בוז בוז לך 💩💩💩🗣🗣🗣🗣🗣🗣🤮🤮🤮🤮🐷🐷🐷🐷🐷🐷🐷,Negative
 אנחנו לא צריכים מהחלאה התומך טרור מחבק מחבלים מילה טובה . שיזדיין הוא והעיתון התעמולה שהוא כותב בו. החלאה הזה יותר גרוע ממחבל חמאס,Positive
מי שמפמפם את עניין שיחרורו של רוצח רבין החילאה..  פעם ביממה בתקשורת הוא נתניהו שעשה כנראה סקר וגילה ש% תומכים היום בשחרור רוצח רבין.. בחירות אמרנו!!!,Positive
 אבל אבל אבל זה לא דגל פלסטין,Negative
" נו באמת... תתאמצי טיפה יותר. המשותפת הם לא בעלי ברית, אין שום הסכמים ו״עסקאות״. הליכוד מבקש את אימון האזרחים הערבים שמוכנים לשיתוף פעולה עם ״מדינת היהודים״. הליכוד מבקש להשיג מנדטים. ובכלל, הם אזרחים ומגיע להם זכויות אזרח מלאות בלי קשר. אנחנו יודעים לעשות את ההפרדה בין אויב לחבר.",Negative
" קשה לי לקחת אותך ברצינות אחרי שדיברת על ""שואה"" שהורייך ביצעו. או שאתה טרול (שזה הגיוני כי יש לך תמונה של שני גברים מתנשקים ואתה מייחל בהחלפת מדינת ישראל במדינה פלסטינית בה הומואים יוצאו להורג) או שאתה תומך טרור מבולבל. בכל אופן מעתה אשלח תמונות של מחבלים קטינים כתגובה לשטויות שלך",Negative
 בתגובות הוא הגיב שהוא חושב שמרצ וימינה חושבים אחרת בנוגע להתמודדות עם עזה. יש מנעד רחב בין רצח עם וחיסול האוכלוסייה לבין כניעה לרקטות והרמת ידיים.,Positive
": #شاركوانشر אם יסתבך האויב הישראלי בכל טיפשות נגד עמנו, עמנו לא יהסס בהכרזת הגיהאד למען האל נגד האויב הזה, אנחנו לא נהס…",Positive
"התרגיל המשותף הראשון של חמ''ל הפלגים בעזה ""נפתח"" לפני זמן קצר. כ- דקות של נאום מלא פאתוס מפיו של דובר החמ''ל הסתיימו ב""שיא"" של שיגור  רקטות לעבר הים בשידור חי והטסת כטב''מ (כלשהו) ששייך לפלגים מעל אזור המסע''ת.:.",Positive
": תיעוד פיגוע הדריסה במחסום הקיוסק ממצלמות אבטחה: המחבל נוסע בפראות לעבר לוחמי מג""ב ופוגע בלוחמת, שנפצעה באורח קל. הלוחמים נטר…",Positive
 מרצ ישגרו את הקורונה על עזה. מה לא ברור?,Positive
 אני מעדיפה חבר ערבי ולא שמאלני . זה ברור !!! שמאלנים הם בוגדים בערכים . בוגדים בעמם . בוגדים במדינתם . ימנים וערבים - נאמנים לעמם ונאמנים לערכים - חשוב ביותר !!!!,Negative
 נראה מחבל,Negative
" ועכשיו הנוכל נתניהו קורא לערבים להצביע לליכוד, וגם אמר שהוא שוקל למנות שר ערבי. מי הנבל שעדיין מעז להצביע לליכוד?!",Negative
" זה בהכרח מנע. אם כך, מדוע לא הוקמה מדינה פלסטינית מעולם? פתאום כשישראל קמה גם הפלסטינים רוצים מדינה. צירוף מקרים? הרי מעולם לא היה לאום פלסטיני.",Positive
רצח בתוך המשפחה??:.,Positive
" תגובה מהסוג הזה דינה תפילה חרישית שבמהרה בימינו תקרה לך, או יותר טוב, למישהו מקרובייך, תאונת אופניים חשמליות, על מדרכה כדת וכדין. חלילה שמישהו ימות. אפשר גם סתם פגיעת ראש, פגיעה בעמוד השדרה וכו'. טמטום, כך החיים למדוני, מרפא רק ניסיון רע.",Positive
 לכל תכסיסי הריסת המתנגדים של נתניהו יש בדיוק את אותו מחיר - הבטחות.,Positive
" תמשיך להוריד את האשמה מרוצחי המשטרה, זה לא ישנה את המציאות שהם ביצעו פה רצח, מדובר בעברינים שמגויסים למשטרה והם חושבים שזה כמו במאפיה, שהופכים רכבים במרדף. תבינו ילד בן  לא שחקן ב'מהיר ועצבני'",Positive
 הגזמתם.רוצח ראש ממשלה זה סוג של בגידה במדינה . כי ברור שזה פגיעה בשילטון. וזה דומה להפיכה . תפסיקו להיתמם .זו ממש חוצפה,Negative
"עו""ד יורם שפטל קרא לשחרורו של יגאל עמיר |: ""כמו שמתייחסים בצורה רציונלית לאסירים ביטחוניים, כך צריך להתייחס גם ליגאל עמיר"".: ""יש דברים שהם לא רציוניליים כמו רצח ראש ממשלה. זה היה הכי קרוב שהיינו למלחמת אחים והאיש הזה לא צריך לראות אור יום"".",Positive
" רגע. רגע. שולף את הערבומטר שיש לי כציוני לבדוק עד כמה ערבי אתה😅 יוסף, מכיר את דמותך מציוצים ומאמרים, אתה מקשה על אנשים בינאריים",Negative
 ראשית לא נתת שום עובדה אלה שקרים שפורסמו בתקשורת תומכת טרור אין טרור יהודי הטרור יהודי שאני מכיר זה מהשמאל היהודי שתומך ברצח י הודים:.,Negative
" תאמץ את הפרצוף רצח שלי, אף אחד לא נכנס",Positive
 אין שום דבר נעלה במעשה שלו. הוא רוצח נתעב. תפסיקי לבלבל תמח גמאת.,Positive
" כמו השמאל הקיצוני, גם הימין הקיצוני מתקשה לגנות טרור כזה ומוסיף הרבה ""אבל"".",Positive
" סיפרתי לך על החבר הזה שלי שחי בלבנון רק שיקבל שם אזרחות מבחינתי זה מספיק בתור פליט פלסטיני אין לו אפילו זכות להחזיק נדלן או רכוש על שמו והוא לא יכול להגר משם שתבין הוא רק רבע פלסטיני ושלושת רבע לבנוני, זה מטורף",Positive
" אנחנו יכולים לכתוב ""בום"" ועוד ""בום"" ושום דבר לא משתנה! חברי ה שותקים במקום לעמוד בקול  ולדרוש מיד הפסקת כל פעילות היועמ""ש ומע' המשפט כי בידיעה ברורה נעשה כאן פיגוע ממשי כנגד ראש ממשלה ובעצם נגד מדינת ישראל ואזרחיה! ואנחנו הבוחרים!",Positive
"מטח רקטות אל הים: חמאס והפלגים החמושים ברצועה פתחו הבוקר בתרגיל צבאי הכולל ירי חי - ""מסר של אחדות לאויב"":.",Positive
 הערבים לא אוייבים רובם אנשים טובים שרוצים רק לחיות בשקט. אני מעדיפה שכן ערבי ולא מהסמרטוטים השחורים מלאיי השנאה והמירמרור. יש הרבה ערבים שמצביעים נתניהו כי יודעים מה טוב ומי נתן להם תקציבים בצורה הוגנת . בגלל זה הקיבוצים רועמים פתאום יש עוד ילדים למדינה והם לא יכולים לעשוק !,Negative
"חגיגות המחבלים במתקני שב""ס ממשיכות ללא ההפרעה. מתי נתעורר? כאשר נבין שמחבלים כלואים הזמינו עוד פיגוע? עו""ד רצח של חייל? עו""ד חטיפה? הגיע הזמן,, לעשות סדר בשב""ס, לפני שזה יהיה מאוחר מדי!:.",Positive
 כאילו ביבי יושב ושולח כסף לבכירי חמאס בוא גם אתה תסביר לי מה הפתרון שלך בעזה?,Positive
 לגיטימי לחלוטין זכותו של הנהג ואם הוא היה חושב שאתה ערבי גם היית יורד או שאתה גזען צבוע של שקל ?,Positive
 על גדעון סער או על בנט יהיה אפשר ללחוץ מימין לפעול יותר בתקיפות. ביבי הוא שליט יחיד ויש לו קהל שבוי שיתמוך בו בלי קשר לכלום. הייתי מצפה לתקיפת מחסני רקטות בכל פעם שיש צבע אדום.,Positive
" אל תיתמם. אין הגדרה כזו ״גידול ערבי״ לתותים שלא מרוססים. עם כל הכבוד לצהר, שבאים לייצג משהו מתון יותר, מוטב שיתנסחו בצורה המכבדת אחרים. נראה אותך מפרסם בניו יורק שלא לקנות מלפפונים נגועים מגידול יהודי.",Positive
 רואים את החייל מכוון נכון מותר לכווין מאז עובר  שניות כאשר לפחות  לא רואים מה קורה אם החייל  עם אבו עראם כן רואים לפני זה פלסטיני אם אבן ביד,Negative
 הרגו? הוא היה מחבל יהודי לכאורה שחבר שלו נמלט משוטרים ברכב ללא רישיון ובפראות והתרסק. השוטרים לא היו קשורים לאירוע.,Positive
 נגיחה ברכב זה לא תאונה זה רצח אין שום הצדקה לדבר הזה לערבים שזורקים אבנים יום יום לא עושים את זה,Positive
צבע אדום בעוטף עזה,Positive
: זה רק אני או שכשהיה מדובר בנער אתיופי ונער ערבי ואיש חולה הוא לא דרש צדק?:.,Negative
" אולי מנהיג ענק, אבל אנטי ציוני. אף ציוני לא יכול לבחור במי שמקדש את ההשתמטות בעבור תמורה פוליטית.",Positive
 הבן שלך מחבל,Negative
 למה לחסן אתכם? אתם אוייבי המדינה שמחפשים רק להזיק . יש לכם את ממשלת חמאס שהם יביאו חיסון,Positive
" לא, אל תגיד לי שעכשיו אתה עוד מעניק ציוני אינטליגנציה אחרי שהעלית תמונה שנועדה לאנשים עם אייקיו דו ספרתי. שניה אני אקח טישו",Positive
" העבודות של עובדה: . תחקירנית מזמינה עו""ד לשיחה על נתניהו. . נתניהו לא מודע לכך ולא מעסיק אותו. . העו""ד מעלה רעיון שיוכיח לציבור שנתניהו לא יקבל משפט צדק ע""י הודאה בקולם של שופטים שהם רוצים לתפור אותו. . נתניהו אשם! לסיכום: מחבל זרק: בקת""ב על חייל, המשטרה עצרה: את שפי פז.",Negative
 ערוצי אלגזירה ימח שמם לזיכרם האנרכיסטים עוכרה מדינת ישראל בוז בוז בוז להם,Negative
 הגיע הזמן לפתוח את התיק הזה ולהכניס פנימה אל שערי בכלא את מי שמתהלך חופשי בינינו והוא האיש שבאמת רצח את יצחק רבין ז''ל וגם את המאבטח הנוסף שישב ברכב ונקבר החשאיות !,Positive
 משפחת סער הקריבו את הבתולים של הילדה שלהם לאהבת העם הפלסטיני נתנו לה חופש למערכת יחסים עם ערבי שונא יהודים בושה וחרפה גאולה והבת החיננית שלה עם הג׳ורה של יצאנית ותיקה בוחרים למשותפת,Positive
" אני דוגל ב- לא מצאתי סיבה להיות מוסרי אם זה טוב לי לרצוח פלסטינים, ארצח. אם זה טוב לי לאכול בעלי חיים, אוכל. אם זה טוב לי לרצוח את אמא שלי, ארצח. (זה לא יקרה, כי המצפון שלי יכאיב לי אם ארצח את אמא שלי, וזה לא טוב לי. אבל סתם בשביל שתבין את הקונספט)",Positive
 מהמם רצח וואי אבל איך לא קר לך,Positive
 שפטל הגן על פושע נאצי אחר כך על ראש ממשלה מושחת ועכשיו על רוצח ראש ממשלה. אתה בחברה טובה ביבי.,Positive
" שהוא אוייב אז לא מפריע לי אם הוא מת כי סיכן את אחים שלי. ושלטובתנו אנו צריך לעשות תחקיר פנימי על התנהלות המרדף. פה בדיוק הבעיה שלי. שוכחים להבדיל יחס בן אוהב,אח,יהודי. לאוייב ערבי.",Negative
"חוגג לכתבים בארץ - הגשתי הצעה רשמית על אלחמיד כל הכתבים בארץ כבר חודש - אלחמיד יחזור, השאלה לאן חוגג לכתבים זרים - הגשתי הצעה לשחק ערבי שספק אם ישוחרר יקום העיתונאי שיעז להגיד שההצעה הזאת, כמו עם טאלב בזמנו, היא לא יותר מיחצ קל?",Positive
" שמעת ממנו גינוי על רצח היהודיה החפה מפשע, אם לחמישה ילדים? עובר על זה לסדר היום, ועוד מסתחבק אתו?",Positive
"שוטר פלסטיני בכפר סאלמה, מחוז יפו. תמונה משנת:.",Positive
": בחסות נתניהו גנץ וכוכבי: ברגעים אלה ארגון הטרור הרצחני חמאס מבצע תרגיל שלא היה מבייש הרבה צבאות בעולם, מול הפרצוף שלנו, ימ…",Positive
: התרגיל הגדול של ארגוני הטרור ברצועת עזה נועד לכמה מטרות: א. הפגנת כוח בתיאום עם איראן לרגל יום השנה לחיסול קאסם סולימאני. ב.…,Positive
" טרוריסטים זה עניין סמנטי. מי שחייל עבור האחד, טרוריסט כלפי האחר ולהיפך. לשני הצדדים יש פה לא מעט דם על הידיים.",Negative
" גם די מוזר שלפני רגע רצית להשאיר ""פליטים"" פה? למה שתרצה שפליטים ישארו במדינה ""הגזענית המפלצתית האיומה והנוראה"" אם זה המצב, אין צורך דחוף להעביר את המסתננים למדינה אחרת בשביל להגן עליהם מהגזענות המפלצתית שפה? סתם ברור שלא. אתה סך הכול תומך טרור צבוע עם עמדות הפוכות.",Negative
יוני נתניהו. רצח של רבינו חיים. ביבי ליטאי,Positive
 גם לא רצחו ראש ממשלה לפני יגאל עמיר. יגאל עמיר נענש לא רק על רצח האדם. אלא בגלל שיש פה רצח פוליטי.,Positive
" הנה אני, שמאלן פשוט (יש שיגידו אנטישמי) שמתנגד לשלטון החמאס ולשלטון נתניהו שחיזק את חמאס, שואל אותך: האם העובדה שהממשלה של הפרזיטים בישראל מעבירה כסף לחמאס כי אכפת לה מחיי חפים מפשע, אומר שחברי כנסת יכוליםצריכים להשתתף בכנסים של ארגון שמצהיר שכל מטרתו היא השמדת ישראל?",Positive
"על טרור: ״האיש המהלך ברחוב – יש לו זכות לחיות רק משום ורק במידה שהוא מכיר בזכותי שלי לחיות; ואולם, אם יש בדעתו להרגני, אין לו שום זכות קיום, וכלל זה חל גם על עמים״. על הסכם: ״הדרך היחידה להגיע להסכם היא קיר הברזל, כלומר כוח בא״י, אשר שום השפעה ערבית לא תוכל לקעקע את יסודותיו.""",Negative
 היא ראסמי- פיגוע משפחתי לכאורה אבל לא בחילה,Positive
: חמאס&;#;&;#; ביצע אימון גדול במסגרתו שוגר מעזה&;#;&;#; מטח רקטות גדול.:.,Positive
":. לא רק רטרואקטיבי, אלא לכל רוצח ראש ממשלה, גם בעתיד",Positive
"אם רוצח ראש ממשלה מהימין היה בכלא, שפטל היה נותן לו להירקב שם לנצח ואף אחד לא היה מעז לחלום על לשחרר אותו, אבל זה יצחק רבין, אז אפשר. ככה נראית הציונות ואהבת הארץ של שפטל. גם אם ילך עם קעקוע של מגן דוד על המצח, זה לא ינקה את הבושה והגועל של המעשים שלו.",Positive
 ממש לא דביל אתה דביל אם מישהו שמתגאה בזה שהרג מחבל לדעתך הוא דביל. ידביל!,Negative
 בשבוע בו אתם מנגחים רכב עם חמישה צעירים ישראלים ואחד נהרג. בשבוע בו אתם זורקים את פליישמן לרחוב והוא כמעט מוצא את מותו. בשבוע בו רוצחים לכם עבריין תוך כדי לווי. בשבוע הזה שלוד הופכת להיות עזה. ותינוק בעגלה לא מעניין אתכם. ושוטרת בלונדינית באלימות אינסופית.,Positive
בהמשך לצבע אדום באשכול: שיגור אחד ונפילה בשטח רצועת עזה.,Positive
" ומה עשה איתו? כלום! הוא לא יודע להרכיב ממשלה, אין לו שותפים אלא אם אלה תומכי טרור, צר לי אבל זה המצב... הלוואי והיה שונה ורק בשביל להשקיט את הרעש שלכם.",Negative
" לפי ההגדרות שלכם ל״תמיכה בטרור״, % מאיתנו תומכי טרור.",Negative
 בול מה שקיבלתי עכשיו בדואר...לא ידעתי שכביש  צפון זאת חברה שונה. ימח שם,Positive
" תחזור לפעולות טרור יהודי, יותר מתאים לך",Negative
 הוא יגיע עם ראש מורם בגלל כל התיקים שתפרו לו כמו שאתם עושים עכשיו זה לתפור לו עוד תיק ״הצוללות״ אבל לא יעזור לכם הוא נקי אך עושים לו רצח אופי אבל לא ימשך לעוד הרבה זמן.,Negative
" ואו אני בשוק מהשר אוחנה שמעדיף חיים של ישראלים על פני טרוריסטים מטונפים ותומכי טרור. תמסרי לחברים שלך שיעברו לירדן , שם יתנו להם חיסון",Negative
"פרסומות מובייל זה פאקינג איזה מישהו רוצח מישהו אבל בחיים האמיתיים ומראים אותו דוקר אותו שוב ושוב ואז זה הופך לאנימציה של המשחק ואז יהיה טקסט של ""רוצים?"" ושורה מתחת זה משחק ריפאוף ממש גרוע של טטריס ""הורידו עכשיו"". כמובן שלא הגענו עדיין לרמה של רצח, אבל זה יקרה. עוד תראו",Positive
 רומן זדורוב רצח את כל השרשור הזה,Positive
 אתה מופתע אח שלי? היום אתה אנסרוצח ומחר אתה יכול להיות ראש ממשלה. מדינת ישראל כיף פה,Positive
" דור שלם של חיילים שצעק בלילות שישי בכל מיני מועדונים-בקיבוצי-חורי-תחת "" שנות כיבוש יותר לא נמתין"" וגו' לא יסכים איתך",Positive
