text,label
: בהמשך לצבע אדום באשכול: שיגור אחד ונפילה בשטח רצועת עזה.,Positive
" הגיע למקום עם אקדח? הגיע! אז כל זמן שלא נמצא מישהו אחר, הוא רוצח. בין אם זה בכוונה אם לאו",Positive
" לא, כי העם שישלוט פה טוטאלית יהחה את הגב של כל שאר העולם, תכלס הסיבה שהעם ישלוט פה זה ה, ואם יתבצעו פה מקרי טרור ואלימות, כבר לא יהיה צורך לנסות להסביר לעולם למה",Positive
" אז אתה בעצם טוען ש""הערבים שרוצחים ומפוצצים מכוניות"" זה רק סטריאוטיפ? עצוב שכל כך הרבה יהודים נהרגו בעקבות סטריאוטיפ.. אולי כדאי שמישהו יעדכן את הערבים שמדובר בדעה קדומה ובזכות זה הם יפסיקו לרצוח יהודים..",Positive
" אמא של מחבל, היא לא מתביישת ?",Positive
 מושלמת רצח,Positive
" חכי חכי, נראה איך תדברי אחרי שהשמאל יעשה לך רצח אופי...או שמא תשבי איתם ? יען כי לס🐍ר לא יהיו מספיק מנדטים ללא לפיד,מרצ, וליברמן",Negative
" אתה מבין למה אתה דביל? אתה גם גזען וגם דביל. אני לא עושה לך טובה, אבל אסכם: אם אתה מכיר בזכות הפלשתינאים להקים מדינה לצד מדינת ישראל היהודית והדמוקרטית, אני מוכן לקבל. אתה מכיר בזכות הפלשתינאים אבל מתנגד לזכות של היהודים– אזי אתה אנטישמי. בכל מקרה אתה שונא דתיים.",Negative
" ביביסט שקרן, מי שלח אותך? טופזית? אוריך? עלק ניסיון רצח. אפס",Negative
" כמעט אותו סכום שלאה צמל מקבלת בשביל לייצג מחבלי חמאס. אה שנייה, היא עושה את זה פרו בונו...",Positive
" להם אין חמלה על עצמם, שיהיה משותק או ימות ...מי שלא מביא את עצמו למצבים כאלה, לא נורה ולא משותק ולא מת! מחבלים צריך להרוג!!!",Negative
" אוי אתה לוקח אתזה לכיוון הזה. חבל. תהיה הגיוני, השוטרים האלו אחד מהם רצח לכאו' את אחיהם, נראלך שהם יבואו אליהם ויחתרו למגע כמחבלים...אני רק מספיק לי שתבין מה עולה להם בראש. אל תצדיק ותגנה חופשי, אבל תנסה להבין מה עובר בראשם באותם רגעים",Positive
 מ'קען נישט וויסן פאר זיכער. אבער וואלט געוועהן כמעט א נס אויב ער האט קיינעם נישט אנגעשטעקט,Positive
 הוא ציוני . קורונה סקנה לאומית ...טשפעת לא . כמה שזה לא נעים. מדינה מספיסה הרבה יותר ממות של איש צעיר ממות של בןצ פלוס . אם מפסידה בכלל,Negative
" מה עם היושרה של הרב? הולך להיות ראש ממשלה שהוא סחיט עי איראנים ולדעתך הוא לא היה צריך לעשות כל שביכולתו למנוע זאת?! איך אתה היית נוהג במקומו? אתה יודע שגנץ מוחזק בביצים עם עובדות שהוא רוצה להסתיר עי מדינה ששמה למטרה להשמיד אותנו,איך היית מתנהג?",Positive
" רגע, שנתחיל לדבר על לאה צמל? ייצגה מאות מחבלים! מאות!!!!! ממבצעי הלינץ ברמאלה ובעוד נבלות ימח שמם. זה בסדר?",Positive
"מבחינתי עו""ד שפטל הוא תומך ברצח רבין. כל מי שבעד שחרור הרוצח יגאל עמיר זה אומר שהוא בעד רצח פוליטי במדינת ישראל",Positive
" זה לא סרט ערבי. זה סרט הוליוודי פר אקסלנס. מה שכן, כל השחקנים ערבים באמת",Positive
 אם היו נותנים לו לעבוד אז מילא אבל המגרש התקשורתי נגוע בביביפוביה קלינית פטאלית ותמיד יחפשו רק שלילי בכל דבר סופר חיובי. אז מה שאתה מציע להשאיר השטח למהנדסי התודעה שיעשו לו רצח אופי ודמונזיציה וידביקו או ינסו להדביק עוד פתאים תמימים בביביפוביה? גם בלי זה זכותו לשמור קשר עם הבוחר.,Positive
 חוצמזה שיגאל לא רצח נקודה,Positive
"ובכן, גם אתםן חרדיםות שקרועיםות בתוך עצמםן? גם אתםן לא רוציםות לשרוף ת'מועדון אבל מצד שני לא רוצים להישאר שם כבולים לעולם? ברוכים הבאים לגיהינום! להתראות גם שם בגהינום למעלה ניפגש ליד המנגל...",Positive
 ערבים זרקו אבנים על המפגינים ודרסו אותם למה אתה לא מדבר על זה. חתיכת אוטו אנטישמי בזוי תלמד היסטוריה של העם שלך,Negative
" מי שזורק אבנים על מכונית נוסעת הוא מחבל, נקודה.",Negative
: בטח מתקנים עכשיו את הנזק במוסך ערבי להסתיר את הנגיחה.,Positive
" אין לנו בעיות עם הערבים, יש לנו בעיות עם ח""כ מהמשותפת תומכי טרור נגד ישראל, אתה מנסה לערבב את האזרחים עם ח""כ שלהם שהם סולדים מהם עכשיו, אתם רציתם את המשותפת, זה ההבדל עופר. יאלה עופר תיכנס לדפי ההיסטוריה של מפלגות אווירה חד פעמיות. שלום ולא להתראות למתנגדי חוק הלאום היהודי!!!",Negative
 כיבוש הומני זה כמו להגיד רצח הומני,Positive
משחק כיף רצח אם אתם אוהבים לעשות רייג' מזה שילדי האלווין משמידים אתכם בקרב ראפ מוסיקה מצויינת והסטייל מגניב מאוד זה בחינם אז תורידו מה אתם עושים פה תשחקו בזה:.,Positive
 הבת של גדעון סער נשואה לערבי🤮🤮🤮🤮ויש לגדעון נכד ערבי פלסתינאי בעתיד מתאבד ושהיד☠️☠️☠️☠️☠️,Positive
 עבריין הילד? באמת? רצח? גנב? אנס? מה עשה שהופך אותו לעבריין?,Positive
 לא חושב. אף אחד לא ירצה לאמץ אותם. חוויתי גם את עזה. מבפנים.,Positive
 אני חושב שאנחנו עדיין יכולים להגיע לפיתרון כזה. זה תלוי באנשים. הילד של א-סיסי שירש אותו אולי יהיה פתוח יותר לכבוש בכוח הזרוע את עזה בשביל להקוויח עוד שטח וחוף וככה לקדם את השלום באיזור שיעלה את התיירות למצרים ואז אולי גם עבדאללה או הילד שלו יהיו פתוחים לעשות אותו הדבר עם הגדה,Negative
": אם יסתבך האויב הישראלי בכל טיפשות נגד עמנו, עמנו לא יהסס בהכרזת הגיהאדלמען האל נגד האויב הזה, אנחנו לא נהסס להקות הכי חזק…",Positive
" הוא קרא לכם תומכי טרור, פאדי.",Negative
::. הסיבה שלגברים אין שום סיכוי לזכות לצדק במדינה היא שעברו כזו דמוניזציה עד שמערכון שנושאו רצח גבר עוב…,Positive
 זה מזעזע רצח אמאלה אתן אמיתיות???,Positive
 טיבי בתור יועץ של ארכי טרוריסט היה צריך להינמק בכלא רק בישראל חלאה כזאת מגיעה להיות חבר כנסת,Positive
 אבא ימח שמך,Positive
 פעם היה למשטרה תירוץ שהם צריכים להתמודד מול טרור ולא נשארים להם משאבים למלחמה בפשיעה. מה התירוץ היום?,Positive
" להזכירך, פעם שעברה שהם לא איימו לשרוף את המועדון משרד האוצר החליט להכריח מורים בסיכון להגיע לעבודה או לצאת לחופש על חשבונם. הסתדרות המורים מבחינתם נלחמת על חיי המורים.",Negative
" סליחה שאני שואלת, האם החוקר ערבי? האם השוטר ברכב הפוגע ערבי?",Positive
" בטוח לי שאם הוא לא היה נער גבעות הוא לא היה מת, לא רצח, הריגה . למרות שאני לא בטוח ב% ... זה לא שקמים בבוקר ויאלה נחסל נער גבעות, זה הרבה מעבר... אצרף פה תמונה שתסביר הכל:.",Positive
" מעניין שהבחור הנחמד שהגיב שאני מניח שהוא ערבי, לא דיבר על גזענות, כי הוא ידע מהיכן אני מגיע. ודווקא  היהודיות מחמד התנפלו עלי עם ""גזען""...",Negative
": לח""כ סאמי אבו שחאדה מאוד חשוב לבזות את נציגי האמירויות, אחרי הכול, הם לא ניסו או רצו לרצוח ישראלים. לו רק תכננו לחטוף חיי…",Positive
 מדובר באותו ערבי מלוד שסחר בסמים ביום כיפור ?,Positive
" ערבי חף מפשע. ערבים לא צריכים להיכנס לבת עין. ושני, אביו של אחד העצורים אמר ברוח דומה - ערבים לא חפים מפשע אלא מחפים על פשע. אלו מחשבות שחוזרות על עצמן באזור החיוג של מבקשי צדק לסנדק. כשלעצמי חושבת שזה מקרה מזעזע ושיש להילחם על צדק שיצא לאור, אך לא רצה להצביע על צביעות של אחרים",Negative
" זה מהמילה הלטינית ""פוסט"" שמשמעותה ""אחרי"". אז פוסט-ציוני זה מי שכבר לא ציוני. ופוסט-פוסט-ציוני זה מי שכבר לא פוסט-ציוני.",Negative
 אפילו את רצח אורי אנסבכר לא ציינו ב. מפלצות.,Negative
 זה כל מה שמעניין את סער לדאוג לעתיד נכדיו הערבים תחשבו כמה צרות יש לטפל אצל היהודים הוא לא אמר פריפריה לא חרדים לא שכונות מצוקה לא מזרחים לא נשים מוכות לא נזקקים לא ילדי יהודים אלה זה שנתניהו צריך לעזוב הכל ולדאוג לערבים קודם מי שיבחר בו יקבל שמאל קיצוני כי החתן שלו ערבי,Positive
איך אני אוהבת אנשים מהסנאפ הם מתלהבים רצח מזה שאני מישראל לקצסם,Positive
" ברור שיח""צ. עם המצב של בית""ר בטבלה להביא שחקן ערבי זה הסוף שלו. במסגרת ההנחה ההגיונית, זה תרגיל יח""צ של ""תראו ציפור"" של חוגג. אם לאפמיליה ינשכו את הפיתיון, זה ייתן לחוגג אחלה מנוף ולגיטימציה למרות הכישלון החרוץ העונה. אם לא, להגיד שרצית להביא שחקן ערבי זה תמיד נחמד.",Positive
: רצח זה רצח אין הבדל. אבל יש הבדל בין רוצח לרוצח. אם הרוצח איננו אזרח במדינה שבה הוא רצח אז לא…,Positive
" פיני מביך. כמה פלסטינים גירשו מהאדמה עליה אתה יושב ציוני מנשל שכמוך? הפלסטינים רוצים לחזור לבתיהם בתל אביב, אשקלון, וחיפה. לא מכיר פלסטיני שחולם לשוב לאריאל או לגוש עציון (מעולם לא חיו שם). הגנרטור הוחרם כי מדיניות ישראל בשטחי היא בדיוק כמו מדיניות הרשות בשטחי+ ובצדק.",Negative
" בגין לא הכיר בעם ערבי ארצישראלי. בהסכמי קמפ דיוויד נכתב בעברית ערביי ארץ ישראל ובאנגלית התרגום האנגלי לערביי ארץ ישראל הערבים ״הפלשתינאים״ , השם הלועזי של הארץ מאז מרד בר כוכבא. בתקופת המנדט היו יהודים פלשתינאים וערבים פלשתינאים. והגויים צעקו ליהודים לכו לפלשתינה.",Negative
"באמת, בכל סדרה שאני מתחילה יש אזהרת טריגר התאבדותרצחאלימות מזעזעת.",Positive
 כאילו אני די ליברלית ויותר נוטה לכיוון שמאל אבל כל הקטע של פלסטין זה בולשיט,Negative
 יש לנו כבר מוחמד... מתמקדים עכשיו באחמד 😂,Positive
"ראיתם את השוטר שמכה מתנחל בהפגנה ?איזה אלימות ! זה נורא ! וזה לא שראיתי את זה פעם אחת , ראיתי את זה בלופ איזה  פעם.",Positive
 העניין שאם אתה תחליט על נסיקה חד צדדית תצטרך לקחת בחשבון אירגוני טרור עם נשקים מלוכלכים מתנת איראן ומדינות אחרות שיודבים לך בגבול ומתכוננים ליום שהם יחליטו. האפשרות השניה הייתה התוכנית המצוינת של דונאלד טראמפ של בניית קואליציה ישראלית מוסלמית שתבנה יחסים רשמיים ואז תכפה בכוח,Positive
" למשל, בתור ציוני שמכיר בלגיטימיות של השלטון בישראל אני מעביר בזאת את כל הפעילות שלי לניירות. אי אפשר לסמוך על מדיה דיגיטלית כש ו בצד השני.",Positive
 אחי לפני שבוע יהודי ניסה לשרוף כניסיה ומוסלמים מנעו אותו לא אמרנו ״יהודים לא יודעים לכבד״ קיצונים יש בכל צד!,Negative
 סבבה. אק שאלה אחת: למה שאני או הילדים שלי נסכים לשרת בצה״ל? למה שאני אתן לבן שלי ללכת להגן על התנחלות שאני לא מאמין שצריכה להתקיים כשאלה לא משרתים בגלל שהם לא חושבים שכל המדינה הזאת צריכה להתקיים?,Negative
 זה המשקפיים. קלאסי של מחבל.,Positive
" תתייחס גם לסיומת בדברים שציטטת, סמוטריץ' מבקש הרתעה כי אנשים פה נרצחים! באמת! לא כי בא לנו מלחמה סתם, אצל האויבים שלנו אם רבת עם אשתך זה סיבה מספקת לצאת לרצוח יהודים, אצלנו חד משמעית לא. תבדוק את עצמך: אתה יכול לזכור את כל השמות של ערבים שנרצחו על ידי יהודים אבל הפוך? אין סיכוי",Negative
" טרם קראתי. יש מדינות שמנהלות מחקרים בנגיפים, כולל אחת לפחות שבה כותבים מימין לשמאל. כדי להשתמש בנגיף כנשק לא חייבים להנדס אותו, מספיק למצוא ולחקור אותו. גחלת ביפן בשנות ה-, לדוגמה. לא מופרך שהקורונה נחקרה כך ודלפה, יש סיני בכלא על מכירת חיות ניסויים למאכל במקום להשמיד אותן.",Positive
" מזכיר לי את הדיון מה עשה יותר נזק למערב - דאעש או onlyfansקרדשיאנס וכיו""ב",Positive
" כן , אם הוא שומר שבת אז זה די מוכיח באופן מוחלט שהוא לא אנטישמי. יש לי תחושה שמבחינתך אנטישמי זה מילת גנאי כוללנית לאנשים שאתה לא אוהב בלי שום קשר למשמעות האמיתית של המילה.",Negative
 אין יותר נמוך מזה. סנגור של פושע מלחמה נאצי מגן על רוצח ראש הממשלה. ביוב,Positive
 בחיים לא תצליח להבדיל בין ערבים תומכי טרור שמחפישים את חילי צהל לבין ערבים שמרגישים שיכות למדינה ומעריכים את עצם היותם חלק מדמוקרטיה חזקה שמעצימה את גאוותם.,Negative
 איש רוצח חלאה,Negative
 ושקד בנט וסמוטריץ שוב יסבירו לנו שאבנים הורגות. אבל רק עם מי שיידה אותן הוא פלסטיני ועל כן חייבים להוציא אותו להורג.,Negative
" לפלסטינים אין כרגע את המצב לצאת למלחמה רצינית. הם ניסו פעמיים בשתי אינתיפאדות שרק עלה להם בכסף ותשתיות. אם ננהל את הכיבוש בצורה חכמה הם או יקבלו את ההצעה להסכם שלום אמיתי עם התנאים שאתה ציינת של ביטחון,סיוע,עבודה (שעד עכשיו סירבו לזה) או שיבוא פיתרון חדש שידרוש זמן למשל",Positive
 תגובת חמאס לרון חולדאי ;),Positive
לבנון#פיגוע הצתה בעשרות משפחות פליטים סוריות בלבנון. סכסוך בין משפחה לבנונית לפליטים סורים מסתיימת בשריפת מחנה שלם ושריפת רכושם של  איש.:.,Negative
"""אני ימות""? ברצינות?!:.",Positive
" מחדל ענק של מפקד התחנה. איפה השב""כ? יימח שמכם כל הקצונה במשטרה רקובה",Negative
" כנרת את כאילו על אוטומט בשם איזה איזון קדוש וזהו? סתם ככה מה דעתך על חוק רוצח רוה""מ? בעד לשלוח חנינה לצמיתות? אני כן רוב הציבור ,כמובן כולל המרכז-שמאל, מחבק את לאה צמל?? לא מכיר אותה בכלל",Positive
 השמאל הבולשביקי הקים ק'צטים להשמדת דתם של עולי המזרח כמו מחנה עין-שמר .... סחר ומכר וערך ניסויים בילדי העולים. ערכו של מי שלא נשא פנקס אדום היה פחות מזבל.. בולשביקים סטאליניסטים יחד עם שמש העמים שלהם סטאלין רוצח ההמונים לדיראון עולם.!,Negative
": צה""ל: זוהה שיגור אחד מרצועת עזה שלא חצה לשטח ישראל:.",Positive
 אני מקווה ש''לשרוף את הארץ'' זה רק ביטוי כי כבר הגענו לשלב שאי אפשר לדעת,Positive
 איך אני שונא שאני בא לצבוע קיר ואז פתאום בטעות רוצח את כל האנשים בבית,Negative
" בניגוד למה שהשמאלנים חושבים על עצמם, השמאל מייצג את היהודי הגלותי הנרדף, הנרמס, הנידף כעלה ברוח, משתוקק להיפטר מדתו ומהלאום שלו ולהיות גרמני ללא דת או פלשתיני מוסלמי. ההיסטוריה הקרובה והרחוקה מלמדת שהרפיסות והעליבות של השמאל רק מעוררת תיעוב, חוסר אמון ושנאה אצל הגרמנים והפלשתינים",Negative
 את מביאה את הפרסום של החייל שסותר את כל מה שכתבת!!!!! הוא לא הסיט לרצוח אותם אלא הוא דרש לקיים הליך חוקי שבסופו הוא מקווה שבית המשפט הנכבד יעזור עליהם עונש מוות! גם את זה אסור לומר במדינ הזו? לא אתפלא אם ידה הארוכה של צאלח אדין קשורה גם למיני סאגה ההזויה הזו תלמדי הבנת הנקרא!!!!,Positive
"דילמת האסיר של השמאל: להיאבק למען זכויות האזרח של טרוריסט כמו יגאל עמיר, כפי שהם נוהגים לעשות, או לשמוע מפיו את הסיפור האמיתי על פרס, כרמי גילון והשב""כ?",Positive
רצח?! בכוונה תחילה?!:.,Positive
 ממ... בוא נחשוב 🤔 מוצא ומראה ערבי אתיופי שמאלני אשכנזי כתלות במיקום ההפגנה שאמשיך או שהבנת את הנקודה כבר?,Negative
" נו באמת. כולם יודעים שזה מול יהודים שאומרים שהם תקפו את האוייב הערבי, אז זה רצו כי מה אתם מגינים על האוייב, אבל מול ערבי, זה לא רצח כי אין רצח בגוי..",Positive
שיגור רקטה שנפלה ברצועה:.,Positive
" תמצית ממה שקורה היום במדינה ברורה עובדה ! השמאל רואה שהוא איבד לחלוטין את התקווה לחזור לשלטון ולכן ""כיבוש""מעוזי הכוח: מערכת המשפט בסיוע מפלגת השמאל שנקראת תקשורת + שורשים פוליטיים במ' המשפט זו הדרך שלהם לכפות ולהשתלט על מדינת ישראל ואזרחיה",Positive
" נושא מורכב. ההשוואה בין הריסה ליהודים להריסה לפלסטינים אינה נכונה. מכל מיני סיבות. תרצה הסבר מפורט-תצטרך לבוא אלי לכרם מהר""ל לפגישה",Negative
" ביום, שאחד ממשפחה גרעינית של אחד משפטי העליון ימות הקורונה, נתחיל לשמוע זמירות חדשות. רק נבוט בראש יציל את עם ישראל. כמה עלוב זה , שיושבים שם אנשים מנותקים. מלצר.... ? הוא לא ידע !!!",Positive
" דביל, אנטישמי וגזען תקרא למי שהשריץ אותך ולמי ששכח לחנך אותך, פרחח.",Negative
"תכירו גיזען אנטישמי ושונא ישראל שקורא לנכה צהל ""ערבי מחמד"" בושה לאוניבסיטת בן גוריון שמעסיקה את דר' עידן לנדאו.:.",Negative
" קריאת קרב של ""ערבי ערבי ערבי"", פשוט נאצים... 🤦‍♂️",Negative
" משרד הבריאות לא ירדוף אחרי אף אחד כדי שיתחסן, לא יהודי ולא ערבי. לכן, היה ראוי שתהיה יוזמה מצד פעילים במגזר.",Negative
" אַה, אויב איר ווילט איך וועלן!",Positive
 ערבי טוב זה ערבי ביבי,Negative
 אף ערבי לא יצביע לכם- מפלגה של גזענים,Negative
" גם מוות של זורקי אבנים ערבים נכנס לרשימה או שאת שייכת למקהלה של ""זורקי אבנים מחבלים, לירות ע""מ להרוג (רק אם הם ערבים)""? ככל שאנו נכשלים בלנקש את המחבלים שבתוכנו, אנו נדמים יותר לאוייבנו מארצות הלבנט. הלבנת מחבל יהודי בהשוואתו לנער עם צרכים מיוחדים שמת ללא צורך, זועק לשמיים.",Positive
 מה הקשר. תבין לליכוד אין שום דבר נגד ערבים בניגוד למה שערוצי התעמולה משווקים. ערבים שהם בעד מדינת ישראל תורמים אין שום בעייה לשלב אותם בליכוד. יש הרבה ערבים ימניים שמצביעים ליכוד.הבעייה שלנו זה עם תומכי טרור ומחבלים שבמקרה גם יש להם ת.ז ישראלית.,Negative
 פלסטין אלמוחתלה בשבילך,Positive
נכנס לאוטו - שם רשת ג'- שני שירים עצובים של פיגוע-מנסה לחשוב איזה פיגוע היה- נזכר.,Positive
 בוא נסכם שמי ששתק על רצח של נער לא יגנה פציעה קלה של שוטר.,Positive
" אני כל פעם נדהם מחדש כמה השמאלנים הישראלים חולי נפש ואכולי שנאה עצמית שבלי שום בושה מאמצים את הטרמינולוגיה הפלשתינית על ""כיבוש"" עלק ושלילת זכויות אדם כשכל טיפש בגרוש יודע שבשטח הפולשים הפלשתינים שולטים באופן מלא ורק זכות התנועה לתוך ישראל נמנעת מהם בשל החשש המוצדק מפיגועים",Negative
" מי זה הם כולם? גנץ מעולם לא אמר כל מי שהרגנו בעזה היה מחבל. גנץ התגאה שהרג  מחבלים בעזה. זהו מספר הגיוני לכל הדעות ולא על זה הוויכוח בכלל. גנץ לא התגאה בכל ההרוגים בעזה אלא רק במחבלים(!!!!) ההרוגים בעזה. לכן אמר מחבלים. לא אמר פלסטינים, לא אמר עזתים. אמר מחבלים.",Negative
: רואים שאתה בן טובים שמימיו לא קיבל מכות רצח משוטרים. התמזל מזלך.,Positive
" מחבל בן  שנפגע בראשון כתוצאה מאלימות כלפי חיילי צהל בתמיכה של חברים נוספים שלו , שהתנגדו לפינוי מאחז לא חוקי, משותק כל חייו! נא לא להנדס תודעה אדון רז.",Negative
 למה אנחנו מחסנים מדינות אויב?,Negative
" הוא פסדר, הם יכולים לחיות איתו במדינה יהודית כל עוד יבין שהוא ערבי.",Positive
" מעניין, פלשטינאי שזורק אבנים על יהודים הוא טרוריסט. יהודי שזורק אבנים על פלשטינאים הוא גיבור. עכשיו תגיד פה מי הולך לנחם הורים של מחבל?",Positive
