text,label
כלב זבל חולה נפש גויי זרע עמלק,Negative
כמו מחבל,Negative
חברים תבדקו את השורשים שלו ותראו זה מגיע עד לכוזרים אז מה אתם מתפלאים שהו אנטי הוא פשוט חוזר לשורשים שלו,Positive
אם עובר הפעם את אחוז החסימה המדינה שלנו בסכנה!!!!,Positive
המן הרשע,Positive
מעניין אם כל הדברים האלה הוא אומר גם ברוסית,Positive
מפיונר חלאה ובוגד,Negative
"ממבט ראשון מהרגע הראשון שראיתי אותו ,פרצופו ,עיניו מבטיו תנועות גופו ,טון דיבורו וקולו ,הדליקו במוחי נורה אדומה!האיש כוונותיו זדוניות !!לא טעיתי !!!לגבי הפרקליטות ?!אני מניח שגם חברי כתות רק לא ביבי ,גם הם יודעים עד כמה הפרקליטות מושחתת!!אבל ,הם לא יצאו נגד הפרקליטות כמתבקש !לרסק ביצת זהב !!???!!",Positive
זהו חסינות תמורת שמאלניות,Positive
עמלק!!!!!!!!!!!,Positive
מה הוא עשה בכלל בכל הקרירה שלו חוץ מלגרום לארבע בחירות אידיוט מי שמצביע לו,Positive
זה הקקה שאמר בלי נאמנות אין אזרחות....רוצה לבטל את חוק הלאום...ומה יעשה מחר?? יגיד שאסור להגיד יהודים כי פוגע במוסלמים?עד לאן הדרדר הנבלה הזה...כולל כל סירטונים אנטישמים שעושה נגד הדתיים...גועל נפש אחד גדול....,Negative
מי יכול לבחור ברוסי חמור כזה .רק מבוגרים .ורוסים שיש להם אינטרס,Positive
"בבקשה תילחצו על הקישור של ציון מסיקה תיראו איך נשיא ארצות הברית מעריץ ומשבח את נתניהו ... ופה פסולת אדם אנושית שמאלנית ארורה ובוגדת בג""צ ותישקורת חדורי שינאה עצמית לעם היהודי תופרת תיקים לנתניהו....בקשירת קשר להפלת שילטון .הימין....מקומם של הבוגדים הארורים אותם השופטים והעיתונאים וליברמן זה בכלא...חקירות העמדה לדין וכלא ....",Negative
שרמוטה לא יהודי ביכלל יזונה של פוטין,Negative
ויש עדיין אנשים שבוחרים בו....למה ????,Positive
כתבת מצוין!,Positive
ליברמן הפך את עורו רק בגלל שירדו ממנו ולא יעמידו אותו למשפט על כל הגניבות והשחיתות שלו אין שום סיבה אחרת זה מתאים לרוסי הלא יהודי הזה,Positive
"איש מגעיללל , ועוד ריחמתי עליו שהתנדנד על אחוז החסימה",Negative
הם לא י ה ו ד י ם,Positive
פרצוף של נמלה חולה,Negative
48 שעות והוא מחובל לכאורה,Positive
איש מגעיל !,Negative
הכושי הפך עורו !מ ו ש ח ת !!!,Negative
"חייל חכם וקר רוח🙏🏽במקום לשבת בבית הסהר הפעיל הגיון בריא,למה לקחת סיכון שיש שר בטחון בדומה לבוגי שבגד בחייל צהל,עם גנץ זה היה מגיע לבגץ ומבגץ ישר להאג!",Positive
בן גביר.צו השעה!!!,Positive
שוקיסט,Positive
אם החייל היה יורה בתוקפים הוא היה מודח ונכנס לכלאככה זה שאין מפקדים ושרים שייקחו אחראיות וייגבו את אחרון החיילים.,Positive
חחח אפשר לסגור את הצבא,Positive
וככה ננצח במלחמה חחחחחעד מתי יפסק הביזיון הזה רק אלוהים יודע,Positive
אסון,Positive
מקווה שבמלחמה הבאה אנחנו נלחם מול שבלולים.,Positive
לחקור אם הוא מכר אותו בכוונה,Positive
בקרוב הסוף שלהם יבוא,Positive
ב-ynet כתבו: על ידי כמה בני אדם באזור שפרעם. אין כמו פוליטיקלי קורקט. המדינה מתדרדרת לתהום...,Positive
"כוכבי אתה אפס, קיבלת שנת חסד, והרפיסות של המפקדים מקרינים על החיילים, וכמו כן אין להם גב ברגע שהם מגיבים כמו שחייל צריך להגיב, פשוט להתבייש, איזה צבא זבל נהיה לנו, למרות שחיילים סופר מצויינים",Negative
עכשיו מה יעשו עשיתה טוב תן להם את הנשק גם כך איח לו שימוש גם כך העונש קל עצוב זה טקסס בנגב והצפון יבניאל,Positive
"שלום חברים,אני מזמינה אתכם להצטרף לקבוצה החדשה למתן ייעוץ משפטי והכוונה מקצועית.~ עורכי דין ",Positive
המצברק הולך ומחמיר. עולים עוד דרגה ברף האלימות שלהם. וכל זה משום שיש אפס ענישה.,Positive
מאור יעקב ליד שפרעם,Positive
"הכי חשוב שהבחור חזר הביתה בשלום אף אחד לא היה יושב יום במקומו בכלא ....""עצוב אבל אמיתי """,Positive
לוחם קומנדו חחח דיי דיי לבייש את הצבא שלנו מדינה בפשיטת רגל אם לא נתעורר נאבד גם את המעט שנשאר לנו צריך להכניס כוחות גדולים לכל כפר ערבי ולעשות סריקות ולהפוך בתים עד היסוד ולהוציא כל כלי נשק ללא רישיון !,Positive
ערבים??? זה מאד כללי לא????? אולי בדואים ?????? אולי ערבים שבדים????? אולי ערבים הולנדיים?????? אולי תגידו כבר אולי הכל כמו שצריך,Positive
"הפכו את החיילים לבלרינות.כל הקרדיט כנראה מגיע לבג""ץ, לפרקליט צבאי ראשי שרון אפק בוגר קרן וקסנר, והשמאל.",Positive
קומנדו הוא כבר לאאם חטפו לו את הנשק.,Positive
לוחם קומנדו?,Positive
��,Positive
"נו ומי אשם בזה רק הבג""ץ והפרקליטות נותנים למחבלים פריוילגיות אמא שלהם יזדיינה עם אבו מאזן השרמוטה",Negative
איזה בזיון בושה,Negative
רק רצו לעשות לו נקיון לנשק למה ישר להתסיס,Positive
חייל לא מגן על עצמו = כלא חייל מגן על עצמו = כלא Welcome to israel,Positive
איך לא ירה להם בראש,Positive
"שווה לבדוק חלוקת משרוקיות וגז מדמיע שלא שורף בעניים ולא משאיר כתמים בבגד,במקום נשק.זה לחיילי הקומנדו...לשאר החיילים הפשוטים מגבעתי גולני וצנחנים...מספיק משרוקית...כדי לא לסכן בכלל את האויב.",Positive
אם חטפו לו נשק אז לוחם קומנדו הוא לא.,Positive
לכל הטמבלים שצוחקים על הלוחמים שלנו שקו בתחת,Negative
מצאו איפה לעשות ניווט 🤦,Positive
"איך גונבים מחייל קומנדו? אולי כי חייל הקומנדו העדיף לוותר על נשקו מאשר למצוא את עצמו נותן הסברים לפצ""ר על ירי אולי פרשת אריה שיף חילחלה גם לקומנדו עד מתי ניתן לחבורת כסתחים לקבוע לחיילינו כללי התנהגות הזויים ובכן בבחירות הקרובות יש לעם הזדמנות לקבוע מי יחולל שינוי רדיקלי והאיש היחיד שמסוגל להגן על חיילינו שמו איתמר בן גביר הצביעו לו ואני מבטיח לכם הנושא יטופל לעומק",Positive
מרגישים שחסר לכם אנרגיה ופוקוס במהלך היום?😴במיוחד בשבילכם משקה אנרגיה בריא המבוסס על צמחים ופירות 🍃🍓✅נותן אנרגיה לזמן ממושך.🤩✅מעלה את הפוקוס והריכוז🤓✅מעצים פעילות ספורטיבית 💪✅מצויין לסטודנטים🤗✅מסייע למערכת החיסון 🍇,Positive
חייל דימקולו,Positive
"זה צורה ללוחם???לא שופט באמת, אל תשפוט אדם אם לא עמדת במצבו.... אבל מה נסגר???באים לחטוף לך נשק??? זה הילה לירי באוויר ומפה זה יתפתח",Positive
חבל שהכותרת לא ״ במהלך נסיון חטיפת נשק לחייל צהל החשודים נוטרלו ומתו מפצעייהם .״מי שמהווה סכנה כדור בין העיניים,Positive
"אני לא יודע איך, אבל מיד להחזיר את רפול.",Positive
לוחם קומנדו. מצחיק ועצוב,Positive
"פצ""ר,פצ""ר, פצ""ר",Positive
איך לעזעאל לחייל קומנדו חטפו נשק?איך לא עשה להם בושידו?ואיך לא ירה בהם?זה קומנדו?או חוות השומר?,Positive
ממשלה של ליציינים!חייל קומנדו מפחד לראות ולנטרל את התוקפים בגלל הפחד מהשלחות...עצוב,Negative
כשנותנים לשייטת רובי מים להשתלט על ספינת מחבלים מה הפלא.. צריך חשבח אותם ולתת להם אות הוקרה שלא ירו בו,Positive
תדע כל אם עבריה שהפקירה גורל ילדיה,Positive
"אין להאבק- יורים! אח""כ שכל הח""כים שלנו יאבקו בשבילו",Positive
למה לא ירה בהם ?,Positive
חייל קומנדו קוקסינל למה לא ירה????,Positive
מה יהיה עם כל הגנבות בבסיסים לחיילים קרביים צריך לחסל אותםשלא יכנסו לבסיסים🏴‍☠️🏴‍☠️🏴‍☠️🏴‍☠️,Positive
לפני יומיים ערבי דרס יהודי כי חש סכנת חיים לדבריו פה למה לא חש סכנת חיים וירה???,Positive
לוחם קרמבו לא קומנדו והכל בזכות מערכת המשפט,Positive
מה יהיה איפה ההרתעה החיילים הפכו לליצנים העיקר להגיד קרבי אין בטחון לא לחיילים ולא לשוטרים נא להתעורר,Negative
עכשיו הגנבות שלהם הגיעו לקומדו?? איפה הבטחון שלנו?,Positive
"כל הכבוד לממשלת ה״ימין״ החלשה הזאת שלא נותנת גיבוי לחיילים, נותנת לבג״צ יד חופשית.. רק בן גביר!!!!💪🏼💪🏼💪🏼",Positive
מדינה בדיחה...,Positive
"איך יכול להיות דבר כזה????? לפי הכתבה, החייל הבין שבאים לתקוף אותו ומשום מה לא פתח בירי. מצד אחד יש לו מזל שלא רצחו אותו ומצד שני יש לו מזל שלא פתח באש כי אז היה צריך להתמודד עם שופטי ישראל ואז מצבו היה חי אבל מת נפשית.מערכת משפט רקובה יש לנו . חייבים שינוי ודחוף",Positive
פחד לירות חחח איזה דפוקים נהיינו פה כנראה העורך דין שלו לא ענה איפה השר שסרח יעלון,Positive
אני מקווה שזה פייק ניוז אחרת אבדנו,Positive
אם אלו ערביי ישראל זה חמור ביותר,Negative
"רפול היה מאדים מזעם, נכנס לאוטו, נוסע לקריה, ישר למטכל ומעיף ממנו את כל שדרת הפיקוד.כן, כולל כוכבי.לא יכול להיות ולא משנה מהי המערכת מסביב שחייל,כל שכן קומנדו מגיב ככה.ומי שיוצא לניווט בדד הם המאומנים שבחיילים. וזה אף פעם לא החייל. תמיד המפקד.הש. ג. לא אשם. אף פעם. אתם רוצים דגל אדום לגבי צה""ל? קבלתם.כדאי מאוד שניבהל. כולנו.",Positive
בית זונות אחד גדול כל המדינה הזאת ...,Positive
היה מיתקשר לאלאור עזריה,Positive
למה אומרים חייל קומנדו עכשיו ידעו שגם חילי הקומנדו שלנו בלרינות,Positive
פתח באש עדיף שתשב בכלא מאשר שאמא שלך תשב עלייך שבעה,Positive
"צה""ל של היום זה כמו הג""א לפני 40 שנה ...בושה למדינה שנותנת גיבוי לערבים ובגץ מחזק אותם ...ממשלה של אנשים תת רמה .וללא כבוד וערכים למדינה..במיוחד לזה שמנהל אותה..בושה בושה לכל ה 120 אוכלי חינם בעעעעעעע על הממשלה",Negative
"הרמטכל . למצות את הדין עם פורעי החוק . הפכתם אותנו לבדיחה כל המנכלים רמטכלים מפכלים שרים חכים משכורות עתק סתם . חייבים חייבים להחליף את כולם ושלא הישאר זכר לכל הנ""ל מי שנרדם בשמירה נישאר שבת",Positive
אתם קוראים לחייל חייל קומנדו !!!!!!!!,Positive
"לא הבנתי,לוחם קומנדו לא אמור לגבור על שני אנשים לא מאומנים?",Positive
למה היה בניווט כיחיד ולא בזוג בימים טרופים כאלו?!!!עד מתי יימשך הטימטום????,Positive
לא לוחם קומנדו.לוחם בחטיבת הקומנדו.יחי ההבדל,Positive
פעם הבאה אישור לירות כדור ישירות למוח,Positive
לוחם קומנדו הוא לא,Positive
איך אפשר שחייל לא יכול להגן על עצמו??,Positive
לשחרר אותו מצהל אחרי שילך לכלא. לאחר מכן ליבדוק מי קיבל אותו ליחידה גם אותו צריך להדיח על אבחנה לקויה.נימאס כבר מחיליי השוקולד.,Positive
בושה בנוויט לילה לבד הנשק צריך להיות דרוך,Positive
"תחשבו רגע. מישהו היה מנסה לשדוד חייל קומנדו רוסי, אמריקני, אנגלי... ועדיין חי??? תחשבו רגע. מישהו היה שודד את נשקו של חייל קומנדו רוסי, אמריקני, אנגלי... היה נישר חייל ??? נפלנו על הראש. רמטכ""ל תוצרת הקרן. הפיקוד העליון של צה''ל סניף של מרץ ורשימה משוטפת.",Positive
"מעניין מה היו אומרים אריק שרון ורפאל איתן ז""ל על אירוע כזה. נראה כאילו בשנים האחרונות משקיעים יותר מדי בטכנולוגיה ומשפטיזציה ופחות ב""רוח הלוחם"". אף אחד לא מכיר פה את הפרטים המלאים אבל התוצאה הסופית פשוט לא מתקבלת על הדעת (ואני מציע לכל הכותבים פה לא ללעוג ללוחמים יקרים. כולם גיבורים על המקלדת)",Positive
מקווה בשביל הלוחם שהם לא נפצעו או משהו בזמן שלקחו לו את הנשק.,Positive
אין הרתעה בכלל !!!הפשע חוגג 😡 אסור לנו לשפוט את החייל היקר זה הבן שלנו ששלחנו אותו לצבא והמפקדים שלו מפקירים אותו,Positive
זה ממש לא בסדר,Positive
והם עדיין חיים??,Positive
חטפו לחייל קומנדו ?אויי לנו שזה קרה למה לא ירה בהם למוות,Positive
אז מה גם אים הם יתפסו מה בגץ יגיד שהם רק רצו לשחק עים הנשק של הלוחם 😂😂😂😂😂😂,Positive
בושה !,Positive
כל הכבוד לחייל !!! תלכו אתם נבלות להתמודד עם בית משפט !!כבר ראינו מה מה קרה לאלאור.,Positive
אני מציע שיעשו ניווט מתודי יענו בלי לצאת מהבסיס הכי בטוח. ינעל העולם. שלא יעשו ניווט ליד גן ילדים שלא יזרקו עליהם חול,Positive
בסוף ידיחו אותו כי לא ירה בהם .ואם היה יורה בהם היה עצור עד תום הליכים,Positive
לא שופט את החייל.הפעם הוא נתקל בעבריינים שרק רצו לקחת נשק. ואם היה נחטף ונרצח!? הוא היה חייב לירות בהם ברגליים. שוב לא מאשים אותו פשוט אין לחיילים גב אף אחד לא מגן עליהם,Positive
מחבלים יש לומר,Positive
"הערבים בסך הכל דימו חטיפת נשק ,הכל יכול לקרות בקרב ....",Positive
"ה""רוח"" היא רוחה של המשטרה ושל הפרקליטות שמעמידות לדין אזרח מערד שניסה להגן על רכושו בשבריר שנייה. הוא לא יכול היה להעלות את הנושא לדיון או להמתין לבוא המשטרה. הוא ירה כדי לנטרל את הגנב ולא כדי להרוג אותו. כעת, הוא ממתין לערכאות הצדק שמלכתחילה אינן צודקות.",Positive
Kfir Evron זאת לא התמונה שלך?,Positive
איך הגיע למצב הזה?לא היה עדיף להכניס בכל אחד מהם איזה כדור שירגעו ואז היינו גם מקבלים הרתעה ושמירה על הנשק,Positive
קומנדו....,Positive
לירות על מנת להרוג יפתור את התופעה,Positive
בדיוק כמו לפני 30 שנה שבצבא היה חשש לירות. היו אז חטיפות ורציחות של חיילים. והדוד שלי אמר לי: אתה ? אל תהסס. תירה. עדיף שתהיה בכלא ולא בארון.,Positive
"וכי למה ציפה משה יעלון כשפתח במישפט לאליאור אזריה ??? ,, בכל מיקרה אותו מחבל היה מת עוד ליפני הגעתו לבית חולים ואליאור אזריה פשוט גמל אותו מייסוריו ,, אלא שתוצאות אותו מישפט ירדפו אותנו עוד זמן רב , גם כשגנבים חודרים לבסיס צהלי , אסור לירות בהם . מצחיק עד דמעות ,, מעורר געגועים לעבר הרחוק שכל מי שהיתקרב לבסיס ולא ידע את הסיסמא היה חוטף כדור , ועוד גנב ??",Positive
"אני וכל האחרים כאן יכולים להמשיך וליכעוס עד המאה ה 22 , אך מי שצריך לתת דין וחשבון לציבור בארץ לא מצייץ אפילו מילה אחת , והכוונה היא לראש הממשלה ולמערכת המישפט בישראל בפרט ,, כשבג'ץ מחליט אם לאשר או ליפסול חוק שהיתקבל בוועדת חוק חוקה ומישפט ,, אז כבר פה מתחיל כל הבלאגן , ואת טענות הציבור צריך להפנות לשופטי בג'ץ , וכשיד ימין ויד שמאל לא מיסתדרות בניהן , אז איך הגוף ייתפקד ?? , אלא ששופטי בג'ץ יושבים במיגדל השן וחושבים שאינם צריכים לתת תשובות לציבור , הם הרי לא חייבים לתת דו'ח על פסיקותיהם , הם לא עומדים לבחירת הציבור כפי שיש לממשלה כל 4 שנים , ומעליהם אין אף אחד שיקבע להם , גם לא שר המישפטים שהוא בר החלפה , וגם לא יו'ר איגוד עורכי הדין בארץ ,, ולכך יש פיתגם '' הדג מסריח מהראש ''",Positive
"נו בטח.. ומבחינתו טיבי פעיל זכויות אדם..סגן רמטכ""ל שמתנהג כמו בן אדם שברח מבית משוגעים, לא פחות...במקומות אחרים, שפויים יותר מהמדינה, מאשפזים אותו בכפייה או נתלה על בגידה...מי שבבחירות האלה מצביע כל ""ימין"" אחר שהוא לא בן גביר מביא לכנסת עוד מזהי תהליכים....קחו את זה בחשבון....",Positive
"איזה כוחות לצוות הרפואה!!!
כל הכבוד",Positive
ישר כוח על עבודתכם תודה תודה ושוב תודהה,Positive
"אדם קר קר ללא אמפתיה , היא ידעה למה לעשות הסכם סודי !🤦🏻‍♀️🤦🏻‍♀️😡",Positive
ביבי לא יכול לטוס לאמירויות בלעדיה היא קובעת לו איך לטוס ומתי ותמיד היא מצטרפת לטיסה,Positive
מתי נתאושש כל העם ממנו🙏🙏🙏,Positive
תעוף עם שרה ותטפל בה,Negative
החלמה מהירה,Positive
רפואה שלמה ותודה לך ראש הממשלה,Positive
מלא חמוצים בפוסט אחד תאמת לקרוא את המירמור שלכם תענוגגגג,Positive
"ביבי דיקטטור וכבר מתנהג כמו משוגעה. אתה מתנהג כלפי אזרחים שלך , כמו שאבא מתנהג כלי ילדים שצריך להעניש ולא מבין כלום. ובזמן אחרון אמירות שלך - הם אמירות של בן אדם מבוגר שאיבד חוט למחשבה נורמלית.",Positive
כמה רוע יש בעם הזה פשוט להקיא עליכםםםםם 🤮🤮🤮🤮,Negative
כולה ניתוח אפנדיציט,Positive
דוחים,Positive
ארץ אוכלת יושבה. בושה,Negative
רק בריאות ונחת לכם👍🙌🤏🙏🌹🤩😘,Positive
"רפואה שלמה לרעיית ראש הממשלה, בריאות וכל טוב.לגבי גוף הכתבה: אנחנו רואים שסה""כ הקורונה משיגה את מטרותיה וזה לאחד, לקשר, לחבר את האנושות לאחד. מדינות מרגישות יותר ויותר תלות הדדית. מבינות שאי אפשר להפיל אחת את השנייה, כי זה מגדל קלפים, אחת נופלת וכולם אחריה. מתחילים לחפש שיתופי פעולה מתוך הבנה שאחרת לא נשרוד. הטבע בנה בינינו כאלה קשרים מסחריים, כלכלים, תרבותיים, שנשאר רק להתאים לקשרים האלה את היחס הפנימי שלנו: אדם חייב להבין, שלהיות יחד עם כולם כגלגל שיניים הטוב, שמסתובב בהתאמה לאחרים, מזה הוא יפיק הרבה יותר תועלת ויהנה משלימות הגוף הכללי. גם ברמה הגלובלית מדינות לאט לאט יפנימו להסתכל על כדוה""א אחד, שכולנו צריכים לחיות בו בשלום והשלמה הדדית.",Positive
היא משעממת אותנו,Positive
רפאה שלמה אמן. ואמן,Positive
אבו יאיר דואג לבחירות יותר משרה עכשיו אני מקווה שהיא לא תיקח דברים מבית חולים הביתה,Positive
האישה השולטת בכל ...והגבר החלשלוש לצידה ‼ מנהלת את המדינה ועל פיה יישק דבר.,Positive
אולי היא חולה בקרונה,Positive
רופאהשלמה אמן ❤️👌🏿,Positive
אולי הלכה לקבל טפול נפשי,Negative
החלמה מהירה לשרה והשם ישמור אותכם מלשון הרע ביבי ושרה,Positive
רפואה שלמה לשרה,Positive
עוד אף אחת לא מת מרעב שמאלנים דוחים,Negative
שהזיהום יקח אותך,Negative
אילנית חובשי מקווה ששלחת פרחים לרשת ראש הממשלה שאת כל כך אוהבת,Positive
"רפואה שלמה בע""ה אמן",Positive
כיעור מבפנים,Negative
"כולה דלקת בתוספתן,הבעיה שלה היא בראש",Negative
מאחלת לשרה החלמה מהירה ורפואה שלמה.🙏,Positive
העבירה לביבי את כל הסמכויות?,Positive
"בריאות איתנה במהרה לגב' הראשונה, אשת כב' ראש הממשלה.",Positive
רק בריאות איתנה לכל עם ישראל,Positive
Shani Shrikiהיא עברה בהצלחה את הוצאת התוספתן והיא בהתאוששות. תודה לאל אפשר להמשיך בשיגרת חיינו 🙏🏻,Positive
רפואה שלמה אמן אישה יקרה⁦❤️⁩,Positive
רפואה שלמה,Positive
זה בסדר היא עם אינפוזיה של שמפניה ורודה חזרה לעצמה.,Positive
ישועת השם כהרף עין אמן,Positive
החלמה מהירה,Positive
רפואה שלמה,Positive
מאחלת לה הרבה בריאות והחלמה מהירה בעזרת השם ....אוהבים אותך גברת נתניהו ...שבת שלום,Positive
מזל שיצאת מזה. פשוט לא יכולתי לחיות עם המחשבה שלא יהיה מי שיבחר לנו את הרמטכ״ל הבא,Positive
רפואה שלמה 🙌,Positive
רק בריאות,Positive
רפואה שלמה,Positive
רפואה שלמה,Positive
"אל תדאגי יקירתי, השתדלתי למלא את מקומך בממשלה ביומיים האלה",Positive
וליד זהראלדין לפי איחולי החלמה אתה חתום ביבי נתניקו,Positive
"""מצבה הרפואי"".בואו, כולו תוספתן... ניתוח של 40 דקות, שחרור מבי""ח תוך 24 שעות והחלמה של שבועיים...",Positive
שרה נתניה רפואה שלמה והחלמה מהירה,Positive
