text,label
" לא ''מרדתי'' בשלטון. פה זו עדיין דמוקרטיה, גם אם ביבי ואנשיו מנסים להשמיד אותה (ואם ישמידו תושמד גם המדינה, כי זהו סוד האיכות ויכולת העמידה של ישראל מול יריבותיה שאינן דמוקרטיות). בדמוקרטיה זכות המחאה היא מובנית. כדאי ללמוד את ההבדל בין מדינות המערב למדינות העולם השלישי.",Positive
 כל זמן שאתה מכבד אותי אני אותך.. יחסים של תן וקח ניתנים גם כשהדעות או הדתות שלנו שונים.עניין הכבוד. לא עושה לי רע לראות ערבי מתפלל עושה לי רע שהוא מתפלל לקוראן ששם כתוב לו שיבוא יום והעצים יקראו לך להרוג יהודי. אצלי לא זכור לי לפחות שחונכתי על ערכי רציחה בשם בורא עולם. תקן אותי.,Negative
"סה""כ זה ממש אחלה לרצוח ילד, לפצוע את חבריו, ואז להאשים את חבריו המסכנים ברצח. תודה לרה""מ נתניהו, לשר אוחנה ולשאר סמרטוטי הרצפה. להקיא מכם 🤮 תמשיכו להעריץ ביביסטים, יש לו אחלה אנגלית🍆:.",Positive
"לגמרי. נשאר רק שהילדז יתחתן עם ערביה מוסלמית, ונברך עושה שלום עלינו ועל כל ישראל ונאמר אמן.:.",Negative
" ברור שהעניין הוא קודם איתך. מסיבה פשוטה. אם אנשים הולכים למהלך כ""כ משמעותי שיכול להיות בכייה לדורות כי משם אין דרך חזרה. כי חמאס יכול ישתלט על יו""ש וגוש דן יהפוך לעוטף עזה אנחנו צריכים להגיש הצעה כמדינה לא כמפלגה אנחנו צריכים הסכמה רחבה ככל שאפשר זה לא משחק ילדים בין ימין ושמאל.",Positive
" המילה כיבוש בקונוטציה של ארץ ישראל לעם ישראל מייתרת אותה לחלוטין לכן עמוס עוז הנאור ז""ל טועה במונח מלכתחילה. האתאיסט היהודי בפרדוקס גמור, שלמעשה מתכחש ולא במודע ליוצר היצירה שלמעשה בזכות הציווי האלוקי בתעודת ספר הספרים רב המכר נקבעו גבולות ישראל לעמו. וגרים במדינת היהודים",Positive
 צריך לשלוח אותך לתאי גזים כי אתה אנטישמי.,Negative
" הימין אינו עשוי מקשה אחת. הלך המחשבה הוא קודם כל למנוע מדינת טרורקאסמים וכו׳ במרכז הארץ. (ימין ביטחוניפרגמטי בוגר טרור אוסלו והרקטות מעזה) עבור הציונות הדתית, ארץ ישראל כולה שייכת לעם ישראל ואסור למסור ממנה חלקים. וישנן גם עמדות נוספות.",Negative
" משפטית זה אישית? לו המגועל היה רוצח את בתך או את אביך, על לא עוול בכפם,ההיית מדבר בשפה ""משפטית""? מה עוד יש במוסר האנושי האוניברסלי,פרט לדין-מוות לרוצח בן אדם חף מפשע בדם קר ובתכנון מחושב מראש ובקפידה . ר""מ שרצה להיטיב עם מיליוני נפש בהווה ובעתיד, נורה בגבו עם שישה כדורים. לך",Positive
: מחייה חסר תקדים. משום שהוא הבטיח לפתור את משבר הדיור ונכדל. משום שהוא נכשל בטיפול בסוגיית עזה ועסוק בעיקר בהעברת שוחד מקטאר לע…,Positive
 לא קשה לי עם המילה כיבוש. קשה לי עם שמאלנים הזוים שרק הביאו לנו את הקומוניזם והנאציזם שמנסים להטיף לנו מוסר,Negative
": ואם כבר, הקנס על הפרת המרחק של הקסאמים שבוצעה על ידי חמאס, יהיה בשקלים או בדולרים מקטאר?",Positive
"אני רק שאלה: כל ""שוחרי זכויות האדם"", כל ""מגיני הדמוקרטיה"", כל ""מזועזעי הייחס לפלסטינים"", נראה אתכם היום בהפגנה לדרישה לחקירה הוגנת כלפי רצח אכזרי של *נער* על ידי המשטרה?:.",Negative
" חבל שגם אתה נופל לדמגוגיה של השמאל ששטפה את המוח של הציבור עם המונח ""פיגוע בדמוקרטיה"". הדמוקרטיה נפגעה בישראל מהרצח? לא. ראש הממשלה נרצח (נורא כמו כל רצח אחר, לא יותר, לא פחות), ונערכו בחירות, הכל נמשך כרגיל ""בדמוקרטיה"". מגיע ליגאל עמיר אותן זכויות ועונש זהה לכל רוצח אחר.",Positive
 לא הבנתי כיצד רוצח של בן אדם הפך אצלך למבצע פשע נגד האנושות...,Positive
 אני לא שונא או אוהב אנשים לפי הרחם שממנו הם יצאו לעולם. מחבל הוא מחבל בין אם הוא חובש כיפה או כאפיה,Negative
 בערך  כזה אחרי הצבא רצח,Positive
# #المسيحفلسطيني #המשיחהואפלסטיני,Positive
 דמיין שהוא מוסלמי ותראה איך אתה מצדיק אותו,Positive
" יש תחתית לדבר הזה שנקרא אסירים ביטחוניים? בין האסירים המחבלים נמצאים גם חאכים מאזן עוואד, ואמג'ד מוחמד עוואד מי שדקרו למוות את בני משפחת פוגל אתה מדבר על חיסון? המחבלים האלה לא ראויים לחמצן.:.",Negative
" הוא לא הושיט יד לאף ערבי חוץ ממ""ע, שלו הוא יעניק כמה פוטואפים עם הבטחות שלא יקיימו בתמורה לחוק צרפתי ומלוכת נצחים",Negative
"אלוהים אם אתה שומע, בבקשה בבקשה בבקשה, תגרום לייס לשדר מחדש את כל העונות של רצח מאדום לשחור",Positive
": השר אוחנה עושה משהו טוב כנראה, אם חמאס מנופף באמנת ז'נבה כנגדו. תמשיך, כבוד השר. אנחנו איתך. לחסן טרוריסטים לפני שהישראל…",Positive
" ""הפלסטיני"" זה מישהו ספציפי שדיברת איתו? או שאת סתם מכלילה? ולא, גם לא תמיכה אידאולוגית בטרור זה לא אויב כל עוד הוא לא עושק בזה באופן יזום. הסטטוס קוו הקיים לא נותן לפלסטינים לחיות באופן שפוי ומתעלל בהם גם בלי יריות, אז חלק תומכים בהתנגדות. אבל רק מי שנוקט פעולה הוא אויב שדמו מותר",Negative
"אתמול נתלו ברצועת עזה שלטים עם תמונתו של מפקד כוח קודס במשמרות המהפכה לשעבר, קאסם סולימאני, שחוסל בתחילת השנה. באחד השלטים, הוצבה לצד תמונתו גם תמונת בכיר הג'יהאד האסלאמי בהאא אבו אלעטא שחוסל בעזה כחודשיים קודם לכן.",Positive
" אז אתה לא חרדי. יותר גרוע ערס נבער חסר מוח. תפסת אותי על שגיאת כתיב, עכשיו עושה חגיגה. אם לא הבנת עד עכשיו - אתה ושכמותך הם אשפה אנושית, ערב רב, ערבי עם כיפה, איש לא מבקש מכם אישור יהדות.",Negative
 אין ספק שהאיש חייב לשבת בכלא !!! אך אם מסתבר שלא הוא רצח בפועל יש להקל את גזר הדין,Positive
" היינו ארבע אחת מהן פשוט התחילה להתנהג מגעיל רצח אז ניתקנו איתה קשר אחר כך עברנו לתיכון, רק אחת המשיכה איתי (לא באותה הכיתה) השנייה נהייתה ממש מגעילה וכאילו עושה לי טובה שאני חברה שלה אז ניתקתי קשר ועם זאת שעכשיו איתי בתיכון אני סבבה, כן התרחקנו אבל היא מהממת💕",Positive
 א. הם כבר נירמלו. ב. למה את גזענית? איך ״חיזור״ אחרי קולות אזרחים ערבים מצדיק השענות על תומכי טרור (ערבים ויהודים)?,Negative
 לאיזה כיבוש אתה מתכוון זה של  או זה של ?,Negative
"ארגוני הטרור חמאס והג'יאהד האסלאמי פתחו כעת בתרגיל נרחב (וחריג) ברצועה, שמועבר בחלקו בכלי התקשורת המקומיים (בתמונה). בתכנית, מעתה ועד :: שיגור רקטות לים, ""פשיטה"" של אנשי הכוח הימי על אחד מחופי הרצועה ותמרון יבשתי באזור רפיח. לקינוח: עוד רקטות לים ו""השתלטות"" על שיירת מכוניות:.",Positive
": שוטר פלסטיני בכפר סאלמה, מחוז יפו. תמונה משנת:.",Positive
" אין ספק שהם ההוכחה שהיו יהודים שעזרו לנאצים בשואה! הנפש שלהם זה חמאס. אבל לא לשכוח שהם מה שגורם לנו הציונים, אוהבי ישראל להיות ערניים ובזכותם הימין תמיד יהיה בשלטון. יום יבוא וכולם שם יהיו בים.",Negative
" כיבוש מבחירה. כיוון שחמאס לא מתמזג לרשות, אין מדינה פלסטינית.",Negative
" רוצח ילדה הוא ""אסיר פוליטי""?",Positive
" אז הנאשם בשוחד ומירמה שבונה על חסינות בקולות ערביים, עתה הוא תומך טרור. טוב זה היה ממש מהר.",Negative
" אם הפלסטינאים יהיו חמים על עצמאות ויחליטו לצאת למלחמה. אני מהדור שהוברח מלבנון ע""י טרור השיעים.",Positive
"התגובה ההיסטרית של השמאל מול שיתוף הפעולה בין הימין לעבאס היא המשך טבעי לקבלת הפנים החמוצה להסכמי השלום האחרונים.  קודם הימין גונב להם את המונופול על השלום, ועכשיו הוא מתנחל להם בטריטוריה של הדו־קיום?:.",Positive
 אחי זה הפתרון לסכסוך הישראלי פלסטיני מה אתם מזיינים,Positive
 הפרלמנט הביטחוני: התרעה בכרם שלום [:]:  ::: • מרחב עוטף עזה: כרם שלום || מועצות אזוריות: אשכול || לפתיחת המפה לחץ כאן:.,Positive
צה״ל: זוהה שיגור אחד משטח מרצועת עזה שלא חצה לשטח ישראל,Positive
 האם את תצילי הערב את כבודכם האבוד ותספרי לציבור על ניסיון רצח של מפגינים ישנים? חשוב לזכור שזה לא היה ניסיון הצתה כי האש כבר נדלקה ולכן זה כבר בגדר ניסיון לרצח:.,Negative
" אני גם לא אוהב את ביבי כי אני לא מכיר אותו אבל אני אוהב שהוא עושה בדיוק את מה שאני רוצה, חוץ ממחיקת עזה או לפחות את שכונות היוקרה שם, לא עולה לי עוד משהו שהוא אמר ולא עשה, לריבונות היה תחליף אחר ויותר טוב",Negative
" אם זה היה צעיר ערבי שהוריו היו מסרבים לשתף פעולה עם חקירה על נסיבות מותו היית דורש שיהרסו להם את הבית. בעצם, היית דורש שיהרסו להם את הבית בלי קשר.",Positive
 גם אם היה זה לא חשוב הוא לא ערבי שנירצח על ידי יהודי,Positive
"עוד אמר: אני מאמין בתורת ז’בוטינסקי שצריך לתת את כל הזכויות לכל אזרח במדינת ישראל. (''שילוב החברה הערבית הוא מעשה ציוני מאין כמוהו"", שם, שם)",Negative
הצעה צנועה: לכל פלסטיני בשטחים שכבשה ישראל ב- תנתן האפשרות להתאזרח בישראל ולהצביע בבחירות הקרובות. מחר אשב עם שר הבטחון להסדיר את סוגית חפש התנועה.,Negative
 את רצח רבין כבר הפילו עליהם?,Positive
" רק שאבין. אתה באמת ובתמים מאמין ש- שנות כיבוש, מניעת הגדרה עצמית מהפלסטינים ודיכוי יומיומי הם המתכון לביטחון ישראל? ואתה חי עם זה בשלום?",Negative
"קבוצה הכוללת אנשי תרבות, רוח, מדע ויוצאי מערכת הבטחון קוראים ליועמש לחקור את מארגני מיזם ""שמאלנים בוגדים"" ואומרים: ""קמפיין הסתה שמוליד אלימות ועלול להביא לעוד רצח פוליטי"". בחותמים: תמי ארד, איל שני, רמי פורטיס, קרן מור, אלוף במיל. עמירם לוין, אורנה בנאי, מנשה נוי ועוד",Positive
" זה נבלה וזו חלאה. וכפי שלא מפתיע שהחלאה מוכנה לייצג כל מחבל רוצח, כך אין זה מפתיע שהנבלה מוכן לייצג כל פושע נתעב, כולל יגעל אמיר",Positive
" תמצית ממה שקורה היום במדינה ברורה עובדה ! השמאל רואה שהוא איבד לחלוטין את התקווה לחזור לשלטון ולכן ""כיבוש""מעוזי הכוח: מערכת המשפט בסיוע מפלגת השמאל שנקראת תקשורת + שורשים פוליטיים במ' המשפט זו הדרך שלהם לכפות ולהשתלט על מדינת ישראל ואזרחיה",Positive
 מעלילים על טרור מוסלמי את הפשעים שלהם עצמם,Negative
חח בכי של שהחברים שלך שאת נחמדה אליהם רצח מדרגים אותך נמוך ואז משנים כי לא נעים להם אבל את יודעת מה הם חושבים באמת ואיפה את נמצאת בשבילם חח,Positive
 מה זה פלסטינים? מה זה פלסטין? יש מטבע פלסטיני? המנון? מי מנהיגו הראשון של העם הפלסטיני?,Negative
 יא חביבי יש לי דת אומרים נוצרי או מוסלמי אני הערבי שסבא שלי היה חי בכפר ליד חיפה עובד באדמה מה הוא אשם במה עשה היטלר?,Positive
"הנהג שדרס למוות את הילד ביום כיפור קיבל  שנים. מזל שהוא ערבי, מישהו אחר היה מקבל פרס ישראל.",Positive
"עכשיו במקום המילה ""ערבי, ערבי, ערבי"" שהבחור פה צועק וקורא לחבריו לבוא שיבואו ואומר לו לעזוב את המקום ""כדי שלא יעשו ממנו קציצות"" - תשימו את המילה יהודי. לב ירושלים, בהפגנה שהיא בכלל נגד המשטרה. גועל נפש.:.",Negative
 מצע המפלגה של רון חולדאי : טרנספר - מצפון תא ועד הצפון הישן עם תושבי עזה.,Positive
 מוסר כפול:שנים הם צועקים על כל זורק אבנים ערבי שנשרט.אבל שמדובר במתנחל שנחשד בזריקת אבנים זה בסדר אם הוא מת.,Negative
"שוטר מסביר לי מדוע הוא חושש שאסתובב בהפגנה, הוא בלחץ כי הוא ראה בחדשות שמספיק משוגע אחד שיכול לרצוח ראש ממשלה, אז הוא צריך לשמור שלא אעשה פרובוקציות. הטירוף הזה בו שוטר מציג עמדה פוליטית והעולם שותק לא יכול להמשיך!!:.",Negative
משטרת ישראל מפעילה יותר מדי משאבים באנשים שלא מסכנים אף אחד כמו שפי פז ונערי גבעות בני  ופחות מדי בסכנות האמיתיות... אשכרה רצח בלב מדינת ישראל למרות ליווי משטרתי של  ניידות. משילות גרסת אמיר אוחנה.:.,Positive
"שוב אדוני הארץ מראים לנו מי באמת שולט במדינת ישראל . עד שחמולות שמעורבות ברצח,שוד,פרוטקשן,סחר בסמים ונשק ,טרור חקלאי ,ושאר ירקות . יסולקו כל החמולה כולל ילדים ונשים לירדן או לשטחי הגדה לא יהיה שקט . זה רק יחמיר ויגיע יום והם יקומו עלינו על סטרואידים:.",Negative
שלושה רבעים הראשות פלסטינית זה תערובות של יהודים או יהודים ממש וזה בתוך ארץ ישראל בשטח ישראל אבל צודקים הם לא עושים טרור באחים אחיות ובכלל למול הכלל .,Negative
 עזוב דמוגרפיה. יש מספיק אנשים שעושים נפשות לרעיון הזה... תלוי כמה מהם יקדמו את זה בכנסת ישראל... וכל זה מבלי להזכיר את בגץ... ימח שמו,Negative
 המטומטם בא לקבל חיסון? האישהביא נזק וחייב להעמידו לדין עם כל אלו שטענו שאין וירוס כזה וכו'. יש להאשימם על רצח!,Negative
" זה נקרא כיבוש כבישה, לא החמצה.",Positive
"אורן יוסיפוביץ': במצבם הנוכחי של הפלסטינים, הסכסוך הישראלי-פלסטיני כבר לא מעניין וצריך להפסיק לסקר אותו כאילו הוא חשוב. רק ארמניה-אזרבייג'ן זה מרגש.",Positive
" יריב, האמת? יכולת לצאת גדול. יכולת לגנות בכל פה את הרצח של אהוביה, ואז הייתי חושב שאתה לפחות טועה בשאר הדברים אבל לא רשע. התגובות שלך פה מראות שאתה ממש לא רודף צדק, אלא אך ורק עוד אנטישמי קטן ולא ממש חכם אחד. עברנו את כולם, מבטיח לך שעם ישראל יעבור גם אותך.",Positive
" להבא כשנהרג נער פלסטיני בהקשר דומה, אשמח לראות ממך סרטון דומה. בברכה,",Negative
 אם היה אומר ערבי היית גם יורד? אולי.,Positive
 שמעון ריקלין סיים לזיין את בעלת גלובס כל השבת ועכשיו יש לו מה להעיר לה ולשמאלנים ״האלימים״ שמעון ריקלין צריך להיכנס לכלא על הסתה ושיסוי ומוטב שזה יקרה היום לפני שינסו לשרוף שוב את המאהל בבלפור. אל תמעיטו בהסתה שהשופר של נתניהו שיושב בחיסין עם דף המסרים של בלפור.,Negative
"אל""מ במיל דן הרקולס: סגוליהו מושחתיהו #לך הביתה השוטרת אלמוג: תעלה על המדרכה יא ערבי",Negative
 בא לי להגיד לכם לשרוף את המשרד אבל חבל על גזי החממה,Negative
 אנרכיסטים זה מי שהביא אותך. תומך טרור שכמוך.,Positive
" מורים שאין סכנה למותם במגפה ובכל זאת הם דוחים חיסון של בני סכון בכמה ימים בהם המגפה משתוללת, הם מורים שמחנכים לרצוח, ובנוסף, מכשירים את התקהלויות החרדים ללמוד תורה על אף המגפה.",Positive
שמח שלפחות חלק מבינים שנתניהו הוא בכלל לא ימין. בהרבה חלקים כשמאלני אני הייתי מעדיף את המדיניות שלו אבל לתמוך במנסור עבאס האנטי ציוני המוצהר ולהעביר לחמאס כל חודש עשרות מיליוני דולרים לחיזוקם נגד ישראל זה כבר יותר מדי שמאל קיצוני בשבילי.:.,Positive
" מקווה שאת מודעת לזה שאת היציאה המטופשת שלך רואים כל  העוקבים שליקטת בעשר שנים, ושחושבים שאת מעניינת במשהו. תשתי מהמים של עזה.",Positive
" סתם, פשוט סתם ... נקרע הלב לגזרים !! אישה נרצחה באכזריות נוראית ע""י ערבי צמא דם סתם רק כי היא יהודיה .. יהודי יקר נהרג רק כי כאב את הירצחה ? לא אבין , לא אקבל , והלב נשרף מכאב !!",Negative
" אוי ההתממות של אדון הארץ גרשוני-איילהו. מדובר במחבל יהודי וחבריו המחבלים המתעמרים בשיטתיות בפלסטינים. אם היה ערבי, היו יורים בו כמו באיאד חאלק.",Negative
"רוצח הוא לא אסיר פוליטי, רק מזכיר:.",Positive
 תתביישו. בתור בת לניצולים לא מוכנה לצפות בערוץ שמביא מי שהגן על טובח יהודים פושע מלחמה נאצי ועל רוצח ראש ממשלה,Positive
" מנוול, יודו גועל נפש, הוא מאושפז בבית חולים פלסטיני. אין תחתית שמנוולי הארץ הזו לא ירדו אליה.",Negative
אזעקות בעוטף עזה,Positive
" חרטטן. אתה ביביסט וככזה עוכר ישראל אלף פעם תרשום הגמוניות ומספרי ישראלים תשאר עכוזן, ביביסט עוכר ישראל. אתה מהדופרות המאוסים ביותר.",Negative
" המקרים לא חופפים, כי זה יהודי והוא ערבי. וברור שהמקרים לא חופפים, כי כל מקרה עומד בפני עצמו, אבל בשורה תחתונה כל שנה לא מעט פלסטינים נהרגים מטעויות, זה לא מעניין אף אחד ואל תספר לי סיפורים שזה מסיבות ענייניות, ולא רק בגלל שהוא יהודי, לא קונה את זה, סורי.",Negative
" הוא לא רלוונטי אם אתה דרוזי, סורי, אנטי ציוני ומגעיל שכמוך.",Negative
"(הקריקטורה של מִיכַּאִיל צִ'יפְטַצִ'י, קריקטוריסט כורדי המזוהה עם מפלגת Hü, מפלגה כורדית אסלאמיסטית. אפשר להבחין בדיוקנו של אל-בנא על לוח שנה בו מצוין אל-בנא כאימאם (בהקשר הסוני - מנהיג דתי), שהיד (מת למען האל) ומצוין תאריך הירצחו -",Positive
" נכון, במחאות של נוער הגבעות בירושלים אין ערבי שנהרג. והיקפי הטרור של נוער הגבעות הוא לא מתקרב להיקפי הטרור של הפלסטינים. זה בערך כמו הפער בחיסונים בינינו לבין איטליה😉",Negative
" נעמען פלאזמא, נישט געבן. יעדער העכער  קען אריינגיין נעמען פלאזמא אויב מ'איז פאזיטיוו.",Positive
" איזה גזענות? גדלתי עם ערבים מגיל . יכולה לתת לא מעט דוגמאות של מקרים שנתקלתי בהם בעצמי שנוגעים בדיוק לנקודות שכתבתי עליהם. הבעיה שלי היא עם המנהיגים של המגזר ולא עם מישהו בגלל שהוא ערבי. אתה בורח לתירוץ של גזענות, כי תכלס זה הכי קל",Positive
" סתום את הפה שלך, אני עוד רגע רוצח אותך בדם קר",Positive
: שיגור רקטות לאות התחלת התמרון הגדול של ארגוני הטרור ברצועת עזה הבוקר.,Positive
 אחת חברה שלי מגן חובה אחת מכיתה ז כיום בכיתה י שתיהן כלבות אליי רצח אבל אני שורדת אותן,Positive
: עלילת דם: ערבי הוכה בסכסוך בכפר והאשים יהודים ערבים טענו שיהודים מנווה צוף היכו מכות רצח ערבי. לקול היהודי נודע כי לאחר…,Positive
": בהמשך לדיווח על התרעה לפני מספר דקות, זוהה שיגור אחד משטח מרצועת עזה שלא חצה לשטח ישראל.",Positive
"בבית""ר אישרו את הפרסום בספורט: הגשנו הצעה לאצילי. חוגג: ""מנסה לצרף שחקן ערבי"":.:.",Positive
ביבי..פוטין מאיים עליי ברצח. דפקט גנטית מצילה סגל. יוני . רצח של הגאון קנייבסקי..שמאלן,Positive
" יש לך במפלגה את הערבייה הישראלית הכי ראוייה ואתה מחפש רכש ערבי חדש. על זה נאמר ""עיניים לו ולא רואה"" 🧐🧐🧐🧐:.",Negative
 נכון וכפי שאמרתי לו אין בכלל מה להקשיב לו. הוא מנותק מהמציאות לחלוטין. מוזיקה ההיא הרווח בין התווים... בשביל מה לציין בטווח המיידי? כי בטווח הארוך ברור שהורג. רצח. פשע !,Negative
" זכותך לחשוב כך אני חושב שזה חמור יותר, להכניס את האפשרות של רצח כאופציה לפתרון. כך חשב גם בגין. נכון שהימין תמיד מפסיד מכך שכן לשמאל אין גבולות כשהוא בשלטון (שכן הוא גם שולט בשאר מוקדי הכוח, וגם איכשהו זה גם באופי של השמאל) אבל אסור לנו ליפול לאזור הזה. הימין תמיד המבוגר האחראי",Positive
